Ticker,Stock Price,Call Contract Price,Strike Price,Expiration Date,Breakeven increase,Company Description,P/E Ratio,Forward P/E,Market Cap,52 Week High,52-week-upside,1y Target Est,1y-target-upside,Dividend Yield,Attractiveness
TSM,180.5449981689453,47.6,180.0,2027-01-15,0.260627557164574,"Taiwan Semiconductor Manufacturing Company Limited, together with its subsidiaries, manufactures, packages, tests, and sells integrated circuits and other semiconductor devices in Taiwan, China, Europe, the Middle East, Africa, Japan, the United States, and internationally. It provides a range of wafer fabrication processes, including processes to manufacture complementary metal- oxide-semiconductor (CMOS) logic, mixed-signal, radio frequency, embedded memory, bipolar CMOS mixed-signal, and others. The company also offers customer and engineering support services; manufactures masks; and invests in technology start-up companies; researches, designs, develops, manufactures, packages, tests, and sells color filters; and provides investment services. Its products are used in high performance computing, smartphones, Internet of things, automotive, and digital consumer electronics. The company was incorporated in 1987 and is headquartered in Hsinchu City, Taiwan.",31.786093,21.831316,936.3 B,193.47,7.2%,199.75,10.6%,1.41%,False
NU,14.84000015258789,3.82,15.0,2027-01-15,0.26819405704103394,"Nu Holdings Ltd. provides digital banking platform in Brazil, Mexico, Colombia, Cayman Islands, Germany, Argentina, the United States, and Uruguay. It offers spending solutions comprising Nu credit and prepaid card, a digitally enabled card that acts as a credit and a prepaid card; Ultraviolet credit and prepaid card, a premium metal credit card for affluent customers; mobile payment solutions for NuAccount customers to make and receive transfers, pay bills, and make everyday purchases through their mobile phones; and Nu Shopping, an integrated mall that enables customers to purchase goods and services from various ecommerce retailers. The company also provides savings solutions, such as Nu Personal Accounts, a digital account solution for personal financial activities; Nu business prepaid and credit card; and Nu business accounts for entrepreneur customers and their businesses. In addition, it offers investing solutions, including Money Boxes for goal-based investing; Nucoin, a proprietary utility token for its loyalty program; NuInvest, which provides equity, fixed-income, stock options, ETF products, and multimarket funds; and NuCrypto, a solution for buying and selling cryptocurrencies through the Nu app. Further, the company provides borrowing solutions comprising Personal unsecured and secured loans; Pix financing that enables credit card and digital account customers to make free and instant peer-to-peer transfers; Boleto financing, which enables credit card and digital account customers to make payments using their credit line; purchase financing; and NuPay to make online purchases and pay for services through Nubank app. Additionally, it offers protection solutions, such as NuInsurance protection solutions, including life, mobile, auto, home, and financial protection insurance policies. The company was founded in 2013 and is headquartered in São Paulo, Brazil.",47.870968,23.555555,71.1 B,15.16,2.2%,14.4,-3.0%,N/A,False
SHOP,80.18499755859375,24.6,80.0,2027-01-15,0.3044834218965389,"Shopify Inc., a commerce company, provides a commerce platform and services in Canada, the United States, Europe, the Middle East, Africa, the Asia Pacific, Australia, China, and Latin America. The company's platform enables merchants to displays, manages, markets, and sells its products through various sales channels, including web and mobile storefronts, physical retail locations, pop-up shops, social media storefronts, native mobile apps, buy buttons, and marketplaces; and enables to manage products and inventory, process orders and payments, fulfill and ship orders, new buyers and build customer relationships, source products, leverage analytics and reporting, manage cash, payments and transactions, and access financing. It also sells custom themes and apps, and registration of domain names; and merchant solutions, which include accepting payments, shipping, and securing working capital. The company was formerly known as Jaded Pixel Technologies Inc. and changed its name to Shopify Inc. in November 2011. Shopify Inc. was incorporated in 2004 and is headquartered in Ottawa, Canada.",80.99495,44.79609,103.0 B,91.57,14.2%,107.88,34.5%,N/A,False
NVDA,121.30000305175781,41.05,120.0,2027-01-15,0.327699884156484,"NVIDIA Corporation provides graphics and compute and networking solutions in the United States, Taiwan, China, Hong Kong, and internationally. The Graphics segment offers GeForce GPUs for gaming and PCs, the GeForce NOW game streaming service and related infrastructure, and solutions for gaming platforms; Quadro/NVIDIA RTX GPUs for enterprise workstation graphics; virtual GPU or vGPU software for cloud-based visual and virtual computing; automotive platforms for infotainment systems; and Omniverse software for building and operating metaverse and 3D internet applications. The Compute & Networking segment comprises Data Center computing platforms and end-to-end networking platforms, including Quantum for InfiniBand and Spectrum for Ethernet; NVIDIA DRIVE automated-driving platform and automotive development agreements; Jetson robotics and other embedded platforms; NVIDIA AI Enterprise and other software; and DGX Cloud software and services. The company's products are used in gaming, professional visualization, data center, and automotive markets. It sells its products to original equipment manufacturers, original device manufacturers, system integrators and distributors, independent software vendors, cloud service providers, consumer internet companies, add-in board manufacturers, distributors, automotive manufacturers and tier-1 automotive suppliers, and other ecosystem participants. NVIDIA Corporation was incorporated in 1993 and is headquartered in Santa Clara, California.",56.94408,30.171865,2975.3 B,140.76,16.0%,145.22,19.7%,0.03%,False
CAMT,75.58999633789062,26.0,75.0,2027-01-15,0.3361556408671531,"Camtek Ltd., together with its subsidiaries, develops, manufactures, and sells inspection and metrology equipment for semiconductor industry. The company provides Eagle-i, a system that delivers 2D inspection and metrology capabilities; Eagle-AP, which addresses the advanced packaging market using software and hardware technologies that deliver superior 2D and 3D inspection and metrology capabilities on the same platform; and Golden Eagle, a panel inspection and metrology system to address the challenges fanout wafer level packaging applications. It also develops automatic defect classification, which provides automatic defect classification of color images utilizing deep learning techniques to reduce and eliminate manual verification. In addition, the company offers MicroProf AP, a wafer metrology tool for applications at 3D packaging process steps; MicroProf DI, an optical inspection tool that enables inspection of structured and unstructured wafers for manufacturing process; MicroProf FE, a 2D/3D wafer metrology tool that serve front end HVM fab; MicroProf FS, an wafer metrology tool configurable for wafer foundry; MicroProf PT for hybrid metrology applications to common panel sizes; MicroProf MHU metrology tool, a material handling unit for semiconductor, MEMS, sapphire, and LED industries; MicroProf TL, an optical surface measurement tool for fully automatic 3D surface measurements; MicroProf 100, a universal surface metrology tool for determination of topography and film and sample thickness; MicroProf 200, a measuring device for contactless and non-destructive characterization of surfaces and films; and MicroProf 300, a SurfaceSens technology for quality assurance, development, and manufacturing. It serves semiconductor manufacturers, outsourced semiconductor assembly and test, integrated device manufacturers, and wafer level packaging subcontractors. Camtek Ltd. was incorporated in 1987 and is headquartered in Migdal Haemek, Israel.",38.370556,23.77044,3.4 B,140.5,85.9%,117.25,55.1%,1.79%,True
RKLB,7.485000133514404,3.84,7.0,2027-01-15,0.4482297670862345,"Rocket Lab USA, Inc., a space company, provides launch services and space systems solutions for the space and defense industries. The company provides launch services, spacecraft design services, spacecraft components, spacecraft manufacturing, and other spacecraft and on-orbit management solutions; and constellation management services, as well as designs and manufactures small and medium-class rockets. It also designs, manufactures, and sells Electron, a reusable orbital-class small rocket; and the Photon satellite platforms, as well as developing the Neutron 8-ton payload class launch vehicle; conducts remote launch activities; and designs and manufactures a range of components and subsystems for the Photon family of spacecraft and broader merchant spacecraft components. The company serves commercial, aerospace prime contractors, and government customers. Rocket Lab USA, Inc. was founded in 2006 and is headquartered in Long Beach, California.",N/A,-32.54348,3.7 B,7.72,3.1%,7.48,-0.1%,N/A,False
ASTS,25.484600067138672,16.35,25.0,2027-01-15,0.622548515223478,"AST SpaceMobile, Inc., together with its subsidiaries, develops and provides access to a space-based cellular broadband network for smartphones in the United States. Its SpaceMobile service provides cellular broadband services to end-users who are out of terrestrial cellular coverage. The company was founded in 2017 and is headquartered in Midland, Texas.",N/A,-38.61303,7.0 B,39.08,53.3%,37.98,49.0%,N/A,False
EME,432.3900146484375,57.32,430.0,2025-05-16,0.12703805243103106,"EMCOR Group, Inc. provides construction and facilities, building, and industrial services in the United States and the United Kingdom. It offers design, integration, installation, start-up, operation, and maintenance services related to power transmission, distribution, and generation systems; energy solutions; premises electrical and lighting systems; process instrumentation; low-voltage systems; voice and data communications systems; roadway and transit lighting, signaling, and fiber optic lines; computerized traffic control systems, and signal and communication equipment; heating, ventilation, air conditioning, refrigeration, and geothermal solutions; clean-room process ventilation systems; fire protection and suppression systems; plumbing, process, and high-purity piping systems; controls and filtration systems; water and wastewater treatment systems; central plant heating and cooling systems; crane and rigging services; millwright services; and steel fabrication, erection, and welding services. The company also provides building services that covers commercial and government site-based operations and maintenance; facility management, maintenance, and services; energy efficiency retrofit services; military base operations support services; services for indoor air quality; floor care and janitorial services; landscaping, lot sweeping, and snow removal services; vendor management and call center services; installation and support for building systems; program development, management, and maintenance for energy systems; technical consulting and diagnostic services; infrastructure and building projects; modification and retrofit projects; and other building services, including reception, security, and catering services. In addition, it offers refinery turnaround planning and engineering; welding; overhaul and maintenance; instrumentation and electrical; and renewable energy services. The company was incorporated in 1987 and is headquartered in Norwalk, Connecticut.",24.778797,20.768013,20.2 B,441.89,2.2%,415.0,-4.0%,0.23%,False
FN,232.5,25.85,230.0,2025-04-17,0.10043010752688164,"Fabrinet provides optical packaging and precision optical, electro-mechanical, and electronic manufacturing services in North America, the Asia-Pacific, and Europe. The company offers a range of advanced optical and electro-mechanical capabilities in the manufacturing process, including process design and engineering, supply chain management, manufacturing, printed circuit board assembly, advanced packaging, integration, final assembly, and testing. Its products include switching products, including reconfigurable optical add-drop multiplexers, optical amplifiers, modulators, and other optical components and modules that enable network managers to route voice, video, and data communications traffic through fiber optic cables at various wavelengths, speeds, and over various distances. The company's products also comprise transceivers, tunable lasers, and transponders; and active optical cables, which provide high-speed interconnect capabilities for data centers and computing clusters, as well as Infiniband, Ethernet, fiber channel, and optical backplane connectivity. In addition, it provides solid state, diode-pumped, gas, and fiber lasers used in semiconductor processing, biotechnology and medical device, metrology, and material processing industries; and differential pressure, micro-gyro, fuel, and other sensors used in automobiles, as well as non-contact temperature measurement sensors for the medical industry. Further, the company designs and fabricates application-specific crystals, lenses, prisms, mirrors, laser components, and substrates; and other custom and standard borosilicate, clear fused quartz, and synthetic fused silica glass products. It serves original equipment manufacturers of optical communication components, modules and sub-systems, industrial lasers, automotive components, medical devices, and sensors. The company was incorporated in 1999 and is based in George Town, the Cayman Islands.",28.739183,20.57522,8.4 B,278.38,19.7%,264.33,13.7%,N/A,True
SPNS,36.20690155029297,4.9,35.0,2025-04-17,0.10199984786262783,"Sapiens International Corporation N.V. provides software solutions for the insurance industry in North America, the United Kingdom, Europe, the Middle East, Africa, the Asia Pacific, and internationally. The company provides various solutions for property and casualty commercial and personal lines, life and pensions, and reinsurance fields. It offers IDITSuite, an AI powered, end-to-end insurance software; DigitalSuite, a cloud-native, future-proof digital engagement platform; IDITGo, a pre-configured, data-enriched insurance launch and accelerator platform solutions; consultancy services for property and casualty commercial lines; and Tia Enterprise solution for customer engagement. The company also provides CoreSuite, an end-to-end cloud and digital PAS for individual and group products across life, health, wealth, and pensions; CustomerConnect, a dynamic self-service and persona-based portal to engage with insureds; AgentConnect, a portal for agents and brokers to focus on sales enablement, customer retention, and increasing customer value; and ReinsuranceMaster, a reinsurance automation software that provides insurers full financial control and flexibility over their entire reinsurance process. The company was founded in 1982 and is headquartered in Holon, Israel.",29.436504,22.91576,2.0 B,41.22,13.8%,38.6,6.6%,1.61%,False
TKC,7.159999847412109,0.43,7.5,2025-04-17,0.10754192304434151,"Turkcell Iletisim Hizmetleri A.S. provides digital services in Turkey, Belarus, Turkish Republic of Northern Cyprus, and the Netherlands. It operates through three segments: Turkcell Turkey, Turkcell International, and Techfin. It offers broadband services consist of mobile broadband, fiber to the home/building, xDSL, cable, and FWA over its mobile network; lifebox, a personal cloud service to users with a space for photos, documents, contacts, and videos; Iste Suit, a one-stop service with e-mail, file management, office applications, and video conferencing solutions for corporate companies; UpCall, an application for telecommunication operator; and GAME+, a cloud gaming platform. The company also operates BiP, a communication and life platform; TV+, a multi-screen TV platform; and fizy, a digital music platform. In addition, it provides digital identity management services, which includes mobile signature solution and one time password services; fixed telco and cyber security, managed security, data center and cloud, and system integration and managed services; digital business applications; and internet of things products and solution management, big data analytics, industry specific, and partner ecosystem and vendors solutions. Further, the company offers digital payment services, such as mobile wallet, direct carrier billing, utility payments, POS solutions, prepaid cards, money transfers, intracity subway/bus card, Payment Link, and QR code payment services, as well as Vitrin, an e-commerce solution; and international roaming, voice, data, and digital services. Additionally, it provides shopping, automobile, and green loans; and operates as an insurance agency. Turkcell Iletisim Hizmetleri A.S. was incorporated in 1993 and is headquartered in Istanbul, Turkey.",12.135593,13.509435,6.2 B,8.47,18.3%,9.5,32.7%,3.15%,True
BBAR,11.420000076293945,2.25,11.0,2025-04-17,0.16024517613663036,"Banco BBVA Argentina S.A. provides various banking products and services to individuals and companies in Argentina. The company provides retail banking products and services, such as checking and savings accounts, time deposits, credit cards financing, consumer and pledge loans, mortgages, insurance, and investment products to individuals; and small and medium-sized companies products and services, including financing products, factoring, checking accounts, time deposits, transactional and payroll services, insurance, and investment products to private-sector companies. It also provides corporate and investment banking products and services, such as global transaction services; global markets solutions comprising risk management and securities brokerage; long-term financing products, including project finance and syndicated loans; and corporate finance services comprising mergers and acquisitions, and capital markets advisory services to corporations and multinational companies. The company was formerly known as BBVA Banco Francés S.A. and changed its name to Banco BBVA Argentina S.A. in July 2019. Banco BBVA Argentina S.A. was incorporated in 1886 and is based in Buenos Aires, Argentina.",17.569231,8.335767,3.0 B,12.4,8.6%,12.97,13.6%,14.77%,False
NMIH,40.869998931884766,4.75,40.0,2025-03-21,0.09493518887978847,"NMI Holdings, Inc. provides private mortgage guaranty insurance services in the United States. The company offers mortgage insurance services, such as primary and pool insurance; and outsourced loan review services to mortgage loan originators. It serves national and regional mortgage banks, money center banks, credit unions, community banks, builder-owned mortgage lenders, internet-sourced lenders, and other non-bank lenders. The company was incorporated in 2011 and is headquartered in Emeryville, California.",9.661939,8.550209,3.3 B,42.49,4.0%,42.86,4.9%,N/A,False
KSPI,106.43000030517578,14.7,105.0,2025-03-21,0.12468288693764928,"Joint Stock Company Kaspi.kz, together with its subsidiaries, provides payments, marketplace, and fintech solutions for consumers and merchants in the Republic of Kazakhstan. It operates through three segments: Payments Platform, Marketplace Platform, and Fintech Platform. The Payments Platform segment facilities transactions between customers and merchants. This segment offers shopping transactions, regular household bills, and peer to peer payments for consumers; accepts payment online and in store, issue and settle invoices, pay suppliers and monitor merchant turnover. It also provides proprietary data facilities informed decision making across multiple areas of business. Its Marketplace Platform segment connects online, and offline merchants and consumers enabling merchants to enhance its sales through an omni channel strategy and enable consumers to buy products and services from various merchants. This segment also operates marketplace through m-commerce, a mobile solution for shopping in person which consumers can use e-commerce to shop anywhere, anytime with free delivery; Kaspi Travel allows consumers to book domestic and international flights and package holidays, domestic rail tickets. It also enhances merchants sales by connecting payments and fintech products, Kapsi advertising, and other delivery services. The Fintech Platform segment provides consumers with BNPL, finance, and savings products and merchants with merchant finance services through super apps and Kapsi.kz Super app. It also involved in the banking; distressed asset management; real estate business; payment processing; online travel; and storage and processing of information services. The company was incorporated in 2008 and is headquartered in Almaty, the Republic of Kazakhstan.",10.527202,0.015596699,24.0 B,143.72,35.0%,68976.0,64708.8%,7.51%,True
ENIC,2.6649999618530273,0.25,2.5,2025-02-21,0.03189494910456592,"Enel Chile S.A., an electricity utility company, engages in the generation, transmission, and distribution of electricity in Chile. It operates through Generation, and Distribution and Networks Segments. The company generates electricity through various sources, such as hydroelectric, solar, wind, thermal, and geothermal power plants; and distributes electricity in various municipalities of the Santiago metropolitan region. It serves residential, commercial, industrial, and other customers. The company was formerly known as Enersis Chile S.A. and changed its name to Enel Chile S.A. in October 2016. Enel Chile S.A. was incorporated in 2016 and is headquartered in Santiago, Chile. Enel Chile S.A. operates as a subsidiary of Enel S.p.A",4.4416666,0.01243932,3.7 B,3.53,32.5%,3853.51,144497.0%,9.47%,True
BAP,178.50999450683594,7.07,185.0,2025-02-21,0.07596216408289003,"Credicorp Ltd. provides various financial, insurance, and health services and products primarily in Peru and internationally. It operates through Universal Banking, Insurance and Pensions, Microfinance, and Investment Banking and Equity Management segments. The Universal Banking segment grants various credits and financial instruments to individuals and legal entities; and various deposits and current accounts. The Insurance and Pensions segment issues insurance policies to cover losses in commercial property, transport, marine vessels, automobiles, life, health, and pensions; and management services for private pension funds. The Microfinance segment provides management of loans, deposits, and current accounts for small and microenterprises. The Investment Banking and Equity Management segment is involved in provision of brokerage and investment management services for corporations, institutional investors, governments, and foundations; structuring and placement of issues in the primary market; execution and negotiation of transactions in the secondary market; and structuring of securitization processes for corporate customers and manages mutual funds. The company was founded in 1889 and is headquartered in Lima, Peru.",10.98523,8.623671,14.2 B,182.83,2.4%,188.57,5.6%,5.29%,False
NVMI,203.8072052001953,25.0,200.0,2025-02-21,0.10398452193575536,"Nova Ltd. designs, develops, produces, and sells process control systems used in the manufacture of semiconductors in Israel, Taiwan, the United States, China, Korea, and internationally. Its product portfolio includes a set of metrology platforms for dimensional, films, and materials and chemical metrology measurements for process control for various semiconductor manufacturing process steps, including lithography, etch, chemical mechanical planarization, deposition, electrochemical plating, and advanced packaging. The company serves various sectors of the integrated circuit manufacturing industry, including logic, foundries, and memory manufacturers, as well as process equipment manufacturers. Nova Ltd. was formerly known as Nova Measuring Instruments Ltd. and changed its name to Nova Ltd. in July 2021. Nova Ltd. was incorporated in 1993 and is headquartered in Rehovot, Israel.",42.37156,27.995495,5.9 B,247.21,21.3%,242.8,19.1%,N/A,True
