Ticker,Stock Price,Call Contract Price,Strike Price,Expiration Date,Breakeven increase,Company Description,P/E Ratio,Forward P/E,Market Cap,52 Week High,52-week-upside,1y Target Est,1y-target-upside,Dividend Yield,Attractiveness
WFC,70.31999969482422,2.9,70.0,2025-02-21,0.03668942429426214,"Wells Fargo & Company, a financial services company, provides diversified banking, investment, mortgage, and consumer and commercial finance products and services in the United States and internationally. The company operates through four segments: Consumer Banking and Lending; Commercial Banking; Corporate and Investment Banking; and Wealth and Investment Management. The Consumer Banking and Lending segment offers diversified financial products and services for consumers and small businesses. Its financial products and services include checking and savings accounts, and credit and debit cards, as well as home, auto, personal, and small business lending services. The Commercial Banking segment provides financial solutions to private, family owned, and certain public companies. Its products and services include banking and credit products across various industry sectors and municipalities, secured lending and lease products, and treasury management services. The Corporate and Investment Banking segment offers a suite of capital markets, banking, and financial products and services, such as corporate banking, investment banking, treasury management, commercial real estate lending and servicing, equity, and fixed income solutions, as well as sales, trading, and research capabilities services to corporate, commercial real estate, government, and institutional clients. The Wealth and Investment Management segment provides personalized wealth management, brokerage, financial planning, lending, private banking, and trust and fiduciary products and services to affluent, high-net worth, and ultra-high-net worth clients. It also operates through financial advisors in brokerage and wealth offices, consumer bank branches, independent offices, and digitally through WellsTrade and Intuitive Investor. The company was founded in 1852 and is headquartered in San Francisco, California.",14.619543,12.605155,234.1 B,78.13,11.1%,77.30087,9.9%,2.29%,True
DE,430.0,15.9,430.0,2025-02-21,0.03697674418604646,"Deere & Company engages in the manufacture and distribution of various equipment worldwide. The company operates through four segments: Production and Precision Agriculture, Small Agriculture and Turf, Construction and Forestry, and Financial Services. The Production and Precision Agriculture segment provides large and medium tractors, combines, cotton pickers and strippers, sugarcane harvesters and loaders, harvesting front-end equipment, pull-behind scrapers, and tillage and seeding equipment, as well as application equipment, including sprayers and nutrient management, and soil preparation machinery for grain growers. The Small Agriculture and Turf segment offers utility tractors, and related loaders and attachments; turf and utility equipment, including riding lawn equipment, commercial mowing equipment, golf course equipment, and utility vehicles, as well as implements for mowing, tilling, snow and debris handling, aerating, residential, commercial, golf, and sports turf care applications; other outdoor power products; and hay and forage equipment. This segment also resells products from other manufacturers. It serves dairy and livestock producers, crop producers, and turf and utility customers. The Construction and Forestry segment provides a range of backhoe loaders, crawler dozers and loaders, four-wheel-drive loaders, excavators, motor graders, articulated dump trucks, landscape and skid-steer loaders, milling machines, pavers, compactors, rollers, crushers, screens, asphalt plants, log skidders, log feller bunchers, log loaders and forwarders, log harvesters, and attachments; and roadbuilding equipment. The Financial Services segment finances sales and leases agriculture and turf, and construction and forestry equipment. It also offers wholesale financing to dealers of the foregoing equipment; and extended equipment warranties, as well as finances retail revolving charge accounts. The company was founded in 1837 and is headquartered in Moline, Illinois.",16.783762,18.908072,117.1 B,469.39,9.2%,464.47592,8.0%,1.45%,True
CAT,362.1099853515625,15.6,360.0,2025-02-21,0.03725391509251108,"Caterpillar Inc. manufactures and sells construction and mining equipment, off-highway diesel and natural gas engines, industrial gas turbines, and diesel-electric locomotives in worldwide. Its Construction Industries segment offers asphalt pavers, compactors, road reclaimers, forestry machines, cold planers, material handlers, track-type tractors, excavators, telehandlers, motor graders, and pipelayers; compact track, wheel, track-type, backhoe, and skid steer loaders; and related parts and tools. The company's Resource Industries segment provides electric rope and hydraulic shovels, draglines, rotary drills, hard rock vehicles, tractors, mining trucks, wheel loaders, off-highway and articulated trucks, wheel tractor scrapers and dozers, fleet management products, landfill and soil compactors, machinery components, autonomous ready vehicles and solutions, work tools, and safety services and mining performance solutions, as well as related parts and services. Its Energy & Transportation segment offers reciprocating engine powered generator sets; reciprocating engines, drivetrain, and integrated systems and solutions; turbines, centrifugal gas compressors, and related services; and diesel-electric locomotives and components, and other rail-related products. The company's Financial Products segment provides operating and finance leases, installment sale contracts, revolving charge accounts, repair/rebuild financing services, working capital loans, and wholesale financing; and insurance and risk management products and services. Its All Other Operating segment offers filters and fluids, undercarriage, ground engaging tools, fluid transfer products, precision seals, and rubber sealing and connecting components; parts distribution; logistics solutions and distribution services; brand management and marketing strategy services; and digital investments services. Caterpillar Inc. was founded in 1925 and is headquartered in Irving, Texas.",16.803247,16.339693,174.8 B,418.5,15.6%,392.80453,8.5%,1.61%,True
NVS,99.01200103759766,2.75,100.0,2025-02-21,0.03775298876126065,"Novartis AG engages in the research, development, manufacture, and marketing of healthcare products in Switzerland and internationally. The company offers prescription medicines for patients and physicians. The company also provides Pluvicto, lutetium Lu 177 vipivotide tetraxetan, indicated for the treatment of adult patients with prostate-specific membrane antigen (PSMA)-positive metastatic castration-resistant prostate cancer; and Lutathera, lutetium Lu 177 dotatate, a prescription medicine used to treat adults and children aged 12 years and older with gastroenteropancreatic neuroendocrine tumors. It focuses on therapeutic areas, such as cardiovascular, renal and metabolic, immunology, neuroscience, and oncology, as well as ophthalmology and hematology. The company has a license and collaboration agreement with Alnylam Pharmaceuticals to develop, manufacture, and commercialize inclisiran, a therapy to reduce LDL cholesterol; and Dawn Health for the development and commercialization of Ekiva, a digital solution designed for people living with Paroxysmal Nocturnal Hemoglobinuria. It also has a research collaboration and license agreement with Schrödinger, Inc. to identify and develop various therapeutic candidates; and a strategic collaboration with Vyriad, Inc. for the discovery and development for vivo chimeric antigen receptor T-cell therapies. The company was incorporated in 1996 and is headquartered in Basel, Switzerland.",17.279581,11.887979,199.5 B,120.92,22.1%,112.66636,13.8%,3.77%,True
BMY,55.29499816894531,2.4,55.0,2025-02-21,0.03806857583434908,"Bristol-Myers Squibb Company discovers, develops, licenses, manufactures, markets, distributes, and sells biopharmaceutical products worldwide. It offers products for hematology, oncology, cardiovascular, immunology, fibrotic, and neuroscience diseases. The company's products include Eliquis for reduction in risk of stroke/systemic embolism in non-valvular atrial fibrillation, and for the treatment of DVT/PE; Opdivo for various anti-cancer indications, including bladder, blood, CRC, head and neck, RCC, HCC, lung, melanoma, MPM, stomach and esophageal cancer; Pomalyst/Imnovid for multiple myeloma; Orencia for active rheumatoid arthritis and psoriatic arthritis; and Sprycel for the treatment of Philadelphia chromosome-positive chronic myeloid leukemia. It also provides Yervoy for the treatment of patients with unresectable or metastatic melanoma; Empliciti for the treatment of multiple myeloma; Abecma for the treatment of relapsed or refractory multiple myeloma; Reblozyl for the treatment of anemia; Opdualag for the treatment of unresectable or metastatic melanoma; and Zeposia to treat relapsing forms of multiple sclerosis. In addition, the company offers Breyanzi for the treatment of relapsed or refractory large B-cell lymphoma; Onureg for the treatment of AML; Inrebic for the treatment of myelofibrosis; Camzyos for the treatment of symptomatic obstructive HCM to enhance functional capacity and symptom; Sotyktu for the treatment of moderate-to-severe plaque psoriasis; Augtyro for the treatment of locally advanced or metastatic ROS1-positive NSCLC; Revlimid, an oral immunomodulatory drug for the treatment of multiple myeloma; and Abraxane to treat breast cancer, NSCLC and pancreatic cancer. It sells products to wholesalers, distributors, pharmacies, retailers, hospitals, clinics, and government agencies. The company was formerly known as Bristol-Myers Company. Bristol-Myers Squibb Company was founded in 1887 and is headquartered in Princeton, New Jersey.",N/A,7.84413,112.1 B,61.08,10.5%,61.00571,10.3%,4.44%,True
GILD,90.01100158691406,3.45,90.0,2025-02-21,0.03820642313112432,"Gilead Sciences, Inc., a biopharmaceutical company, discovers, develops, and commercializes medicines in the areas of unmet medical need in the United States, Europe, and internationally. The company provides Biktarvy, Genvoya, Descovy, Odefsey, Truvada, Complera/ Eviplera, Stribild, Sunlencs, and Atripla products for the treatment of HIV/AIDS; Veklury, an injection for intravenous use, for the treatment of COVID-19; and Epclusa, Harvoni, Vemlidy, and Viread for the treatment of viral hepatitis. It also offers Yescarta, Tecartus, and Trodelvy products for the treatment of oncology; Letairis, an oral formulation for the treatment of pulmonary arterial hypertension; and AmBisome, a liposomal formulation for the treatment of serious invasive fungal infections. The company has collaboration agreements with Arcus Biosciences, Inc.; Merck Sharp & Dohme Corp.; Pionyr Immunotherapeutics Inc.; Tizona Therapeutics, Inc.; Galapagos NV; Janssen Sciences Ireland Unlimited Company; Japan Tobacco, Inc.; Dragonfly Therapeutics, Inc.; Arcellx, Inc.; Everest Medicines; Merck & Co, Inc.; Tentarix Biotherapeutics Inc.; Marengo Therapeutics; and Assembly Biosciences, Inc. It also has research collaboration, option, and license agreement with Merus N.V. for the discovery of novel dual tumor-associated antigens (TAA) targeting trispecific antibodies. The company has a collaboration with Terray Therapeutics, Inc. to discover and develop small molecule therapies. The company was incorporated in 1987 and is headquartered in Foster City, California.",1000.1222,11.902423,112.2 B,98.9,9.9%,99.95846,11.1%,3.43%,True
IBM,217.22000122070312,10.57,215.0,2025-02-21,0.03844028511358388,"International Business Machines Corporation, together with its subsidiaries, provides integrated solutions and services worldwide. The company operates through Software, Consulting, Infrastructure, and Financing segments. The Software segment offers a hybrid cloud and AI platforms that allows clients to realize their digital and AI transformations across the applications, data, and environments in which they operate. The Consulting segment focuses on skills integration for strategy, experience, technology, and operations by domain and industry. The Infrastructure segment provides on-premises and cloud based server, and storage solutions, as well as life-cycle services for hybrid cloud infrastructure deployment. The Financing segment offers client and commercial financing, facilitates IBM clients' acquisition of hardware, software, and services. The company has a strategic partnership to various companies including hyperscalers, service providers, global system integrators, and software and hardware vendors that includes Adobe, Amazon Web services, Microsoft, Oracle, Salesforce, Samsung Electronics and SAP, and others. The company was formerly known as Computing-Tabulating-Recording Co. International Business Machines Corporation was incorporated in 1911 and is headquartered in Armonk, New York.",31.664722,20.212585,200.9 B,239.35,10.2%,218.59412,0.6%,3.04%,False
TXN,191.1300048828125,8.55,190.0,2025-02-21,0.038821717823619206,"Texas Instruments Incorporated designs, manufactures, and sells semiconductors to electronics designers and manufacturers in the United States and internationally. The company operates through Analog and Embedded Processing segments. The Analog segment offers power products to manage power requirements across various voltage levels, including battery-management solutions, DC/DC switching regulators, AC/DC and isolated controllers and converters, power switches, linear regulators, voltage references, and lighting products. This segment provides signal chain products that sense, condition, and measure signals to allow information to be transferred or converted for further processing and control, including amplifiers, data converters, interface products, motor drives, clocks, and logic and sensing products. The Embedded Processing segment offers microcontrollers that are used in electronic equipment; digital signal processors for mathematical computations; and applications processors for specific computing activity. This segment offers products for use in various markets, such as industrial, automotive, personal electronics, communications equipment, enterprise systems, and calculators and other. It provides DLP products primarily for use in project high-definition images; calculators; and application-specific integrated circuits. The company markets and sells its semiconductor products through direct sales and distributors, as well as through its website. Texas Instruments Incorporated was founded in 1930 and is headquartered in Dallas, Texas.",35.52695,31.493137,174.4 B,220.39,15.3%,208.83173,9.3%,2.86%,True
SONY,20.209999084472656,1.0,20.0,2025-02-21,0.039089606695445145,"Sony Group Corporation designs, develops, produces, and sells electronic equipment, instruments, and devices for the consumer, professional, and industrial markets in Japan, the United States, Europe, China, the Asia-Pacific, and internationally. The company distributes software titles and add-on content through digital networks; network services related to game, video, and music content; and home gaming consoles, packaged and game software, and peripheral devices. It also develops, produces, markets, and distributes recorded music; publishes music; and produces and distributes animation titles, game applications, and various services for music and visual products. In addition, the company produces, acquires, and distributes live-action and animated motion pictures for theatrical release, as well as scripted and animated series, unscripted reality or light entertainment, daytime serials, game shows, television movies, and miniseries and other television programs; operation of television networks and direct-to-consumer streaming services; operates a visual effects and animation unit; and manages a studio facility. Further, it researches, develops, designs, produces, markets, distributes, sells, and services televisions, and video and sound products; interchangeable lens, as well as compact digital, and consumer and professional video cameras; projectors and medical equipment; mobile phones, accessories, and applications; and metal oxide semiconductor image sensors, charge-coupled devices, integration systems, and other semiconductors. Additionally, it offers Internet broadband network services; recording media, and storage media products; and life and non-life insurance, banking, and other services, as well as creates and distributes content for PCs and mobile phones. The company was formerly known as Sony Corporation and changed its name to Sony Group Corporation in April 2021. Sony Group Corporation was incorporated in 1946 and is headquartered in Tokyo, Japan.",17.426725,16.987394,122.3 B,22.71,12.4%,24.27205,20.1%,0.61%,True
MS,123.94000244140625,3.9,125.0,2025-02-21,0.04001934372188387,"Morgan Stanley, a financial holding company, provides various financial products and services to corporations, governments, financial institutions, and individuals in the Americas, Europe, the Middle East, Africa, and Asia. It operates through Institutional Securities, Wealth Management, and Investment Management segments. The Institutional Securities segment offers capital raising and financial advisory services, including services related to the underwriting of debt, equity, and other securities, as well as advice on mergers and acquisitions, restructurings, real estate, and project finance. This segment also provides equity and fixed income products comprising sales, financing, prime brokerage, and market-making services; foreign exchange and commodities; corporate and commercial real estate loans, commercial mortgage and secured lending facilities, and financing for sales and trading customers, and asset-backed and mortgage lending; and wealth management services, investment, and research services. The Wealth Management segment offers financial advisor-led brokerage, custody, administrative, and investment advisory services; self-directed brokerage services; financial and wealth planning services; workplace services, including stock plan administration; annuity and insurance products; securities-based lending, residential real estate loans, and other lending products; banking; and retirement plan services to individual investors and small to medium-sized businesses and institutions. The Investment Management segment provides equity, fixed income, alternatives and solutions, and liquidity and overlay services to benefit/defined contribution plans, foundations, endowments, government entities, sovereign wealth funds, insurance companies, third-party fund sponsors, corporations, and individuals through institutional and intermediary channels. The company was founded in 1924 and is headquartered in New York, New York.",18.835867,15.309023,199.7 B,136.24,9.9%,130.77779,5.5%,3.00%,True
TTE,56.79499816894531,1.57,57.5,2025-02-21,0.040056376519061576,"TotalEnergies SE, a multi-energy company, produces and markets oil and biofuels, natural gas, green gases, renewables, and electricity in France, rest of Europe, North America, Africa, and internationally. It operates through five segments: Exploration & Production, Integrated LNG, Integrated Power, Refining & Chemicals, and Marketing & Services. The Exploration & Production segment is involved in the exploration and production of oil and natural gas. The Integrated LNG segment comprises the integrated gas chain, including upstream and midstream liquified natural gas (LNG) activities, as well as biogas, hydrogen, and gas trading activities. The Integrated Power segment includes generation, storage, electricity trading, and B2B-B2C distribution of gas and electricity. The Refining & Chemicals segment consists of refining, petrochemicals, and specialty chemicals. This segment also includes oil supply, trading, and marine shipping activities. The Marketing & Services segment supplies and markets petroleum products. The company was formerly known as TOTAL SE and changed its name to TotalEnergies SE in June 2021. TotalEnergies SE was founded in 1924 and is headquartered in Courbevoie, France.",8.010578,6.8890185,128.5 B,74.97,32.0%,73.727,29.8%,5.86%,True
SCHW,72.31999969482422,2.8,72.5,2025-02-21,0.04120575660606707,"The Charles Schwab Corporation, together with its subsidiaries, operates as a savings and loan holding company that provides wealth management, securities brokerage, banking, asset management, custody, and financial advisory services in the United States and internationally. The company operates in two segments, Investor Services and Advisor Services. It offers brokerage accounts with equity and fixed income trading, margin lending, options trading, futures and forex trading, and cash management capabilities, including certificates of deposit; third-party mutual funds through the Mutual Fund Marketplace and Mutual Fund OneSource service, as well as mutual fund trading and clearing services to broker-dealers; exchange-traded funds; advisory solutions for managed portfolios, separately managed accounts, customized personal advice for tailored portfolios, specialized planning, and full-time portfolio management; banking products comprising checking and savings accounts, first lien residential real estate mortgage loans, home equity lines of credit, and pledged asset lines; and trust custody services, personal trust reporting services, and administrative trustee services. It also provides digital retirement calculators; integrated web-, mobile-, and software-based trading platforms, real-time market data, options trading, premium research, and multi-channel access; self-service education and support tools; online research and analysis tools; equity compensation plan sponsors full-service recordkeeping for stock plans, stock options, restricted stock, performance shares, and stock appreciation rights; retirement plan services; mutual fund clearing services; and advisor services, including interactive tools and educational content. The Company operates through branch offices. The Charles Schwab Corporation was founded in 1971 and is headquartered in Westlake, Texas.",28.25,18.219194,132.4 B,83.35,15.3%,85.19048,17.8%,1.37%,True
RIO,59.505001068115234,2.03,60.0,2025-02-21,0.04243339024554271,"Rio Tinto Group engages in exploring, mining, and processing mineral resources worldwide. The company operates through Iron Ore, Aluminium, Copper, and Minerals Segments. The Iron Ore segment engages in the iron ore mining, and salt and gypsum production in Western Australia. The Aluminum segment is involved in bauxite mining; alumina refining; and aluminium smelting. The Copper segment engages in mining and refining of copper, gold, silver, molybdenum, and other by-products and exploration activities. The Minerals segment is involved in mining and processing of borates, titanium dioxide feedstock, and iron concentrate and pellets; diamond mining, sorting, and marketing; and development projects for battery materials, such as lithium. It also owns and operates open pit and underground mines; and refineries, smelters, processing plants and power, and shipping facilities. Rio Tinto Group was founded in 1873 and is headquartered in London, the United Kingdom.",9.043313,8.684655,97.6 B,74.24,24.8%,80.8,35.8%,7.39%,True
AXP,296.989990234375,10.11,300.0,2025-02-21,0.044176605936351976,"American Express Company, together with its subsidiaries, operates as integrated payments company in the United States, Europe, the Middle East and Africa, the Asia Pacific, Australia, New Zealand, Latin America, Canada, the Caribbean, and Internationally. It operates through four segments: U.S. Consumer Services, Commercial Services, International Card Services, and Global Merchant and Network Services. The company's products and services include credit card, charge card, banking, and other payment and financing products; network services; expense management products and services; and travel and lifestyle services. It also provides merchant acquisition and processing, servicing and settlement, point-of-sale marketing, and information products and services for merchants; and fraud prevention services, as well as the design and operation of customer loyalty programs. In addition, the company operates lounges at airports under Centurion Lounge brand name. It sells its products and services to consumers, small businesses, mid-sized companies, and large corporations through mobile and online applications, affiliate marketing, customer referral programs, third-party service providers and business partners, direct mail, telephone, in-house sales teams, and direct response advertising. American Express Company was founded in 1850 and is headquartered in New York, New York.",21.869661,19.546041,209.2 B,307.82,3.6%,303.25168,2.1%,0.95%,False
