Ticker,Stock Price,Call Contract Price,Strike Price,Expiration Date,Breakeven increase,Company Description,P/E Ratio,Forward P/E,Market Cap,52 Week High,52-week-upside,1y Target Est,1y-target-upside,Dividend Yield,Attractiveness
TM,183.5800018310547,30.0,175.0,2027-01-15,0.11667936570050674,"Toyota Motor Corporation designs, manufactures, assembles, and sells passenger vehicles, minivans and commercial vehicles, and related parts and accessories in Japan, North America, Europe, Asia, Central and South America, Oceania, Africa, and the Middle East. It operates through Automotive, Financial Services, and All Other segments. The company offers subcompact and compact cars; mini-vehicles; mid-size, luxury, sports, and specialty cars; recreational and sport-utility vehicles; pickup trucks; minivans; trucks; and buses. It offers vehicles under the Toyota and Lexus brand names. Further, the company provides financial services, such as retail financing and leasing, wholesale financing, insurance, and credit cards. Additionally, it operates GAZOO.com, a web portal for automobile information, as well as engages in telecommunications and other businesses. The company was founded in 1933 and is headquartered in Toyota, Japan.",7.1738963,8.06945,247.3 B,255.23,39.0%,242.87,32.3%,2.16%,True
KO,71.36499786376953,7.52,72.5,2027-01-15,0.12127797092844061,"The Coca-Cola Company, a beverage company, manufactures, markets, and sells various nonalcoholic beverages worldwide. The company provides sparkling soft drinks, sparkling flavors; water, sports, coffee, and tea; juice, value-added dairy, and plant-based beverages; and other beverages. It also offers beverage concentrates and syrups, as well as fountain syrups to fountain retailers, such as restaurants and convenience stores. The company sells its products under the Coca-Cola, Diet Coke/Coca-Cola Light, Coca-Cola Zero Sugar, caffeine free Diet Coke, Cherry Coke, Fanta Orange, Fanta Zero Orange, Fanta Zero Sugar, Fanta Apple, Sprite, Sprite Zero Sugar, Simply Orange, Simply Apple, Simply Grapefruit, Fresca, Schweppes, Thums Up, Aquarius, Ayataka, BODYARMOR, Ciel, Costa, Dasani, dogadan, FUZE TEA, Georgia, glacéau smartwater, glacéau vitaminwater, Gold Peak, Ice Dew, I LOHAS, Powerade, Topo Chico, AdeS, Del Valle, fairlife, innocent, Minute Maid, and Minute Maid Pulpy brands. It operates through a network of independent bottling partners, distributors, wholesalers, and retailers, as well as through bottling and distribution operators. The company was founded in 1886 and is headquartered in Atlanta, Georgia.",29.01016,23.475328,307.6 B,73.53,3.0%,71.93,0.8%,2.70%,False
PG,172.83999633789062,20.13,175.0,2027-01-15,0.12896322688258977,"The Procter & Gamble Company engages in the provision of branded consumer packaged goods worldwide. The company operates through five segments: Beauty; Grooming; Health Care; Fabric & Home Care; and Baby, Feminine & Family Care. The Beauty segment offers conditioners, shampoos, styling aids, and treatments under the Head & Shoulders, Herbal Essences, Pantene, and Rejoice brands; and antiperspirants and deodorants, personal cleansing, and skin care products under the Olay, Old Spice, Safeguard, Secret, SK-II, and Native brands. The Grooming segment provides blades and razors, shave products, appliances, and other grooming products under the Braun, Gillette, and Venus brand names. The Health Care segment offers toothbrushes, toothpastes, and other oral care products under the Crest and Oral-B brand names; and gastrointestinal, pain relief, rapid diagnostics, respiratory, vitamins/minerals/supplements, and other personal health care products under Metamucil, Neurobion, Pepto-Bismol, and Vicks brands. The Fabric & Home Care segment provides fabric enhancers, laundry additives, and laundry detergents under the Ariel, Downy, Gain, and Tide brands; and air care, dish care, P&G professional, and surface care products under the Cascade, Dawn, Fairy, Febreze, Mr. Clean, and Swiffer brands. The Baby, Feminine & Family Care segment offers baby wipes, and taped diapers and pants under the Luvs and Pampers brands; adult incontinence and feminine care products under the Always, Always Discreet, and Tampax brands; and paper towels, tissues, and toilet papers under the Bounty, Charmin, and Puffs brands. It sells its products primarily through mass merchandisers, e-commerce, grocery stores, membership club stores, drug stores, department stores, distributors, wholesalers, specialty beauty stores, high-frequency stores, pharmacies, electronics stores, and professional channels, as well as directly to consumers. The company was founded in 1837 and is headquartered in Cincinnati, Ohio.",28.758734,23.231182,406.1 B,177.94,3.0%,177.42,2.6%,2.32%,False
F,10.845000267028809,2.27,10.0,2027-01-15,0.13139692926550728,"Ford Motor Company develops, delivers, and services a range of Ford trucks, commercial cars and vans, sport utility vehicles, and Lincoln luxury vehicles worldwide. It operates through Ford Blue, Ford Model e, and Ford Pro; Ford Next; and Ford Credit segments. The company sells Ford and Lincoln vehicles, service parts, and accessories through distributors and dealers, as well as through dealerships to commercial fleet customers, daily rental car companies, and governments. It also engages in vehicle-related financing and leasing activities to and through automotive dealers. In addition, the company provides retail installment sale contracts for new and used vehicles; and direct financing leases for new vehicles to retail and commercial customers, such as leasing companies, government entities, daily rental companies, and fleet customers. Further, it offers wholesale loans to dealers to finance the purchase of vehicle inventory; and loans to dealers to finance working capital and enhance dealership facilities, purchase dealership real estate, and other dealer vehicle programs. The company was incorporated in 1903 and is based in Dearborn, Michigan.",11.296876,5.648438,43.1 B,14.85,36.9%,12.62,16.4%,5.50%,True
CAT,384.3800048828125,65.36,370.0,2027-01-15,0.13262915466357317,"Caterpillar Inc. manufactures and sells construction and mining equipment, off-highway diesel and natural gas engines, industrial gas turbines, and diesel-electric locomotives in worldwide. Its Construction Industries segment offers asphalt pavers, compactors, road reclaimers, forestry machines, cold planers, material handlers, track-type tractors, excavators, telehandlers, motor graders, and pipelayers; compact track, wheel, track-type, backhoe, and skid steer loaders; and related parts and tools. The company's Resource Industries segment provides electric rope and hydraulic shovels, draglines, rotary drills, hard rock vehicles, tractors, mining trucks, wheel loaders, off-highway and articulated trucks, wheel tractor scrapers and dozers, fleet management products, landfill and soil compactors, machinery components, autonomous ready vehicles and solutions, work tools, and safety services and mining performance solutions, as well as related parts and services. Its Energy & Transportation segment offers reciprocating engine powered generator sets; reciprocating engines, drivetrain, and integrated systems and solutions; turbines, centrifugal gas compressors, and related services; and diesel-electric locomotives and components, and other rail-related products. The company's Financial Products segment provides operating and finance leases, installment sale contracts, revolving charge accounts, repair/rebuild financing services, working capital loans, and wholesale financing; and insurance and risk management products and services. Its All Other Operating segment offers filters and fluids, undercarriage, ground engaging tools, fluid transfer products, precision seals, and rubber sealing and connecting components; parts distribution; logistics solutions and distribution services; brand management and marketing strategy services; and digital investments services. Caterpillar Inc. was founded in 1925 and is headquartered in Irving, Texas.",17.519598,16.80717,186.4 B,389.43,1.3%,338.55,-11.9%,1.52%,False
CL,103.76249694824219,13.35,105.0,2027-01-15,0.1405855051756726,"Colgate-Palmolive Company, together with its subsidiaries, manufactures and sells consumer products in the United States and internationally. It operates through two segments: Oral, Personal and Home Care; and Pet Nutrition. The Oral, Personal and Home Care segment offers toothpaste, toothbrushes, mouthwash, bar and liquid hand soaps, shower gels, shampoos, conditioners, deodorants and antiperspirants, skin health products, dishwashing detergents, fabric conditioners, household cleaners, and other related items. This segment markets and sells its products under various brands, which include Colgate, Darlie, elmex, hello, meridol, Sorriso, Tom's of Maine, Irish Spring, Palmolive, Protex, Sanex, Softsoap, Lady Speed Stick, Speed Stick, EltaMD, Filorga, PCA SKIN, Ajax, Axion, Fabuloso, Murphy, Suavitel, and Soupline to a range of traditional and eCommerce retailers, wholesalers, and distributors. It includes pharmaceutical products for dentists and other oral health professionals. Its Pet Nutrition segment offers pet nutrition products for everyday nutritional needs under the Hill's Science Diet brand; and a range of therapeutic pet products to help nutritionally support dogs and cats in different stages of health under the Hill's Prescription Diet brand. This segment markets and sells its products through pet supply retailers, veterinarians, and eCommerce retailers. Colgate-Palmolive Company was founded in 1806 and is headquartered in New York, New York.",30.251455,26.74291,84.8 B,109.3,5.3%,106.7,2.8%,1.94%,False
JPM,211.07000732421875,32.09,210.0,2027-01-15,0.1469654218949843,"JPMorgan Chase & Co. operates as a financial services company worldwide. It operates through four segments: Consumer & Community Banking (CCB), Corporate & Investment Bank (CIB), Commercial Banking (CB), and Asset & Wealth Management (AWM). The CCB segment offers deposit, investment and lending products, cash management, and payments and services; mortgage origination and servicing activities; residential mortgages and home equity loans; and credit cards, auto loans, leases, and travel services to consumers and small businesses through bank branches, ATMs, and digital and telephone banking. The CIB segment provides investment banking products and services, including corporate strategy and structure advisory, and equity and debt market capital-raising services, as well as loan origination and syndication; payments; and cash and derivative instruments, risk management solutions, prime brokerage, and research. This segment also offers securities services, including custody, fund accounting and administration, and securities lending products for asset managers, insurance companies, and public and private investment funds. The CB segment provides financial solutions, including lending, payments, investment banking, and asset management to small and midsized companies, local governments, nonprofit clients, and large corporations, as well as investors, developers, and owners of multifamily, office, retail, industrial, and affordable housing properties. The AWM segment offers multi-asset investment management solutions in equities, fixed income, alternatives, and money market funds to institutional clients and retail investors; and retirement products and services, brokerage, custody, estate planning, lending, deposits, and investment management products to high net worth clients. JPMorgan Chase & Co. was founded in 1799 and is headquartered in New York, New York.",11.771891,12.481964,600.5 B,225.48,6.8%,216.13,2.4%,2.36%,False
BLK,936.9205932617188,136.75,950.0,2027-01-15,0.15991686789237636,"BlackRock, Inc. is a publicly owned investment manager. The firm primarily provides its services to institutional, intermediary, and individual investors including corporate, public, union, and industry pension plans, insurance companies, third-party mutual funds, endowments, public institutions, governments, foundations, charities, sovereign wealth funds, corporations, official institutions, and banks. It also provides global risk management and advisory services. The firm manages separate client-focused equity, fixed income, and balanced portfolios. It also launches and manages open-end and closed-end mutual funds, offshore funds, unit trusts, and alternative investment vehicles including structured funds. The firm launches equity, fixed income, balanced, and real estate mutual funds. It also launches equity, fixed income, balanced, currency, commodity, and multi-asset exchange traded funds. The firm also launches and manages hedge funds. It invests in the public equity, fixed income, real estate, currency, commodity, and alternative markets across the globe. The firm primarily invests in growth and value stocks of small-cap, mid-cap, SMID-cap, large-cap, and multi-cap companies. It also invests in dividend-paying equity securities. The firm invests in investment grade municipal securities, government securities including securities issued or guaranteed by a government or a government agency or instrumentality, corporate bonds, and asset-backed and mortgage-backed securities. It employs fundamental and quantitative analysis with a focus on bottom-up and top-down approach to make its investments. The firm employs liquidity, asset allocation, balanced, real estate, and alternative strategies to make its investments. In real estate sector, it seeks to invest in Poland and Germany. The firm benchmarks the performance of its portfolios against various S&P, Russell, Barclays, MSCI, Citigroup, and Merrill Lynch indices. BlackRock, Inc. was founded in 1988 and is based in New York City with additional offices in Boston, Massachusetts; London, United Kingdom; Gurgaon, India; Hong Kong; Greenwich, Connecticut; Princeton, New Jersey; Edinburgh, United Kingdom; Sydney, Australia; Taipei, Taiwan; Singapore; Sao Paulo, Brazil; Philadelphia, Pennsylvania; Washington, District of Columbia; Toronto, Canada; Wilmington, Delaware; and San Francisco, California.",23.237118,20.118544,138.8 B,942.73,0.6%,947.93,1.2%,2.18%,False
BX,157.1999969482422,28.73,155.0,2027-01-15,0.16876592599739526,"Blackstone Inc. is an alternative asset management firm specializing in real estate, private equity, hedge fund solutions, credit, secondary funds of funds, public debt and equity and multi-asset class strategies. The firm typically invests in early-stage companies. It also provide capital markets services. The real estate segment specializes in opportunistic, core+ investments as well as debt investment opportunities collateralized by commercial real estate, and stabilized income-oriented commercial real estate across North America, Europe and Asia. The firm's corporate private equity business pursues transactions throughout the world across a variety of transaction types, including large buyouts,special situations, distressed mortgage loans, mid-cap buyouts, buy and build platforms, which involves multiple acquisitions behind a single management team and platform, and growth equity/development projects involving significant majority stakes in portfolio companies and minority investments in operating companies, shipping, real estate, corporate or consumer loans, and alternative energy greenfield development projects in energy and power, property, dislocated markets, shipping opportunities, financial institution breakups, re-insurance, and improving freight mobility, financial services, healthcare, life sciences, infrastructure, enterprise tech and consumer, as well as consumer technologies. The firm considers investment in Asia and Latin America. It seeks to invest between $0.25 million and $900 million per transaction. It invests in companies with enterprise value between $500 million and $5000 million. It has a three year investment period. Its hedge fund business manages a broad range of commingled and customized fund solutions and its credit business focuses on loans, and securities of non-investment grade companies spread across the capital structure including senior debt, subordinated debt, preferred stock and common equity. Blackstone Inc. was founded in 1985 and is headquartered in New York, New York with additional offices across Asia, Europe, North America and Central America.",59.77186,26.598986,192.0 B,161.25,2.6%,138.68,-11.8%,2.16%,False
ABEV,2.3450000286102295,0.25,2.5,2027-01-15,0.17270787481814875,"Ambev S.A., through its subsidiaries, engages in the production, distribution, and sale of beer, draft beer, carbonated soft drinks, malt and food, other alcoholic beverages, and non-alcoholic and non-carbonated products in Brazil, Central America and Caribbean, Latin America South, and Canada. It offers beer primarily under the Skol, Brahma, Antarctica, Brahva, Budweiser, Bud Light, Beck, Leffe, Hoegaarden, Balboa ICE, Balboa, Atlas Golden Light, Atlas, Bucanero, Cristal, Mayabe, Presidente, Presidente Light, Brahma Light, Bohemia, The One, Corona, Modelo Especial, Stella Artois, Quilmes Clásica, Paceña, Taquiña, Huari, Becker, Cusqueña, Michelob Ultra, Busch, Pilsen, Ouro Fino, Bud 66, Banks, Deputy, Patricia, Labatt Blue, Alexander Keith's, and Kokanee brands. The company also provides carbonated soft drinks, bottled water, isotonic beverages, energy drinks, coconut water, powdered and natural juices, and ready-to-drink teas under the Guaraná Antarctica, Gatorade, H2OH!, Pepsi Black, Lipton Iced Tea, Fusion, Pepsi-Cola, Canada Dry, Squirt, Red Rock, Red Bull, Seven Up, Nutrl, Bud Light Seltzer, Palm Bay, and Mike's brands. It offers its products through a network of third-party distributors and a direct distribution system. The company was founded in 1885 and is headquartered in São Paulo, Brazil. Ambev S.A. is a subsidiary of Interbrew International B.V.",13.794118,13.027778,37.5 B,3.0,27.9%,3.1,32.2%,6.54%,True
FDX,266.885009765625,43.0,270.0,2027-01-15,0.17278973545525322,"FedEx Corporation, together with its subsidiaries, provides transportation, e-commerce, and business services in the United States and internationally. It operates through FedEx Express, FedEx Ground, FedEx Freight, and FedEx Services segments. The FedEx Express segment offers express transportation, small-package ground delivery, and freight transportation services; and time-critical transportation services. The FedEx Ground segment provides small-package ground delivery services. The FedEx Freight segment offers less-than-truckload freight transportation services. The FedEx Services segment provides sales, marketing, information technology, communications, customer service, technical support, billing and collection, and back-office support services. In addition, the company offers supply chain management solutions; and air and ocean freight forwarding and cargo transportation, specialty transportation, customs brokerage, third party logistics and supply chain, and document and business solutions, as well as provides trade management tools and data. The company was founded in 1971 and is headquartered in Memphis, Tennessee.",16.474382,11.644197,65.2 B,313.84,17.6%,307.59,15.3%,2.13%,False
MA,487.0,86.61,490.0,2027-01-15,0.18400410677618062,"Mastercard Incorporated, a technology company, provides transaction processing and other payment-related products and services in the United States and internationally. The company offers integrated products and value-added services for account holders, merchants, financial institutions, digital partners, businesses, governments, and other organizations, such as programs that enable issuers to provide consumers with credits to defer payments; payment products and solutions that allow its customers to access funds in deposit and other accounts; prepaid programs services; and commercial credit, debit, and prepaid payment products and solutions. It also provides solutions that enable businesses or governments to make payments to businesses, including Virtual Card Number, which is generated dynamically from a physical card and leverages the credit limit of the funding account; a platform to optimize supplier payment enablement campaigns for financial institutions; and treasury intelligence platform that offers corporations with recommendations to enhance working capital performance and accelerate spend on cards. In addition, the company offers Mastercard Send, which partners with digital messaging and payment platforms to enable consumers to send money directly within applications to other consumers; and Mastercard Cross-Border Services enables a range of payment flows through a distribution network with a single point of access to send and receive money globally through various channels, including bank accounts, mobile wallets, cards, and cash payouts. Further, it provides cyber and intelligence solutions; insights and analytics, consulting, marketing, loyalty, processing, and payment gateway solutions for e-commerce merchants; and open banking and digital identity services. The company offers payment solutions and services under the MasterCard, Maestro, and Cirrus name. Mastercard Incorporated was founded in 1966 and is headquartered in Purchase, New York.",37.260902,29.302044,449.9 B,501.8,3.0%,518.86,6.5%,0.53%,False
IBKR,135.8800048828125,31.0,130.0,2027-01-15,0.18486895948268356,"Interactive Brokers Group, Inc. operates as an automated electronic broker worldwide. The company engages in the execution, clearance, and settlement of trades in stocks, options, futures, foreign exchange instruments, bonds, mutual funds, exchange traded funds (ETFs), precious metals, and cryptocurrencies. It also custodies and services accounts for hedge and mutual funds, ETFs, registered investment advisors, proprietary trading groups, introducing brokers, and individual investors. In addition, the company offers custody, prime brokerage, securities, and margin lending services. It serves institutional and individual customers through electronic exchanges and market centers. The company was founded in 1977 and is headquartered in Greenwich, Connecticut.",21.534075,19.75,57.5 B,136.22,0.3%,149.33,9.9%,0.74%,False
BAC,39.48910140991211,6.8,40.0,2027-01-15,0.18513712211878253,"Bank of America Corporation, through its subsidiaries, provides banking and financial products and services for individual consumers, small and middle-market businesses, institutional investors, large corporations, and governments worldwide. It operates in four segments: Consumer Banking, Global Wealth & Investment Management (GWIM), Global Banking, and Global Markets. The Consumer Banking segment offers traditional and money market savings accounts, certificates of deposit and IRAs, non-interest and interest-bearing checking accounts, and investment accounts and products; credit and debit cards; residential mortgages, and home equity loans; and direct and indirect loans, such as automotive, recreational vehicle, and consumer personal loans. The GWIM segment provides investment management, brokerage, banking, and trust and retirement products and services; wealth management solutions; and customized solutions, including specialty asset management services. The Global Banking segment offers lending products and services, including commercial loans, leases, commitment facilities, trade finance, and commercial real estate and asset-based lending; treasury solutions, such as treasury management, foreign exchange, short-term investing options, and merchant services; working capital management solutions; debt and equity underwriting and distribution, and merger-related and other advisory services; and fixed-income and equity research, and certain market-based services. The Global Markets segment provides market-making, financing, securities clearing, settlement, and custody services; securities and derivative products; and risk management products using interest rate, equity, credit, currency and commodity derivatives, foreign exchange, fixed-income, and mortgage-related products. Bank of America Corporation was founded in 1784 and is based in Charlotte, North Carolina.",13.855825,10.759973,306.4 B,44.44,12.5%,45.82,16.0%,2.61%,False
COST,901.9650268554688,171.0,900.0,2027-01-15,0.18740745828454108,"Costco Wholesale Corporation, together with its subsidiaries, engages in the operation of membership warehouses in the United States, Puerto Rico, Canada, Mexico, Japan, the United Kingdom, Korea, Australia, Taiwan, China, Spain, France, Iceland, New Zealand, and Sweden. The company offers branded and private-label products in a range of merchandise categories. It offers merchandise, such as sundries, dry groceries, candies, coolers, freezers, deli, liquor, and tobacco; appliances, electronics, health and beauty aids, hardware, garden and patio products, sporting goods, tires, toys and seasonal products, office supplies, automotive care products, postages, tickets, apparel, small appliances, furniture, domestics, housewares, special order kiosks, and jewelry; and meat, produce, service deli, and bakery products. The company also operates gasoline, pharmacies, optical, food courts, hearing-aid centers, and tire installation centers; and offers business delivery, travel, grocery, and various other services online. It also operates e-commerce websites. The company was formerly known as Costco Companies, Inc. and changed its name to Costco Wholesale Corporation in August 1999. Costco Wholesale Corporation was founded in 1976 and is based in Issaquah, Washington.",55.88383,50.64374,399.9 B,923.83,2.4%,901.91,-0.0%,0.51%,False
