Ticker,Stock Price,Call Contract Price,Strike Price,Expiration Date,Breakeven increase,Company Description,P/E Ratio,Forward P/E,Market Cap,52 Week High,52-week-upside,1y Target Est,1y-target-upside,Dividend Yield,Attractiveness
RY,118.66999816894531,11.4,120.0,2027-01-15,0.1072722847179246,"Royal Bank of Canada operates as a diversified financial service company worldwide. The company's Personal & Commercial Banking segment offers checking and savings accounts, home equity financing, personal lending, private banking, indirect lending, including auto financing, mutual funds and self-directed brokerage accounts, guaranteed investment certificates, credit cards, and payment products and solutions; and lending, leasing, deposit, investment, foreign exchange, cash management, auto dealer financing, trade products, and services to small and medium-sized commercial businesses. This segment offers financial products and services through branches, automated teller machines, and mobile sales network. Its Wealth Management segment provides a suite of wealth, investment, trust, banking, credit, and other advice-based solutions and strategies to high net worth and ultra-high net worth individuals, and institutional clients; asset management products to institutional and individual clients; and asset and investor services to financial institutions, asset managers, and asset owners. The company's Insurance segment offers life, health, home, auto, travel, wealth, annuities, property and casualty, and reinsurance advice and solutions; and business insurance services to individual, business, and group clients through its advice centers, RBC insurance stores, and mobile advisors; digital platforms; and independent brokers and partners. The company's Capital Markets segment offers advisory and origination, sales and trading, lending and financing, and transaction banking services to corporations, institutional clients, asset managers, private equity firms, and governments. The company was founded in 1864 and is headquartered in Toronto, Canada.",15.175191,8.363987,168.2 B,128.05,7.9%,109.40339,-7.8%,3.26%,False
KO,61.814998626708984,6.3,62.5,2027-01-15,0.11299848788272793,"The Coca-Cola Company, a beverage company, manufactures, markets, and sells various nonalcoholic beverages worldwide. The company provides sparkling soft drinks, sparkling flavors; water, sports, coffee, and tea; juice, value-added dairy, and plant-based beverages; and other beverages. It also offers beverage concentrates and syrups, as well as fountain syrups to fountain retailers, such as restaurants and convenience stores. The company sells its products under the Coca-Cola, Diet Coke/Coca-Cola Light, Coca-Cola Zero Sugar, caffeine free Diet Coke, Cherry Coke, Fanta Orange, Fanta Zero Orange, Fanta Zero Sugar, Fanta Apple, Sprite, Sprite Zero Sugar, Simply Orange, Simply Apple, Simply Grapefruit, Fresca, Schweppes, Thums Up, Aquarius, Ayataka, BODYARMOR, Ciel, Costa, Dasani, dogadan, FUZE TEA, Georgia, glacéau smartwater, glacéau vitaminwater, Gold Peak, Ice Dew, I LOHAS, Powerade, Topo Chico, AdeS, Del Valle, fairlife, innocent, Minute Maid, and Minute Maid Pulpy brands. It operates through a network of independent bottling partners, distributors, wholesalers, and retailers, as well as through bottling and distribution operators. The company was founded in 1886 and is headquartered in Atlanta, Georgia.",25.649376,20.815163,266.3 B,73.53,19.0%,72.96792,18.0%,3.18%,True
MCD,283.8699951171875,39.81,280.0,2027-01-15,0.1266072691760738,"McDonald's Corporation operates and franchises restaurants under the McDonald's brand in the United States and internationally. It offers food and beverages, including hamburgers and cheeseburgers, various chicken sandwiches, fries, shakes, desserts, sundaes, cookies, pies, soft drinks, coffee, and other beverages; and full or limited breakfast, as well as sells various other products during limited-time promotions. The company owns and operates under various structures comprising conventional franchise, developmental license, or affiliate. McDonald's Corporation was founded in 1940 and is based in Chicago, Illinois.",24.94464,22.597336,203.4 B,317.9,12.0%,323.42612,13.9%,2.51%,False
PM,117.5999984741211,13.2,120.0,2027-01-15,0.13265307592084552,"Philip Morris International Inc. operates as a tobacco company working to delivers a smoke-free future and evolving portfolio for the long-term to include products outside of the tobacco and nicotine sector. The company's product portfolio primarily consists of cigarettes and smoke-free products, including heat-not-burn, vapor, and oral nicotine products primarily under the IQOS and ZYN brands; and consumer accessories, such as lighters and matches. It also offers wellness and healthcare products. Philip Morris International Inc. was incorporated in 1987 and is headquartered in Stamford, Connecticut.",18.666666,16.664375,182.8 B,134.15,14.1%,135.54077,15.3%,4.61%,True
LIN,421.8399963378906,59.77,420.0,2027-01-15,0.13732695847955556,"Linde plc operates as an industrial gas company in the Americas, Europe, the Middle East, Africa, Asia, and South Pacific. It offers atmospheric gases, including oxygen, nitrogen, argon, and rare gases; and process gases, such as carbon dioxide, helium, hydrogen, electronic gases, specialty gases, and acetylene. The company also designs and constructs turnkey process plants for third-party customers, as well as for the gas businesses in various locations, such as air separation, hydrogen, synthesis, olefin, and natural gas plants. It serves a range of industries, including healthcare, chemicals and energy, manufacturing, metals and mining, food and beverage, and electronics. The company was founded in 1879 and is based in Woking, the United Kingdom.",32.030373,24.999674,200.9 B,487.49,15.6%,492.58,16.8%,1.34%,True
ITUB,5.070000171661377,0.79,5.0,2027-01-15,0.1420117956529947,"Itaú Unibanco Holding S.A. offers a range of financial products and services to individuals and corporate customers in Brazil and internationally. The company operates through three segments: Retail Banking, Wholesale Banking, and Activities with the Market + Corporation. It offers current account; loans; credit and debit cards; investment and commercial banking services; real estate lending services; financing and investment services; economic, financial and brokerage advisory; and leasing and foreign exchange services. The company also provides property and casualty insurance products covering loss, damage, or liabilities for assets or persons, as well as life insurance products covering death and personal accident. It serves retail customers, account and non-account holders, individuals and legal entities, high income clients, microenterprises, and small companies, as well as middle-market companies and high net worth clients. The company was formerly known as Itaú Unibanco Banco Múltiplo S.A. and changed its name to Itaú Unibanco Holding S.A. in April 2009. The company was incorporated in 1924 and is headquartered in São Paulo, Brazil. Itaú Unibanco Holding S.A. operates as a subsidiary of IUPAR - Itaú Unibanco Participações S.A.",7.681818,6.488936,47.1 B,7.27,43.4%,7.05714,39.2%,2.56%,True
ABBV,177.6750030517578,23.4,180.0,2027-01-15,0.14478681022309225,"AbbVie Inc. discovers, develops, manufactures, and sells pharmaceuticals worldwide. The company offers Humira, an injection for autoimmune and intestinal Behçet's diseases, and pyoderma gangrenosum; Skyrizi to treat moderate to severe plaque psoriasis, psoriatic disease, and Crohn's disease; Rinvoq to treat rheumatoid and psoriatic arthritis, ankylosing spondylitis, atopic dermatitis, axial spondyloarthropathy, ulcerative colitis, and Crohn's disease; Imbruvica for the treatment of adult patients with blood cancers; Epkinly to treat lymphoma; Elahere to treat cancer; and Venclexta/Venclyxto to treat blood cancers. It also provides facial injectables, plastics and regenerative medicine, body contouring, and skincare products; botox therapeutic; Vraylar for depressive disorder; Duopa and Duodopa to treat advanced Parkinson's disease; Ubrelvy for the acute treatment of migraine in adults; and Qulipta for episodic and chronic migraine. In addition, the company offers Ozurdex for eye diseases; Lumigan/Ganfort and Alphagan/Combigan for the reduction of elevated intraocular pressure in patients with open angle glaucoma or ocular hypertension; Restasis to increase tear production; and other eye care products. Further, it provides Mavyret/Maviret to treat chronic hepatitis C virus genotype 1-6 infection; Creon, a pancreatic enzyme therapy; Lupron to treat advanced prostate cancer, endometriosis and central precocious puberty, and patients with anemia caused by uterine fibroids; Linzess/Constella to treat irritable bowel syndrome with constipation and chronic idiopathic constipation; and Synthroid for hypothyroidism. It has collaborations with Calico Life Sciences LLC; REGENXBIO Inc.; Janssen Biotech, Inc.; Evolveimmune Therapeutics, Inc.; Genentech, Inc.; and Tentarix Biotherapeutics, LP. The company was incorporated in 2012 and is headquartered in North Chicago, Illinois.",61.90767,14.593442,314.0 B,207.32,16.7%,202.32787,13.9%,3.74%,False
HD,389.34710693359375,58.9,390.0,2027-01-15,0.15295578676680255,"The Home Depot, Inc. operates as a home improvement retailer in the United States and internationally. It sells various building materials, home improvement products, lawn and garden products, and décor products, as well as facilities maintenance, repair, and operations products. The company also offers installation services for flooring, water heaters, bath, garage doors, cabinets, cabinet makeovers, countertops, sheds, furnaces and central air systems, and windows. In addition, it provides tool and equipment rental services. The company primarily serves homeowners; and professional renovators/remodelers, general contractors, maintenance professionals, handymen, property managers, and building service contractors, as well as specialty tradesmen, such as electricians, plumbers, and painters. It sells its products through websites, including homedepot.com; homedepot.ca and homedepot.com.mx; blinds.com, justblinds.com, and americanblinds.com for custom window coverings; thecompanystore.com, an online site for textiles and décor products; hdsupply.com for maintenance, repair, and operations (MRO) products and related services; and The Home Depot stores. The Home Depot, Inc. was incorporated in 1978 and is headquartered in Atlanta, Georgia.",26.414322,24.733517,386.8 B,439.37,12.8%,430.352,10.5%,2.31%,False
BAC,45.005001068115234,7.35,45.0,2027-01-15,0.16320406082799743,"Bank of America Corporation, through its subsidiaries, provides banking and financial products and services for individual consumers, small and middle-market businesses, institutional investors, large corporations, and governments worldwide. It operates in four segments: Consumer Banking, Global Wealth & Investment Management (GWIM), Global Banking, and Global Markets. The Consumer Banking segment offers traditional and money market savings accounts, certificates of deposit and IRAs, non-interest and interest-bearing checking accounts, and investment accounts and products; credit and debit cards; residential mortgages, and home equity loans; and direct and indirect loans, such as automotive, recreational vehicle, and consumer personal loans. The GWIM segment provides investment management, brokerage, banking, and trust and retirement products and services; wealth management solutions; and customized solutions, including specialty asset management services. The Global Banking segment offers lending products and services, including commercial loans, leases, commitment facilities, trade finance, and commercial real estate and asset-based lending; treasury solutions, such as treasury management, foreign exchange, short-term investing options, and merchant services; working capital management solutions; debt and equity underwriting and distribution, and merger-related and other advisory services; and fixed-income and equity research, and certain market-based services. The Global Markets segment provides market-making, financing, securities clearing, settlement, and custody services; securities and derivative products; and risk management products using interest rate, equity, credit, currency and commodity derivatives, foreign exchange, fixed-income, and mortgage-related products. Bank of America Corporation was founded in 1784 and is based in Charlotte, North Carolina.",16.30616,12.139825,345.3 B,48.08,6.8%,50.84682,13.0%,2.31%,False
UNP,226.71499633789062,35.05,230.0,2027-01-15,0.1690889631534378,"Union Pacific Corporation, through its subsidiary, Union Pacific Railroad Company, operates in the railroad business in the United States. The company offers transportation services for grain and grain products, fertilizers, food and refrigerated products, and coal and renewables to grain processors, animal feeders, ethanol producers, renewable biofuel producers, and other agricultural users; and construction products, industrial chemicals, plastics, forest products, specialized products, metals and ores, petroleum, liquid petroleum gases, soda ash, and sand, as well as finished automobiles, automotive parts, and merchandise in intermodal containers. Union Pacific Corporation was founded in 1862 and is headquartered in Omaha, Nebraska.",20.837774,18.67738,137.4 B,258.66,14.1%,256.9718,13.3%,2.38%,False
GS,561.7999267578125,97.0,560.0,2027-01-15,0.16945547464129085,"The Goldman Sachs Group, Inc., a financial institution, provides a range of financial services for corporations, financial institutions, governments, and individuals worldwide. It operates through Global Banking & Markets, Asset & Wealth Management, and Platform Solutions segments. The Global Banking & Markets segment provides financial advisory services, including strategic advisory assignments related to mergers and acquisitions, divestitures, corporate defense activities, restructurings, and spin-offs; and relationship lending, and acquisition financing, as well as secured lending, through structured credit and asset-backed lending and involved in financing under securities to resale agreements. This segment also offers client execution activities for cash and derivative instruments; credit and interest rate products; and provision of mortgages, currencies, commodities, and equities related products, as well as underwriting services. The Asset & Wealth Management segment manages assets across various classes, including equity, fixed income, hedge funds, credit funds, private equity, real estate, currencies, and commodities; and provides customized investment advisory solutions, wealth advisory services, personalized financial planning, and private banking services, as well as invests in corporate equity, credit, real estate, and infrastructure assets. The Platform Solutions segment offers credit cards and point-of-sale financing for purchase of goods or services. This segment also provides cash management services, such as deposit-taking and payment solutions for corporate and institutional clients. The Goldman Sachs Group, Inc. was founded in 1869 and is headquartered in New York, New York.",16.47507,12.914525,176.4 B,612.73,9.1%,614.55,9.4%,2.14%,False
COST,927.6699829101562,158.0,930.0,2027-01-15,0.17283087740629366,"Costco Wholesale Corporation, together with its subsidiaries, engages in the operation of membership warehouses in the United States, Puerto Rico, Canada, Mexico, Japan, the United Kingdom, Korea, Australia, Taiwan, China, Spain, France, Iceland, New Zealand, and Sweden. The company offers branded and private-label products in a range of merchandise categories. It offers merchandise, such as sundries, dry groceries, candies, coolers, freezers, deli, liquor, and tobacco; appliances, electronics, health and beauty aids, hardware, lawn and garden, sporting goods, tires, toys and seasonal products, office supplies, automotive care products, postages, tickets, apparel, small appliances, furniture, domestics, housewares, special order kiosks, and jewelry; and meat, produce, service deli, and bakery products. The company also operates gasoline, pharmacies, optical, food courts, hearing-aid centers, and tire installation centers; and offers business delivery, travel, grocery, and various other services online. It also operates e-commerce websites. The company was formerly known as Costco Companies, Inc. and changed its name to Costco Wholesale Corporation in August 1999. Costco Wholesale Corporation was founded in 1976 and is based in Issaquah, Washington.",54.4088,46.39192,411.8 B,1008.25,8.7%,1018.35315,9.8%,0.47%,False
ETN,341.010009765625,61.3,340.0,2027-01-15,0.17679830065930346,"Eaton Corporation plc operates as a power management company worldwide. The company's Electrical Americas and Electrical Global segment provides electrical components, industrial components, power distribution and assemblies, residential products, single and three phase power quality and connectivity products, wiring devices, circuit protection products, utility power distribution products, power reliability equipment, and services, as well as hazardous duty electrical equipment, emergency lighting, fire detection, explosion-proof instrumentation, and structural support systems. Its Aerospace segment offers pumps, motors, hydraulic power units, hoses and fittings, and electro-hydraulic pumps; valves, cylinders, electronic controls, electromechanical actuators, sensors, aircraft flap and slat systems, and nose wheel steering systems; hose, thermoplastic tubing products, fittings, adapters, couplings, and sealing and ducting products; air-to-air refueling systems, fuel pumps, fuel inerting products, sensors, and adapters and regulators; oxygen generation system, payload carriages, and thermal management products; and wiring connectors and cables, as well as hydraulic and bag filters, strainers and cartridges, and golf grips for manufacturers of commercial and military aircraft, and related after-market customers, as well as industrial applications. The company's Vehicle segment offers transmissions, clutches, hybrid power systems, superchargers, engine valves and valve actuation systems, locking and limited slip differentials, transmission controls, and fuel vapor components for the vehicle industry. Its eMobility segment provides voltage inverters, converters, fuses, circuit protection units, vehicle controls, power distribution systems, fuel tank isolation valves, and commercial vehicle hybrid systems. Eaton Corporation plc was founded in 1911 and is based in Dublin, Ireland.",36.33014,28.275341,134.8 B,379.99,11.4%,381.3929,11.8%,1.10%,False
HON,219.125,38.4,220.0,2027-01-15,0.17923559612093554,"Honeywell International Inc. engages in the aerospace technologies, building automation, energy and sustainable solutions, and industrial automation businesses in the United States, Europe, and internationally. The company's Aerospace segment offers auxiliary power units, propulsion engines, integrated avionics, environmental control and electric power systems, engine controls, flight safety, communications, navigation hardware, data and software applications, radar and surveillance systems, aircraft lighting, advanced systems and instruments, satellite and space components, and aircraft wheels and brakes; spare parts; repair, overhaul, and maintenance services; and thermal systems, as well as wireless connectivity services. Its Honeywell Building Technologies segment provides software applications for building control and optimization; sensors, switches, control systems, and instruments for energy management; access control; video surveillance; fire products; and installation, maintenance, and upgrades of systems. The company's Performance Materials and Technologies segment offers automation control, instrumentation, and software and related services; catalysts and adsorbents, equipment, and consulting; and materials to manufacture end products, such as bullet-resistant armor, nylon, computer chips, and pharmaceutical packaging, as well as provides materials based on hydrofluoro-olefin technology. Its Safety and Productivity Solutions segment provides personal protective equipment, apparel, gear, and footwear; gas detection technology; custom-engineered sensors, switches, and controls for sensing and productivity solution; cloud-based notification and emergency messaging; mobile devices and software; custom-engineered sensors, switches, and controls; and data and asset management productivity solutions. Honeywell International Inc. was founded in 1885 and is headquartered in Charlotte, North Carolina.",25.303118,19.996113,142.5 B,242.77,10.8%,245.10793,11.9%,2.07%,False
DHR,239.45970153808594,43.35,240.0,2027-01-15,0.18328887148860562,"Danaher Corporation designs, manufactures, and markets professional, medical, industrial, and commercial products and services worldwide. The Biotechnology segments offers bioprocess technologies, consumables, and services that advance, accelerate, and integrate the development and manufacture of therapeutics; cell line and cell culture media development services; cell culture media, process liquids and buffers for manufacturing, chromatography resins, filtration technologies, aseptic fill finish; single-use hardware and consumables and services, such as the design and installation of full manufacturing suites; lab filtration, separation, and purification; lab-scale protein purification and analytical tools; reagents, membranes, and services; and healthcare filtration solutions. The Life Sciences segment provides mass spectrometers; flow cytometry, genomics, lab automation, centrifugation, liquid handling automation instruments, antibodies and reagents, and particle counting and characterization; microscopes; protein consumables; industrial filtration products; and genomic medicines, such as custom nucleic acid products, plasmid DNA, RNA, and proteins under the ABCAM, ALDEVRON, BECKMAN COULTER, IDT, LEICA MICROSYSTEMS, MOLECULAR DEVICES, PALL, PHENOMENEX and SCIEX brands. The Diagnostics segment offers chemistry, immunoassay, microbiology, and automation systems; and molecular, acute care, and pathology diagnostics products. This segment also provides clinical instruments, reagents, consumables, software, and services for hospitals, physicians' offices, reference laboratories, and other critical care settings. The company has a research  collaboration  with Stanford  University's Department  of  Bioengineering for cancer drug development. The company was formerly known as Diversified Mortgage Investors, Inc. and changed its name to Danaher Corporation in 1984. Danaher Corporation was founded in 1969 and is based in Washington, the District of Columbia.",45.266483,28.837328,173.0 B,281.7,17.6%,284.4269,18.8%,0.46%,False
PGR,236.09140014648438,41.5,240.0,2027-01-15,0.19233483229521098,"The Progressive Corporation, an insurance holding company, provides personal and commercial auto, personal residential and commercial property, business related general liability, and other specialty property-casualty insurance products and related services in the United States. It operates in three segments: Personal Lines, Commercial Lines, and Property. The Personal Lines segment writes insurance for personal autos and recreational vehicles (RV). This segment's products include personal auto insurance; and special lines products, including insurance for motorcycles, ATVs, RVs, watercrafts, snowmobiles, and related products. The Commercial Lines segment provides auto-related liability and physical damage insurance, and business-related general liability and property insurance for autos, vans, and pick-up trucks used by small businesses, as well as non-fleet taxis, black-car services, and airport taxis; tractors, trailers, and straight trucks primarily used by regional general freight and expeditor-type businesses, and long-haul operators; dump trucks used by light contractors and heavy constructions; log trucks and garbage trucks used by dirt, sand and gravel, logging, garbage/debris removal, and coal-type businesses; and tow trucks and wreckers used in towing services and gas/service station businesses. The Property segment writes residential property insurance for homeowners, other property owners, and renters, as well as offers manufactured homes, personal umbrella insurance, and primary and excess flood insurance. The company offers policy issuance and claims adjusting services; acts as an agent to homeowners, general liability, workers' compensation insurance, and other products; and reinsurance services. It sells its products through independent insurance agencies, as well as through mobile applications and over the phone. The Progressive Corporation was founded in 1937 and is headquartered in Mayfield Village, Ohio.",17.157804,16.476854,138.3 B,270.62,14.6%,277.7647,17.7%,2.08%,False
