Ticker,Stock Price,Call Contract Price,Strike Price,Expiration Date,Breakeven increase,Company Description,P/E Ratio,Forward P/E,Market Cap,52 Week High,52-week-upside,1y Target Est,1y-target-upside,Dividend Yield,Attractiveness
AMD,126.29000091552734,10.8,125.0,2025-02-21,0.07530286654153806,"Advanced Micro Devices, Inc. operates as a semiconductor company worldwide. It operates through Data Center, Client, Gaming, and Embedded segments. The company offers x86 microprocessors and graphics processing units (GPUs) as an accelerated processing unit, chipsets, data center, and professional GPUs; and embedded processors, and semi-custom system-on-chip (SoC) products, microprocessor and SoC development services and technology, data processing unites, field programmable gate arrays (FPGA), and adaptive SoC products. It provides processors under the AMD Ryzen, AMD Ryzen PRO, Ryzen Threadripper, Ryzen Threadripper PRO, AMD Athlon, AMD Athlon PRO, and AMD PRO A-Series brand names; graphics under the AMD Radeon graphics and AMD Embedded Radeon graphics; and professional graphics under the AMD Radeon Pro graphics brand name. In addition, the company offers data center graphics under the Radeon Instinct and Radeon PRO V-series brands, as well as servers under the AMD Instinct accelerators brand; server microprocessors under the AMD EPYC brands; low power solutions under the AMD Athlon, AMD Geode, AMD Ryzen, AMD EPYC, AMD R-Series, and G-Series brands; FPGA products under the Virtex-6, Virtex-7, Virtex UltraScale+, Kintex-7, Kintex UltraScale, Kintex UltraScale+, Artix-7, Artix UltraScale+, Spartan-6, and Spartan-7 brands; adaptive SOCs under the Zynq-7000, Zynq UltraScale+ MPSoC, Zynq UltraScale+ RFSoCs, Versal HBM, Versal Premium, Versal Prime, Versal AI Core, Versal AI Edge, Vitis, and Vivado brands; and compute and network acceleration board products under the Alveo brand. It serves original equipment and design manufacturers, public cloud service providers, system integrators, independent distributors, and add-in-board manufacturers through its direct sales force, and sales representatives. Advanced Micro Devices, Inc. was incorporated in 1969 and is headquartered in Santa Clara, California.",112.75893,24.598372,204.9 B,227.3,80.0%,183.16273,45.0%,N/A,True
TSM,206.3300018310547,11.92,210.0,2025-02-21,0.07555856167592423,"Taiwan Semiconductor Manufacturing Company Limited, together with its subsidiaries, manufactures, packages, tests, and sells integrated circuits and other semiconductor devices in Taiwan, China, Europe, the Middle East, Africa, Japan, the United States, and internationally. It provides a range of wafer fabrication processes, including processes to manufacture complementary metal- oxide-semiconductor (CMOS) logic, mixed-signal, radio frequency, embedded memory, bipolar CMOS mixed-signal, and others. The company also offers customer and engineering support services; manufactures masks; and invests in technology start-up companies; researches, designs, develops, manufactures, packages, tests, and sells color filters; and provides investment services. Its products are used in high performance computing, smartphones, Internet of things, automotive, and digital consumer electronics. The company was incorporated in 1987 and is headquartered in Hsinchu City, Taiwan.",33.332794,23.099674,1070.1 B,212.6,3.0%,232.40312,12.6%,1.41%,False
ANET,114.6500015258789,8.48,115.0,2025-02-21,0.07701699395204975,"Arista Networks Inc engages in the development, marketing, and sale of data-driven, client to cloud networking solutions for data center, campus, and routing environments in the Americas, Europe, the Middle East, Africa, and the Asia-Pacific. Its cloud networking solutions consist of Extensible Operating System (EOS), a publish-subscribe state-sharing networking operating system offered in combination with a set of network applications. The company offers data center and cloud networking systems, including newer artificial intelligence (AI) ethernet switching platforms; campus wired and wireless products, and routing systems addressing Core Routing, Edge Routing, Data Center Interconnect (DCI), Multi-cloud and Wide Area Networking (WAN) use cases; and a suite of value-add software solutions that leverage EOS to provide end-to-end orchestration, automation, analytics, network monitoring, and security. It also provides post contract customer support services, such as technical support, hardware repair and replacement parts beyond standard warranty, bug fixes, patches, and upgrade services. The company serves a range of industries comprising internet companies, service providers, financial services organizations, government agencies, media and entertainment companies, telecommunication service providers, and others. It markets and sells its products through distributors, system integrators, value-added resellers, and original equipment manufacturer partners, as well as through its direct sales force. The company was formerly known as Arastra, Inc. and changed its name to Arista Networks Inc in October 2008. Arista Networks Inc was incorporated in 2004 and is headquartered in Santa Clara, California.",54.85646,46.637543,144.4 B,116.94,2.0%,108.48424,-5.4%,N/A,False
UBER,61.709999084472656,4.15,62.5,2025-02-21,0.08005187147653592,"Uber Technologies, Inc. develops and operates proprietary technology applications in the United States, Canada, Latin America, Europe, the Middle East, Africa, and Asia excluding China and Southeast Asia. It operates through three segments: Mobility, Delivery, and Freight. The Mobility segment connects consumers with a range of transportation modalities, such as ridesharing, carsharing, micromobility, rentals, public transit, taxis, and other modalities; and offers riders in a variety of vehicle types, as well as financial partnerships products and advertising services. The Delivery segment allows to search for and discover restaurants to grocery, alcohol, convenience, and other retails; order a meal or other items; and Uber direct, a white-label Delivery-as-a-Service for retailers and restaurants, as well as advertising. The Freight segment manages transportation and logistics network, which connects shippers and carriers in digital marketplace including carriers upfronts, pricing, and shipment booking; and provides on-demand platform to automate logistics end-to-end transactions for small-and medium-sized business to global enterprises. The company was formerly known as Ubercab, Inc. and changed its name to Uber Technologies, Inc. in February 2011. Uber Technologies, Inc. was founded in 2009 and is headquartered in San Francisco, California.",30.399015,19.529161,129.9 B,87.0,41.0%,90.0346,45.9%,N/A,True
HDB,65.19000244140625,0.61,70.0,2025-02-21,0.0831415455685145,"HDFC Bank Limited engages in the provision of banking and financial services to individuals and businesses in India, Bahrain, Hong Kong, Singapore, and Dubai. The company operates in three segments: Treasury, Retail Banking, Wholesale Banking, and Other Banking Services. It accepts savings, salary, current, rural, public provident fund, pension, and demat accounts; fixed and recurring deposits; and safe deposit lockers, as well as offshore accounts and deposits, and overdrafts against fixed deposits. The company also provides personal, home, car, two-wheeler, business, doctor, educational, gold, consumer, and rural loans; loans against properties, securities, mutual funds, rental receivables, and assets; loans for professionals; government sponsored programs; and loans on credit card, as well as working capital and commercial/construction equipment finance, healthcare/medical equipment and commercial vehicle finance, dealer finance, and term loans. In addition, it offers credit, debit, prepaid, and forex cards; payment and collection, export, import, remittance, bank guarantee, letter of credit, trade, hedging, and merchant and cash management services; insurance and investment products. Further, the company provides short term finance, bill discounting, structured finance, export credit, loan repayment, and documents collection services; online and wholesale, mobile, and phone banking services; unified payment interface, immediate payment, national electronic funds transfer, and real time gross settlement services; and channel financing, vendor financing, reimbursement account, money market, derivatives, employee trusts, cash surplus corporates, tax payment, and bankers to rights/public issue services, as well as financial solutions for supply chain partners and agricultural customers. It operates branches and automated teller machines in various cities/towns. The company was incorporated in 1994 and is headquartered in Mumbai, India.",20.894232,21.921154,166.2 B,68.5,5.1%,75.3875,15.6%,1.08%,False
MUFG,11.539999961853027,0.25,12.5,2025-02-21,0.10485268996072672,"Mitsubishi UFJ Financial Group, Inc. operates as the bank holding company, that engages in a range of financial businesses in Japan, the United States, Europe, Asia/Oceania, and internationally. It operates through seven segments: Digital Service, Retail & Commercial Banking, Japanese Corporate & Investment Banking, Global Commercial Banking, Asset Management & Investor Services, Global Corporate & Investment Banking, and Global Markets. The company offers commercial banking, trust banking, and securities products and services to retail, and small and medium-sized enterprise customers. It also provides mergers and acquisition, debt and equity issuance, financial advice, and real estate-related services; digital-based financial services; credit cards; and trust banking and securities products and services, as well as engages in the lending, fund settlement, and foreign exchange businesses. In addition, the company offers corporate banking services, such as project export credit agency finance, and financing through asset-backed commercial paper; investment and transaction banking services for corporations, financial institutions, sovereign and multinational organizations, and institutional investors; and asset management and investor services, including pension fund management and administration, pension structure advisory, beneficiary payment, and investment trust services for retail customers. Further, it provides loans, deposits, fund transfers, hedging, and investments services for retail, small and medium-sized enterprise, as well as corporate customers; financing for automotive and consumer goods; sells and trades in fixed income instruments, currencies, equities, and equities; offers investment products comprising mutual funds, structured bonds, and notes; originates and distributes of financial products; and provides insurance and treasury services. The company was founded in 1880 and is headquartered in Tokyo, Japan.",11.656566,11.203884,134.4 B,12.31,6.7%,12.9305,12.0%,2.21%,False
MO,53.470001220703125,1.02,52.5,2025-01-17,0.0009350809454913289,"Altria Group, Inc., through its subsidiaries, manufactures and sells smokeable and oral tobacco products in the United States. The company offers cigarettes primarily under the Marlboro brand; large cigars and pipe tobacco under the Black & Mild brand; moist smokeless tobacco and snus products under the Copenhagen, Skoal, Red Seal, and Husky brands; oral nicotine pouches under the on! brand; and e-vapor products under the NJOY ACE brand. It sells its products to distributors, as well as large retail organizations, such as chain stores. The company was founded in 1822 and is headquartered in Richmond, Virginia.",9.032095,9.991759,90.6 B,58.04,8.5%,56.80333,6.2%,7.58%,True
CMCSA,38.400001525878906,1.17,37.5,2025-01-17,0.0070312099841749465,"Comcast Corporation operates as a media and technology company worldwide. It operates through Residential Connectivity & Platforms, Business Services Connectivity, Media, Studios, and Theme Parks segments. The Residential Connectivity & Platforms segment provides residential broadband and wireless connectivity services, residential and business video services, sky-branded entertainment television networks, and advertising. The Business Services Connectivity segment offers connectivity services for small business locations, which include broadband, wireline voice, and wireless services, as well as solutions for medium-sized customers and larger enterprises; and small business connectivity services in the United Kingdom. The Media segment operates NBCUniversal's television and streaming business, including national and regional cable networks; the NBC and Telemundo broadcast networks and owned local broadcast television stations; and Peacock, a direct-to-consumer streaming services. It also operates international television networks comprising the Sky Sports networks, as well as other digital properties. The Studios segment operates NBCUniversal and Sky film and television studio production and distribution operations. The Theme Parks segment operates Universal theme parks in Orlando, Florida; Hollywood, California; Osaka, Japan; and Beijing, China. The company also offers a consolidated streaming platforms under the Philadelphia Flyers and the Wells Fargo Center arena in Philadelphia, Pennsylvania; and Xumo. Comcast Corporation was founded in 1963 and is headquartered in Philadelphia, Pennsylvania.",10.350405,8.779872,146.9 B,47.11,22.7%,47.91679,24.8%,3.24%,True
SNY,48.290000915527344,1.73,47.0,2025-01-17,0.009111598180383762,"Sanofi, a healthcare company, engages in the research, development, manufacture, and marketing of therapeutic solutions in the United States, Europe, Canada, and internationally. It operates through Pharmaceuticals, Vaccines, and Consumer Healthcare segments. The company provides specialty care, such as DUPIXENT, neurology and immunology, rare diseases, oncology, and rare blood disorders; medicines for diabetes and cardiovascular diseases; and established prescription products. In addition, it offers poliomyelitis, pertussis, and hib pediatric vaccines; influenza, booster, meningitis, and travel and endemic vaccines, which includes hepatitis A, typhoid, cholera, yellow fever, and rabies vaccines. The company also provides cough, cold, and flu, allergy, and pain care products, as well as physical, mental, and digestive wellness products; and offers products for itching, hydration, aging, cracking, overnight, and specialty skincare needs like eczema. Further, it has a collaboration and license agreement with Exscientia to develop up to 15 novel small-molecule for oncology and immunology; ABL Bio, Inc. to develop ABL301, a treatment for alpha-synucleinopathies; Blackstone Life Sciences to develop pivotal studies and clinical development program; and Seagen Inc. to design, develop, and commercialize antibody-drug conjugates for cancer. Additionally, the company has a collaboration agreement with IGM Biosciences, Inc. to develop, manufacture, and commercialize IgM antibody; Skyhawk Therapeutics, Inc to discover and develop novel small molecules; and Adagene Inc., for the discovery and development of antibody-based therapies. It also has collaborations with Scribe Therapeutics Inc. to develop genome editing technologies; and co-promotion service agreement with Provention Bio, Inc. for the commercialization of teplizumab. The company was formerly known as Sanofi-Aventis and changed its name to Sanofi in May 2011. Sanofi was incorporated in 1994 and is headquartered in Paris, France.",25.82353,9.956557,121.1 B,58.97,22.1%,63.06286,30.6%,4.27%,True
TD,53.060001373291016,1.05,52.5,2025-01-17,0.009234802375177376,"The Toronto-Dominion Bank, together with its subsidiaries, provides various financial products and services in Canada, the United States, and internationally. It operates through four segments: Canadian Personal and Commercial Banking, U.S. Retail, Wealth Management and Insurance, and Wholesale Banking. The company offers personal deposits, such as chequing, savings, and investment products; financing, investment, cash management, international trade, and day-to-day banking services to businesses; and financing options to customers at point of sale for automotive and recreational vehicle purchases. It also provides credit cards and payments; real estate secured lending, auto finance, and consumer lending services; point-of-sale payment solutions for large and small businesses; wealth and asset management products, and advice to retail and institutional clients through direct investing, advice-based, and asset management businesses; and property and casualty insurance, as well as life and health insurance products. The company also provides capital markets, and corporate and investment banking products and services, including underwriting and distribution of new debt and equity issues; advice on strategic acquisitions and divestitures; and trading, funding, and investment services to corporations, governments, and institutions. It offers its products and services under the TD Bank and America's Most Convenient Bank brand names. The Toronto-Dominion Bank was founded in 1855 and is headquartered in Toronto, Canada.",16.17683,6.305265,92.9 B,65.12,22.7%,59.551174,12.2%,5.18%,True
BP,28.790000915527344,1.07,28.0,2025-01-17,0.00972556705691674,"BP p.l.c. provides carbon products and services. The company operates through Gas & Low Carbon Energy, Oil Production & Operations, and Customers & Products segments. It engages in the production of natural gas, and integrated gas and power; trading of gas; operation of onshore and offshore wind power, as well as hydrogen and carbon capture and storage facilities; trading and marketing of renewable and non-renewable power; and production of crude oil. In addition, the company involved in convenience and retail fuel, EV charging, Castrol lubricant, aviation, B2B, and midstream businesses; refining and oil trading; and bioenergy business. The company was founded in 1908 and is headquartered in London, the United Kingdom.",28.79,6.3732195,76.0 B,40.4,40.3%,37.56125,30.5%,6.71%,True
CME,239.47000122070312,1.81,240.0,2025-01-17,0.009771573756080842,"CME Group Inc., together with its subsidiaries, operates contract markets for the trading of futures and options on futures contracts worldwide. It offers futures and options products based on interest rates, equity indexes, foreign exchange, agricultural commodities, energy, and metals, as well as fixed income and foreign currency trading services. The company also provides clearing house services, including clearing, settling, and guaranteeing futures and options contracts, and cleared swaps products traded through its exchanges; and trade processing and risk mitigation services. In addition, the company offers a range of market data services, including real-time and historical data services. It serves professional traders, financial institutions, institutional and individual investors, corporations, manufacturers, producers, governments, and central banks. The company was formerly known as Chicago Mercantile Exchange Holdings Inc. and changed its name to CME Group Inc. in July 2007. The company was founded in 1898 and is headquartered in Chicago, Illinois.",25.180862,22.987854,86.3 B,249.02,4.0%,242.375,1.2%,4.36%,True
BN,57.4900016784668,3.1,55.0,2025-01-17,0.010610511458059024,"Brookfield Corporation is an alternative asset manager and REIT/Real Estate Investment Manager firm focuses on real estate, renewable power, infrastructure and venture capital and private equity assets. It manages a range of public and private investment products and services for institutional and retail clients. It typically makes investments in sizeable, premier assets across geographies and asset classes. It invests both its own capital as well as capital from other investors. Within private equity and venture capital, it focuses on acquisition, early ventures, control buyouts and financially distressed, buyouts and corporate carve-outs, recapitalizations, convertible, senior and mezzanine financings, operational and capital structure restructuring, strategic re-direction, turnaround, and under-performing midmarket companies. It invests in both public debt and equity markets. It invests in private equity sectors with focus on Business Services include infrastructure, healthcare, road fuel distribution and marketing, construction and real estate; Industrials include manufacturers of automotive batteries, graphite electrodes, returnable plastic packaging, and sanitation management and development; and Residential/ infrastructure services. It targets companies which likely possess underlying real assets, primarily in sectors such as industrial products, building materials, metals, mining, homebuilding, oil and gas, paper and packaging, manufacturing and forest product sectors. It invests globally with focus on North America including Brazil, the United States, Canada; Europe; and Australia; and Asia-Pacific. The firm considers equity investments in the range of $2 million to $500 million. It has a four-year investment period and a 10-year term with two one-year extensions. The firm prefers to take minority stake and majority stake. Brookfield Corporation was founded in 1997 and based in Toronto, Canada with additional offices across Northern America; South America; Europe; Middle East and Asia.",124.978264,9.793868,86.9 B,62.44,8.6%,63.71429,10.8%,0.55%,True
AON,361.6099853515625,5.61,360.0,2025-01-17,0.01106168195147772,"Aon plc, a professional services firm, provides a range of risk and human capital solutions worldwide. It offers commercial risk solutions, including retail brokerage, specialty solutions, global risk consulting and captives management, and affinity programs; and health solutions, such as health and benefits brokerages, and health care exchanges. The company also provides treaty and facultative reinsurance, as well as insurance-linked securities, capital raising, strategic advice, restructuring, and mergers and acquisitions services; and corporate finance advisory services. In addition, it offers strategic design consulting services on their retirement programs, actuarial services, and risk management services; and advice services on developing and maintaining investment programs across various plan types, including defined benefit plans, defined contribution plans, endowments, and foundations for public and private companies, and other institutions. Aon plc was founded in 1919 and is headquartered in Dublin, Ireland.",30.959759,20.754997,78.2 B,395.33,9.3%,383.08212,5.9%,0.75%,True
WELL,126.58999633789062,3.2,125.0,2025-01-17,0.012718253485148878,"Welltower Inc. (NYSE:WELL), a real estate investment trust (""REIT"") and S&P 500 company headquartered in Toledo, Ohio, is driving the transformation of health care infrastructure. Welltower invests with leading seniors housing operators, post-acute providers and health systems to fund the real estate infrastructure needed to scale innovative care delivery models and improve people's wellness and overall health care experience. Welltower owns interests in properties concentrated in major, high-growth markets in the United States, Canada and the United Kingdom, consisting of seniors housing and post-acute communities and outpatient medical properties.",80.63057,66.27749,78.8 B,140.75,11.2%,144.10526,13.8%,2.15%,True
PFE,26.739999771118164,1.09,26.0,2025-01-17,0.01308901390716799,"Pfizer Inc. discovers, develops, manufactures, markets, distributes, and sells biopharmaceutical products in the United States, Europe, and internationally. The company offers medicines and vaccines in various therapeutic areas, including cardiovascular metabolic, migraine, and women's health under the Eliquis, Nurtec ODT/Vydura, Zavzpret, and the Premarin family brands; infectious diseases with unmet medical needs under the Prevnar family, Abrysvo, Nimenrix, FSME/IMMUN-TicoVac, and Trumenba brands; and COVID-19 prevention and treatment, and potential future mRNA and antiviral products under the Comirnaty and Paxlovid brands. It also provides medicines and vaccines in various therapeutic areas, such as biosimilars for chronic immune and inflammatory diseases under the Xeljanz, Enbrel, Inflectra, Litfulo, Velsipity, and Cibinqo brands; amyloidosis, hemophilia, endocrine diseases, and sickle cell disease under the Vyndaqel family, Oxbryta, BeneFIX, Somavert, Ngenla, and Genotropin brands; sterile injectable and anti-infective medicines under the Sulperazon, Medrol, Zavicefta, Zithromax, and Panzyga brands; and biologics, small molecules, immunotherapies, and biosimilars under the Ibrance, Xtandi, Inlyta, Bosulif, Mektovi, Padcev, Adcetris, Talzenna, Tukysa, Elrexfio, Tivdak, Lorbrena, and Braftovi brands. In addition, the company involved in the contract manufacturing business. It serves wholesalers, retailers, hospitals, clinics, government agencies, pharmacies, individual provider offices, retail pharmacies, and integrated delivery systems. The company has collaboration agreements with Bristol-Myers Squibb Company; Astellas Pharma US, Inc.; Merck KGaA; and BioNTech SE, as well as has strategic clinical collaboration with Acepodia Inc. for the development of antibody-cell conjugation-based cell therapies in autoimmune diseases. Pfizer Inc. was founded in 1849 and is headquartered in New York, New York.",35.65333,9.115143,151.5 B,31.54,18.0%,31.86304,19.2%,6.53%,True
