Ticker,Stock Price,Call Contract Price,Strike Price,Expiration Date,Breakeven increase,Company Description,P/E Ratio,Forward P/E,Market Cap,52 Week High,52-week-upside,1y Target Est,1y-target-upside,Dividend Yield,Attractiveness
PANW,172.8300018310547,9.25,175.0,2025-02-21,0.06607648005528932,"Palo Alto Networks, Inc. provides cybersecurity solutions worldwide. The company's network security platforms include Prisma Access, a security services edge (SSE) solution, as well as Strata Cloud Manager, a network security management solution. It also provides cloud security solutions, including Prisma Cloud, a cloud native application protection platform; and Code to Cloud platform, as well as offers VM-Series and CN-Series virtual firewalls for inline network security on multi- and hybrid-cloud environments. In addition, the company provides security operation solutions through Cortex platform that includes Cortex XSIAM, an AI-driven security operations platform; Cortex XDR for the prevention, detection, and response to complex cybersecurity attacks; and Cortex XSOAR for security orchestration, automation, and response; and Cortex Xpanse for attack surface management, as well as offers threat intelligence and advisory services under the Unit 42 name. Further, it provides subscription services covering the areas of threat prevention, malware and persistent threat, URL filtering, laptop and mobile device protection, DNS security, Internet of Things security, SaaS security API, and SaaS security inline, as well as threat intelligence, and data loss prevention. Additionally, the company offers professional services, including architecture design and planning, implementation, configuration, and firewall migration; education services, such as certifications, as well as online and in-classroom training; and support services. It sells its products and services through its channel partners, as well as directly to medium to large enterprises, service providers, and government entities operating in various industries, including education, energy, financial services, government entities, healthcare, Internet and media, manufacturing, public sector, and telecommunications. The company was incorporated in 2005 and is headquartered in Santa Clara, California.",44.89091,47.622196,113.4 B,207.24,19.9%,202.65224,17.3%,N/A,True
TSM,207.1199951171875,10.9,210.0,2025-02-21,0.06653150447891742,"Taiwan Semiconductor Manufacturing Company Limited, together with its subsidiaries, manufactures, packages, tests, and sells integrated circuits and other semiconductor devices in Taiwan, China, Europe, the Middle East, Africa, Japan, the United States, and internationally. It provides a range of wafer fabrication processes, including processes to manufacture complementary metal- oxide-semiconductor (CMOS) logic, mixed-signal, radio frequency, embedded memory, bipolar CMOS mixed-signal, and others. The company also offers customer and engineering support services; manufactures masks; and invests in technology start-up companies; researches, designs, develops, manufactures, packages, tests, and sells color filters; and provides investment services. Its products are used in high performance computing, smartphones, Internet of things, automotive, and digital consumer electronics. The company was incorporated in 1987 and is headquartered in Hsinchu City, Taiwan.",33.46042,22.874662,1074.2 B,222.2,7.3%,231.5762,11.8%,1.34%,True
ANET,115.51000213623047,8.33,115.0,2025-02-21,0.06769974650807087,"Arista Networks Inc engages in the development, marketing, and sale of data-driven, client to cloud networking solutions for data center, campus, and routing environments in the Americas, Europe, the Middle East, Africa, and the Asia-Pacific. Its cloud networking solutions consist of Extensible Operating System (EOS), a publish-subscribe state-sharing networking operating system offered in combination with a set of network applications. The company offers data center and cloud networking systems, including newer artificial intelligence (AI) ethernet switching platforms; campus wired and wireless products, and routing systems addressing Core Routing, Edge Routing, Data Center Interconnect (DCI), Multi-cloud and Wide Area Networking (WAN) use cases; and a suite of value-add software solutions that leverage EOS to provide end-to-end orchestration, automation, analytics, network monitoring, and security. It also provides post contract customer support services, such as technical support, hardware repair and replacement parts beyond standard warranty, bug fixes, patches, and upgrade services. The company serves a range of industries comprising internet companies, service providers, financial services organizations, government agencies, media and entertainment companies, telecommunication service providers, and others. It markets and sells its products through distributors, system integrators, value-added resellers, and original equipment manufacturer partners, as well as through its direct sales force. The company was formerly known as Arastra, Inc. and changed its name to Arista Networks Inc in October 2008. Arista Networks Inc was incorporated in 2004 and is headquartered in Santa Clara, California.",55.533657,46.987377,145.5 B,120.28,4.1%,109.1724,-5.5%,N/A,False
NU,11.140000343322754,0.91,11.0,2025-02-21,0.0691202543040117,"Nu Holdings Ltd. provides digital banking platform in Brazil, Mexico, Colombia, Cayman Islands, Germany, Argentina, the United States, and Uruguay. It offers spending solutions comprising Nu credit and prepaid card, a digitally enabled card that acts as a credit and a prepaid card; Ultraviolet credit and prepaid card, a premium metal credit card for affluent customers; mobile payment solutions for NuAccount customers to make and receive transfers, pay bills, and make everyday purchases through their mobile phones; and Nu Shopping, an integrated mall that enables customers to purchase goods and services from various ecommerce retailers. The company also provides savings solutions, such as Nu Personal Accounts, a digital account solution for personal financial activities; Nu business prepaid and credit card; and Nu business accounts for entrepreneur customers and their businesses. In addition, it offers investing solutions, including Money Boxes for goal-based investing; Nucoin, a proprietary utility token for its loyalty program; NuInvest, which provides equity, fixed-income, stock options, ETF products, and multimarket funds; and NuCrypto, a solution for buying and selling cryptocurrencies through the Nu app. Further, the company provides borrowing solutions comprising Personal unsecured and secured loans; Pix financing that enables credit card and digital account customers to make free and instant peer-to-peer transfers; Boleto financing, which enables credit card and digital account customers to make payments using their credit line; purchase financing; and NuPay to make online purchases and pay for services through Nubank app. Additionally, it offers protection solutions, such as NuInsurance protection solutions, including life, mobile, auto, home, and financial protection insurance policies. The company was founded in 2013 and is headquartered in São Paulo, Brazil.",30.944445,17.93361,53.5 B,16.145,44.9%,15.46,38.8%,N/A,True
SPOT,479.7300109863281,33.65,480.0,2025-02-21,0.07070641451830828,"Spotify Technology S.A., together with its subsidiaries, provides audio streaming subscription services worldwide. It operates through two segments, Premium and Ad-Supported. The Premium segment offers unlimited online and offline streaming access to its catalog of music and podcasts without commercial breaks to its subscribers. This segment sells directly to the end users. The Ad-Supported segment provides on-demand online access to its catalog of music and unlimited online access to the catalog of podcasts to its users on their computers, tablets, and compatible mobile devices. The company also offers sales, distribution and marketing, contract research and development, and customer and other support services. Spotify Technology S.A. was incorporated in 2006 and is based in Luxembourg City, Luxembourg.",137.06572,51.34163,96.9 B,506.473,5.6%,476.80063,-0.6%,N/A,False
CMG,57.91999816894531,2.05,60.0,2025-02-21,0.07130528248650814,"Chipotle Mexican Grill, Inc., together with its subsidiaries, owns and operates Chipotle Mexican Grill restaurants. It sells food and beverages through offering burritos, burrito bowls, quesadillas, tacos, and salads. The company also provides delivery and related services its app and website. It has operations in the United States, Canada, France, Germany, Dubai, and the United Kingdom. Chipotle Mexican Grill, Inc. was founded in 1993 and is headquartered in Newport Beach, California.",53.629627,43.823013,78.9 B,69.2614,19.6%,65.89774,13.8%,N/A,True
LRCX,77.04000091552734,4.65,78.0,2025-02-21,0.07281930189258312,"Lam Research Corporation designs, manufactures, markets, refurbishes, and services semiconductor processing equipment used in the fabrication of integrated circuits. The company offers ALTUS systems to deposit conformal films for tungsten metallization applications; SABRE electrochemical deposition products for copper interconnect transition that offers copper damascene manufacturing; and VECTOR plasma-enhanced CVD products. It also provides SPEED gapfill high-density plasma chemical vapor deposition products; and Striker single-wafer atomic layer deposition products for dielectric film solutions. In addition, the company offers Flex for dielectric etch applications; Vantex, a dielectric etch system that provides RF technology and repeatable wafer-to-wafer performance enabled by Equipment Intelligence solutions; Kiyo for conductor etch applications; Syndion for through-silicon via etch applications; and Versys metal products for metal etch processes. Further, it provides Coronus bevel clean products to enhance die yield; and Da Vinci, DV-Prime, EOS, and SP series products to address various wafer cleaning applications. The company sells its products in the United States, China, Europe, Japan, Korea, Southeast Asia, and Taiwan. Lam Research Corporation was incorporated in 1980 and is headquartered in Fremont, California.",24.93204,18.474688,99.1 B,113.0,46.7%,92.82013,20.5%,1.19%,True
MPWR,620.9600219726562,46.3,620.0,2025-02-21,0.0730159372954613,"Monolithic Power Systems, Inc. engages in the design, development, marketing, and sale of semiconductor-based power electronics solutions for the storage and computing, automotive, enterprise data, consumer, communications, and industrial markets. The company provides direct current (DC) to DC integrated circuits (ICs) that are used to convert and control voltages of various electronic systems, such as cloud-based CPU servers, server artificial intelligence applications, storage applications, commercial notebooks, digital cockpit, power sources, home appliances, 4G and 5G infrastructure, and satellite communications applications. It offers lighting control ICs for backlighting that are used in systems, which provide the light source for LCD panels in computers and notebooks, monitors, car navigation systems, and televisions, as well as for general illumination products. The company sells its products through third-party distributors, value-added resellers, directly to original equipment manufacturers, original design manufacturers, electronic manufacturing service providers, and other end customers. It serves China, Taiwan, South Korea, Europe, Japan, Southeast Asia, the United States, and internationally. Monolithic Power Systems, Inc. was incorporated in 1997 and is headquartered in Kirkland, Washington.",69.92793,37.539726,30.3 B,959.64,54.5%,809.7286,30.4%,0.81%,True
GEV,366.4800109863281,24.95,370.0,2025-02-21,0.07768497096758153,"GE Vernova Inc., an energy company, engages in the provision of various products and services that generate, transfer, orchestrate, convert, and store electricity in the United States, Europe, Asia, the Americas, the Middle East, and Africa. The company operates through three segments: Power, Wind, and Electrification. The Power segment designs, manufactures, and services gas, nuclear, hydro, and steam technologies. The Wind segment offers wind generation technologies, including onshore and offshore wind turbines and blades. The Electrification segment provides grid solutions, power conversion, solar, and storage solutions; and electrification software for the transmission, distribution, conversion, storage, and orchestration of electricity from point of generation to point of consumption. The company was incorporated in 2023 and is headquartered in Cambridge, Massachusetts.",87.04988,54.90469,101.0 B,376.295,2.7%,366.49707,0.0%,0.27%,False
APO,161.97999572753906,15.0,160.0,2025-02-21,0.08038032236006121,"Apollo Global Management, Inc. is a private equity firm specializing in investments in credit, private equity, infrastructure, secondaries and real estate markets. The firm prefers to invest in private and public markets. The firm's private equity investments include traditional buyouts, recapitalization, distressed buyouts and debt investments in real estate, corporate partner buyouts, distressed asset, corporate carve-outs, middle market, growth, venture capital, turnaround, bridge, corporate restructuring, special situation, acquisition, and industry consolidation transactions. For credit strategies, the firm focuses to invest in multi-sector credit, semi-liquid credit, direct lending, first lien, unitranche, whole loans and private credit. The firm provides its services to endowment and sovereign wealth funds, as well as other institutional and individual investors. It manages client focused portfolios. The firm launches and manages hedge funds for its clients. It also manages real estate funds and private equity funds for its clients. The firm invests in the fixed income and alternative investment markets across the globe. Its fixed income investments include income-oriented senior loans, bonds, collateralized loan obligations, structured credit, opportunistic credit, non-performing loans, distressed debt, mezzanine debt, and value oriented fixed income securities. The firm seeks to invest in chemicals, commodities, consumer and retail, oil and gas, metals, mining, agriculture, commodities, distribution and transportation, financial and business services, manufacturing and industrial, media distribution, cable, entertainment and leisure, telecom, technology, natural resources, energy, packaging and materials, and satellite and wireless industries. It also focuses on clean energy, sustainable industry, climate solutions, energy transition, industrial decarbonization, sustainable mobility, sustainable resource use, and sustainable real estate. It seeks to invest in companies based in across Africa, Asia, North America with a focus on United States, Western Europe and Europe. It employs a combination of contrarian, value, and distressed strategies to make its investments. The firm seeks to make investments in the range of $75 million and $1500 million. The firm seeks to invest in companies with Enterprise value between $750 million to $2500 million. The firm conducts in-house research to create its investment portfolio. It seeks to acquire minority and majority positions in its portfolio companies. Apollo Global Management, Inc. was founded in 1990 and is headquartered in New York, New York with additional offices in North America, Asia, Africa and Europe.",17.086498,19.017406,91.7 B,189.49,17.0%,184.05882,13.6%,1.14%,True
ARM,145.1999969482422,12.65,145.0,2025-02-21,0.08574382447263917,"Arm Holdings plc architects, develops, and licenses central processing unit products and related technologies for semiconductor companies and original equipment manufacturers rely on to develop products. The company is involved in the licensing, marketing, research, and development of microprocessors, systems intellectual property (IPs), graphics processing units, physical IP and associated systems IPs, software, tools, and other related services. It also offers system IP products, including memory controller IP, interconnect IP, and other on-chip peripheral components; and compute platforms for a range of devices and applications. The company's products are used in various markets, such as automotive, computing infrastructure, consumer technologies, and Internet of things. It operates in the United States, the People's Republic of China, Taiwan, the Republic of Korea, and internationally. The company was founded in 1990 and is headquartered in Cambridge, the United Kingdom. Arm Holdings plc operates as a subsidiary of Kronos II LLC.",238.03278,71.125565,152.6 B,188.75,30.0%,145.2794,0.1%,N/A,False
BBD,1.909999966621399,0.1,2.0,2025-02-21,0.09947645900470481,"Banco Bradesco S.A., together with its subsidiaries, provides various banking products and services to individuals, corporates, and businesses in Brazil and internationally. The company operates through two segments, Banking and Insurance. It provides current, savings, click, and salary accounts; real estate credit, vehicle financing, payroll loans, mortgage loans, microcredit, leasing, and personal and installment credit; overdraft and agribusiness loans; debit and business cards; financial and security services; consortium products; car, personal accident, dental, travel, and life insurance; investment products; pension products; foreign currency exchange services; capitalization bonds; and internet banking services. Banco Bradesco S.A. was founded in 1943 and is headquartered in Osasco, Brazil.",9.095239,5.1991177,19.2 B,3.36,75.9%,3.21667,68.4%,2.02%,True
KSPI,95.69999694824219,5.5,100.0,2025-02-21,0.10240337893697093,"Joint Stock Company Kaspi.kz, together with its subsidiaries, provides payments, marketplace, and fintech solutions for consumers and merchants in the Republic of Kazakhstan. It operates through three segments: Payments Platform, Marketplace Platform, and Fintech Platform. The Payments Platform segment facilities transactions between customers and merchants. This segment offers shopping transactions, regular household bills, and peer to peer payments for consumers; accepts payment online and in store, issue and settle invoices, pay suppliers and monitor merchant turnover. It also provides proprietary data facilities informed decision making across multiple areas of business. Its Marketplace Platform segment connects online, and offline merchants and consumers enabling merchants to enhance its sales through an omni channel strategy and enable consumers to buy products and services from various merchants. This segment also operates marketplace through m-commerce, a mobile solution for shopping in person which consumers can use e-commerce to shop anywhere, anytime with free delivery; Kaspi Travel allows consumers to book domestic and international flights and package holidays, domestic rail tickets. It also enhances merchants sales by connecting payments and fintech products, Kapsi advertising, and other delivery services. The Fintech Platform segment provides consumers with BNPL, finance, and savings products and merchants with merchant finance services through super apps and Kapsi.kz Super app. It also involved in the banking; distressed asset management; real estate business; payment processing; online travel; and storage and processing of information services. The company was incorporated in 2008 and is headquartered in Almaty, the Republic of Kazakhstan.",10.041973,0.0137295835,19.5 B,143.72,50.2%,132.25322,38.2%,7.63%,True
ASTS,22.510000228881836,2.65,22.5,2025-02-21,0.11728119699132056,"AST SpaceMobile, Inc., together with its subsidiaries, develops and provides access to a space-based cellular broadband network for smartphones in the United States. Its SpaceMobile service provides cellular broadband services to end-users who are out of terrestrial cellular coverage. The company was founded in 2017 and is headquartered in Midland, Texas.",N/A,-30.963715,6.5 B,39.08,73.6%,35.94,59.7%,N/A,True
NMIH,35.68000030517578,0.25,40.0,2025-02-21,0.12808294999261216,"NMI Holdings, Inc. provides private mortgage guaranty insurance services in the United States. The company offers mortgage insurance services, such as primary and pool insurance; and outsourced loan review services to mortgage loan originators. It serves national and regional mortgage banks, money center banks, credit unions, community banks, builder-owned mortgage lenders, internet-sourced lenders, and other non-bank lenders. The company was incorporated in 2011 and is headquartered in Emeryville, California.",8.16476,7.4897246,2.8 B,42.49,19.1%,42.5,19.1%,N/A,True
RKLB,27.360000610351562,3.9,27.0,2025-02-21,0.12938593971774592,"Rocket Lab USA, Inc., a space company, provides launch services and space systems solutions for the space and defense industries. The company provides launch services, spacecraft design services, spacecraft components, spacecraft manufacturing, and other spacecraft and on-orbit management solutions; and constellation management services, as well as designs and manufactures small and medium-class rockets. It also designs, manufactures, and sells Electron, a reusable orbital-class small rocket; and the Photon satellite platforms, as well as developing the Neutron 8-ton payload class launch vehicle; conducts remote launch activities; and designs and manufactures a range of components and subsystems for the Photon family of spacecraft and broader merchant spacecraft components. The company serves commercial, aerospace prime contractors, and government customers. Rocket Lab USA, Inc. was founded in 2006 and is headquartered in Long Beach, California.",N/A,-152.88333,13.7 B,30.26,10.6%,23.72727,-13.3%,N/A,False
VIV,7.75,0.15,7.5,2025-01-17,-0.012903225806451535,"Telefônica Brasil S.A., together with its subsidiaries, operates as a mobile telecommunications company in Brazil. Its fixed line services portfolio includes local, domestic long-distance, and international long-distance calls; and mobile portfolio comprises voice and broadband internet access through 3G, 4G, 4.5G, and 5G, as well as value-added and wireless roaming services. The company also offers data services, including broadband and mobile data services. In addition, it provides pay TV services through IPTV technologies; network services, such as rental of facilities; other services; wholesale services, including interconnection services to users of other network providers; and digital services, such as entertainment, cloud, and security and financial services. Further, the company offers multimedia communication services, which include audio, data, voice and other sounds, images, texts, and other information, as well as sells devices, such as smartphones, broadband USB modems, and other devices. Additionally, it provides telecommunications solutions and IT support to various industries, such as retail, manufacturing, services, financial institutions, government, etc. It markets and sells its solutions through own stores, dealers, retail and distribution channels, door-to-door sales, and outbound tele sales. The company was formerly known as Telecomunicações de São Paulo S.A. - TELESP and changed its name to Telefônica Brasil S.A. in October 2011. The company was incorporated in 1998 and is headquartered in São Paulo, Brazil.",14.351851,1.7535523,13.0 B,11.43,47.5%,10.700533,38.1%,6.35%,True
RELX,46.77000045776367,1.55,45.0,2025-01-17,-0.004703879743647832,"RELX PLC, together with its subsidiaries, provides information-based analytics and decision tools for professional and business customers in North America, Europe, and internationally. It operates through four segments: Risk; Scientific, Technical & Medical; Legal; and Exhibitions. The Risk segment offers information-based analytics and decision tools that combine public and industry specific content with technology and algorithms to assist clients in evaluating and predicting risk. The Scientific, Technical & Medical segment provides information and data sets that help researchers and healthcare professionals to advance science and health outcomes. The Legal segment provides legal, regulatory, and business information and analytics that help customers in decision-making, as well as increases the productivity. The Exhibitions segment is involved in the business that combines face-to-face with data and digital tools to help customers learn about markets, source products, and complete transactions. The company was formerly known as Reed Elsevier PLC and changed its name to RELX PLC in July 2015. RELX PLC was incorporated in 1903 and is headquartered in London, the United Kingdom.",37.416,28.319023,86.8 B,48.91,4.6%,50.125,7.2%,1.64%,True
MO,51.4900016784668,0.77,51.0,2025-01-17,0.00543791634115065,"Altria Group, Inc., through its subsidiaries, manufactures and sells smokeable and oral tobacco products in the United States. The company offers cigarettes primarily under the Marlboro brand; large cigars and pipe tobacco under the Black & Mild brand; moist smokeless tobacco and snus products under the Copenhagen, Skoal, Red Seal, and Husky brands; oral nicotine pouches under the on! brand; and e-vapor products under the NJOY ACE brand. It sells its products to distributors, as well as large retail organizations, such as chain stores. The company was founded in 1822 and is headquartered in Richmond, Virginia.",8.697636,9.621764,87.3 B,58.04,12.7%,56.80333,10.3%,7.92%,True
