Ticker,Stock Price,Call Contract Price,Strike Price,Expiration Date,Breakeven increase,Company Description,P/E Ratio,Forward P/E,Market Cap,52 Week High,52-week-upside,1y Target Est,1y-target-upside,Dividend Yield,Attractiveness
DIS,109.76000213623047,4.8,110.0,2025-02-21,0.04591834699050068,"The Walt Disney Company operates as an entertainment company worldwide. It operates through three segments: Entertainment, Sports, and Experiences. The company produces and distributes film and television video streaming content under the ABC Television Network, Disney, Freeform, FX, Fox, National Geographic, and Star brand television channels, as well as ABC television stations and A+E television networks; and produces original content under the ABC Signature, Disney Branded Television, FX Productions, Lucasfilm, Marvel, National Geographic Studios, Pixar, Searchlight Pictures, Twentieth Century Studios, 20th Television, and Walt Disney Pictures banners. It also offers direct-to-consumer streaming services through Disney+, Disney+ Hotstar, Hulu, and Star+; sports-related entertainment services through ESPN, ESPN on ABC, ESPN+ DTC, and Star; sale/licensing of film and episodic content to third-party television and VOD services; theatrical, home entertainment, and music distribution services; DVD and Blu-ray discs, electronic home video licenses, and VOD rental services; staging and licensing of live entertainment events; and post-production services. In addition, the company operates theme parks and resorts comprising Walt Disney World Resort, Disneyland Resort, Disneyland Paris, Hong Kong Disneyland Resort, Shanghai Disney Resort, Disney Cruise Line, Disney Vacation Club, National Geographic Expeditions, and Adventures by Disney, as well as Aulani, a Disney resort and spa in Hawaii. It also licenses its intellectual property to a third party for operations of the Tokyo Disney Resort; licenses trade names, characters, visual, literary, and other IP for use on merchandise, published materials, and games; operates a direct-to-home satellite distribution platform; sells branded merchandise through retail, online, and wholesale businesses; and develops and publishes books, comic books, and magazines. The company was founded in 1923 and is based in Burbank, California.",40.352943,18.026096,198.8 B,123.74,12.7%,123.98519,13.0%,0.82%,True
MS,127.86000061035156,3.8,130.0,2025-02-21,0.0464570574166534,"Morgan Stanley, a financial holding company, provides various financial products and services to corporations, governments, financial institutions, and individuals in the Americas, Europe, the Middle East, Africa, and Asia. It operates through Institutional Securities, Wealth Management, and Investment Management segments. The Institutional Securities segment offers capital raising and financial advisory services, including services related to the underwriting of debt, equity, and other securities, as well as advice on mergers and acquisitions, restructurings, real estate, and project finance. This segment also provides equity and fixed income products comprising sales, financing, prime brokerage, and market-making services; foreign exchange and commodities; corporate and commercial real estate loans, commercial mortgage and secured lending facilities, and financing for sales and trading customers, and asset-backed and mortgage lending; and wealth management services, investment, and research services. The Wealth Management segment offers financial advisor-led brokerage, custody, administrative, and investment advisory services; self-directed brokerage services; financial and wealth planning services; workplace services, including stock plan administration; annuity and insurance products; securities-based lending, residential real estate loans, and other lending products; banking; and retirement plan services to individual investors and small to medium-sized businesses and institutions. The Investment Management segment provides equity, fixed income, alternatives and solutions, and liquidity and overlay services to benefit/defined contribution plans, foundations, endowments, government entities, sovereign wealth funds, insurance companies, third-party fund sponsors, corporations, and individuals through institutional and intermediary channels. The company was founded in 1924 and is headquartered in New York, New York.",19.431612,15.851959,206.0 B,136.24,6.6%,130.55556,2.1%,2.89%,False
IBKR,190.88999938964844,9.8,190.0,2025-02-21,0.04667609952768825,"Interactive Brokers Group, Inc. operates as an automated electronic broker worldwide. The company engages in the execution, clearance, and settlement of trades in stocks, options, futures, foreign exchange instruments, bonds, mutual funds, exchange traded funds (ETFs), precious metals, and cryptocurrencies. It also custodies and services accounts for hedge and mutual funds, ETFs, registered investment advisors, proprietary trading groups, introducing brokers, and individual investors. In addition, the company offers custody, prime brokerage, securities, and margin lending services. It serves institutional and individual customers through electronic exchanges and market centers. The company was founded in 1977 and is headquartered in Greenwich, Connecticut.",29.780031,26.698164,80.7 B,193.42,1.3%,205.3,7.5%,0.52%,False
BABA,83.69000244140625,5.15,82.5,2025-02-21,0.047317450628183044,"Alibaba Group Holding Limited, through its subsidiaries, provides technology infrastructure and marketing reach to help merchants, brands, retailers, and other businesses to engage with their users and customers in the People's Republic of China and internationally. The company operates through seven segments: China Commerce, International Commerce, Local Consumer Services, Cainiao, Cloud, Digital Media and Entertainment, and Innovation Initiatives and Others. It operates Taobao and Tmall, which are digital retail platforms; Alimama, a proprietary monetization platform; 1688.com and Alibaba.com, which are online wholesale marketplaces; AliExpress, a retail marketplace; Lazada, Trendyol, and Daraz that are e-commerce platforms; Freshippo, a retail platform for groceries and fresh goods; and Tmall Global, an import e-commerce platform. The company also operates Cainiao Network logistic services platform; Ele.me, an on-demand delivery and local services platform; Koubei, a restaurant and local services guide platform; and Fliggy, an online travel platform. In addition, it offers pay-for-performance, in-feed, and display marketing services; and Taobao Ad Network and Exchange, a real-time online bidding marketing exchange. Further, the company provides elastic computing, storage, network, security, database, big data, and IoT services; and hardware, software license, software installation, and application development and maintenance services. Additionally, it operates Youku, an online video platform; Quark, a platform for information search, storage, and consumption; Alibaba Pictures and other content platforms that provide online videos, films, live events, news feeds, literature, music, and others; Amap, a mobile digital map, navigation, and real-time traffic information app; DingTalk, a business efficiency mobile app; and Tmall Genie smart speaker. The company was incorporated in 1999 and is based in Hangzhou, the People's Republic of China.",17.435417,1.1796442,199.2 B,117.82,40.8%,121.010376,44.6%,2.21%,True
FI,205.22999572753906,5.0,210.0,2025-02-21,0.04760514776520042,"Fiserv, Inc., together with its subsidiaries, provides payments and financial services technology services in the United States, Europe, the Middle East and Africa, Latin America, the Asia-Pacific, and internationally. It operates through Merchant Acceptance, Financial Technology, and Payments and Network segments. The Merchant Acceptance segment provides merchant acquiring and digital commerce services; mobile payment services; security and fraud protection products; Clover, a cloud based POS and integrated commerce operating system for small and mid-sized businesses and independent software vendors; and Carat, an integrated operating system for large businesses. This segment distributes through various channels, including direct sales teams, strategic partnerships with agent sales forces, independent software vendors, financial institutions, and other strategic partners in the form of joint venture alliances, revenue sharing alliances, and referral agreement. The Financial Technology segment offers customer deposit and loan accounts, as well as manages an institution's general ledger and central information files. This segment also provides digital banking, financial and risk management, professional services and consulting, check processing, and other products and services. The Payments and Network segment offers card transactions, such as debit, credit, and prepaid card processing and services; funds access, debit payments, cardless ATM access, and surcharge-free ATM network; security and fraud protection products; card production; print services; and various network services, as well as non-card digital payment software and services, including bill payment, account-to-account transfers, person-to-person payments, electronic billing, and security and fraud protection products. It serves merchants, banks, credit unions, other financial institutions, and corporate clients. Fiserv, Inc. was incorporated in 1984 and is headquartered in Milwaukee, Wisconsin.",39.696323,20.153723,116.8 B,223.23,8.8%,230.70294,12.4%,N/A,True
TMUS,215.52000427246094,5.79,220.0,2025-02-21,0.04765216928334737,"T-Mobile US, Inc., together with its subsidiaries, provides mobile communications services in the United States, Puerto Rico, and the United States Virgin Islands. The company offers voice, messaging, and data services to customers in the postpaid, prepaid, and wholesale and other services. It also provides wireless devices, including smartphones, wearables, tablets, home broadband routers, and other mobile communication devices, as well as wireless devices and accessories; financing through equipment installment plans; reinsurance for device insurance policies and extended warranty contracts; leasing through JUMP! On Demand; and High Speed Internet services. In addition, the company offers services, devices, and accessories under the T-Mobile and Metro by T-Mobile brands through its owned and operated retail stores, T-Mobile app and customer care channels, and its websites. It also sells its devices to dealers and other third-party distributors for resale through independent third-party retail outlets and various third-party websites. The company was founded in 1994 and is headquartered in Bellevue, Washington. T-Mobile US, Inc. operates as a subsidiary of Deutsche Telekom AG.",24.574686,19.89765,250.1 B,248.15,15.1%,243.72154,13.1%,1.63%,True
ISRG,544.02001953125,25.2,545.0,2025-02-21,0.048123193134156805,"Intuitive Surgical, Inc. develops, manufactures, and markets products that enable physicians and healthcare providers to enhance the quality of and access to minimally invasive care in the United States and internationally. The company offers the da Vinci Surgical System that enables complex surgery using a minimally invasive approach; and Ion endoluminal system, which extends its commercial offerings beyond surgery into diagnostic procedures enabling minimally invasive biopsies in the lung. It also provides a suite of stapling, energy, and core instrumentation for its multi-port da Vinci surgical systems; progressive learning pathways to support the use of its technology; infrastructure of service and support specialists, a complement of services to its customers, including installation, repair, maintenance, 24/7 technical support, and proactive system health monitoring; and integrated digital capabilities providing connected offerings, streamlining performance for hospitals with program-enhancing insights. The company sells its products through direct sales organizations, such as capital and clinical sales teams. It has a collaboration agreement with FluoGuide A/S for head & neck cancer. The company was incorporated in 1995 and is headquartered in Sunnyvale, California.",87.74517,69.25727,193.8 B,556.23,2.2%,566.9732,4.2%,N/A,False
IBN,29.229999542236328,1.65,29.0,2025-02-21,0.048580242216966774,"ICICI Bank Limited, together with its subsidiaries, engages in the provision of various banking and financial services to retail and corporate customers in India and internationally. The company operates through Retail Banking, Wholesale Banking, Treasury, Other Banking, Life Insurance, and Others segments. It accepts savings, salary, pension, current, trade, escrow, foreign currency, and vostro accounts, as well as time, fixed, recurring, and security deposits services. The company also provides home, car, two-wheeler, personal, gold, and commercial business loans, as well as loans against securities and other loans; business loans, including working capital finance, term loans, collateral free loans, loans without financials, finance for importers and exporters, and overdraft facilities, as well as loans for new entities and card swipes; and credit, debit, prepaid, travel, forex, and corporate cards. In addition, it offers pockets wallet; fixed income products; investment products, such as mutual funds, gold monetization schemes, initial public offerings, and other online investment services; and agri and rural business, farmer finance, tractor loans, and micro banking services. Further, the company provides portfolio management, trade, foreign exchange, locker, private and NRI banking, and cash management services; family wealth and demat accounts; commercial and investment banking, capital market, custodial, and institutional banking services; health, personal accident, fire, and motor insurance, as well as distributes general and life insurance products; and Internet, mobile, and phone banking services. Additionally, it offers securities investment, broking, trading, and underwriting services; and merchant banking, trusteeship, housing finance, pension fund management, asset management, investment advisory, points of presence, and private equity/venture capital fund management services. The company was founded in 1955 and is headquartered in Mumbai, India.",18.98052,17.826214,104.0 B,32.14,10.0%,36.625,25.3%,0.82%,True
ETN,345.1099853515625,11.9,350.0,2025-02-21,0.048651199215037355,"Eaton Corporation plc operates as a power management company worldwide. The company's Electrical Americas and Electrical Global segment provides electrical components, industrial components, power distribution and assemblies, residential products, single and three phase power quality and connectivity products, wiring devices, circuit protection products, utility power distribution products, power reliability equipment, and services, as well as hazardous duty electrical equipment, emergency lighting, fire detection, explosion-proof instrumentation, and structural support systems. Its Aerospace segment offers pumps, motors, hydraulic power units, hoses and fittings, and electro-hydraulic pumps; valves, cylinders, electronic controls, electromechanical actuators, sensors, aircraft flap and slat systems, and nose wheel steering systems; hose, thermoplastic tubing products, fittings, adapters, couplings, and sealing and ducting products; air-to-air refueling systems, fuel pumps, fuel inerting products, sensors, and adapters and regulators; oxygen generation system, payload carriages, and thermal management products; and wiring connectors and cables, as well as hydraulic and bag filters, strainers and cartridges, and golf grips for manufacturers of commercial and military aircraft, and related after-market customers, as well as industrial applications. The company's Vehicle segment offers transmissions, clutches, hybrid power systems, superchargers, engine valves and valve actuation systems, locking and limited slip differentials, transmission controls, and fuel vapor components for the vehicle industry. Its eMobility segment provides voltage inverters, converters, fuses, circuit protection units, vehicle controls, power distribution systems, fuel tank isolation valves, and commercial vehicle hybrid systems. Eaton Corporation plc was founded in 1911 and is based in Dublin, Ireland.",36.752926,28.604391,136.4 B,379.99,10.1%,381.3929,10.5%,1.09%,True
HCA,311.25,16.47,310.0,2025-02-21,0.048899598393574495,"HCA Healthcare, Inc., through its subsidiaries, owns and operates hospitals and related healthcare entities in the United States. It operates general and acute care hospitals that offers medical and surgical services, including inpatient care, intensive care, cardiac care, diagnostic, and emergency services; and outpatient services, such as outpatient surgery, laboratory, radiology, respiratory therapy, cardiology, and physical therapy. The company also operates outpatient health care facilities consisting of freestanding ambulatory surgery centers, freestanding emergency care facilities, urgent care facilities, walk-in clinics, diagnostic and imaging centers, rehabilitation and physical therapy centers, radiation and oncology therapy centers, physician practices, and various other facilities. In addition, it operates behavioral hospitals, which provide therapeutic programs comprising child, adolescent and adult psychiatric care, adolescent and adult alcohol, drug abuse treatment, and counseling services. The company was formerly known as HCA Holdings, Inc. HCA Healthcare, Inc. was founded in 1968 and is headquartered in Nashville, Tennessee.",13.96366,12.643655,78.8 B,417.14,34.0%,392.18784,26.0%,0.85%,True
GOOGL,193.9499969482422,8.5,195.0,2025-02-21,0.04923951122467063,"Alphabet Inc. offers various products and platforms in the United States, Europe, the Middle East, Africa, the Asia-Pacific, Canada, and Latin America. It operates through Google Services, Google Cloud, and Other Bets segments. The Google Services segment provides products and services, including ads, Android, Chrome, devices, Gmail, Google Drive, Google Maps, Google Photos, Google Play, Search, and YouTube. It is also involved in the sale of apps and in-app purchases and digital content in the Google Play and YouTube; and devices, as well as in the provision of YouTube consumer subscription services. The Google Cloud segment offers infrastructure, cybersecurity, databases, analytics, AI, and other services; Google Workspace that include cloud-based communication and collaboration tools for enterprises, such as Gmail, Docs, Drive, Calendar, and Meet; and other services for enterprise customers. The Other Bets segment sells healthcare-related and internet services. The company was incorporated in 1998 and is headquartered in Mountain View, California.",25.72281,21.63049,2382.1 B,201.42,3.9%,211.88489,9.2%,0.41%,False
WFC,71.56999969482422,2.6,72.5,2025-02-21,0.049322346237638204,"Wells Fargo & Company, a financial services company, provides diversified banking, investment, mortgage, and consumer and commercial finance products and services in the United States and internationally. The company operates through four segments: Consumer Banking and Lending; Commercial Banking; Corporate and Investment Banking; and Wealth and Investment Management. The Consumer Banking and Lending segment offers diversified financial products and services for consumers and small businesses. Its financial products and services include checking and savings accounts, and credit and debit cards, as well as home, auto, personal, and small business lending services. The Commercial Banking segment provides financial solutions to private, family owned, and certain public companies. Its products and services include banking and credit products across various industry sectors and municipalities, secured lending and lease products, and treasury management services. The Corporate and Investment Banking segment offers a suite of capital markets, banking, and financial products and services, such as corporate banking, investment banking, treasury management, commercial real estate lending and servicing, equity, and fixed income solutions, as well as sales, trading, and research capabilities services to corporate, commercial real estate, government, and institutional clients. The Wealth and Investment Management segment provides personalized wealth management, brokerage, financial planning, lending, private banking, and trust and fiduciary products and services to affluent, high-net worth, and ultra-high-net worth clients. It also operates through financial advisors in brokerage and wealth offices, consumer bank branches, independent offices, and digitally through WellsTrade and Intuitive Investor. The company was founded in 1852 and is headquartered in San Francisco, California.",14.879418,12.881569,238.3 B,78.13,9.2%,77.21391,7.9%,2.24%,True
BA,171.75999450683594,10.26,170.0,2025-02-21,0.04948769076041026,"The Boeing Company, together with its subsidiaries, designs, develops, manufactures, sells, services, and supports commercial jetliners, military aircraft, satellites, missile defense, human space flight and launch systems, and services worldwide. The company operates through Commercial Airplanes; Defense, Space & Security; and Global Services segments. The Commercial Airplanes segment develops, produces, and markets commercial jet aircraft for passenger and cargo requirements, as well as provides fleet support services. The Defense, Space & Security segment engages in the research, development, production, and modification of manned and unmanned military aircraft and weapons systems; strategic defense and intelligence systems, which include strategic missile and defense systems, command, control, communications, computers, intelligence, surveillance and reconnaissance, cyber and information solutions, and intelligence systems; and satellite systems, such as government and commercial satellites, and space exploration. The Global Services segment offers products and services, including supply chain and logistics management, engineering, maintenance and modifications, upgrades and conversions, spare parts, pilot and maintenance training systems and services, technical and maintenance documents, and data analytics and digital services to commercial and defense customers. The Boeing Company was incorporated in 1916 and is based in Arlington, Virginia.",N/A,245.835,128.5 B,228.28,32.9%,185.71333,8.1%,N/A,True
CI,279.32000732421875,13.4,280.0,2025-02-21,0.050408106496424354,"The Cigna Group, together with its subsidiaries, provides insurance and related products and services in the United States. Its Evernorth Health Services segment provides a range of coordinated and point solution health services, including pharmacy benefits, home delivery pharmacy, specialty pharmacy, distribution, and care delivery and management solutions to health plans, employers, government organizations, and health care providers. The company's Cigna Healthcare segment offers medical, pharmacy, behavioral health, dental, and other products and services for insured and self-insured customers; Medicare Advantage, Medicare Supplement, and Medicare Part D plans for seniors, as well as individual health insurance plans; and health care coverage in its international markets, as well as health care benefits for mobile individuals and employees of multinational organizations. In addition, it offers permanent insurance contracts sold to corporations to provide coverage on the lives of certain employees for financing employer-paid future benefit obligations. The company distributes its products and services through insurance brokers and consultants; directly to employers, unions and other groups, or individuals; and private and public exchanges. The company was formerly known as Cigna Corporation and changed its name to The Cigna Group in February 2023. The Cigna Group was founded in 1792 and is headquartered in Bloomfield, Connecticut.",26.450758,8.864842,77.7 B,370.83,32.8%,391.2513,40.1%,2.00%,True
