Ticker,Stock Price,Call Contract Price,Strike Price,Expiration Date,Breakeven increase,Company Description,P/E Ratio,Forward P/E,Market Cap,52 Week High,52-week-upside,1y Target Est,1y-target-upside,Dividend Yield,Attractiveness
CSCO,58.619998931884766,1.81,57.5,2025-01-17,0.0117707451499105,"Cisco Systems, Inc. designs, manufactures, and sells Internet Protocol based networking and other products related to the communications and information technology industry in the Americas, Europe, the Middle East, Africa, the Asia Pacific, Japan, and China. The company also offers switching portfolio encompasses campus switching as well as data center switching; enterprise routing portfolio interconnects public and private wireline and mobile networks, delivering highly secure, and reliable connectivity to campus, data center and branch networks; and wireless products include indoor and outdoor wireless coverage designed for seamless roaming use of voice, video, and data applications. In addition, it provides security, which comprising network security, identity and access management, secure access service edge, and threat intelligence, detection, and response offerings; collaboration products, such as Webex Suite, collaboration devices, contact center, and communication platform as a service; end-to-end collaboration solutions that can be delivered from the cloud, on-premise or within hybrid cloud environments allowing customers to transition their collaboration solutions from on-premise to the cloud; and observability offers network assurance, monitoring and analytics and observability suite. Further, the company offers a range of service and support options for its customers, including technical support and advanced services and advisory services. It serves businesses of various sizes, public institutions, governments, and service providers. The company sells its products and services directly, as well as through systems integrators, service providers, other resellers, and distributors. Cisco Systems, Inc. has strategic alliances with other companies. Cisco Systems, Inc. was incorporated in 1984 and is headquartered in San Jose, California.",25.158798,14.91808,233.5 B,60.23,2.7%,61.91208,5.6%,2.73%,True
HDB,67.0,2.95,65.0,2025-01-17,0.014179104477612059,"HDFC Bank Limited engages in the provision of banking and financial services to individuals and businesses in India, Bahrain, Hong Kong, Singapore, and Dubai. The company operates in three segments: Treasury, Retail Banking, Wholesale Banking, and Other Banking Services. It accepts savings, salary, current, rural, public provident fund, pension, and demat accounts; fixed and recurring deposits; and safe deposit lockers, as well as offshore accounts and deposits, and overdrafts against fixed deposits. The company also provides personal, home, car, two-wheeler, business, doctor, educational, gold, consumer, and rural loans; loans against properties, securities, mutual funds, rental receivables, and assets; loans for professionals; government sponsored programs; and loans on credit card, as well as working capital and commercial/construction equipment finance, healthcare/medical equipment and commercial vehicle finance, dealer finance, and term loans. In addition, it offers credit, debit, prepaid, and forex cards; payment and collection, export, import, remittance, bank guarantee, letter of credit, trade, hedging, and merchant and cash management services; insurance and investment products. Further, the company provides short term finance, bill discounting, structured finance, export credit, loan repayment, and documents collection services; online and wholesale, mobile, and phone banking services; unified payment interface, immediate payment, national electronic funds transfer, and real time gross settlement services; and channel financing, vendor financing, reimbursement account, money market, derivatives, employee trusts, cash surplus corporates, tax payment, and bankers to rights/public issue services, as well as financial solutions for supply chain partners and agricultural customers. It operates branches and automated teller machines in various cities/towns. The company was incorporated in 1994 and is headquartered in Mumbai, India.",21.47436,22.529793,170.7 B,68.5,2.2%,74.6375,11.4%,1.04%,True
PM,126.62000274658203,3.5,125.0,2025-01-17,0.014847553408923853,"Philip Morris International Inc. operates as a tobacco company working to delivers a smoke-free future and evolving portfolio for the long-term to include products outside of the tobacco and nicotine sector. The company's product portfolio primarily consists of cigarettes and smoke-free products, including heat-not-burn, vapor, and oral nicotine products primarily under the IQOS and ZYN brands; and consumer accessories, such as lighters and matches. It also offers wellness and healthcare products. Philip Morris International Inc. was incorporated in 1987 and is headquartered in Stamford, Connecticut.",20.06656,17.75782,196.9 B,134.15,5.9%,136.15614,7.5%,4.26%,True
DHR,234.88999938964844,8.6,230.0,2025-01-17,0.015794629911838776,"Danaher Corporation designs, manufactures, and markets professional, medical, industrial, and commercial products and services worldwide. The Biotechnology segments offers bioprocess technologies, consumables, and services that advance, accelerate, and integrate the development and manufacture of therapeutics; cell line and cell culture media development services; cell culture media, process liquids and buffers for manufacturing, chromatography resins, filtration technologies, aseptic fill finish; single-use hardware and consumables and services, such as the design and installation of full manufacturing suites; lab filtration, separation, and purification; lab-scale protein purification and analytical tools; reagents, membranes, and services; and healthcare filtration solutions. The Life Sciences segment provides mass spectrometers; flow cytometry, genomics, lab automation, centrifugation, liquid handling automation instruments, antibodies and reagents, and particle counting and characterization; microscopes; protein consumables; industrial filtration products; and genomic medicines, such as custom nucleic acid products, plasmid DNA, RNA, and proteins under the ABCAM, ALDEVRON, BECKMAN COULTER, IDT, LEICA MICROSYSTEMS, MOLECULAR DEVICES, PALL, PHENOMENEX and SCIEX brands. The Diagnostics segment offers chemistry, immunoassay, microbiology, and automation systems; and molecular, acute care, and pathology diagnostics products. This segment also provides clinical instruments, reagents, consumables, software, and services for hospitals, physicians' offices, reference laboratories, and other critical care settings. The company has a research  collaboration  with Stanford  University's Department  of  Bioengineering for cancer drug development. The company was formerly known as Diversified Mortgage Investors, Inc. and changed its name to Danaher Corporation in 1984. Danaher Corporation was founded in 1969 and is based in Washington, the District of Columbia.",44.235405,27.954374,169.7 B,281.7,19.9%,289.37918,23.2%,0.46%,True
TD,53.25,1.6,52.5,2025-01-17,0.015962441314554043,"The Toronto-Dominion Bank, together with its subsidiaries, provides various financial products and services in Canada, the United States, and internationally. It operates through four segments: Canadian Personal and Commercial Banking, U.S. Retail, Wealth Management and Insurance, and Wholesale Banking. The company offers personal deposits, such as chequing, savings, and investment products; financing, investment, cash management, international trade, and day-to-day banking services to businesses; and financing options to customers at point of sale for automotive and recreational vehicle purchases. It also provides credit cards and payments; real estate secured lending, auto finance, and consumer lending services; point-of-sale payment solutions for large and small businesses; wealth and asset management products, and advice to retail and institutional clients through direct investing, advice-based, and asset management businesses; and property and casualty insurance, as well as life and health insurance products. The company also provides capital markets, and corporate and investment banking products and services, including underwriting and distribution of new debt and equity issues; advice on strategic acquisitions and divestitures; and trading, funding, and investment services to corporations, governments, and institutions. It offers its products and services under the TD Bank and America's Most Convenient Bank brand names. The Toronto-Dominion Bank was founded in 1855 and is headquartered in Toronto, Canada.",16.039158,6.323327,93.4 B,65.12,22.3%,60.074253,12.8%,5.18%,True
MO,54.91999816894531,0.84,55.0,2025-01-17,0.01675167264617472,"Altria Group, Inc., through its subsidiaries, manufactures and sells smokeable and oral tobacco products in the United States. The company offers cigarettes primarily under the Marlboro brand; large cigars and pipe tobacco under the Black & Mild brand; moist smokeless tobacco and snus products under the Copenhagen, Skoal, Red Seal, and Husky brands; oral nicotine pouches under the on! brand; and e-vapor products under the NJOY ACE brand. It sells its products to distributors, as well as large retail organizations, such as chain stores. The company was founded in 1822 and is headquartered in Richmond, Virginia.",9.277026,10.262715,93.1 B,58.04,5.7%,56.80333,3.4%,7.43%,True
NVS,98.36000061035156,2.65,97.5,2025-01-17,0.01819844833815565,"Novartis AG engages in the research, development, manufacture, and marketing of healthcare products in Switzerland and internationally. The company offers prescription medicines for patients and physicians. The company also provides Pluvicto, lutetium Lu 177 vipivotide tetraxetan, indicated for the treatment of adult patients with prostate-specific membrane antigen (PSMA)-positive metastatic castration-resistant prostate cancer; and Lutathera, lutetium Lu 177 dotatate, a prescription medicine used to treat adults and children aged 12 years and older with gastroenteropancreatic neuroendocrine tumors. It focuses on therapeutic areas, such as cardiovascular, renal and metabolic, immunology, neuroscience, and oncology, as well as ophthalmology and hematology. The company has a license and collaboration agreement with Alnylam Pharmaceuticals to develop, manufacture, and commercialize inclisiran, a therapy to reduce LDL cholesterol; and Dawn Health for the development and commercialization of Ekiva, a digital solution designed for people living with Paroxysmal Nocturnal Hemoglobinuria. It also has a research collaboration and license agreement with Schrödinger, Inc. to identify and develop various therapeutic candidates; and a strategic collaboration with Vyriad, Inc. for the discovery and development for vivo chimeric antigen receptor T-cell therapies. The company was incorporated in 1996 and is headquartered in Basel, Switzerland.",17.165794,11.813753,196.6 B,120.92,22.9%,114.02946,15.9%,3.80%,True
PG,171.05999755859375,4.2,170.0,2025-01-17,0.018356146885426528,"The Procter & Gamble Company engages in the provision of branded consumer packaged goods worldwide. The company operates through five segments: Beauty; Grooming; Health Care; Fabric & Home Care; and Baby, Feminine & Family Care. The Beauty segment offers conditioners, shampoos, styling aids, and treatments under the Head & Shoulders, Herbal Essences, Pantene, and Rejoice brands; and antiperspirants and deodorants, personal cleansing, and skin care products under the Olay, Old Spice, Safeguard, Secret, SK-II, and Native brands. The Grooming segment provides blades and razors, shave products, appliances, and other grooming products under the Braun, Gillette, and Venus brand names. The Health Care segment offers toothbrushes, toothpastes, and other oral care products under the Crest and Oral-B brand names; and gastrointestinal, pain relief, rapid diagnostics, respiratory, vitamins/minerals/supplements, and other personal health care products under Metamucil, Neurobion, Pepto-Bismol, and Vicks brands. The Fabric & Home Care segment provides fabric enhancers, laundry additives, and laundry detergents under the Ariel, Downy, Gain, and Tide brands; and air care, dish care, P&G professional, and surface care products under the Cascade, Dawn, Fairy, Febreze, Mr. Clean, and Swiffer brands. The Baby, Feminine & Family Care segment offers baby wipes, and taped diapers and pants under the Luvs and Pampers brands; adult incontinence and feminine care products under the Always, Always Discreet, and Tampax brands; and paper towels, tissues, and toilet papers under the Bounty, Charmin, and Puffs brands. It sells its products primarily through mass merchandisers, e-commerce, grocery stores, membership club stores, drug stores, department stores, distributors, wholesalers, specialty beauty stores, high-frequency stores, pharmacies, electronics stores, and professional channels, as well as directly to consumers. The company was founded in 1837 and is headquartered in Cincinnati, Ohio.",29.493101,23.06031,402.9 B,180.43,5.5%,180.88155,5.7%,2.35%,True
JNJ,146.6199951171875,4.38,145.0,2025-01-17,0.018824205256633197,"Johnson & Johnson, together with its subsidiaries, researches, develops, manufactures, and sells various products in the healthcare field worldwide. The company's Innovative Medicine segment offers products for various therapeutic areas, such as immunology, including rheumatoid arthritis, psoriatic arthritis, inflammatory bowel disease, and psoriasis; infectious diseases comprising HIV/AIDS; neuroscience, consisting of mood disorders, neurodegenerative disorders, and schizophrenia; oncology, such as prostate cancer, hematologic malignancies, lung cancer, and bladder cancer; cardiovascular and metabolism, including thrombosis, diabetes, and macular degeneration; and pulmonary hypertension comprising pulmonary arterial hypertension through retailers, wholesalers, distributors, hospitals, and healthcare professionals for prescription use. Its MedTech segment provides Interventional Solutions, including electrophysiology products to treat heart rhythm disorders; the heart recovery portfolio, which includes technologies to treat severe coronary artery disease requiring high-risk PCI or AMI cardiogenic shock; and neurovascular care that treats hemorrhagic and ischemic stroke. this segment also offers an orthopaedics portfolio that includes products and enabling technologies that support hips, knees, trauma, spine, sports, and other; surgery portfolios comprising advanced and general surgery technologies, as well as solutions for breast aesthetics, ear, nose, and throat procedures; contact lenses under the ACUVUE Brand; and TECNIS intraocular lenses for cataract surgery. It distributes its products to wholesalers, hospitals, and retailers, as well as physicians, nurses, hospitals, eye care professionals, and clinics. The company has a collaboration agreement with Stand Up To Cancer for research testing a combination of teclistamab and daratumumab to treat a rare disease AL amyloidosis. Johnson & Johnson was founded in 1886 and is based in New Brunswick, New Jersey.",24.19472,13.803998,353.0 B,168.85,15.2%,174.28,18.9%,3.38%,True
BUD,53.43000030517578,1.95,52.5,2025-01-17,0.019090392831710545,"Anheuser-Busch InBev SA/NV produces, distributes, exports, markets, and sells beer and beverages. It offers a portfolio of approximately 500 beer brands, which primarily include Budweiser, Corona, and Stella Artois; Beck's, Hoegaarden, Leffe, and Michelob Ultra; and Aguila, Antarctica, Bud Light, Brahma, Cass, Castle, Castle Lite, Cristal, Harbin, Jupiler, Modelo Especial, Quilmes, Victoria, Sedrin, and Skol brands. The company operates in North America, Middle America, South America, Europe, the Middle East, Africa, and the Asia Pacific. The company was founded in 1366 and is headquartered in Leuven, Belgium.",16.696875,14.626936,105.6 B,67.49,26.3%,73.6,37.8%,1.63%,True
VZ,42.279998779296875,1.09,42.0,2025-01-17,0.019158023748566455,"Verizon Communications Inc., through its subsidiaries, engages in the provision of communications, technology, information, and entertainment products and services to consumers, businesses, and governmental entities worldwide. It operates in two segments, Verizon Consumer Group (Consumer) and Verizon Business Group (Business). The Consumer segment provides wireless services across the wireless networks in the United States under the Verizon and TracFone brands and through wholesale and other arrangements; and fixed wireless access (FWA) broadband through its wireless networks, as well as related equipment and devices, such as smartphones, tablets, smart watches, and other wireless-enabled connected devices. The segment also offers wireline services in the Mid-Atlantic and Northeastern United States, as well as Washington D.C. through its fiber-optic network, Verizon Fios product portfolio, and a copper-based network. The Business segment provides wireless and wireline communications services and products, including FWA broadband, data, video and conferencing, corporate networking, security and managed network, local and long-distance voice, and network access services to deliver various IoT services and products to businesses, government customers, and wireless and wireline carriers in the United States and internationally. The company was formerly known as Bell Atlantic Corporation and changed its name to Verizon Communications Inc. in June 2000. Verizon Communications Inc. was incorporated in 1983 and is headquartered in New York, New York.",18.30303,8.92844,178.0 B,45.36,7.3%,47.37083,12.0%,6.41%,True
BMY,55.779998779296875,1.85,55.0,2025-01-17,0.019182524993174965,"Bristol-Myers Squibb Company discovers, develops, licenses, manufactures, markets, distributes, and sells biopharmaceutical products worldwide. It offers products for hematology, oncology, cardiovascular, immunology, fibrotic, and neuroscience diseases. The company's products include Eliquis for reduction in risk of stroke/systemic embolism in non-valvular atrial fibrillation, and for the treatment of DVT/PE; Opdivo for various anti-cancer indications, including bladder, blood, CRC, head and neck, RCC, HCC, lung, melanoma, MPM, stomach and esophageal cancer; Pomalyst/Imnovid for multiple myeloma; Orencia for active rheumatoid arthritis and psoriatic arthritis; and Sprycel for the treatment of Philadelphia chromosome-positive chronic myeloid leukemia. It also provides Yervoy for the treatment of patients with unresectable or metastatic melanoma; Empliciti for the treatment of multiple myeloma; Abecma for the treatment of relapsed or refractory multiple myeloma; Reblozyl for the treatment of anemia; Opdualag for the treatment of unresectable or metastatic melanoma; and Zeposia to treat relapsing forms of multiple sclerosis. In addition, the company offers Breyanzi for the treatment of relapsed or refractory large B-cell lymphoma; Onureg for the treatment of AML; Inrebic for the treatment of myelofibrosis; Camzyos for the treatment of symptomatic obstructive HCM to enhance functional capacity and symptom; Sotyktu for the treatment of moderate-to-severe plaque psoriasis; Augtyro for the treatment of locally advanced or metastatic ROS1-positive NSCLC; Revlimid, an oral immunomodulatory drug for the treatment of multiple myeloma; and Abraxane to treat breast cancer, NSCLC and pancreatic cancer. It sells products to wholesalers, distributors, pharmacies, retailers, hospitals, clinics, and government agencies. The company was formerly known as Bristol-Myers Company. Bristol-Myers Squibb Company was founded in 1887 and is headquartered in Princeton, New Jersey.",N/A,7.9013085,113.1 B,61.08,9.5%,60.57714,8.6%,4.45%,True
WM,213.1999969482422,7.34,210.0,2025-01-17,0.01941840108357451,"Waste Management, Inc., through its subsidiaries, engages in the provision of environmental solutions to residential, commercial, industrial, and municipal customers in the United States and Canada. It offers collection services, including picking up and transporting waste and recyclable materials from where it was generated to a transfer station, material recovery facility (MRF), or disposal site; and owns and operates transfer stations, as well as owns, develops, and operates landfill facilities that produce landfill gas used as renewable natural gas for generating electricity. As of December 31, 2022, the company owned or operated 254 solid waste landfills, five secure hazardous waste landfills, 97 MRFs, and 337 transfer stations. It also provides materials processing and commodities recycling services at its MRFs, where cardboard, paper, glass, metals, plastics, construction and demolition materials, and other recycling commodities are recovered for resale or redirected for other purposes; recycling brokerage services, such as managing the marketing of recyclable materials for third parties; and other strategic business solutions. In addition, the company offers construction and remediation services; services related with the disposal of fly ash, and residue generated from the combustion of coal and other fuel stocks; in-plant services comprising full-service waste management solutions and consulting services; and specialized disposal services for oil and gas exploration and production operations. The company was formerly known as USA Waste Services, Inc. and changed its name to Waste Management, Inc. in 1998. Waste Management, Inc. was incorporated in 1987 and is headquartered in Houston, Texas.",32.549618,26.392899,85.6 B,230.39,8.1%,232.35,9.0%,1.41%,True
FI,204.66000366210938,8.66,200.0,2025-01-17,0.01954459233028527,"Fiserv, Inc., together with its subsidiaries, provides payments and financial services technology services in the United States, Europe, the Middle East and Africa, Latin America, the Asia-Pacific, and internationally. It operates through Merchant Acceptance, Financial Technology, and Payments and Network segments. The Merchant Acceptance segment provides merchant acquiring and digital commerce services; mobile payment services; security and fraud protection products; Clover, a cloud based POS and integrated commerce operating system for small and mid-sized businesses and independent software vendors; and Carat, an integrated operating system for large businesses. This segment distributes through various channels, including direct sales teams, strategic partnerships with agent sales forces, independent software vendors, financial institutions, and other strategic partners in the form of joint venture alliances, revenue sharing alliances, and referral agreement. The Financial Technology segment offers customer deposit and loan accounts, as well as manages an institution's general ledger and central information files. This segment also provides digital banking, financial and risk management, professional services and consulting, check processing, and other products and services. The Payments and Network segment offers card transactions, such as debit, credit, and prepaid card processing and services; funds access, debit payments, cardless ATM access, and surcharge-free ATM network; security and fraud protection products; card production; print services; and various network services, as well as non-card digital payment software and services, including bill payment, account-to-account transfers, person-to-person payments, electronic billing, and security and fraud protection products. It serves merchants, banks, credit unions, other financial institutions, and corporate clients. Fiserv, Inc. was incorporated in 1984 and is headquartered in Milwaukee, Wisconsin.",39.509655,20.07256,116.4 B,223.23,9.1%,226.79118,10.8%,N/A,True
