Ticker,Stock Price,Call Contract Price,Strike Price,Expiration Date,Breakeven increase,Company Description,P/E Ratio,Forward P/E,Market Cap,52 Week High,52-week-upside,1y Target Est,1y-target-upside,Dividend Yield,Attractiveness
SPGI,504.75,15.1,500.0,2025-02-21,0.02050520059435379,"S&P Global Inc., together with its subsidiaries, provides credit ratings, benchmarks, analytics, and workflow solutions in the global capital, commodity, and automotive markets. It operates through S&P Global Market Intelligence, S&P Global Ratings, S&P Global Commodity Insights, S&P Global Mobility, and S&P Dow Jones Indices segments. The S&P Global Market Intelligence segment offers multi-asset-class data and analytics integrated with purpose-built workflow solutions. This segment offers Desktop, a product suite that provides data, analytics, and third-party research; Data and Advisory Solutions for research, reference data, market data, derived analytics, and valuation services; Enterprise Solutions, software and workflow solutions; and Credit & Risk Solutions for selling Ratings' credit ratings and related data and research. The S&P Global Ratings segment operates as an independent provider of credit ratings, research, and analytics, offering investors and other market participants information, ratings, and benchmarks. The S&P Global Commodity Insights segment provides information and benchmark prices for the commodity and energy markets. The S&P Global Mobility segment provides solutions serving the full automotive value chain, including vehicle manufacturers (OEMs), automotive suppliers, mobility service providers, retailers, consumers, and finance and insurance companies. The S&P Dow Jones Indices segment is an index provider that maintains various valuation and index benchmarks for investment advisors, wealth managers, and institutional investors. S&P Global Inc. was founded in 1860 and is headquartered in New York, New York.",44.628647,29.956717,156.6 B,533.29,5.7%,580.91473,15.1%,0.74%,True
MDLZ,60.0,1.9,60.0,2025-02-21,0.03166666666666673,"Mondelez International, Inc., through its subsidiaries, manufactures, markets, and sells snack food and beverage products in the Latin America, North America, Asia, the Middle East, Africa, and Europe. It provides biscuits and baked snacks, including cookies, crackers, salted snacks, snack bars, and cakes and pastries; chocolates; and gums and candies, as well as various cheese and grocery, and powdered beverage products. The company's brand portfolio includes Oreo, Ritz, LU, CLIF Bar, and Tate's Bake Shop biscuits and baked snacks, as well as Cadbury Dairy Milk, Milka, and Toblerone chocolate. It serves supermarket chains, wholesalers, supercenters, club stores, mass merchandisers, distributors, convenience stores, gasoline stations, drug stores, value stores, and other retail food outlets through direct store delivery, company-owned and satellite warehouses, distribution centers, third party distributors, and other facilities, as well as through independent sales offices and agents. The company also sells products directly to businesses and consumers through e-retail platforms, retailer digital platforms, as well as through its direct-to-consumer websites and social media platforms. Mondelez International, Inc. was formerly known as Kraft Foods Inc. and changed its name to Mondelez International, Inc. in October 2012. The company was incorporated in 2000 and is headquartered in Chicago, Illinois.",21.276596,17.649965,80.2 B,77.2,28.7%,78.4044,30.7%,3.17%,True
MA,535.7100219726562,18.5,535.0,2025-02-21,0.03320822328810524,"Mastercard Incorporated, a technology company, provides transaction processing and other payment-related products and services in the United States and internationally. The company offers integrated products and value-added services for account holders, merchants, financial institutions, digital partners, businesses, governments, and other organizations, such as programs that enable issuers to provide consumers with credits to defer payments; payment products and solutions that allow its customers to access funds in deposit and other accounts; prepaid programs services; and commercial credit, debit, and prepaid payment products and solutions. It also provides solutions that enable businesses or governments to make payments to businesses, including Virtual Card Number, which is generated dynamically from a physical card and leverages the credit limit of the funding account; a platform to optimize supplier payment enablement campaigns for financial institutions; and treasury intelligence platform that offers corporations with recommendations to enhance working capital performance and accelerate spend on cards. In addition, the company offers Mastercard Send, which partners with digital messaging and payment platforms to enable consumers to send money directly within applications to other consumers; and Mastercard Cross-Border Services enables a range of payment flows through a distribution network with a single point of access to send and receive money globally through various channels, including bank accounts, mobile wallets, cards, and cash payouts. Further, it provides cyber and intelligence solutions; insights and analytics, consulting, marketing, loyalty, processing, and payment gateway solutions for e-commerce merchants; and open banking and digital identity services. The company offers payment solutions and services under the MasterCard, Maestro, and Cirrus name. Mastercard Incorporated was founded in 1966 and is headquartered in Purchase, New York.",40.492065,32.715553,491.7 B,537.13,0.3%,564.63513,5.4%,0.58%,False
BSX,91.06999969482422,4.15,90.0,2025-02-21,0.03382014181944526,"Boston Scientific Corporation develops, manufactures, and markets medical devices for use in various interventional medical specialties worldwide. It operates through two segments, MedSurg and Cardiovascular. The company offers devices to diagnose and treat gastrointestinal and pulmonary conditions, such as resolution clips, biliary stent systems, stents and electrocautery enhanced delivery systems, direct visualization systems, digital catheters, and single-use duodenoscopes; devices to treat urological conditions, including ureteral stents, catheters, baskets, guidewires, sheaths, balloons, single-use digital flexible ureteroscopes, holmium laser systems, artificial urinary sphincter, laser system, fiber, and hydrogel systems; and devices to treat neurological movement disorders and manage chronic pain, such as spinal cord stimulator system, proprietary programming software, radiofrequency generator, indirect decompression systems, practice optimization tools, and deep brain stimulation system. It also provides technologies for diagnosing and treating coronary artery disease and aortic valve conditions; WATCHMAN FLX, a Left Atrial Appendage Closure Device; and implantable devices that monitor the heart and deliver electricity to treat cardiac abnormalities, such as cardioverter and cardiac resynchronization therapy defibrillators, MRI S-ICD systems, cardiac resynchronization therapy pacemakers, quadripolar LV leads, ICD leads, pacing leads, remote patient management systems, insertable cardiac monitor systems, and remote cardiac monitoring systems. In addition, the company offers diagnosis and treatment of rate and rhythm disorders of the heart; peripheral arterial and venous diseases; and products to diagnose, treat and ease forms of cancer. The company was incorporated in 1979 and is headquartered in Marlborough, Massachusetts.",75.26446,32.53383,134.2 B,91.93,0.9%,99.14333,8.9%,N/A,False
ICE,150.4600067138672,5.61,150.0,2025-02-21,0.034228320193595785,"Intercontinental Exchange, Inc., together with its subsidiaries, engages in the provision of market infrastructure, data services, and technology solutions for financial institutions, corporations, and government entities in the United States, the United Kingdom, the European Union, Singapore, India, Abu Dhabi, Israel, and Canada. It operates through three segments: Exchanges, Fixed Income and Data Services, and Mortgage Technology. The company operates regulated marketplaces for listing, trading, and clearing an array of derivatives contracts and financial securities, such as commodities, interest rates, foreign exchange, and equities, as well as corporate and exchange-traded funds; and trading venues, including regulated exchanges and clearing houses. It also offers energy, agricultural and metals, and financial futures and options; and cash equities and equity options, and over-the-counter and other markets, as well as listings and data and connectivity services. In addition, the company provides fixed income data and analytic, fixed income execution, CDS clearing, and other multi-asset class data and network services. Further, it offers proprietary and comprehensive mortgage origination platform, which serves residential mortgage loans; closing solutions that provides customers connectivity to the mortgage supply chain and facilitates the secure exchange of information; data and analytics services; and Data as a Service for lenders to access data and origination information. Intercontinental Exchange, Inc. was founded in 2000 and is headquartered in Atlanta, Georgia.",35.73872,22.339651,86.4 B,167.99,11.7%,183.5,22.0%,1.20%,True
V,320.6499938964844,11.7,320.0,2025-02-21,0.03446127027553558,"Visa Inc. operates as a payment technology company in the United States and internationally. The company operates VisaNet, a transaction processing network that enables authorization, clearing, and settlement of payment transactions. It also offers credit, debit, and prepaid card products; tap to pay, tokenization, and click to pay services; Visa Direct, a solution that facilitates the delivery of funds to eligible cards, bank accounts, and digital wallets; Visa B2B Connect, a multilateral business-to-business cross-border payments network; Visa Cross-Border Solution, a cross-border consumer payments solution; and Visa DPS that provides a range of value-added services, including fraud mitigation, dispute management, data analytics, campaign management, a suite of digital solutions, and contact center services. The company also provides acceptance solutions, which include Cybersource and Authorize.net that provides new and enhanced payment integrations with ecommerce platforms, enabling sellers and acquirers to offer tailored commerce experiences; risk and identity solutions, such as Visa Advanced Authorization, Visa Secure, Visa Consumer Authentication Service, Visa Protect Authentication Intelligence, and Visa Provisioning Intelligence; and Visa Consulting and Analytics, a payment consulting advisory services. It provides its services under the Visa, Visa Electron, Interlink, V PAY, and PLUS brands. The company serves merchants, financial institutions, and government entities. Visa Inc. was founded in 1958 and is headquartered in San Francisco, California.",32.98868,25.308912,620.9 B,321.62,0.3%,331.91772,3.5%,0.74%,False
TJX,123.48999786376953,2.81,125.0,2025-02-21,0.03498260758734628,"The TJX Companies, Inc., together with its subsidiaries, operates as an off-price apparel and home fashions retailer in the United States, Canada, Europe, and Australia. It operates through four segments: Marmaxx, HomeGoods, TJX Canada, and TJX International. The company sells family apparel, including footwear and accessories; home fashions, such as home basics, furniture, rugs, lighting products, giftware, soft home products, decorative accessories, tabletop, and cookware, as well as expanded pet, and gourmet food departments; jewelry and accessories; and other merchandise. It offers its products through stores and e-commerce sites. The TJX Companies, Inc. was incorporated in 1962 and is headquartered in Framingham, Massachusetts.",29.125002,26.83801,138.8 B,128.0,3.7%,129.55136,4.9%,1.25%,True
FI,209.4499969482422,6.85,210.0,2025-02-21,0.03533064291992538,"Fiserv, Inc., together with its subsidiaries, provides payments and financial services technology services in the United States, Europe, the Middle East and Africa, Latin America, the Asia-Pacific, and internationally. It operates through Merchant Acceptance, Financial Technology, and Payments and Network segments. The Merchant Acceptance segment provides merchant acquiring and digital commerce services; mobile payment services; security and fraud protection products; Clover, a cloud based POS and integrated commerce operating system for small and mid-sized businesses and independent software vendors; and Carat, an integrated operating system for large businesses. This segment distributes through various channels, including direct sales teams, strategic partnerships with agent sales forces, independent software vendors, financial institutions, and other strategic partners in the form of joint venture alliances, revenue sharing alliances, and referral agreement. The Financial Technology segment offers customer deposit and loan accounts, as well as manages an institution's general ledger and central information files. This segment also provides digital banking, financial and risk management, professional services and consulting, check processing, and other products and services. The Payments and Network segment offers card transactions, such as debit, credit, and prepaid card processing and services; funds access, debit payments, cardless ATM access, and surcharge-free ATM network; security and fraud protection products; card production; print services; and various network services, as well as non-card digital payment software and services, including bill payment, account-to-account transfers, person-to-person payments, electronic billing, and security and fraud protection products. It serves merchants, banks, credit unions, other financial institutions, and corporate clients. Fiserv, Inc. was incorporated in 1984 and is headquartered in Milwaukee, Wisconsin.",40.512573,20.530169,119.2 B,223.23,6.6%,230.70294,10.1%,N/A,True
TMUS,223.00999450683594,11.05,220.0,2025-02-21,0.03605222048878898,"T-Mobile US, Inc., together with its subsidiaries, provides mobile communications services in the United States, Puerto Rico, and the United States Virgin Islands. The company offers voice, messaging, and data services to customers in the postpaid, prepaid, and wholesale and other services. It also provides wireless devices, including smartphones, wearables, tablets, home broadband routers, and other mobile communication devices, as well as wireless devices and accessories; financing through equipment installment plans; reinsurance for device insurance policies and extended warranty contracts; leasing through JUMP! On Demand; and High Speed Internet services. In addition, the company offers services, devices, and accessories under the T-Mobile and Metro by T-Mobile brands through its owned and operated retail stores, T-Mobile app and customer care channels, and its websites. It also sells its devices to dealers and other third-party distributors for resale through independent third-party retail outlets and various third-party websites. The company was founded in 1994 and is headquartered in Bellevue, Washington. T-Mobile US, Inc. operate as a subsidiary Deutsche Telekom AG",25.457762,20.602736,258.8 B,248.15,11.3%,245.06769,9.9%,1.60%,True
TMO,528.97998046875,19.8,530.0,2025-02-21,0.03935880430257588,"Thermo Fisher Scientific Inc. provides life sciences solutions, analytical instruments, specialty diagnostics, and laboratory products and biopharma services in the North America, Europe, Asia-Pacific, and internationally. The company's Life Sciences Solutions segment offers reagents, instruments, and consumables for biological and medical research, discovery, and production of drugs and vaccines, as well as diagnosis of infections and diseases; and solutions include biosciences, genetic sciences, and bio production to pharmaceutical, biotechnology, agricultural, clinical, healthcare, academic, and government markets. Its Analytical Instruments segment provides instruments, consumables, software, and services for pharmaceutical, biotechnology, academic, government, environmental, and other research and industrial markets, as well as clinical laboratories. The company's Specialty Diagnostics segment offers liquid, ready-to-use, and lyophilized immunodiagnostic reagent kits, as well as calibrators, controls, protein detection assays, and instruments; immunodiagnostics develops, manufactures and markets complete bloodtest systems to support the clinical diagnosis and monitoring of allergy, asthma and autoimmune diseases; dehydrated and prepared culture media, collection and transport systems, instrumentation, and consumables; human leukocyte antigen typing and testing for organ transplant market; and healthcare products. Its Laboratory Products and Biopharma Services segment provides laboratory products, research and safety market channel, and pharma services and clinical research. It offers products and services through a direct sales force, customer-service professionals, electronic commerce, and third-party distributors under Thermo Scientific; Applied Biosystems; Invitrogen; Fisher Scientific; Unity Lab Services; and Patheon and PPD. It has a collaboration agreement with Mainz Biomed N.V. for the development of colorectal cancer screening product. Thermo Fisher Scientific Inc. was founded in 1956 and is headquartered in Waltham, Massachusetts.",33.102627,22.564701,202.3 B,627.88,18.7%,649.80414,22.8%,0.30%,True
CRM,344.42999267578125,18.4,340.0,2025-02-21,0.04055978753676359,"Salesforce, Inc. provides Customer Relationship Management (CRM) technology that brings companies and customers together worldwide. The company's service includes sales to store data, monitor leads and progress, forecast opportunities, gain insights through analytics and artificial intelligence, and deliver quotes, contracts, and invoices; and service that enables companies to deliver trusted and highly personalized customer support at scale. In addition, its platform offering comprise a flexible platform that enables companies of various sizes, locations, and industries to build business workflow and apps with customer; online learning platform that allows anyone to learn in-demand Salesforce skills; and Slack, an intelligent productivity platform. The company's marketing services enables companies to plan, personalize, automate, and optimize customer marketing journey, connecting interaction, and connected products; and commerce services, which empowers shopping experience across various customer touchpoint, such as mobile, web, social, and stores and provides click-to-code tools that offers customers to build and deploy solutions. Further, its analytics offering includes Tableau, an end-to-end analytics solution for range of enterprise use cases and intelligent analytics with AI models, spot trends, predict outcomes, creates summaries, timely recommendations, and take action from any device; and integration service including MuleSoft, which provides building blocks to deliver end-to-end and connected experiences. Additionally, the company provides data cloud, a hyperscale data engine native to Salesforce; vertical services to meet the needs of customers in industries, such as financial services, healthcare and life sciences, manufacturing and automotive and government; and offers salesforce starter for small and medium-sized businesses. Salesforce, Inc. was incorporated in 1999 and is headquartered in San Francisco, California.",56.83663,30.677027,329.6 B,369.0,7.1%,395.75555,14.9%,0.48%,True
MSFT,439.3299865722656,17.3,440.0,2025-02-21,0.040903225313482006,"Microsoft Corporation develops and supports software, services, devices and solutions worldwide. The Productivity and Business Processes segment offers office, exchange, SharePoint, Microsoft Teams, office 365 Security and Compliance, Microsoft viva, and Microsoft 365 copilot; and office consumer services, such as Microsoft 365 consumer subscriptions, Office licensed on-premises, and other office services. This segment also provides LinkedIn; and dynamics business solutions, including Dynamics 365, a set of intelligent, cloud-based applications across ERP, CRM, power apps, and power automate; and on-premises ERP and CRM applications. The Intelligent Cloud segment offers server products and cloud services, such as azure and other cloud services; SQL and windows server, visual studio, system center, and related client access licenses, as well as nuance and GitHub; and enterprise services including enterprise support services, industry solutions, and nuance professional services. The More Personal Computing segment offers Windows, including windows OEM licensing and other non-volume licensing of the Windows operating system; Windows commercial comprising volume licensing of the Windows operating system, windows cloud services, and other Windows commercial offerings; patent licensing; and windows Internet of Things; and devices, such as surface, HoloLens, and PC accessories. Additionally, this segment provides gaming, which includes Xbox hardware and content, and first- and third-party content; Xbox game pass and other subscriptions, cloud gaming, advertising, third-party disc royalties, and other cloud services; and search and news advertising, which includes Bing, Microsoft News and Edge, and third-party affiliates. The company sells its products through OEMs, distributors, and resellers; and directly through digital marketplaces, online, and retail stores. The company was founded in 1975 and is headquartered in Redmond, Washington.",36.218464,29.25736,3266.4 B,468.35,6.6%,508.5454,15.8%,0.76%,True
CMG,62.2400016784668,4.8,60.0,2025-02-21,0.04113107732159471,"Chipotle Mexican Grill, Inc., together with its subsidiaries, owns and operates Chipotle Mexican Grill restaurants. It sells food and beverages through offering burritos, burrito bowls, quesadillas, tacos, and salads. The company also provides delivery and related services its app and website. It has operations in the United States, Canada, France, Germany, Dubai, and the United Kingdom. Chipotle Mexican Grill, Inc. was founded in 1993 and is headquartered in Newport Beach, California.",57.629627,47.133305,84.8 B,69.2614,11.3%,65.63968,5.5%,N/A,True
WMT,92.68000030517578,4.06,92.5,2025-02-21,0.041864476500304226,"Walmart Inc. engages in the operation of retail, wholesale, other units, and eCommerce worldwide. The company operates through three segments: Walmart U.S., Walmart International, and Sam's Club. It operates supercenters, supermarkets, hypermarkets, warehouse clubs, cash and carry stores, and discount stores under Walmart and Walmart Neighborhood Market brands; membership-only warehouse clubs; ecommerce websites, such as walmart.com.mx, walmart.ca, flipkart.com, PhonePe and other sites; and mobile commerce applications. The company offers grocery and consumables, including dairy, meat, bakery, deli, produce, dry, chilled or frozen packaged foods, alcoholic and nonalcoholic beverages, floral, snack foods, candy, other grocery items, health and beauty aids, paper goods, laundry and home care, baby care, pet supplies, and other consumable items; fuel, tobacco and other categories. It is also involved in the provision of health and wellness products covering pharmacy, optical and hearing services, and over-the-counter drugs and other medical products; and home and apparel including home improvement, outdoor living, gardening, furniture, apparel, jewelry, tools and power equipment, housewares, toys, seasonal items, mattresses and tire and battery centers. In addition, the company offers consumer electronics and accessories, software, video games, office supplies, appliances, and third-party gift cards. Further, it operates digital payment platforms; and offers financial services and related products, including money transfers, bill payments, money orders, check cashing, prepaid access, co-branded credit cards, installment lending, and earned wage access. Additionally, the company markets lines of merchandise under private brands, including Allswell, Athletic Works, Equate, and Free Assembly. The company was formerly known as Wal-Mart Stores, Inc. and changed its name to Walmart Inc. in February 2018. Walmart Inc. was founded in 1945 and is based in Bentonville, Arkansas.",38.29752,33.628693,744.5 B,96.18,3.8%,98.48237,6.3%,0.99%,False
