Ticker,Stock Price,Call Contract Price,Strike Price,Expiration Date,Breakeven increase,Company Description,P/E Ratio,Forward P/E,Market Cap,52 Week High,52-week-upside,1y Target Est,1y-target-upside,Dividend Yield,Attractiveness
TMO,526.8900146484375,14.0,530.0,2025-01-17,0.03247354262915558,"Thermo Fisher Scientific Inc. provides life sciences solutions, analytical instruments, specialty diagnostics, and laboratory products and biopharma services in the North America, Europe, Asia-Pacific, and internationally. The company's Life Sciences Solutions segment offers reagents, instruments, and consumables for biological and medical research, discovery, and production of drugs and vaccines, as well as diagnosis of infections and diseases; and solutions include biosciences, genetic sciences, and bio production to pharmaceutical, biotechnology, agricultural, clinical, healthcare, academic, and government markets. Its Analytical Instruments segment provides instruments, consumables, software, and services for pharmaceutical, biotechnology, academic, government, environmental, and other research and industrial markets, as well as clinical laboratories. The company's Specialty Diagnostics segment offers liquid, ready-to-use, and lyophilized immunodiagnostic reagent kits, as well as calibrators, controls, protein detection assays, and instruments; immunodiagnostics develops, manufactures and markets complete bloodtest systems to support the clinical diagnosis and monitoring of allergy, asthma and autoimmune diseases; dehydrated and prepared culture media, collection and transport systems, instrumentation, and consumables; human leukocyte antigen typing and testing for organ transplant market; and healthcare products. Its Laboratory Products and Biopharma Services segment provides laboratory products, research and safety market channel, and pharma services and clinical research. It offers products and services through a direct sales force, customer-service professionals, electronic commerce, and third-party distributors under Thermo Scientific; Applied Biosystems; Invitrogen; Fisher Scientific; Unity Lab Services; and Patheon and PPD. It has a collaboration agreement with Mainz Biomed N.V. for the development of colorectal cancer screening product. Thermo Fisher Scientific Inc. was founded in 1956 and is headquartered in Waltham, Massachusetts.",33.013157,22.425203,201.5 B,627.88,19.2%,653.5114,24.0%,0.30%,True
DIS,113.33999633789062,2.07,115.0,2025-01-17,0.032909862207772145,"The Walt Disney Company operates as an entertainment company worldwide. It operates through three segments: Entertainment, Sports, and Experiences. The company produces and distributes film and television video streaming content under the ABC Television Network, Disney, Freeform, FX, Fox, National Geographic, and Star brand television channels, as well as ABC television stations and A+E television networks; and produces original content under the ABC Signature, Disney Branded Television, FX Productions, Lucasfilm, Marvel, National Geographic Studios, Pixar, Searchlight Pictures, Twentieth Century Studios, 20th Television, and Walt Disney Pictures banners. It also offers direct-to-consumer streaming services through Disney+, Disney+ Hotstar, Hulu, and Star+; sports-related entertainment services through ESPN, ESPN on ABC, ESPN+ DTC, and Star; sale/licensing of film and episodic content to third-party television and VOD services; theatrical, home entertainment, and music distribution services; DVD and Blu-ray discs, electronic home video licenses, and VOD rental services; staging and licensing of live entertainment events; and post-production services. In addition, the company operates theme parks and resorts comprising Walt Disney World Resort, Disneyland Resort, Disneyland Paris, Hong Kong Disneyland Resort, Shanghai Disney Resort, Disney Cruise Line, Disney Vacation Club, National Geographic Expeditions, and Adventures by Disney, as well as Aulani, a Disney resort and spa in Hawaii. It also licenses its intellectual property to a third party for operations of the Tokyo Disney Resort; licenses trade names, characters, visual, literary, and other IP for use on merchandise, published materials, and games; operates a direct-to-home satellite distribution platform; sells branded merchandise through retail, online, and wholesale businesses; and develops and publishes books, comic books, and magazines. The company was founded in 1923 and is based in Burbank, California.",41.669117,18.667545,205.3 B,123.74,9.2%,122.12857,7.8%,0.82%,True
GILD,91.86000061035156,2.39,92.5,2025-01-17,0.03298497027559333,"Gilead Sciences, Inc., a biopharmaceutical company, discovers, develops, and commercializes medicines in the areas of unmet medical need in the United States, Europe, and internationally. The company provides Biktarvy, Genvoya, Descovy, Odefsey, Truvada, Complera/ Eviplera, Stribild, Sunlencs, and Atripla products for the treatment of HIV/AIDS; Veklury, an injection for intravenous use, for the treatment of COVID-19; and Epclusa, Harvoni, Vemlidy, and Viread for the treatment of viral hepatitis. It also offers Yescarta, Tecartus, and Trodelvy products for the treatment of oncology; Letairis, an oral formulation for the treatment of pulmonary arterial hypertension; and AmBisome, a liposomal formulation for the treatment of serious invasive fungal infections. The company has collaboration agreements with Arcus Biosciences, Inc.; Merck Sharp & Dohme Corp.; Pionyr Immunotherapeutics Inc.; Tizona Therapeutics, Inc.; Galapagos NV; Janssen Sciences Ireland Unlimited Company; Japan Tobacco, Inc.; Dragonfly Therapeutics, Inc.; Arcellx, Inc.; Everest Medicines; Merck & Co, Inc.; Tentarix Biotherapeutics Inc.; Marengo Therapeutics; and Assembly Biosciences, Inc. It also has research collaboration, option, and license agreement with Merus N.V. for the discovery of novel dual tumor-associated antigens (TAA) targeting trispecific antibodies. The company was incorporated in 1987 and is headquartered in Foster City, California.",1020.6111,12.133874,114.5 B,98.9,7.7%,98.92,7.7%,3.35%,True
ABT,113.37999725341797,2.14,115.0,2025-01-17,0.03316284033927053,"Abbott Laboratories, together with its subsidiaries, discovers, develops, manufactures, and sells health care products worldwide. It operates in four segments: Established Pharmaceutical Products, Diagnostic Products, Nutritional Products, and Medical Devices. The company provides generic pharmaceuticals for the treatment of pancreatic exocrine insufficiency, irritable bowel syndrome or biliary spasm, intrahepatic cholestasis or depressive symptoms, gynecological disorder, hormone replacement therapy, dyslipidemia, hypertension, hypothyroidism, Ménière's disease and vestibular vertigo, pain, fever, inflammation, and migraine, as well as provides anti-infective clarithromycin, influenza vaccine, and products to regulate physiological rhythm of the colon. It also offers laboratory and transfusion medicine systems in the areas of immunoassay, clinical chemistry, hematology, and transfusion; molecular diagnostics polymerase chain reaction instrument systems that automate the extraction, purification, and preparation of DNA and RNA from patient samples, and detect and measure infectious agents; point of care systems; cartridges for testing blood gas, chemistry, electrolytes, coagulation, and immunoassay; rapid diagnostics lateral flow testing products; molecular point-of-care testing for HIV, SARS-CoV-2, influenza A and B, RSV, and strep A; cardiometabolic test systems; drug and alcohol test, and remote patient monitoring and consumer self-test systems; and informatics and automation solutions for laboratories. In addition, the company provides pediatric and adult nutritional products; rhythm management, electrophysiology, heart failure, vascular, and structural heart devices for the treatment of cardiovascular diseases; diabetes care products, such as glucose and blood glucose monitoring systems; and neuromodulation devices for the management of chronic pain and movement disorders. Abbott Laboratories was founded in 1888 and is based in North Chicago, Illinois.",34.462006,21.973421,196.7 B,121.64,7.3%,129.87125,14.5%,1.94%,True
INFY,23.399999618530273,1.18,23.0,2025-01-17,0.03333335017886285,"Infosys Limited, together with its subsidiaries, provides consulting, technology, outsourcing, and next-generation digital services in North America, Europe, India, and internationally. It provides digital marketing and digital workplace, digital commerce, digital experience and interactions, metaverse, data analytics and AI, applied AI, generative AI, sustainability, blockchain, engineering, Internet of Things, enterprise agile DevOps, application modernization, cloud, digital process automation, digital supply chain, Microsoft business application and cloud business, service experience transformation, energy transition, cyber security, and quality engineering solutions; Oracle, SAP, and Saleforce solutions; API economy and microservices; and Topaz, an AI-first set of services, solutions, and platforms using generative AI technologies. The company's products and platforms include Finacle, a core banking solution; Edge suite of products; Panaya platform, Infosys Equinox, Infosys Helix, Infosys Applied AI, Infosys Cortex, and Stater digital platforms; and Infosys McCamish, an insurance platform. It serves aerospace and defense, agriculture, automotive, chemical manufacturing, communication, consumer packaged goods, education, engineering procurement and construction, healthcare, high technology, industrial manufacturing, information services and publishing, insurance, life science, logistics and distribution, media, entertainment, mining, oil and gas, private equity, professional, public, retail, travel, hospitality, utilities, and waste management industries. The company was formerly known as Infosys Technologies Limited and changed its name to Infosys Limited in June 2011. Infosys Limited was incorporated in 1981 and is headquartered in Bengaluru, India.",30.38961,27.683462,97.6 B,23.63,1.0%,23.40623,0.0%,2.12%,False
BP,29.979999542236328,0.99,30.0,2025-01-17,0.03368914186742278,"BP p.l.c. provides carbon products and services. The company operates through Gas & Low Carbon Energy, Oil Production & Operations, and Customers & Products segments. It engages in the production of natural gas, and integrated gas and power; trading of gas; operation of onshore and offshore wind power, as well as hydrogen and carbon capture and storage facilities; trading and marketing of renewable and non-renewable power; and production of crude oil. In addition, the company involved in convenience and retail fuel, EV charging, Castrol lubricant, aviation, B2B, and midstream businesses; refining and oil trading; and bioenergy business. The company was founded in 1908 and is headquartered in London, the United Kingdom.",29.98,7.895894,79.3 B,40.4,34.8%,37.81125,26.1%,6.40%,True
WFC,70.44000244140625,2.82,70.0,2025-01-17,0.03378758483964406,"Wells Fargo & Company, a financial services company, provides diversified banking, investment, mortgage, and consumer and commercial finance products and services in the United States and internationally. The company operates through four segments: Consumer Banking and Lending; Commercial Banking; Corporate and Investment Banking; and Wealth and Investment Management. The Consumer Banking and Lending segment offers diversified financial products and services for consumers and small businesses. Its financial products and services include checking and savings accounts, and credit and debit cards, as well as home, auto, personal, and small business lending services. The Commercial Banking segment provides financial solutions to private, family owned, and certain public companies. Its products and services include banking and credit products across various industry sectors and municipalities, secured lending and lease products, and treasury management services. The Corporate and Investment Banking segment offers a suite of capital markets, banking, and financial products and services, such as corporate banking, investment banking, treasury management, commercial real estate lending and servicing, equity, and fixed income solutions, as well as sales, trading, and research capabilities services to corporate, commercial real estate, government, and institutional clients. The Wealth and Investment Management segment provides personalized wealth management, brokerage, financial planning, lending, private banking, and trust and fiduciary products and services to affluent, high-net worth, and ultra-high-net worth clients. It also operates through financial advisors in brokerage and wealth offices, consumer bank branches, independent offices, and digitally through WellsTrade and Intuitive Investor. The company was founded in 1852 and is headquartered in San Francisco, California.",14.644491,12.908925,234.5 B,78.13,10.9%,74.36,5.6%,2.27%,True
PYPL,91.0199966430664,4.1,90.0,2025-01-17,0.033838754894836676,"PayPal Holdings, Inc. operates a technology platform that enables digital payments on behalf of merchants and consumers worldwide. It operates a two-sided network at scale that connects merchants and consumers that enables its customers to connect, transact, and send and receive payments through online and in person, as well as transfer and withdraw funds using various funding sources, such as bank accounts, PayPal or Venmo account balance, PayPal and Venmo branded credit products comprising its installment products, credit and debit cards, and cryptocurrencies, as well as other stored value products, including gift cards and eligible rewards. The company provides payment solutions under the PayPal, PayPal Credit, Braintree, Venmo, Xoom, Zettle, Hyperwallet, Honey, and Paidy names. The company was founded in 1998 and is headquartered in San Jose, California.",21.77512,18.642126,91.3 B,93.66,2.9%,92.0727,1.2%,N/A,False
GOOGL,189.82000732421875,6.25,190.0,2025-01-17,0.03387415671520122,"Alphabet Inc. offers various products and platforms in the United States, Europe, the Middle East, Africa, the Asia-Pacific, Canada, and Latin America. It operates through Google Services, Google Cloud, and Other Bets segments. The Google Services segment provides products and services, including ads, Android, Chrome, devices, Gmail, Google Drive, Google Maps, Google Photos, Google Play, Search, and YouTube. It is also involved in the sale of apps and in-app purchases and digital content in the Google Play and YouTube; and devices, as well as in the provision of YouTube consumer subscription services. The Google Cloud segment offers infrastructure, cybersecurity, databases, analytics, AI, and other services; Google Workspace that include cloud-based communication and collaboration tools for enterprises, such as Gmail, Docs, Drive, Calendar, and Meet; and other services for enterprise customers. The Other Bets segment sells healthcare-related and internet services. The company was incorporated in 1998 and is headquartered in Mountain View, California.",25.175068,21.201431,2332.2 B,195.61,3.1%,209.84563,10.5%,0.42%,False
SMFG,14.890000343322754,0.4,15.0,2025-01-17,0.03425115143841828,"Sumitomo Mitsui Financial Group, Inc., together with its subsidiaries, provides banking, leasing, securities, consumer finance, and other services in Japan, the Americas, Europe, the Middle East, Asia, and Oceania. It operates through Wholesale Business Unit, Retail Business Unit, Global Business Unit, and Global Markets Business Unit segments. The Wholesale Business Unit segment offers bilateral loans, syndicated loans, commitment lines, structured finance, project finance, and nonrecourse loans; deposits and investment trusts; risk hedging services, including forward exchange contracts and derivatives; stand-by credit, performance bond and credit guarantee services; remittance, cash management, trade finance, and supply chain finance services; merger and acquisition, and other advisory services; digital services; and equipment, operating and leveraged leasing services. The Retail Business Unit segment provides wealth management services, such as time deposits and foreign currency deposits, investment trusts, equities, bonds, insurance products, and trust services; credit card, installment, and transaction services; and consumer finance and housing loans. The Global Business Unit segment offers loans, deposits, clearing services, trade finance, project finance, loan syndication, derivatives, and global cash management services; equity and fixed income sales and trading, and underwriting services; and construction machinery, transportation equipment, industrial machinery, medical equipment, and other leasing services. The Global Markets Business Unit segment provides asset liability management and portfolio management, foreign currency funding, and sales and trading services. The company offers system development, data processing, management consulting, economic research, and asset management services. Sumitomo Mitsui Financial Group, Inc. was incorporated in 2002 and is headquartered in Tokyo, Japan.",12.836207,36.317074,97.1 B,15.56,4.5%,16.464,10.6%,2.45%,True
ZTS,178.17999267578125,4.3,180.0,2025-01-17,0.03434733177565463,"Zoetis Inc. engages in the discovery, development, manufacture, and commercialization of animal health medicines, vaccines, and diagnostic products and services in the United States and internationally. The company commercializes products primarily across species, including livestock, such as cattle, swine, poultry, fish, and sheep and others; and companion animals comprising dogs, cats, and horses. It also offers parasiticides, vaccines, dermatology, other pharmaceutical, anti-infectives, animal health diagnostics, and medicated feed additives. In addition, the company provides animal health diagnostics, including point-of-care diagnostic products, instruments and reagents, rapid immunoassay tests, reference laboratory kits and services, and blood glucose monitors; and other non-pharmaceutical products, which include nutritionals, as well as products and services in biodevices, genetic tests, and precision animal health. It markets its products to veterinarians, livestock producers, and pet owners. The company has collaboration Blacksmith Medicines, Inc. to discover and develop novel antibiotics for animal health. Zoetis Inc. was founded in 1952 and is headquartered in Parsippany, New Jersey.",33.42964,27.81281,80.4 B,200.53,12.5%,214.21765,20.2%,1.12%,True
ADBE,465.69000244140625,16.69,465.0,2025-01-17,0.03435761445320451,"Adobe Inc., together with its subsidiaries, operates as a diversified software company worldwide. It operates through three segments: Digital Media, Digital Experience, and Publishing and Advertising. The Digital Media segment offers products, services, and solutions that enable individuals, teams, and enterprises to create, publish, and promote content; and Document Cloud, a unified cloud-based document services platform. Its flagship product is Creative Cloud, a subscription service that allows members to access its creative products. This segment serves content creators, students, workers, marketers, educators, enthusiasts, and communicators. The Digital Experience segment provides an integrated platform and set of applications and services that enable brands and businesses to create, manage, execute, measure, monetize, and optimize customer experiences from analytics to commerce. This segment serves marketers, advertisers, agencies, publishers, merchandisers, merchants, web analysts, data scientists, developers, and executives across the C-suite. The Publishing and Advertising segment offers products and services, such as e-learning solutions, technical document publishing, web conferencing, document and forms platform, web application development, and high-end printing, as well as Advertising Cloud offerings. It also provides consulting, technical support, and learning services. The company offers its products and services directly to enterprise customers through its sales force and local field offices, as well as to end users through app stores and through its website at adobe.com. It also distributes products and services through distributors, value-added resellers, systems integrators, software vendors and developers, retailers, and original equipment manufacturers. The company was formerly known as Adobe Systems Incorporated and changed its name to Adobe Inc. in October 2018. Adobe Inc. was founded in 1982 and is headquartered in San Jose, California.",37.73825,20.20355,205.0 B,638.25,37.1%,587.9397,26.3%,N/A,True
GS,585.47998046875,20.6,585.0,2025-01-17,0.03436500000416998,"The Goldman Sachs Group, Inc., a financial institution, provides a range of financial services for corporations, financial institutions, governments, and individuals worldwide. It operates through Global Banking & Markets, Asset & Wealth Management, and Platform Solutions segments. The Global Banking & Markets segment provides financial advisory services, including strategic advisory assignments related to mergers and acquisitions, divestitures, corporate defense activities, restructurings, and spin-offs; and relationship lending, and acquisition financing, as well as secured lending, through structured credit and asset-backed lending and involved in financing under securities to resale agreements. This segment also offers client execution activities for cash and derivative instruments; credit and interest rate products; and provision of mortgages, currencies, commodities, and equities related products, as well as underwriting services. The Asset & Wealth Management segment manages assets across various classes, including equity, fixed income, hedge funds, credit funds, private equity, real estate, currencies, and commodities; and provides customized investment advisory solutions, wealth advisory services, personalized financial planning, and private banking services, as well as invests in corporate equity, credit, real estate, and infrastructure assets. The Platform Solutions segment offers credit cards and point-of-sale financing for purchase of goods or services. This segment also provides cash management services, such as deposit-taking and payment solutions for corporate and institutional clients. The Goldman Sachs Group, Inc. was founded in 1869 and is headquartered in New York, New York.",17.15441,13.690708,183.8 B,612.73,4.7%,601.8421,2.8%,2.05%,False
FTNT,97.94999694824219,3.85,97.5,2025-01-17,0.034711619782432424,"Fortinet, Inc. provides cybersecurity and convergence of networking and security solutions worldwide. It offers secure networking solutions focus on the convergence of networking and security; network firewall solutions that consist of FortiGate data centers, hyperscale, and distributed firewalls, as well as encrypted applications; wireless LAN solutions; and secure connectivity solutions, including FortiSwitch secure ethernet switches, FortiAP wireless local area network access points, FortiExtender 5G connectivity gateways, and other products. The company also provides the Fortinet Unified SASE solutions that include firewall, SD-WAN, Secure web gateway, cloud access services broker, data loss prevention, zero trust network access, and cloud security, including web application firewalls, virtualized firewalls, and cloud-native firewalls. In addition, it offers security operations solutions comprising FortiAI generative AI assistant, FortiSIEM security information and event management, FortiSOAR security orchestration, automation and response, FortiEDR endpoint detection and response, FortiXDR extended detection and response, FortiMDR managed detection and response service, FortiNDR network detection and response, FortiRecon digital risk protection, FortiDeceptor deception technology, FortiGuard SoCaaS, FortiSandbox sandboxing, FortiGuard incident response, and other products. Further, the company offers FortiGuard security services consisting of FortiGuard application security, content security, device security, NOC/SOC security, and web security services; FortiCare technical support services; and training services to customers and channel partners, as well as operates a FortiGuard Lab, a cybersecurity threat intelligence and research organization. It serves enterprise, communication and security service providers, government organizations, and small and medium-sized businesses. The company was incorporated in 2000 and is headquartered in Sunnyvale, California.",49.221104,40.4306,75.1 B,100.59,2.7%,95.54361,-2.5%,N/A,False
EQIX,965.0,38.5,960.0,2025-01-17,0.0347150259067357,"Equinix (Nasdaq: EQIX) is the world's digital infrastructure company. Digital leaders harness Equinix's trusted platform to bring together and interconnect foundational infrastructure at software speed. Equinix enables organizations to access all the right places, partners and possibilities to scale with agility, speed the launch of digital services, deliver world-class experiences and multiply their value, while supporting their sustainability goals.",86.936935,74.46476,93.1 B,994.03,3.0%,1000.1739,3.6%,1.77%,False
