Ticker,Stock Price,Call Contract Price,Strike Price,Expiration Date,Breakeven increase,Company Description,P/E Ratio,Forward P/E,Market Cap,52 Week High,52-week-upside,1y Target Est,1y-target-upside,Dividend Yield,Attractiveness
CBRE,123.30999755859375,9.25,125.0,2025-06-20,0.0887195090260855,"CBRE Group, Inc. operates as a commercial real estate services and investment company in the United States, the United Kingdom, and internationally. The Advisory Services segment offers strategic advice and execution to owners, investors, and occupiers of real estate in connection with leasing of offices, and industrial and retail space; clients fully integrated property sales services under the CBRE Capital Markets brand; clients commercial mortgage and structured financing services; originates and sells commercial mortgage loans; property management services, such as marketing, building engineering, accounting, and financial services on a contractual basis for owners of and investors in office, industrial, and retail properties; and valuation services that include market value appraisals, litigation support, discounted cash flow analyses, and feasibility studies, as well as consulting services, such as property condition reports, hotel advisory, and environmental consulting. The Global Workplace Solutions segment provides facilities management, including day-to-day management of client-occupied space, headquarters, regional offices, administrative offices, data centers and other critical facilities, manufacturing and laboratory facilities, and distribution facilities and retail space; and project management services comprising building consulting, program, and project and cost management services under the Turner & Townsend brand name. The Real Estate Investments segment offers investment management services under the CBRE Investment Management brand to pension funds, insurance companies, sovereign wealth funds, foundations, endowments, and other institutional investors; and development services, such as real estate development and investment activities under the Trammell Crow Company and Telford Homes brands to users and investors in commercial real estate, and for their own account. CBRE Group, Inc. was founded in 1906 and is headquartered in Dallas, Texas.",39.90615,20.124163,37.7 B,142.0,15.2%,146.81818,19.1%,N/A,True
KSPI,91.54000091552734,14.4,90.0,2025-06-20,0.14048502245854033,"Joint Stock Company Kaspi.kz, together with its subsidiaries, provides payments, marketplace, and fintech solutions for consumers and merchants in the Republic of Kazakhstan. It operates through three segments: Payments Platform, Marketplace Platform, and Fintech Platform. The Payments Platform segment facilities transactions between customers and merchants. This segment offers shopping transactions, regular household bills, and peer to peer payments for consumers; accepts payment online and in store, issue and settle invoices, pay suppliers and monitor merchant turnover. It also provides proprietary data facilities informed decision making across multiple areas of business. Its Marketplace Platform segment connects online, and offline merchants and consumers enabling merchants to enhance its sales through an omni channel strategy and enable consumers to buy products and services from various merchants. This segment also operates marketplace through m-commerce, a mobile solution for shopping in person which consumers can use e-commerce to shop anywhere, anytime with free delivery; Kaspi Travel allows consumers to book domestic and international flights and package holidays, domestic rail tickets. It also enhances merchants sales by connecting payments and fintech products, Kapsi advertising, and other delivery services. The Fintech Platform segment provides consumers with BNPL, finance, and savings products and merchants with merchant finance services through super apps and Kapsi.kz Super app. It also involved in the banking; distressed asset management; real estate business; payment processing; online travel; and storage and processing of information services. The company was incorporated in 2008 and is headquartered in Almaty, the Republic of Kazakhstan.",9.54536,0.013132771,19.6 B,143.72,57.0%,129.66606,41.6%,7.97%,True
DUK,106.27999877929688,2.95,105.0,2025-02-21,0.01571322205386072,"Duke Energy Corporation, together with its subsidiaries, operates as an energy company in the United States. It operates through two segments: Electric Utilities and Infrastructure (EU&I), and Gas Utilities and Infrastructure (GU&I). The EU&I segment generates, transmits, distributes, and sells electricity in the Carolinas, Florida, and the Midwest. It generates electricity through coal, hydroelectric, natural gas, oil, solar and wind sources, renewables, and nuclear fuel. This segment also engages in the wholesale of electricity to municipalities, electric cooperative utilities, and load-serving entities. The GU&I segment distributes natural gas to residential, commercial, industrial, and power generation natural gas customers; and invests in pipeline transmission projects, renewable natural gas projects, and natural gas storage facilities. The company was formerly known as Duke Energy Holding Corp. and changed its name to Duke Energy Corporation in April 2006. Duke Energy Corporation was founded in 1904 and is headquartered in Charlotte, North Carolina.",19.079891,16.769178,82.1 B,121.25,14.1%,123.06588,15.8%,3.95%,True
ABEV,1.8049999475479126,0.34,1.5,2025-02-21,0.01939061134025799,"Ambev S.A., through its subsidiaries, engages in the production, distribution, and sale of beer, draft beer, carbonated soft drinks, malt and food, other alcoholic beverages, and non-alcoholic and non-carbonated products in Brazil, Central America and Caribbean, Latin America South, and Canada. It offers beer primarily under the Skol, Brahma, Antarctica, Brahva, Budweiser, Bud Light, Beck, Leffe, Hoegaarden, Balboa ICE, Balboa, Atlas Golden Light, Atlas, Bucanero, Cristal, Mayabe, Presidente, Presidente Light, Brahma Light, Bohemia, The One, Corona, Modelo Especial, Stella Artois, Quilmes Clásica, Paceña, Taquiña, Huari, Becker, Cusqueña, Michelob Ultra, Busch, Pilsen, Ouro Fino, Bud 66, Banks, Deputy, Patricia, Labatt Blue, Alexander Keith's, and Kokanee brands. The company also provides carbonated soft drinks, bottled water, isotonic beverages, energy drinks, coconut water, powdered and natural juices, and ready-to-drink teas under the Guaraná Antarctica, Gatorade, H2OH!, Pepsi Black, Lipton Iced Tea, Fusion, Pepsi-Cola, Canada Dry, Squirt, Red Rock, Red Bull, Seven Up, Nutrl, Bud Light Seltzer, Palm Bay, and Mike's brands. It offers its products through a network of third-party distributors and a direct distribution system. The company was founded in 1885 and is headquartered in São Paulo, Brazil. Ambev S.A. is a subsidiary of Interbrew International B.V.",12.033333,10.005543,29.8 B,2.75,52.4%,3.008,66.6%,6.09%,True
MMC,212.30990600585938,6.59,210.0,2025-02-21,0.02015965281442167,"Marsh & McLennan Companies, Inc., a professional services company, provides advice and solutions to clients in the areas of risk, strategy, and people worldwide. It operates through Risk and Insurance Services, and Consulting segments. The Risk and Insurance Services segment offers risk management services, such as risk advice, risk transfer, and risk control and mitigation solutions, as well as insurance and reinsurance broking, strategic advisory services, and analytics solutions, and insurance program management services. It serves businesses, public entities, insurance companies, associations, professional services organizations, and private clients. The Consulting segment provides health, wealth and career advice, solutions and products; and specialized management, strategic, economic, and brand consulting services. Marsh & McLennan Companies, Inc. was founded in 1871 and is headquartered in New York, New York.",26.178782,22.34171,104.3 B,235.5,10.9%,228.875,7.8%,1.56%,True
MO,50.869998931884766,2.14,50.0,2025-02-21,0.02496562010578729,"Altria Group, Inc., through its subsidiaries, manufactures and sells smokeable and oral tobacco products in the United States. The company offers cigarettes primarily under the Marlboro brand; large cigars and pipe tobacco under the Black & Mild brand; moist smokeless tobacco and snus products under the Copenhagen, Skoal, Red Seal, and Husky brands; oral nicotine pouches under the on! brand; and e-vapor products under the NJOY ACE brand. It sells its products to distributors, as well as large retail organizations, such as chain stores. The company was founded in 1822 and is headquartered in Richmond, Virginia.",8.6097975,9.523115,86.4 B,58.04,14.1%,56.80333,11.7%,8.02%,True
JNJ,144.89999389648438,3.71,145.0,2025-02-21,0.026294039089038712,"Johnson & Johnson, together with its subsidiaries, researches, develops, manufactures, and sells various products in the healthcare field worldwide. The company's Innovative Medicine segment offers products for various therapeutic areas, such as immunology, including rheumatoid arthritis, psoriatic arthritis, inflammatory bowel disease, and psoriasis; infectious diseases comprising HIV/AIDS; neuroscience, consisting of mood disorders, neurodegenerative disorders, and schizophrenia; oncology, such as prostate cancer, hematologic malignancies, lung cancer, and bladder cancer; cardiovascular and metabolism, including thrombosis, diabetes, and macular degeneration; and pulmonary hypertension comprising pulmonary arterial hypertension through retailers, wholesalers, distributors, hospitals, and healthcare professionals for prescription use. Its MedTech segment provides Interventional Solutions, including electrophysiology products to treat heart rhythm disorders; the heart recovery portfolio, which includes technologies to treat severe coronary artery disease requiring high-risk PCI or AMI cardiogenic shock; and neurovascular care that treats hemorrhagic and ischemic stroke. this segment also offers an orthopaedics portfolio that includes products and enabling technologies that support hips, knees, trauma, spine, sports, and other; surgery portfolios comprising advanced and general surgery technologies, as well as solutions for breast aesthetics, ear, nose, and throat procedures; contact lenses under the ACUVUE Brand; and TECNIS intraocular lenses for cataract surgery. It distributes its products to wholesalers, hospitals, and retailers, as well as physicians, nurses, hospitals, eye care professionals, and clinics. The company has a collaboration agreement with Stand Up To Cancer for research testing a combination of teclistamab and daratumumab to treat a rare disease AL amyloidosis. Johnson & Johnson was founded in 1886 and is based in New Brunswick, New Jersey.",23.95041,13.623349,348.9 B,168.85,16.5%,171.61092,18.4%,3.49%,True
SHW,333.6199951171875,12.7,330.0,2025-02-21,0.027216608763581673,"The Sherwin-Williams Company engages in the development, manufacture, distribution, and sale of paints, coating, and related products to professional, industrial, commercial, and retail customers. It operates through three segments: Paint Stores Group, Consumer Brands Group, and Performance Coatings Group. The Paint Stores Group segment offers architectural paints and coatings, and protective and marine products, as well as OEM product finishes and related products for architectural and industrial paint contractors, and do-it-yourself homeowners. The Consumer Brands Group segment supplies a portfolio of branded and private-label architectural paints, stains, varnishes, industrial products, wood finishes products, wood preservatives, applicators, corrosion inhibitors, aerosols, caulks, and adhesives to retailers, including home centers and hardware stores, and dedicated dealers and distributors. The Performance Coatings Group segment develops and sells industrial coatings for wood finishing and general industrial applications, automotive refinish products, protective and marine coatings, coil coatings, packaging coatings, and performance-based resins and colorants. It serves retailers, dealers, jobbers, licensees, and other third-party distributors through its branches and direct sales staff, as well as through outside sales representatives. The company has operations primarily in the North and South America, the Caribbean, Europe, Asia, and Australia. The Sherwin-Williams Company was founded in 1866 and is headquartered in Cleveland, Ohio.",33.229084,26.301764,84.0 B,400.42,20.0%,384.35696,15.2%,0.87%,True
PG,159.26210021972656,3.7,160.0,2025-02-21,0.027865385262097364,"The Procter & Gamble Company engages in the provision of branded consumer packaged goods worldwide. The company operates through five segments: Beauty; Grooming; Health Care; Fabric & Home Care; and Baby, Feminine & Family Care. The Beauty segment offers conditioners, shampoos, styling aids, and treatments under the Head & Shoulders, Herbal Essences, Pantene, and Rejoice brands; and antiperspirants and deodorants, personal cleansing, and skin care products under the Olay, Old Spice, Safeguard, Secret, SK-II, and Native brands. The Grooming segment provides blades and razors, shave products, appliances, and other grooming products under the Braun, Gillette, and Venus brand names. The Health Care segment offers toothbrushes, toothpastes, and other oral care products under the Crest and Oral-B brand names; and gastrointestinal, pain relief, rapid diagnostics, respiratory, vitamins/minerals/supplements, and other personal health care products under Metamucil, Neurobion, Pepto-Bismol, and Vicks brands. The Fabric & Home Care segment provides fabric enhancers, laundry additives, and laundry detergents under the Ariel, Downy, Gain, and Tide brands; and air care, dish care, P&G professional, and surface care products under the Cascade, Dawn, Fairy, Febreze, Mr. Clean, and Swiffer brands. The Baby, Feminine & Family Care segment offers baby wipes, and taped diapers and pants under the Luvs and Pampers brands; adult incontinence and feminine care products under the Always, Always Discreet, and Tampax brands; and paper towels, tissues, and toilet papers under the Bounty, Charmin, and Puffs brands. It sells its products primarily through mass merchandisers, e-commerce, grocery stores, membership club stores, drug stores, department stores, distributors, wholesalers, specialty beauty stores, high-frequency stores, pharmacies, electronics stores, and professional channels, as well as directly to consumers. The company was founded in 1837 and is headquartered in Cincinnati, Ohio.",27.458982,21.521759,375.1 B,180.43,13.3%,180.38155,13.3%,2.54%,True
TD,54.43009948730469,0.95,55.0,2025-02-21,0.027923897384200425,"The Toronto-Dominion Bank, together with its subsidiaries, provides various financial products and services in Canada, the United States, and internationally. It operates through four segments: Canadian Personal and Commercial Banking, U.S. Retail, Wealth Management and Insurance, and Wholesale Banking. The company offers personal deposits, such as chequing, savings, and investment products; financing, investment, cash management, international trade, and day-to-day banking services to businesses; and financing options to customers at point of sale for automotive and recreational vehicle purchases. It also provides credit cards and payments; real estate secured lending, auto finance, and consumer lending services; point-of-sale payment solutions for large and small businesses; wealth and asset management products, and advice to retail and institutional clients through direct investing, advice-based, and asset management businesses; and property and casualty insurance, as well as life and health insurance products. The company also provides capital markets, and corporate and investment banking products and services, including underwriting and distribution of new debt and equity issues; advice on strategic acquisitions and divestitures; and trading, funding, and investment services to corporations, governments, and institutions. It offers its products and services under the TD Bank and America's Most Convenient Bank brand names. The Toronto-Dominion Bank was founded in 1855 and is headquartered in Toronto, Canada.",16.594543,6.4680777,95.4 B,64.91,19.3%,59.33213,9.0%,5.18%,True
CVX,155.11500549316406,4.5,155.0,2025-02-21,0.028269312133242908,"Chevron Corporation, through its subsidiaries, engages in the integrated energy and chemicals operations in the United States and internationally. The company operates in two segments, Upstream and Downstream. The Upstream segment is involved in the exploration, development, production, and transportation of crude oil and natural gas; processing, liquefaction, transportation, and regasification of liquefied natural gas; transportation of crude oil through pipelines; transportation, storage, and marketing of natural gas; and carbon capture and storage, as well as a gas-to-liquids plant. The Downstream segment refines crude oil into petroleum products; markets crude oil, refined products, and lubricants; manufactures and markets renewable fuels, commodity petrochemicals, plastics for industrial uses, and fuel and lubricant additives; and transports crude oil and refined products by pipeline, marine vessel, motor equipment, and rail car. The company was formerly known as ChevronTexaco Corporation and changed its name to Chevron Corporation in 2005. Chevron Corporation was founded in 1879 and is headquartered in San Ramon, California.",17.045053,13.562242,276.5 B,167.11,7.7%,175.66957,13.3%,4.26%,True
LOW,249.5800018310547,6.95,250.0,2025-02-21,0.02952960219118106,"Lowe's Companies, Inc., together with its subsidiaries, operates as a home improvement retailer in the United States. The company offers a line of products for construction, maintenance, repair, remodeling, and decorating. It also provides home improvement products, such as appliances, seasonal and outdoor living, lawn and garden, lumber, kitchens and bath, tools, paint, millwork, hardware, flooring, rough plumbing, building materials, décor, and electrical. In addition, the company offers installation services through independent contractors in various product categories; and extended protection plans and repair services. It sells its national brand-name merchandise and private brand products to professional customers, homeowners, renters, businesses, and government. The company also sells its products through Lowes.com website; and through mobile applications. Lowe's Companies, Inc. was founded in 1921 and is based in Mooresville, North Carolina.",20.763727,19.701454,140.9 B,287.01,15.0%,282.82706,13.3%,1.69%,True
VALE,8.494999885559082,0.75,8.0,2025-02-21,0.030017671321503014,"Vale S.A., together with its subsidiaries, produces and sells iron ore, iron ore pellets, nickel, and copper in Brazil and internationally. The company operates through Iron Solutions and Energy Transition Materials segments. The Iron Solutions segment produces and extracts iron ore and pellets, and other ferrous products; and provides related logistic services. The Energy Transition Materials segment produces and extracts nickel; and its by-products, such as gold, silver, cobalt, precious metals, and others, as well as copper used in the construction sector to produce pipes and electrical wires. The company was formerly known as Companhia Vale do Rio Doce and changed its name to Vale S.A. in May 2009. Vale S.A. was founded in 1942 and is headquartered in Rio De Janeiro, Brazil.",3.9328701,4.0313587,36.3 B,14.54,71.2%,13.01739,53.2%,17.36%,True
PBR,13.475000381469727,0.88,13.0,2025-02-21,0.030055629466787526,"Petróleo Brasileiro S.A. - Petrobras explores, produces, and sells oil and gas in Brazil and internationally. The company operates through three segments: Exploration and Production; Refining, Transportation and Marketing; and Gas and Power. The Exploration and Production segment explores, develops, and produces crude oil, natural gas liquids, and natural gas primarily for supplies to the domestic refineries. The Refining, Transportation and Marketing segment engages in the refining, logistics, transport, acquisition, and exports of crude oil; and production of fertilizers, as well as holding interests in petrochemical companies. The Gas and Power segment is involved in the logistic and trading of natural gas and electricity; transportation and trading of LNG; generation of electricity through thermoelectric power plants; renewable energy businesses; low carbon services; and natural gas processing business, as well as production of biodiesel and its co-products. The company also engages in prospecting, drilling, refining, processing, trading, and transporting crude oil from producing onshore and offshore oil fields, and shale or other rocks, as well as oil products, natural gas, and other liquid hydrocarbons. In addition, it engages in research, development, production, transport, distribution, and trading of energy. Petróleo Brasileiro S.A. - Petrobras was incorporated in 1953 and is headquartered in Rio de Janeiro, Brazil.",5.2636724,4.2882333,82.4 B,17.91,32.9%,16.65,23.6%,21.00%,True
CL,87.13999938964844,2.26,87.5,2025-02-21,0.030066566774187953,"Colgate-Palmolive Company, together with its subsidiaries, manufactures and sells consumer products in the United States and internationally. It operates through two segments: Oral, Personal and Home Care; and Pet Nutrition. The Oral, Personal and Home Care segment offers toothpaste, toothbrushes, mouthwash, bar and liquid hand soaps, shower gels, shampoos, conditioners, deodorants and antiperspirants, skin health products, dishwashing detergents, fabric conditioners, household cleaners, and other related items. This segment markets and sells its products under various brands, which include Colgate, Darlie, elmex, hello, meridol, Sorriso, Tom's of Maine, Irish Spring, Palmolive, Protex, Sanex, Softsoap, Lady Speed Stick, Speed Stick, EltaMD, Filorga, PCA SKIN, Ajax, Axion, Fabuloso, Murphy, Suavitel, and Soupline to a range of traditional and eCommerce retailers, wholesalers, and distributors. It includes pharmaceutical products for dentists and other oral health professionals. Its Pet Nutrition segment offers pet nutrition products for everyday nutritional needs under the Hill's Science Diet brand; and a range of therapeutic pet products to help nutritionally support dogs and cats in different stages of health under the Hill's Prescription Diet brand. This segment markets and sells its products through pet supply retailers, veterinarians, and eCommerce retailers. Colgate-Palmolive Company was founded in 1806 and is headquartered in New York, New York.",25.04023,22.821255,71.2 B,109.3,25.4%,103.05045,18.3%,2.32%,True
SO,81.77999877929688,1.8,82.5,2025-02-21,0.030814395430647457,"The Southern Company, through its subsidiaries, engages in the generation, transmission, and distribution of electricity. The company also develops, constructs, acquires, owns, and manages power generation assets, including renewable energy projects and sells electricity in the wholesale market; and distributes natural gas in Illinois, Georgia, Virginia, and Tennessee, as well as provides gas marketing services, gas distribution operations, and gas pipeline investments operations. In addition, it owns and operates nuclear, coal, hydro, cogeneration, solar, wind, battery storage, and fuel cell facilities. Further, the constructs, operates, and maintains approximately 77,900 miles of natural gas pipelines and 14 storage facilities with total capacity of 157 Bcf to provide natural gas to residential, commercial, and industrial customers. The company serves approximately 8.9 million electric and gas utility customers. Further, it develops distributed energy and resilience solutions; deploys microgrids for commercial, industrial, governmental, and utility customers; and offers digital wireless communications and fiber optics services. The Southern Company was incorporated in 1945 and is headquartered in Atlanta, Georgia.",19.062937,18.948452,89.6 B,94.45,15.5%,90.75211,11.0%,3.54%,True
HSBC,48.93000030517578,1.45,49.0,2025-02-21,0.031064779998855485,"HSBC Holdings plc provides banking and financial services worldwide. The company operates through Wealth and Personal Banking, Commercial Banking, and Global Banking and Markets segments. The Wealth and Personal Banking segment offers retail banking and wealth products, including current and savings accounts, mortgages and personal loans, credit and debit cards, and local and international payment services; and wealth management services comprising insurance and investment products, global asset management services, investment management, and private wealth solutions. This segment serves personal banking and high net worth individuals. The Commercial Banking segment provides credit and lending, treasury management, payment, cash management, commercial insurance, and investment services; commercial cards; international trade and receivables finance services; foreign exchange products; capital raising services on debt and equity markets; and advisory services. It serves small and medium sized enterprises, mid-market enterprises, and corporates. The Global Banking and Markets segment offers financing, advisory, and transaction services; and credit, rates, foreign exchange, equities, money markets, and securities services; and engages in principal investment activities. It serves government, corporate and institutional clients, and private investors. HSBC Holdings plc was founded in 1865 and is headquartered in London, the United Kingdom.",8.021312,35.20144,175.9 B,49.86,1.9%,58.54,19.6%,4.05%,False
