Ticker,Stock Price,Call Contract Price,Strike Price,Expiration Date,Breakeven increase,Company Description,P/E Ratio,Forward P/E,Market Cap,52 Week High,52-week-upside,1y Target Est,1y-target-upside,Dividend Yield,Attractiveness
UL,56.13999938964844,2.0,55.0,2025-02-21,0.015318856781286971,"Unilever PLC operates as a fast-moving consumer goods company in the Asia Pacific, Africa, the Americas, and Europe. It operates through five segments: Beauty & Wellbeing, Personal Care, Home Care, Nutrition, and Ice Cream. The Beauty & Wellbeing segment engages in the sale of hair care products, such as shampoo, conditioner, and styling; skin care products including face, hand, and body moisturizer; and prestige beauty and health & wellbeing products consist of the vitamins, minerals, and supplements. The Personal Care segment offers skin cleansing products comprising soap and shower; deodorants; and oral care products, such as toothpaste, toothbrush, and mouthwash products. The Home Care segment is involved in the sale of fabric care products, including washing powders and liquids, and rinse conditioners; and fabric enhancers, and home and hygiene products. The Nutrition segment provides dressings products, such as mayonnaise and ketchup; sells scratch cooking aids consist of soups, bouillons, and seasonings; plant-based meat; beverages; and functional nutrition products, including Horlicks and Boost, as well as tea products. The Ice Cream segment offers ice cream products including in-home and out-of-home ice creams. The company provides its products under the AXE, Ben & Jerry's, Cif, Clear, Closeup, Comfort, Cornetto, Dermalogica, Domestos, Dove, Dove Men+Care, Hellmann's, Horlicks, Knorr, LUX, Lifebuoy, Liquid I.V., Magnum, Nutrafol, OMO, Paula's Choice, Pepsodent, Pond's, Rexona, Rexona, Sunlight, Sunsilk, Surf, TRESemmé, Vaseline, Wall's, Breyers, and Yasso brand names. Unilever PLC was founded in 1860 and is headquartered in London, the United Kingdom.",20.639706,17.822222,139.1 B,65.87,17.3%,65.73906,17.1%,3.39%,True
PG,162.10000610351562,5.3,160.0,2025-02-21,0.01974086228251526,"The Procter & Gamble Company engages in the provision of branded consumer packaged goods worldwide. The company operates through five segments: Beauty; Grooming; Health Care; Fabric & Home Care; and Baby, Feminine & Family Care. The Beauty segment offers conditioners, shampoos, styling aids, and treatments under the Head & Shoulders, Herbal Essences, Pantene, and Rejoice brands; and antiperspirants and deodorants, personal cleansing, and skin care products under the Olay, Old Spice, Safeguard, Secret, SK-II, and Native brands. The Grooming segment provides blades and razors, shave products, appliances, and other grooming products under the Braun, Gillette, and Venus brand names. The Health Care segment offers toothbrushes, toothpastes, and other oral care products under the Crest and Oral-B brand names; and gastrointestinal, pain relief, rapid diagnostics, respiratory, vitamins/minerals/supplements, and other personal health care products under Metamucil, Neurobion, Pepto-Bismol, and Vicks brands. The Fabric & Home Care segment provides fabric enhancers, laundry additives, and laundry detergents under the Ariel, Downy, Gain, and Tide brands; and air care, dish care, P&G professional, and surface care products under the Cascade, Dawn, Fairy, Febreze, Mr. Clean, and Swiffer brands. The Baby, Feminine & Family Care segment offers baby wipes, and taped diapers and pants under the Luvs and Pampers brands; adult incontinence and feminine care products under the Always, Always Discreet, and Tampax brands; and paper towels, tissues, and toilet papers under the Bounty, Charmin, and Puffs brands. It sells its products primarily through mass merchandisers, e-commerce, grocery stores, membership club stores, drug stores, department stores, distributors, wholesalers, specialty beauty stores, high-frequency stores, pharmacies, electronics stores, and professional channels, as well as directly to consumers. The company was founded in 1837 and is headquartered in Cincinnati, Ohio.",27.948277,21.89103,381.8 B,180.43,11.3%,180.42,11.3%,2.48%,True
RY,121.66999816894531,4.1,120.0,2025-02-21,0.019972070910040607,"Royal Bank of Canada operates as a diversified financial service company worldwide. The company's Personal & Commercial Banking segment offers checking and savings accounts, home equity financing, personal lending, private banking, indirect lending, including auto financing, mutual funds and self-directed brokerage accounts, guaranteed investment certificates, credit cards, and payment products and solutions; and lending, leasing, deposit, investment, foreign exchange, cash management, auto dealer financing, trade products, and services to small and medium-sized commercial businesses. This segment offers financial products and services through branches, automated teller machines, and mobile sales network. Its Wealth Management segment provides a suite of wealth, investment, trust, banking, credit, and other advice-based solutions and strategies to high net worth and ultra-high net worth individuals, and institutional clients; asset management products to institutional and individual clients; and asset and investor services to financial institutions, asset managers, and asset owners. The company's Insurance segment offers life, health, home, auto, travel, wealth, annuities, property and casualty, and reinsurance advice and solutions; and business insurance services to individual, business, and group clients through its advice centers, RBC insurance stores, and mobile advisors; digital platforms; and independent brokers and partners. The company's Capital Markets segment offers advisory and origination, sales and trading, lending and financing, and transaction banking services to corporations, institutional clients, asset managers, private equity firms, and governments. The company was founded in 1864 and is headquartered in Toronto, Canada.",15.519132,8.57543,172.3 B,128.05,5.2%,109.551636,-10.0%,3.26%,False
TJX,121.6500015258789,4.2,120.0,2025-02-21,0.020961762779580617,"The TJX Companies, Inc., together with its subsidiaries, operates as an off-price apparel and home fashions retailer in the United States, Canada, Europe, and Australia. It operates through four segments: Marmaxx, HomeGoods, TJX Canada, and TJX International. The company sells family apparel, including footwear and accessories; home fashions, such as home basics, furniture, rugs, lighting products, giftware, soft home products, decorative accessories, tabletop, and cookware, as well as expanded pet, and gourmet food departments; jewelry and accessories; and other merchandise. It offers its products through stores and e-commerce sites. The TJX Companies, Inc. was incorporated in 1962 and is headquartered in Framingham, Massachusetts.",28.62353,26.42991,136.8 B,128.0,5.2%,130.36955,7.2%,1.25%,True
JNJ,142.27000427246094,5.27,140.0,2025-02-21,0.021086635534176112,"Johnson & Johnson, together with its subsidiaries, researches, develops, manufactures, and sells various products in the healthcare field worldwide. The company's Innovative Medicine segment offers products for various therapeutic areas, such as immunology, including rheumatoid arthritis, psoriatic arthritis, inflammatory bowel disease, and psoriasis; infectious diseases comprising HIV/AIDS; neuroscience, consisting of mood disorders, neurodegenerative disorders, and schizophrenia; oncology, such as prostate cancer, hematologic malignancies, lung cancer, and bladder cancer; cardiovascular and metabolism, including thrombosis, diabetes, and macular degeneration; and pulmonary hypertension comprising pulmonary arterial hypertension through retailers, wholesalers, distributors, hospitals, and healthcare professionals for prescription use. Its MedTech segment provides Interventional Solutions, including electrophysiology products to treat heart rhythm disorders; the heart recovery portfolio, which includes technologies to treat severe coronary artery disease requiring high-risk PCI or AMI cardiogenic shock; and neurovascular care that treats hemorrhagic and ischemic stroke. this segment also offers an orthopaedics portfolio that includes products and enabling technologies that support hips, knees, trauma, spine, sports, and other; surgery portfolios comprising advanced and general surgery technologies, as well as solutions for breast aesthetics, ear, nose, and throat procedures; contact lenses under the ACUVUE Brand; and TECNIS intraocular lenses for cataract surgery. It distributes its products to wholesalers, hospitals, and retailers, as well as physicians, nurses, hospitals, eye care professionals, and clinics. The company has a collaboration agreement with Stand Up To Cancer for research testing a combination of teclistamab and daratumumab to treat a rare disease AL amyloidosis. Johnson & Johnson was founded in 1886 and is based in New Brunswick, New Jersey.",23.515703,13.371517,342.5 B,168.85,18.7%,171.65636,20.7%,3.49%,True
ABEV,1.840000033378601,0.38,1.5,2025-02-21,0.021739111899879093,"Ambev S.A., through its subsidiaries, engages in the production, distribution, and sale of beer, draft beer, carbonated soft drinks, malt and food, other alcoholic beverages, and non-alcoholic and non-carbonated products in Brazil, Central America and Caribbean, Latin America South, and Canada. It offers beer primarily under the Skol, Brahma, Antarctica, Brahva, Budweiser, Bud Light, Beck, Leffe, Hoegaarden, Balboa ICE, Balboa, Atlas Golden Light, Atlas, Bucanero, Cristal, Mayabe, Presidente, Presidente Light, Brahma Light, Bohemia, The One, Corona, Modelo Especial, Stella Artois, Quilmes Clásica, Paceña, Taquiña, Huari, Becker, Cusqueña, Michelob Ultra, Busch, Pilsen, Ouro Fino, Bud 66, Banks, Deputy, Patricia, Labatt Blue, Alexander Keith's, and Kokanee brands. The company also provides carbonated soft drinks, bottled water, isotonic beverages, energy drinks, coconut water, powdered and natural juices, and ready-to-drink teas under the Guaraná Antarctica, Gatorade, H2OH!, Pepsi Black, Lipton Iced Tea, Fusion, Pepsi-Cola, Canada Dry, Squirt, Red Rock, Red Bull, Seven Up, Nutrl, Bud Light Seltzer, Palm Bay, and Mike's brands. It offers its products through a network of third-party distributors and a direct distribution system. The company was founded in 1885 and is headquartered in São Paulo, Brazil. Ambev S.A. is a subsidiary of Interbrew International B.V.",13.142858,10.199556,29.7 B,2.82,53.3%,3.008,63.5%,5.89%,True
SO,83.0199966430664,2.37,82.5,2025-02-21,0.02228382837555931,"The Southern Company, through its subsidiaries, engages in the generation, transmission, and distribution of electricity. The company also develops, constructs, acquires, owns, and manages power generation assets, including renewable energy projects and sells electricity in the wholesale market; and distributes natural gas in Illinois, Georgia, Virginia, and Tennessee, as well as provides gas marketing services, gas distribution operations, and gas pipeline investments operations. In addition, it owns and operates nuclear, coal, hydro, cogeneration, solar, wind, battery storage, and fuel cell facilities. Further, the constructs, operates, and maintains approximately 77,900 miles of natural gas pipelines and 14 storage facilities with total capacity of 157 Bcf to provide natural gas to residential, commercial, and industrial customers. The company serves approximately 8.9 million electric and gas utility customers. Further, it develops distributed energy and resilience solutions; deploys microgrids for commercial, industrial, governmental, and utility customers; and offers digital wireless communications and fiber optics services. The Southern Company was incorporated in 1945 and is headquartered in Atlanta, Georgia.",19.35198,19.23576,91.0 B,94.45,13.8%,90.75211,9.3%,3.47%,True
PM,121.86000061035156,4.6,120.0,2025-02-21,0.022484813523098612,"Philip Morris International Inc. operates as a tobacco company working to delivers a smoke-free future and evolving portfolio for the long-term to include products outside of the tobacco and nicotine sector. The company's product portfolio primarily consists of cigarettes and smoke-free products, including heat-not-burn, vapor, and oral nicotine products primarily under the IQOS and ZYN brands; and consumer accessories, such as lighters and matches. It also offers wellness and healthcare products. Philip Morris International Inc. was incorporated in 1987 and is headquartered in Stamford, Connecticut.",19.342857,17.205887,189.5 B,134.15,10.1%,135.38692,11.1%,4.43%,True
XOM,106.93000030517578,4.4,105.0,2025-02-21,0.023099220871363624,"Exxon Mobil Corporation engages in the exploration and production of crude oil and natural gas in the United States and internationally. It operates through Upstream, Energy Products, Chemical Products, and Specialty Products segments. The Upstream segment explores for and produces crude oil and natural gas. The Energy Products segment offers fuels, aromatics, and catalysts, as well as licensing services. It sells its products under the Exxon, Esso, and Mobil brands. The Chemical Products segment manufactures and markets petrochemicals including olefins, polyolefins, and intermediates. The Specialty Products segment offers performance products, including lubricants, basestocks, waxes, synthetics, elastomers, and resins. The company also involves in the manufacturing, trade, transport, and sale of crude oil, natural gas, petroleum products, petrochemicals, and other specialty products; and pursuit lower-emission business opportunities, including carbon capture and storage, hydrogen, lower-emission fuels, and lithium. Exxon Mobil Corporation was founded in 1870 and is based in Spring, Texas.",13.316315,13.029313,470.0 B,126.34,18.2%,129.9376,21.5%,3.70%,True
VALE,8.5,0.71,8.0,2025-02-21,0.024705882352941355,"Vale S.A., together with its subsidiaries, produces and sells iron ore, iron ore pellets, nickel, and copper in Brazil and internationally. The company operates through Iron Solutions and Energy Transition Materials segments. The Iron Solutions segment produces and extracts iron ore and pellets, and other ferrous products; and provides related logistic services. The Energy Transition Materials segment produces and extracts nickel; and its by-products, such as gold, silver, cobalt, precious metals, and others, as well as copper used in the construction sector to produce pipes and electrical wires. The company was formerly known as Companhia Vale do Rio Doce and changed its name to Vale S.A. in May 2009. Vale S.A. was founded in 1942 and is headquartered in Rio De Janeiro, Brazil.",3.935185,4.0337315,36.3 B,15.02,76.7%,13.20348,55.3%,17.36%,True
MDLZ,58.290000915527344,2.25,57.5,2025-02-21,0.025047161803762208,"Mondelez International, Inc., through its subsidiaries, manufactures, markets, and sells snack food and beverage products in the Latin America, North America, Asia, the Middle East, Africa, and Europe. It provides biscuits and baked snacks, including cookies, crackers, salted snacks, snack bars, and cakes and pastries; chocolates; and gums and candies, as well as various cheese and grocery, and powdered beverage products. The company's brand portfolio includes Oreo, Ritz, LU, CLIF Bar, and Tate's Bake Shop biscuits and baked snacks, as well as Cadbury Dairy Milk, Milka, and Toblerone chocolate. It serves supermarket chains, wholesalers, supercenters, club stores, mass merchandisers, distributors, convenience stores, gasoline stations, drug stores, value stores, and other retail food outlets through direct store delivery, company-owned and satellite warehouses, distribution centers, third party distributors, and other facilities, as well as through independent sales offices and agents. The company also sells products directly to businesses and consumers through e-retail platforms, retailer digital platforms, as well as through its direct-to-consumer websites and social media platforms. Mondelez International, Inc. was formerly known as Kraft Foods Inc. and changed its name to Mondelez International, Inc. in October 2012. The company was incorporated in 2000 and is headquartered in Chicago, Illinois.",20.670214,17.34548,77.9 B,77.2,32.4%,76.6444,31.5%,3.23%,True
PBR,13.399999618530273,0.74,13.0,2025-02-21,0.025373163518568775,"Petróleo Brasileiro S.A. - Petrobras explores, produces, and sells oil and gas in Brazil and internationally. The company operates through three segments: Exploration and Production; Refining, Transportation and Marketing; and Gas and Power. The Exploration and Production segment explores, develops, and produces crude oil, natural gas liquids, and natural gas primarily for supplies to the domestic refineries. The Refining, Transportation and Marketing segment engages in the refining, logistics, transport, acquisition, and exports of crude oil; and production of fertilizers, as well as holding interests in petrochemical companies. The Gas and Power segment is involved in the logistic and trading of natural gas and electricity; transportation and trading of LNG; generation of electricity through thermoelectric power plants; renewable energy businesses; low carbon services; and natural gas processing business, as well as production of biodiesel and its co-products. The company also engages in prospecting, drilling, refining, processing, trading, and transporting crude oil from producing onshore and offshore oil fields, and shale or other rocks, as well as oil products, natural gas, and other liquid hydrocarbons. In addition, it engages in research, development, production, transport, distribution, and trading of energy. Petróleo Brasileiro S.A. - Petrobras was incorporated in 1953 and is headquartered in Rio de Janeiro, Brazil.",5.234375,4.264365,82.9 B,17.91,33.7%,16.74733,25.0%,21.12%,True
VZ,38.939998626708984,0.93,39.0,2025-02-21,0.025423764977022145,"Verizon Communications Inc., through its subsidiaries, engages in the provision of communications, technology, information, and entertainment products and services to consumers, businesses, and governmental entities worldwide. It operates in two segments, Verizon Consumer Group (Consumer) and Verizon Business Group (Business). The Consumer segment provides wireless services across the wireless networks in the United States under the Verizon and TracFone brands and through wholesale and other arrangements; and fixed wireless access (FWA) broadband through its wireless networks, as well as related equipment and devices, such as smartphones, tablets, smart watches, and other wireless-enabled connected devices. The segment also offers wireline services in the Mid-Atlantic and Northeastern United States, as well as Washington D.C. through its fiber-optic network, Verizon Fios product portfolio, and a copper-based network. The Business segment provides wireless and wireline communications services and products, including FWA broadband, data, video and conferencing, corporate networking, security and managed network, local and long-distance voice, and network access services to deliver various IoT services and products to businesses, government customers, and wireless and wireline carriers in the United States and internationally. The company was formerly known as Bell Atlantic Corporation and changed its name to Verizon Communications Inc. in June 2000. Verizon Communications Inc. was incorporated in 1983 and is headquartered in New York, New York.",16.857143,8.237382,163.9 B,45.36,16.5%,47.5375,22.1%,6.96%,True
UNP,231.82000732421875,7.9,230.0,2025-02-21,0.02622721285345264,"Union Pacific Corporation, through its subsidiary, Union Pacific Railroad Company, operates in the railroad business in the United States. The company offers transportation services for grain and grain products, fertilizers, food and refrigerated products, and coal and renewables to grain processors, animal feeders, ethanol producers, renewable biofuel producers, and other agricultural users; and construction products, industrial chemicals, plastics, forest products, specialized products, metals and ores, petroleum, liquid petroleum gases, soda ash, and sand, as well as finished automobiles, automotive parts, and merchandise in intermodal containers. Union Pacific Corporation was founded in 1862 and is headquartered in Omaha, Nebraska.",21.326588,19.097944,140.5 B,258.66,11.6%,257.0432,10.9%,2.31%,True
BHP,48.720001220703125,2.5,47.5,2025-02-21,0.02627255228296166,"BHP Group Limited operates as a resources company in Australia, Europe, China, Japan, India, South Korea, the rest of Asia, North America, South America, and internationally. The company operates through Copper, Iron Ore, and Coal segments. It engages in the mining of copper, uranium, gold, zinc, lead, molybdenum, silver, iron ore, cobalt, and metallurgical and energy coal. The company is also involved in the mining, smelting, and refining of nickel, as well as potash development activities. In addition, it provides towing, freight, marketing and trading, marketing support, finance, administrative, and other services. The company was founded in 1851 and is headquartered in Melbourne, Australia.",15.665596,10.526908,124.5 B,64.04,31.4%,53.8,10.4%,5.99%,True
PEP,146.5399932861328,5.4,145.0,2025-02-21,0.026340977826648126,"PepsiCo, Inc. engages in the manufacture, marketing, distribution, and sale of various beverages and convenient foods worldwide. The company operates through seven segments: Frito-Lay North America; Quaker Foods North America; PepsiCo Beverages North America; Latin America; Europe; Africa, Middle East and South Asia; and Asia Pacific, Australia and New Zealand and China Region. It provides dips, cheese-flavored snacks, and spreads, as well as corn, potato, and tortilla chips; cereals, rice, pasta, mixes and syrups, granola bars, grits, oatmeal, rice cakes, and side dishes; beverage concentrates, fountain syrups, and finished goods; ready-to-drink tea, coffee, and juices; dairy products; and sparkling water makers and related products, as well as distributes alcoholic beverages under Hard MTN Dew brand. The company offers its products primarily under the Lay's, Doritos, Fritos, Tostitos, BaiCaoWei, Cheetos, Cap'n Crunch, Life, Pearl Milling Company, Gatorade, Pepsi-Cola, Mountain Dew, Quaker, Rice-A-Roni, Aquafina, Bubly, Emperador, Diet Mountain Dew, Diet Pepsi, Gatorade Zero, Crush, Propel, Dr Pepper, Schweppes, Marias Gamesa, Ruffles, Sabritas, Saladitas, Tostitos, 7UP, Diet 7UP, H2oh!, Manzanita Sol, Mirinda, Pepsi Black, Pepsi Max, San Carlos, Toddy, Walkers, Chipsy, Kurkure, Sasko, Spekko, White Star, Smith's, Sting, SodaStream, Lubimyj Sad, Agusha, Chudo, Domik v Derevne, Lipton, and other brands. It serves wholesale and other distributors, foodservice customers, grocery stores, drug stores, convenience stores, discount/dollar stores, mass merchandisers, membership stores, hard discounters, e-commerce retailers and authorized independent bottlers, and others through a network of direct-store-delivery, customer warehouse, and distributor networks, as well as directly to consumers through e-commerce platforms and retailers. The company was founded in 1898 and is based in Purchase, New York.",21.613567,17.054745,201.1 B,183.41,25.2%,177.98409,21.5%,3.70%,True
CVX,150.3000030517578,4.3,150.0,2025-02-21,0.026613418942278644,"Chevron Corporation, through its subsidiaries, engages in the integrated energy and chemicals operations in the United States and internationally. The company operates in two segments, Upstream and Downstream. The Upstream segment is involved in the exploration, development, production, and transportation of crude oil and natural gas; processing, liquefaction, transportation, and regasification of liquefied natural gas; transportation of crude oil through pipelines; transportation, storage, and marketing of natural gas; and carbon capture and storage, as well as a gas-to-liquids plant. The Downstream segment refines crude oil into petroleum products; markets crude oil, refined products, and lubricants; manufactures and markets renewable fuels, commodity petrochemicals, plastics for industrial uses, and fuel and lubricant additives; and transports crude oil and refined products by pipeline, marine vessel, motor equipment, and rail car. The company was formerly known as ChevronTexaco Corporation and changed its name to Chevron Corporation in 2005. Chevron Corporation was founded in 1879 and is headquartered in San Ramon, California.",16.534653,13.141673,268.0 B,167.11,11.2%,175.49565,16.8%,4.34%,True
