Ticker,Stock Price,Call Contract Price,Strike Price,Expiration Date,Breakeven increase,Company Description,P/E Ratio,Forward P/E,Market Cap,52 Week High,52-week-upside,1y Target Est,1y-target-upside,Dividend Yield,Attractiveness
ADP,289.75518798828125,8.8,290.0,2025-02-21,0.031215358297862705,"Automatic Data Processing, Inc. engages in the provision of cloud-based human capital management (HCM) solutions worldwide. It operates in two segments, Employer Services and Professional Employer Organization (PEO). The Employer Services segment offers strategic, cloud-based platforms, and human resources (HR) outsourcing solutions. This segment's offerings include RUN Powered by ADP, a software platform for small business payroll, HR management, and tax compliance administration; ADP Workforce Now, a HCM solution used across mid-sized and large businesses to manage employees; and ADP Vantage HCM, a solution for HR management, benefits administration, payroll services, time and attendance management, and talent management. The PEO Services segment provides HR and employment administration outsourcing solutions under ADP TotalSource name to businesses through a co-employment model. The segment also provides employee benefits, protection and compliance, talent engagement, expertise, comprehensive outsourcing, and recruitment process outsourcing services. The company was founded in 1949 and is headquartered in Roseland, New Jersey.",30.989859,26.645773,118.1 B,309.63,6.9%,296.88187,2.5%,2.15%,False
PEP,144.97000122070312,4.6,145.0,2025-02-21,0.031937633581503144,"PepsiCo, Inc. engages in the manufacture, marketing, distribution, and sale of various beverages and convenient foods worldwide. The company operates through seven segments: Frito-Lay North America; Quaker Foods North America; PepsiCo Beverages North America; Latin America; Europe; Africa, Middle East and South Asia; and Asia Pacific, Australia and New Zealand and China Region. It provides dips, cheese-flavored snacks, and spreads, as well as corn, potato, and tortilla chips; cereals, rice, pasta, mixes and syrups, granola bars, grits, oatmeal, rice cakes, and side dishes; beverage concentrates, fountain syrups, and finished goods; ready-to-drink tea, coffee, and juices; dairy products; and sparkling water makers and related products, as well as distributes alcoholic beverages under Hard MTN Dew brand. The company offers its products primarily under the Lay's, Doritos, Fritos, Tostitos, BaiCaoWei, Cheetos, Cap'n Crunch, Life, Pearl Milling Company, Gatorade, Pepsi-Cola, Mountain Dew, Quaker, Rice-A-Roni, Aquafina, Bubly, Emperador, Diet Mountain Dew, Diet Pepsi, Gatorade Zero, Crush, Propel, Dr Pepper, Schweppes, Marias Gamesa, Ruffles, Sabritas, Saladitas, Tostitos, 7UP, Diet 7UP, H2oh!, Manzanita Sol, Mirinda, Pepsi Black, Pepsi Max, San Carlos, Toddy, Walkers, Chipsy, Kurkure, Sasko, Spekko, White Star, Smith's, Sting, SodaStream, Lubimyj Sad, Agusha, Chudo, Domik v Derevne, Lipton, and other brands. It serves wholesale and other distributors, foodservice customers, grocery stores, drug stores, convenience stores, discount/dollar stores, mass merchandisers, membership stores, hard discounters, e-commerce retailers and authorized independent bottlers, and others through a network of direct-store-delivery, customer warehouse, and distributor networks, as well as directly to consumers through e-commerce platforms and retailers. The company was founded in 1898 and is based in Purchase, New York.",21.382006,16.888102,198.9 B,183.41,26.5%,177.575,22.5%,3.80%,True
VZ,38.04999923706055,1.27,38.0,2025-02-21,0.03206309559531295,"Verizon Communications Inc., through its subsidiaries, engages in the provision of communications, technology, information, and entertainment products and services to consumers, businesses, and governmental entities worldwide. It operates in two segments, Verizon Consumer Group (Consumer) and Verizon Business Group (Business). The Consumer segment provides wireless services across the wireless networks in the United States under the Verizon and TracFone brands and through wholesale and other arrangements; and fixed wireless access (FWA) broadband through its wireless networks, as well as related equipment and devices, such as smartphones, tablets, smart watches, and other wireless-enabled connected devices. The segment also offers wireline services in the Mid-Atlantic and Northeastern United States, as well as Washington D.C. through its fiber-optic network, Verizon Fios product portfolio, and a copper-based network. The Business segment provides wireless and wireline communications services and products, including FWA broadband, data, video and conferencing, corporate networking, security and managed network, local and long-distance voice, and network access services to deliver various IoT services and products to businesses, government customers, and wireless and wireline carriers in the United States and internationally. The company was formerly known as Bell Atlantic Corporation and changed its name to Verizon Communications Inc. in June 2000. Verizon Communications Inc. was incorporated in 1983 and is headquartered in New York, New York.",16.47381,8.050063,160.2 B,45.36,19.2%,47.5375,24.9%,7.17%,True
CB,261.0199890136719,9.69,260.0,2025-02-21,0.03321588901712036,"Chubb Limited provides insurance and reinsurance products worldwide. The company's North America Commercial P&C Insurance segment offers commercial property, casualty, workers' compensation, package policies, risk management, financial lines, marine, construction, environmental, medical risk, cyber risk, surety, and casualty; and group accident and health insurance to large, middle market, and small commercial businesses. Its North America Personal P&C Insurance segment provides affluent and high net worth individuals and families with homeowners, automobile and collector cars, valuable articles, personal and excess liability, travel insurance, and recreational marine insurance and services. The company's North America Agricultural Insurance segment offers multiple peril crop and crop-hail insurance; and coverage for farm, ranch, and specialty property and casualty, and commercial agriculture products. Its Overseas General Insurance segment provides coverage for traditional commercial property and casualty; specialty categories, such as financial lines, marine, energy, aviation, political risk, and construction; and group accident and health, and traditional and specialty personal lines for corporations, middle markets, and small customers through retail brokers, agents, and other channels. The company's Global Reinsurance segment offers traditional and specialty reinsurance under the Chubb Tempest Re brand to property and casualty companies. Its Life Insurance segment provides protection and savings products comprising whole life, endowment plans, individual and life, group term life, health protection, personal accident, credit life, universal life, group employee benefits, and unit linked contracts. It markets its products primarily through insurance and reinsurance brokers. The company was formerly known as ACE Limited and changed its name to Chubb Limited in January 2016. Chubb Limited was incorporated in 1985 and is headquartered in Zurich, Switzerland.",10.706317,11.076837,105.2 B,302.05,15.7%,301.65,15.6%,1.41%,True
PFE,26.749799728393555,0.64,27.0,2025-02-21,0.033278763977494075,"Pfizer Inc. discovers, develops, manufactures, markets, distributes, and sells biopharmaceutical products in the United States, Europe, and internationally. The company offers medicines and vaccines in various therapeutic areas, including cardiovascular metabolic, migraine, and women's health under the Eliquis, Nurtec ODT/Vydura, Zavzpret, and the Premarin family brands; infectious diseases with unmet medical needs under the Prevnar family, Abrysvo, Nimenrix, FSME/IMMUN-TicoVac, and Trumenba brands; and COVID-19 prevention and treatment, and potential future mRNA and antiviral products under the Comirnaty and Paxlovid brands. It also provides medicines and vaccines in various therapeutic areas, such as biosimilars for chronic immune and inflammatory diseases under the Xeljanz, Enbrel, Inflectra, Litfulo, Velsipity, and Cibinqo brands; amyloidosis, hemophilia, endocrine diseases, and sickle cell disease under the Vyndaqel family, Oxbryta, BeneFIX, Somavert, Ngenla, and Genotropin brands; sterile injectable and anti-infective medicines under the Sulperazon, Medrol, Zavicefta, Zithromax, and Panzyga brands; and biologics, small molecules, immunotherapies, and biosimilars under the Ibrance, Xtandi, Inlyta, Bosulif, Mektovi, Padcev, Adcetris, Talzenna, Tukysa, Elrexfio, Tivdak, Lorbrena, and Braftovi brands. In addition, the company involved in the contract manufacturing business. It serves wholesalers, retailers, hospitals, clinics, government agencies, pharmacies, individual provider offices, retail pharmacies, and integrated delivery systems. The company has collaboration agreements with Bristol-Myers Squibb Company; Astellas Pharma US, Inc.; Merck KGaA; and BioNTech SE, as well as has strategic clinical collaboration with Acepodia Inc. for the development of antibody-cell conjugation-based cell therapies in autoimmune diseases. Pfizer Inc. was founded in 1849 and is headquartered in New York, New York.",35.6664,9.128596,151.6 B,31.54,17.9%,31.77609,18.8%,6.44%,True
SNY,48.61289978027344,2.75,47.5,2025-02-21,0.033676251100554166,"Sanofi, a healthcare company, engages in the research, development, manufacture, and marketing of therapeutic solutions in the United States, Europe, Canada, and internationally. It operates through Pharmaceuticals, Vaccines, and Consumer Healthcare segments. The company provides specialty care, such as DUPIXENT, neurology and immunology, rare diseases, oncology, and rare blood disorders; medicines for diabetes and cardiovascular diseases; and established prescription products. In addition, it offers poliomyelitis, pertussis, and hib pediatric vaccines; influenza, booster, meningitis, and travel and endemic vaccines, which includes hepatitis A, typhoid, cholera, yellow fever, and rabies vaccines. The company also provides cough, cold, and flu, allergy, and pain care products, as well as physical, mental, and digestive wellness products; and offers products for itching, hydration, aging, cracking, overnight, and specialty skincare needs like eczema. Further, it has a collaboration and license agreement with Exscientia to develop up to 15 novel small-molecule for oncology and immunology; ABL Bio, Inc. to develop ABL301, a treatment for alpha-synucleinopathies; Blackstone Life Sciences to develop pivotal studies and clinical development program; and Seagen Inc. to design, develop, and commercialize antibody-drug conjugates for cancer. Additionally, the company has a collaboration agreement with IGM Biosciences, Inc. to develop, manufacture, and commercialize IgM antibody; Skyhawk Therapeutics, Inc to discover and develop novel small molecules; and Adagene Inc., for the discovery and development of antibody-based therapies. It also has collaborations with Scribe Therapeutics Inc. to develop genome editing technologies; and co-promotion service agreement with Provention Bio, Inc. for the commercialization of teplizumab. The company was formerly known as Sanofi-Aventis and changed its name to Sanofi in May 2011. Sanofi was incorporated in 1994 and is headquartered in Paris, France.",26.275675,10.022536,124.2 B,58.97,21.3%,63.06286,29.7%,4.18%,True
UL,55.03499984741211,1.92,55.0,2025-02-21,0.03425093409310742,"Unilever PLC operates as a fast-moving consumer goods company in the Asia Pacific, Africa, the Americas, and Europe. It operates through five segments: Beauty & Wellbeing, Personal Care, Home Care, Nutrition, and Ice Cream. The Beauty & Wellbeing segment engages in the sale of hair care products, such as shampoo, conditioner, and styling; skin care products including face, hand, and body moisturizer; and prestige beauty and health & wellbeing products consist of the vitamins, minerals, and supplements. The Personal Care segment offers skin cleansing products comprising soap and shower; deodorants; and oral care products, such as toothpaste, toothbrush, and mouthwash products. The Home Care segment is involved in the sale of fabric care products, including washing powders and liquids, and rinse conditioners; and fabric enhancers, and home and hygiene products. The Nutrition segment provides dressings products, such as mayonnaise and ketchup; sells scratch cooking aids consist of soups, bouillons, and seasonings; plant-based meat; beverages; and functional nutrition products, including Horlicks and Boost, as well as tea products. The Ice Cream segment offers ice cream products including in-home and out-of-home ice creams. The company provides its products under the AXE, Ben & Jerry's, Cif, Clear, Closeup, Comfort, Cornetto, Dermalogica, Domestos, Dove, Dove Men+Care, Hellmann's, Horlicks, Knorr, LUX, Lifebuoy, Liquid I.V., Magnum, Nutrafol, OMO, Paula's Choice, Pepsodent, Pond's, Rexona, Rexona, Sunlight, Sunsilk, Surf, TRESemmé, Vaseline, Wall's, Breyers, and Yasso brand names. Unilever PLC was founded in 1860 and is headquartered in London, the United Kingdom.",20.308117,17.779034,139.8 B,65.87,19.7%,64.56533,17.3%,3.45%,True
MDT,81.80999755859375,2.12,82.5,2025-02-21,0.03434791009978566,"Medtronic plc develops, manufactures, and sells device-based medical therapies to healthcare systems, physicians, clinicians, and patients worldwide. The Cardiovascular Portfolio segment offers implantable cardiac pacemakers, cardioverter defibrillators, and cardiac resynchronization therapy devices; cardiac ablation products; insertable cardiac monitor systems; TYRX products; and remote monitoring and patient-centered software. It also provides aortic valves, surgical valve replacement and repair products, endovascular stent grafts and accessories, and transcatheter pulmonary valves; and percutaneous coronary intervention products, percutaneous angioplasty balloons, and other products. The Neuroscience Portfolio segment offers medical devices and implants, biologic solutions, spinal cord stimulation and brain modulation systems, implantable drug infusion systems, and interventional products, as well as nerve ablation system under the Accurian name. The segment offers its products for spinal surgeons, neurosurgeons, neurologists, pain management specialists, anesthesiologists, orthopedic surgeons, urologists, urogynecologists, and interventional radiologists, as well as ear, nose, and throat specialists; and energy surgical instruments. The Medical Surgical Portfolio segment offers surgical stapling devices, vessel sealing instruments, wound closure and electrosurgery products, AI-powered surgical video and analytics platform, robotic-assisted surgery products, hernia mechanical devices, mesh implants, gynecology products, gastrointestinal and hepatologic diagnostics and therapies, and therapies to treat other non-exclusive diseases and conditions; and patient monitoring and airway management products. The Diabetes Operating Unit segment provides insulin pumps and consumables, continuous glucose monitoring systems, and InPen, a smart insulin pen system. The company was founded in 1949 and is headquartered in Galway, Ireland.",25.018349,14.009473,104.9 B,92.68,13.3%,95.55704,16.8%,3.20%,True
AMGN,269.5899963378906,9.03,270.0,2025-02-21,0.03501614967299349,"Amgen Inc. discovers, develops, manufactures, and delivers human therapeutics worldwide. The company's principal products include Enbrel to treat plaque psoriasis, rheumatoid arthritis, and psoriatic arthritis; Otezla for the treatment of adult patients with plaque psoriasis, psoriatic arthritis, and oral ulcers associated with Behçet's disease; Prolia to treat postmenopausal women with osteoporosis; XGEVA for skeletal-related events prevention; Repatha, which reduces the risks of myocardial infarction, stroke, and coronary revascularization; Nplate for the treatment of patients with immune thrombocytopenia; KYPROLIS to treat patients with relapsed or refractory multiple myeloma; Aranesp to treat a lower-than-normal number of red blood cells and anemia; EVENITY for the treatment of osteoporosis in postmenopausal for men and women; Vectibix to treat patients with wild-type RAS metastatic colorectal cancer; BLINCYTO for the treatment of patients with acute lymphoblastic leukemia; TEPEZZA to treat thyroid eye disease; and KRYSTEXXA for the treatment of chronic refractory gout. It also markets other products, including Neulasta, MVASI, AMJEVITA/AMGEVITA, TEZSPIRE, Parsabiv, Aimovig, LUMAKRAS/LUMYKRAS, EPOGEN, KANJINTI, TAVNEOS, RAVICTI, UPLIZNA and PROCYSBI. The company serves healthcare providers, including physicians or their clinics, dialysis centers, hospitals, and pharmacies. It distributes its products through pharmaceutical wholesale distributors, as well as direct-to-consumer channels. The company has collaboration agreements with AstraZeneca plc for the development and commercialization of TEZSPIRE; Novartis Pharma AG to develop and commercialize Aimovig; UCB for the development and commercialization of EVENITY; Kyowa Kirin Co., Ltd. for rocatinlimab development and commercialization; and BeiGene, Ltd. for oncology products expansion and development. Amgen Inc. was incorporated in 1980 and is headquartered in Thousand Oaks, California.",34.38648,12.996229,144.9 B,346.85,28.7%,317.2369,17.7%,3.63%,True
NKE,72.45999908447266,2.5,72.5,2025-02-21,0.03505383587662281,"NIKE, Inc., together with its subsidiaries, engages in the design, development, marketing, and sale of athletic footwear, apparel, equipment, accessories, and services worldwide. The company provides athletic and casual footwear, apparel, and accessories under the NIKE, Jumpman, Converse, Chuck Taylor, All Star, One Star, Star Chevron, and Jack Purcell trademarks. It also sells a line of performance equipment and accessories comprising bags, sport balls, socks, eyewear, timepieces, digital devices, bats, gloves, protective equipment, and other equipment for sports activities under the NIKE brand; and various plastic products to other manufacturers. In addition, the company markets apparel with licensed college and professional team, and league logos, as well as sells sports apparel; licenses unaffiliated parties to manufacture and sell apparel, digital devices, and applications and other equipment for sports activities under NIKE-owned trademarks; and operates digital platforms, including fitness and activity apps; sport, fitness, and wellness content; and digital services and features in retail stores. It sells its products to footwear stores; sporting goods stores; athletic specialty stores; department stores; skate, tennis, and golf shops; and other retail accounts through NIKE-owned retail stores, digital platforms, independent distributors, licensees, and sales representatives. The company was founded in 1964 and is headquartered in Beaverton, Oregon.",22.364197,28.569849,107.2 B,107.43,48.3%,87.01029,20.1%,2.08%,True
XOM,109.1416015625,2.97,110.0,2025-02-21,0.03507735256484823,"Exxon Mobil Corporation engages in the exploration and production of crude oil and natural gas in the United States and internationally. It operates through Upstream, Energy Products, Chemical Products, and Specialty Products segments. The Upstream segment explores for and produces crude oil and natural gas. The Energy Products segment offers fuels, aromatics, and catalysts, as well as licensing services. It sells its products under the Exxon, Esso, and Mobil brands. The Chemical Products segment manufactures and markets petrochemicals including olefins, polyolefins, and intermediates. The Specialty Products segment offers performance products, including lubricants, basestocks, waxes, synthetics, elastomers, and resins. The company also involves in the manufacturing, trade, transport, and sale of crude oil, natural gas, petroleum products, petrochemicals, and other specialty products; and pursuit lower-emission business opportunities, including carbon capture and storage, hydrogen, lower-emission fuels, and lithium. Exxon Mobil Corporation was founded in 1870 and is based in Spring, Texas.",13.591732,13.298794,479.7 B,126.34,15.8%,129.55537,18.7%,3.72%,True
JPM,243.7100067138672,7.35,245.0,2025-02-21,0.035451943080354376,"JPMorgan Chase & Co. operates as a financial services company worldwide. It operates through three segments: Consumer & Community Banking, Commercial & Investment Bank, and Asset & Wealth Management. It offers deposit, investment and lending products, cash management, and payments and services; mortgage origination and servicing activities; residential mortgages and home equity loans; and credit cards, auto loans, leases, and travel services to consumers and small businesses through bank branches, ATMs, and digital and telephone banking. The company also provides investment banking products and services, including corporate strategy and structure advisory, and equity and debt market capital-raising services, as well as loan origination and syndication; payments; and cash and derivative instruments, risk management solutions, prime brokerage, and research, as well as offers securities services, including custody, fund accounting and administration, and securities lending products for asset managers, insurance companies, and public and private investment funds. In addition, it provides financial solutions, including lending, payments, investment banking, and asset management to small and midsized companies, local governments, nonprofit clients, and large corporations, as well as investors, developers, and owners of multifamily, office, retail, industrial, and affordable housing properties. Further, the company offers multi-asset investment management solutions in equities, fixed income, alternatives, and money market funds to institutional clients and retail investors; and retirement products and services, brokerage, custody, estate planning, lending, deposits, and investment management products to high net worth clients. JPMorgan Chase & Co. was founded in 1799 and is headquartered in New York, New York.",13.544747,14.045845,686.0 B,254.31,4.3%,254.52953,4.4%,2.08%,True
LMT,483.69000244140625,16.1,485.0,2025-02-21,0.03599412324157525,"Lockheed Martin Corporation, a security and aerospace company, engages in the research, design, development, manufacture, integration, and sustainment of technology systems, products, and services worldwide. The company operates through Aeronautics, Missiles and Fire Control, Rotary and Mission Systems, and Space segments. The Aeronautics segment offers combat and air mobility aircraft, unmanned air vehicles, and related technologies. The Missiles and Fire Control segment provides air and missile defense systems; tactical missiles and air-to-ground precision strike weapon systems; logistics; fire control systems; mission operations support, readiness, engineering support, and integration services; manned and unmanned ground vehicles; and energy management solutions. The Rotary and Mission Systems segment offers military and commercial helicopters, surface ships, sea and land-based missile defense systems, radar systems, sea and air-based mission and combat systems, command and control mission solutions, cyber solutions, and simulation and training solutions. The Space segment offers satellites; space transportation systems; strategic, advanced strike, and defensive systems; and classified systems and services in support of national security systems. This segment also provides network-enabled situational awareness and integrates space and ground global systems to help its customers gather, analyze, and securely distribute critical intelligence data. It serves primarily serves the U.S. government, as well as foreign military sales contracted through the U.S. government. The company was formerly known as The Lockheed Corporation and changed its name to Lockheed Martin Corporation in March 1995. Lockheed Martin Corporation was founded in 1912 and is based in Bethesda, Maryland.",17.518652,17.39105,114.7 B,618.95,28.0%,571.7857,18.2%,2.82%,True
