Ticker,Stock Price,Call Contract Price,Strike Price,Expiration Date,Breakeven increase,Company Description,P/E Ratio,Forward P/E,Market Cap,52 Week High,52-week-upside,1y Target Est,1y-target-upside,Dividend Yield,Attractiveness
PG,168.94000244140625,2.13,170.0,2025-01-17,0.018882428746857194,"The Procter & Gamble Company engages in the provision of branded consumer packaged goods worldwide. The company operates through five segments: Beauty; Grooming; Health Care; Fabric & Home Care; and Baby, Feminine & Family Care. The Beauty segment offers conditioners, shampoos, styling aids, and treatments under the Head & Shoulders, Herbal Essences, Pantene, and Rejoice brands; and antiperspirants and deodorants, personal cleansing, and skin care products under the Olay, Old Spice, Safeguard, Secret, SK-II, and Native brands. The Grooming segment provides blades and razors, shave products, appliances, and other grooming products under the Braun, Gillette, and Venus brand names. The Health Care segment offers toothbrushes, toothpastes, and other oral care products under the Crest and Oral-B brand names; and gastrointestinal, pain relief, rapid diagnostics, respiratory, vitamins/minerals/supplements, and other personal health care products under Metamucil, Neurobion, Pepto-Bismol, and Vicks brands. The Fabric & Home Care segment provides fabric enhancers, laundry additives, and laundry detergents under the Ariel, Downy, Gain, and Tide brands; and air care, dish care, P&G professional, and surface care products under the Cascade, Dawn, Fairy, Febreze, Mr. Clean, and Swiffer brands. The Baby, Feminine & Family Care segment offers baby wipes, and taped diapers and pants under the Luvs and Pampers brands; adult incontinence and feminine care products under the Always, Always Discreet, and Tampax brands; and paper towels, tissues, and toilet papers under the Bounty, Charmin, and Puffs brands. It sells its products primarily through mass merchandisers, e-commerce, grocery stores, membership club stores, drug stores, department stores, distributors, wholesalers, specialty beauty stores, high-frequency stores, pharmacies, electronics stores, and professional channels, as well as directly to consumers. The company was founded in 1837 and is headquartered in Cincinnati, Ohio.",29.177893,22.794983,397.9 B,180.43,6.8%,180.99692,7.1%,2.40%,True
SAP,253.63999938964844,8.5,250.0,2025-01-17,0.019161018065157354,"SAP SE, together with its subsidiaries, provides applications, technology, and services worldwide. It offers SAP S/4HANA that provides software capabilities for finance, risk and project management, procurement, manufacturing, supply chain and asset management, and research and development; SAP SuccessFactors solutions for human resources, including HR and payroll, talent and employee experience management, and people and workforce analytics; and spend management solutions that covers direct and indirect spend, travel and expense, and external workforce management. The company also provides SAP customer experience solutions; SAP Business Technology platform that enables customers and partners to build, integrate, and automate applications; and SAP Business Network, a business-to-business collaboration platform that helps digitalize key business processes across the supply chain and enables communication between trading partners. In addition, it offers SAP Signavio to help customers to discover, analyze, and understand their business process operations; SAP's industry cloud solutions that provides modular solutions addressing industry-specific functions; Taulia solutions for working capital management to help enable customers mitigate the effects of inflation by providing visibility into working capital and access to liquidity; and sustainability solutions and services. SAP SE was founded in 1972 and is headquartered in Walldorf, Germany.",105.24481,39.063366,295.9 B,256.13,1.0%,267.39386,5.4%,0.96%,False
COST,958.8200073242188,17.22,960.0,2025-01-17,0.01919024690268012,"Costco Wholesale Corporation, together with its subsidiaries, engages in the operation of membership warehouses in the United States, Puerto Rico, Canada, Mexico, Japan, the United Kingdom, Korea, Australia, Taiwan, China, Spain, France, Iceland, New Zealand, and Sweden. The company offers branded and private-label products in a range of merchandise categories. It offers merchandise, such as sundries, dry groceries, candies, coolers, freezers, deli, liquor, and tobacco; appliances, electronics, health and beauty aids, hardware, lawn and garden, sporting goods, tires, toys and seasonal products, office supplies, automotive care products, postages, tickets, apparel, small appliances, furniture, domestics, housewares, special order kiosks, and jewelry; and meat, produce, service deli, and bakery products. The company also operates gasoline, pharmacies, optical, food courts, hearing-aid centers, and tire installation centers; and offers business delivery, travel, grocery, and various other services online. It also operates e-commerce websites. The company was formerly known as Costco Companies, Inc. and changed its name to Costco Wholesale Corporation in August 1999. Costco Wholesale Corporation was founded in 1976 and is based in Issaquah, Washington.",56.16989,47.942944,425.6 B,1008.25,5.2%,1024.1481,6.8%,0.47%,True
CBRE,131.9199981689453,4.46,130.0,2025-01-17,0.019254107537219678,"CBRE Group, Inc. operates as a commercial real estate services and investment company in the United States, the United Kingdom, and internationally. The Advisory Services segment offers strategic advice and execution to owners, investors, and occupiers of real estate in connection with leasing of offices, and industrial and retail space; clients fully integrated property sales services under the CBRE Capital Markets brand; clients commercial mortgage and structured financing services; originates and sells commercial mortgage loans; property management services, such as marketing, building engineering, accounting, and financial services on a contractual basis for owners of and investors in office, industrial, and retail properties; and valuation services that include market value appraisals, litigation support, discounted cash flow analyses, and feasibility studies, as well as consulting services, such as property condition reports, hotel advisory, and environmental consulting. The Global Workplace Solutions segment provides facilities management, including day-to-day management of client-occupied space, headquarters, regional offices, administrative offices, data centers and other critical facilities, manufacturing and laboratory facilities, and distribution facilities and retail space; and project management services comprising building consulting, program, and project and cost management services under the Turner & Townsend brand name. The Real Estate Investments segment offers investment management services under the CBRE Investment Management brand to pension funds, insurance companies, sovereign wealth funds, foundations, endowments, and other institutional investors; and development services, such as real estate development and investment activities under the Trammell Crow Company and Telford Homes brands to users and investors in commercial real estate, and for their own account. CBRE Group, Inc. was founded in 1906 and is headquartered in Dallas, Texas.",42.69256,21.571558,40.4 B,142.0,7.6%,145.63635,10.4%,N/A,True
LOW,250.22000122070312,5.04,250.0,2025-01-17,0.019263043544810232,"Lowe's Companies, Inc., together with its subsidiaries, operates as a home improvement retailer in the United States. The company offers a line of products for construction, maintenance, repair, remodeling, and decorating. It also provides home improvement products, such as appliances, seasonal and outdoor living, lawn and garden, lumber, kitchens and bath, tools, paint, millwork, hardware, flooring, rough plumbing, building materials, dcor, and electrical. In addition, the company offers installation services through independent contractors in various product categories; and extended protection plans and repair services. It sells its national brand-name merchandise and private brand products to professional customers, homeowners, renters, businesses, and government. The company also sells its products through Lowes.com website; and through mobile applications. Lowe's Companies, Inc. was founded in 1921 and is based in Mooresville, North Carolina.",20.834305,19.751974,141.3 B,287.01,14.7%,283.1506,13.2%,1.69%,True
ORCL,171.41000366210938,4.75,170.0,2025-01-17,0.01948542247554319,"Oracle Corporation offers products and services that address enterprise information technology environments worldwide. Its Oracle cloud software as a service offering include various cloud software applications, including Oracle Fusion cloud enterprise resource planning (ERP), Oracle Fusion cloud enterprise performance management, Oracle Fusion cloud supply chain and manufacturing management, Oracle Fusion cloud human capital management, Oracle Cerner healthcare, and NetSuite applications suite, as well as Oracle Fusion Sales, Service, and Marketing. The company also offers cloud-based industry solutions for various industries; Oracle application licenses; and Oracle license support services. In addition, it provides cloud and license business' infrastructure technologies, such as the Oracle Database and MySQL Database; Java, a software development language; and middleware, including development tools and others. The company's cloud and license business' infrastructure technologies also comprise cloud-based compute, storage, and networking capabilities; and Oracle autonomous database and MySQL HeatWave, as well as Internet-of-Things, digital assistant, and blockchain. Further, it provides hardware products and other hardware-related software offerings, including Oracle engineered systems, enterprise servers, storage solutions, industry-specific hardware, virtualization software, operating systems, management software, and related hardware services, as well as hardware support products; and consulting and customer services. The company markets and sells its cloud, license, hardware, support, and services offerings directly to businesses in various industries, government agencies, and educational institutions, as well as through indirect channels. Oracle Corporation was founded in 1977 and is headquartered in Austin, Texas.",41.80732,24.308752,479.4 B,198.31,15.7%,196.55232,14.7%,0.83%,True
PGR,243.24000549316406,3.0,245.0,2025-01-17,0.01956912678564171,"The Progressive Corporation, an insurance holding company, provides personal and commercial auto, personal residential and commercial property, business related general liability, and other specialty property-casualty insurance products and related services in the United States. It operates in three segments: Personal Lines, Commercial Lines, and Property. The Personal Lines segment writes insurance for personal autos and recreational vehicles (RV). This segment's products include personal auto insurance; and special lines products, including insurance for motorcycles, ATVs, RVs, watercrafts, snowmobiles, and related products. The Commercial Lines segment provides auto-related liability and physical damage insurance, and business-related general liability and property insurance for autos, vans, and pick-up trucks used by small businesses, as well as non-fleet taxis, black-car services, and airport taxis; tractors, trailers, and straight trucks primarily used by regional general freight and expeditor-type businesses, and long-haul operators; dump trucks used by light contractors and heavy constructions; log trucks and garbage trucks used by dirt, sand and gravel, logging, garbage/debris removal, and coal-type businesses; and tow trucks and wreckers used in towing services and gas/service station businesses. The Property segment writes residential property insurance for homeowners, other property owners, and renters, as well as offers manufactured homes, personal umbrella insurance, and primary and excess flood insurance. The company offers policy issuance and claims adjusting services; acts as an agent to homeowners, general liability, workers' compensation insurance, and other products; and reinsurance services. It sells its products through independent insurance agencies, as well as through mobile applications and over the phone. The Progressive Corporation was founded in 1937 and is headquartered in Mayfield Village, Ohio.",17.664488,17.146168,142.5 B,270.62,11.3%,276.5625,13.7%,0.17%,True
ABBV,180.0,3.55,180.0,2025-01-17,0.019722222222222197,"AbbVie Inc. discovers, develops, manufactures, and sells pharmaceuticals worldwide. The company offers Humira, an injection for autoimmune and intestinal Behet's diseases, and pyoderma gangrenosum; Skyrizi to treat moderate to severe plaque psoriasis, psoriatic disease, and Crohn's disease; Rinvoq to treat rheumatoid and psoriatic arthritis, ankylosing spondylitis, atopic dermatitis, axial spondyloarthropathy, ulcerative colitis, and Crohn's disease; Imbruvica for the treatment of adult patients with blood cancers; Epkinly to treat lymphoma; Elahere to treat cancer; and Venclexta/Venclyxto to treat blood cancers. It also provides facial injectables, plastics and regenerative medicine, body contouring, and skincare products; botox therapeutic; Vraylar for depressive disorder; Duopa and Duodopa to treat advanced Parkinson's disease; Ubrelvy for the acute treatment of migraine in adults; and Qulipta for episodic and chronic migraine. In addition, the company offers Ozurdex for eye diseases; Lumigan/Ganfort and Alphagan/Combigan for the reduction of elevated intraocular pressure in patients with open angle glaucoma or ocular hypertension; Restasis to increase tear production; and other eye care products. Further, it provides Mavyret/Maviret to treat chronic hepatitis C virus genotype 1-6 infection; Creon, a pancreatic enzyme therapy; Lupron to treat advanced prostate cancer, endometriosis and central precocious puberty, and patients with anemia caused by uterine fibroids; Linzess/Constella to treat irritable bowel syndrome with constipation and chronic idiopathic constipation; and Synthroid for hypothyroidism. It has collaborations with Calico Life Sciences LLC; REGENXBIO Inc.; Janssen Biotech, Inc.; Evolveimmune Therapeutics, Inc.; Genentech, Inc.; and Tentarix Biotherapeutics, LP. The company was incorporated in 2012 and is headquartered in North Chicago, Illinois.",62.937065,14.784066,318.1 B,207.32,15.2%,202.54214,12.5%,3.74%,True
BLK,1054.8299560546875,25.66,1050.0,2025-01-17,0.019747300335707152,"BlackRock, Inc. is a publicly owned investment manager. The firm primarily provides its services to institutional, intermediary, and individual investors including corporate, public, union, and industry pension plans, insurance companies, third-party mutual funds, endowments, public institutions, governments, foundations, charities, sovereign wealth funds, corporations, official institutions, and banks. It also provides global risk management and advisory services. The firm manages separate client-focused equity, fixed income, and balanced portfolios. It also launches and manages open-end and closed-end mutual funds, offshore funds, unit trusts, and alternative investment vehicles including structured funds. The firm launches equity, fixed income, balanced, and real estate mutual funds. It also launches equity, fixed income, balanced, currency, commodity, and multi-asset exchange traded funds. The firm also launches and manages hedge funds. It invests in the public equity, fixed income, real estate, currency, commodity, and alternative markets across the globe. The firm primarily invests in growth and value stocks of small-cap, mid-cap, SMID-cap, large-cap, and multi-cap companies. It also invests in dividend-paying equity securities. The firm invests in investment grade municipal securities, government securities including securities issued or guaranteed by a government or a government agency or instrumentality, corporate bonds, and asset-backed and mortgage-backed securities. It employs fundamental and quantitative analysis with a focus on bottom-up and top-down approach to make its investments. The firm employs liquidity, asset allocation, balanced, real estate, and alternative strategies to make its investments. In real estate sector, it seeks to invest in Poland and Germany. The firm benchmarks the performance of its portfolios against various S&P, Russell, Barclays, MSCI, Citigroup, and Merrill Lynch indices. BlackRock, Inc. was founded in 1988 and is based in New York City with additional offices in Boston, Massachusetts; London, United Kingdom; Gurgaon, India; Hong Kong; Greenwich, Connecticut; Princeton, New Jersey; Edinburgh, United Kingdom; Sydney, Australia; Taipei, Taiwan; Singapore; Sao Paulo, Brazil; Philadelphia, Pennsylvania; Washington, District of Columbia; Toronto, Canada; Wilmington, Delaware; and San Francisco, California.",26.038755,21.785572,163.4 B,1082.45,2.6%,1145.5883,8.6%,1.98%,True
MCD,293.989990234375,4.8,295.0,2025-01-17,0.019762610832406713,"McDonald's Corporation operates and franchises restaurants under the McDonald's brand in the United States and internationally. It offers food and beverages, including hamburgers and cheeseburgers, various chicken sandwiches, fries, shakes, desserts, sundaes, cookies, pies, soft drinks, coffee, and other beverages; and full or limited breakfast, as well as sells various other products during limited-time promotions. The company owns and operates under various structures comprising conventional franchise, developmental license, or affiliate. McDonald's Corporation was founded in 1940 and is based in Chicago, Illinois.",25.833918,23.305553,210.7 B,317.9,8.1%,321.50656,9.4%,2.42%,True
AMGN,264.489990234375,4.78,265.0,2025-01-17,0.020000793833208075,"Amgen Inc. discovers, develops, manufactures, and delivers human therapeutics worldwide. The company's principal products include Enbrel to treat plaque psoriasis, rheumatoid arthritis, and psoriatic arthritis; Otezla for the treatment of adult patients with plaque psoriasis, psoriatic arthritis, and oral ulcers associated with Behet's disease; Prolia to treat postmenopausal women with osteoporosis; XGEVA for skeletal-related events prevention; Repatha, which reduces the risks of myocardial infarction, stroke, and coronary revascularization; Nplate for the treatment of patients with immune thrombocytopenia; KYPROLIS to treat patients with relapsed or refractory multiple myeloma; Aranesp to treat a lower-than-normal number of red blood cells and anemia; EVENITY for the treatment of osteoporosis in postmenopausal for men and women; Vectibix to treat patients with wild-type RAS metastatic colorectal cancer; BLINCYTO for the treatment of patients with acute lymphoblastic leukemia; TEPEZZA to treat thyroid eye disease; and KRYSTEXXA for the treatment of chronic refractory gout. It also markets other products, including Neulasta, MVASI, AMJEVITA/AMGEVITA, TEZSPIRE, Parsabiv, Aimovig, LUMAKRAS/LUMYKRAS, EPOGEN, KANJINTI, TAVNEOS, RAVICTI, UPLIZNA and PROCYSBI. The company serves healthcare providers, including physicians or their clinics, dialysis centers, hospitals, and pharmacies. It distributes its products through pharmaceutical wholesale distributors, as well as direct-to-consumer channels. The company has collaboration agreements with AstraZeneca plc for the development and commercialization of TEZSPIRE; Novartis Pharma AG to develop and commercialize Aimovig; UCB for the development and commercialization of EVENITY; Kyowa Kirin Co., Ltd. for rocatinlimab development and commercialization; and BeiGene, Ltd. for oncology products expansion and development. Amgen Inc. was incorporated in 1980 and is headquartered in Thousand Oaks, California.",33.779053,12.797338,142.2 B,346.85,31.1%,322.42923,21.9%,3.61%,True
NEE,72.91000366210938,1.87,72.5,2025-01-17,0.02002463673787158,"NextEra Energy, Inc., through its subsidiaries, generates, transmits, distributes, and sells electric power to retail and wholesale customers in North America. The company generates electricity through wind, solar, nuclear,natural gas, and other clean energy. It also develops, constructs, and operates long-term contracted assets that consists of clean energy solutions, such as renewable generation facilities, battery storage projects, and electric transmission facilities; sells energy commodities; and owns, develops, constructs, manages and operates electric generation facilities in wholesale energy markets. The company had approximately 33,276 megawatts of net generating capacity; approximately 90,000 circuit miles of transmission and distribution lines; and 883 substations. It serves approximately 12 million people through approximately 5.9 million customer accounts in the east and lower west coasts of Florida. The company was formerly known as FPL Group, Inc. and changed its name to NextEra Energy, Inc. in 2010. NextEra Energy, Inc. was founded in 1925 and is headquartered in Juno Beach, Florida.",21.635017,19.81988,149.9 B,86.1,18.1%,87.14545,19.5%,2.87%,True
ABT,114.76000213623047,2.06,115.0,2025-01-17,0.0200418074325166,"Abbott Laboratories, together with its subsidiaries, discovers, develops, manufactures, and sells health care products worldwide. It operates in four segments: Established Pharmaceutical Products, Diagnostic Products, Nutritional Products, and Medical Devices. The company provides generic pharmaceuticals for the treatment of pancreatic exocrine insufficiency, irritable bowel syndrome or biliary spasm, intrahepatic cholestasis or depressive symptoms, gynecological disorder, hormone replacement therapy, dyslipidemia, hypertension, hypothyroidism, Mnire's disease and vestibular vertigo, pain, fever, inflammation, and migraine, as well as provides anti-infective clarithromycin, influenza vaccine, and products to regulate physiological rhythm of the colon. It also offers laboratory and transfusion medicine systems in the areas of immunoassay, clinical chemistry, hematology, and transfusion; molecular diagnostics polymerase chain reaction instrument systems that automate the extraction, purification, and preparation of DNA and RNA from patient samples, and detect and measure infectious agents; point of care systems; cartridges for testing blood gas, chemistry, electrolytes, coagulation, and immunoassay; rapid diagnostics lateral flow testing products; molecular point-of-care testing for HIV, SARS-CoV-2, influenza A and B, RSV, and strep A; cardiometabolic test systems; drug and alcohol test, and remote patient monitoring and consumer self-test systems; and informatics and automation solutions for laboratories. In addition, the company provides pediatric and adult nutritional products; rhythm management, electrophysiology, heart failure, vascular, and structural heart devices for the treatment of cardiovascular diseases; diabetes care products, such as glucose and blood glucose monitoring systems; and neuromodulation devices for the management of chronic pain and movement disorders. Abbott Laboratories was founded in 1888 and is based in North Chicago, Illinois.",34.88146,22.24432,199.0 B,121.64,6.0%,130.20457,13.5%,2.07%,True
JPM,242.30999755859375,7.18,240.0,2025-01-17,0.020098231564831037,"JPMorgan Chase & Co. operates as a financial services company worldwide. It operates through three segments: Consumer & Community Banking, Commercial & Investment Bank, and Asset & Wealth Management. It offers deposit, investment and lending products, cash management, and payments and services; mortgage origination and servicing activities; residential mortgages and home equity loans; and credit cards, auto loans, leases, and travel services to consumers and small businesses through bank branches, ATMs, and digital and telephone banking. The company also provides investment banking products and services, including corporate strategy and structure advisory, and equity and debt market capital-raising services, as well as loan origination and syndication; payments; and cash and derivative instruments, risk management solutions, prime brokerage, and research, as well as offers securities services, including custody, fund accounting and administration, and securities lending products for asset managers, insurance companies, and public and private investment funds. In addition, it provides financial solutions, including lending, payments, investment banking, and asset management to small and midsized companies, local governments, nonprofit clients, and large corporations, as well as investors, developers, and owners of multifamily, office, retail, industrial, and affordable housing properties. Further, the company offers multi-asset investment management solutions in equities, fixed income, alternatives, and money market funds to institutional clients and retail investors; and retirement products and services, brokerage, custody, estate planning, lending, deposits, and investment management products to high net worth clients. JPMorgan Chase & Co. was founded in 1799 and is headquartered in New York, New York.",13.476641,14.247428,682.2 B,254.31,5.0%,246.556,1.8%,2.10%,False
