Ticker,Stock Price,Call Contract Price,Strike Price,Expiration Date,Breakeven increase,Company Description,P/E Ratio,Forward P/E,Market Cap,52 Week High,52-week-upside,1y Target Est,1y-target-upside,Dividend Yield,Attractiveness
UPS,126.76000213623047,6.25,125.0,2025-02-21,0.035421251089472916,"United Parcel Service, Inc., a package delivery company, provides transportation and delivery, distribution, contract logistics, ocean freight, airfreight, customs brokerage, and insurance services. It operates through two segments, U.S. Domestic Package and International Package. The U.S. Domestic Package segment offers time-definite delivery of express letters, documents, small packages, and palletized freight through air and ground services in the United States. The International Package segment provides guaranteed day and time-definite international shipping services comprising guaranteed time-definite express options in Europe, Asia, the Indian sub-continent, the Middle East, Africa, Canada, and Latin America. The company also offers international air and ocean freight forwarding, post-sales, and mail and consulting services. In addition, it provides truckload and customs brokerage services; supply chain solutions to the healthcare and life sciences industries; fulfillment and transportation management services; and integrated supply chain and shipment insurance solutions. United Parcel Service, Inc. was founded in 1907 and is headquartered in Atlanta, Georgia.",19.148037,14.453639,108.2 B,161.47,27.4%,148.84355,17.4%,5.14%,True
ABBV,178.5,4.85,180.0,2025-02-21,0.035574229691876624,"AbbVie Inc. discovers, develops, manufactures, and sells pharmaceuticals worldwide. The company offers Humira, an injection for autoimmune and intestinal Behçet's diseases, and pyoderma gangrenosum; Skyrizi to treat moderate to severe plaque psoriasis, psoriatic disease, and Crohn's disease; Rinvoq to treat rheumatoid and psoriatic arthritis, ankylosing spondylitis, atopic dermatitis, axial spondyloarthropathy, ulcerative colitis, and Crohn's disease; Imbruvica for the treatment of adult patients with blood cancers; Epkinly to treat lymphoma; Elahere to treat cancer; and Venclexta/Venclyxto to treat blood cancers. It also provides facial injectables, plastics and regenerative medicine, body contouring, and skincare products; botox therapeutic; Vraylar for depressive disorder; Duopa and Duodopa to treat advanced Parkinson's disease; Ubrelvy for the acute treatment of migraine in adults; and Qulipta for episodic and chronic migraine. In addition, the company offers Ozurdex for eye diseases; Lumigan/Ganfort and Alphagan/Combigan for the reduction of elevated intraocular pressure in patients with open angle glaucoma or ocular hypertension; Restasis to increase tear production; and other eye care products. Further, it provides Mavyret/Maviret to treat chronic hepatitis C virus genotype 1-6 infection; Creon, a pancreatic enzyme therapy; Lupron to treat advanced prostate cancer, endometriosis and central precocious puberty, and patients with anemia caused by uterine fibroids; Linzess/Constella to treat irritable bowel syndrome with constipation and chronic idiopathic constipation; and Synthroid for hypothyroidism. It has collaborations with Calico Life Sciences LLC; REGENXBIO Inc.; Janssen Biotech, Inc.; Evolveimmune Therapeutics, Inc.; Genentech, Inc.; and Tentarix Biotherapeutics, LP. The company was incorporated in 2012 and is headquartered in North Chicago, Illinois.",62.195126,14.673254,315.4 B,207.32,16.1%,202.39929,13.4%,3.68%,True
PFE,26.860000610351562,0.82,27.0,2025-02-21,0.03574085509433922,"Pfizer Inc. discovers, develops, manufactures, markets, distributes, and sells biopharmaceutical products in the United States, Europe, and internationally. The company offers medicines and vaccines in various therapeutic areas, including cardiovascular metabolic, migraine, and women's health under the Eliquis, Nurtec ODT/Vydura, Zavzpret, and the Premarin family brands; infectious diseases with unmet medical needs under the Prevnar family, Abrysvo, Nimenrix, FSME/IMMUN-TicoVac, and Trumenba brands; and COVID-19 prevention and treatment, and potential future mRNA and antiviral products under the Comirnaty and Paxlovid brands. It also provides medicines and vaccines in various therapeutic areas, such as biosimilars for chronic immune and inflammatory diseases under the Xeljanz, Enbrel, Inflectra, Litfulo, Velsipity, and Cibinqo brands; amyloidosis, hemophilia, endocrine diseases, and sickle cell disease under the Vyndaqel family, Oxbryta, BeneFIX, Somavert, Ngenla, and Genotropin brands; sterile injectable and anti-infective medicines under the Sulperazon, Medrol, Zavicefta, Zithromax, and Panzyga brands; and biologics, small molecules, immunotherapies, and biosimilars under the Ibrance, Xtandi, Inlyta, Bosulif, Mektovi, Padcev, Adcetris, Talzenna, Tukysa, Elrexfio, Tivdak, Lorbrena, and Braftovi brands. In addition, the company involved in the contract manufacturing business. It serves wholesalers, retailers, hospitals, clinics, government agencies, pharmacies, individual provider offices, retail pharmacies, and integrated delivery systems. The company has collaboration agreements with Bristol-Myers Squibb Company; Astellas Pharma US, Inc.; Merck KGaA; and BioNTech SE, as well as has strategic clinical collaboration with Acepodia Inc. for the development of antibody-cell conjugation-based cell therapies in autoimmune diseases. Pfizer Inc. was founded in 1849 and is headquartered in New York, New York.",35.813335,9.1662035,152.2 B,31.54,17.4%,31.77609,18.3%,6.40%,True
V,312.6000061035156,8.88,315.0,2025-02-21,0.03608443274549744,"Visa Inc. operates as a payment technology company in the United States and internationally. The company operates VisaNet, a transaction processing network that enables authorization, clearing, and settlement of payment transactions. It also offers credit, debit, and prepaid card products; tap to pay, tokenization, and click to pay services; Visa Direct, a solution that facilitates the delivery of funds to eligible cards, bank accounts, and digital wallets; Visa B2B Connect, a multilateral business-to-business cross-border payments network; Visa Cross-Border Solution, a cross-border consumer payments solution; and Visa DPS that provides a range of value-added services, including fraud mitigation, dispute management, data analytics, campaign management, a suite of digital solutions, and contact center services. The company also provides acceptance solutions, which include Cybersource and Authorize.net that provides new and enhanced payment integrations with ecommerce platforms, enabling sellers and acquirers to offer tailored commerce experiences; risk and identity solutions, such as Visa Advanced Authorization, Visa Secure, Visa Consumer Authentication Service, Visa Protect Authentication Intelligence, and Visa Provisioning Intelligence; and Visa Consulting and Analytics, a payment consulting advisory services. It provides its services under the Visa, Visa Electron, Interlink, V PAY, and PLUS brands. The company serves merchants, financial institutions, and government entities. Visa Inc. was founded in 1958 and is headquartered in San Francisco, California.",32.160492,24.6874,605.3 B,321.62,2.9%,334.34628,7.0%,0.75%,False
SAP,253.49000549316406,12.8,250.0,2025-02-21,0.03672726460644227,"SAP SE, together with its subsidiaries, provides applications, technology, and services worldwide. It offers SAP S/4HANA that provides software capabilities for finance, risk and project management, procurement, manufacturing, supply chain and asset management, and research and development; SAP SuccessFactors solutions for human resources, including HR and payroll, talent and employee experience management, and people and workforce analytics; and spend management solutions that covers direct and indirect spend, travel and expense, and external workforce management. The company also provides SAP customer experience solutions; SAP Business Technology platform that enables customers and partners to build, integrate, and automate applications; and SAP Business Network, a business-to-business collaboration platform that helps digitalize key business processes across the supply chain and enables communication between trading partners. In addition, it offers SAP Signavio to help customers to discover, analyze, and understand their business process operations; SAP's industry cloud solutions that provides modular solutions addressing industry-specific functions; Taulia solutions for working capital management to help enable customers mitigate the effects of inflation by providing visibility into working capital and access to liquidity; and sustainability solutions and services. SAP SE was founded in 1972 and is headquartered in Walldorf, Germany.",105.18257,38.999542,295.7 B,256.13,1.0%,270.31693,6.6%,0.94%,False
MSFT,424.55999755859375,15.23,425.0,2025-02-21,0.036908805661191924,"Microsoft Corporation develops and supports software, services, devices and solutions worldwide. The Productivity and Business Processes segment offers office, exchange, SharePoint, Microsoft Teams, office 365 Security and Compliance, Microsoft viva, and Microsoft 365 copilot; and office consumer services, such as Microsoft 365 consumer subscriptions, Office licensed on-premises, and other office services. This segment also provides LinkedIn; and dynamics business solutions, including Dynamics 365, a set of intelligent, cloud-based applications across ERP, CRM, power apps, and power automate; and on-premises ERP and CRM applications. The Intelligent Cloud segment offers server products and cloud services, such as azure and other cloud services; SQL and windows server, visual studio, system center, and related client access licenses, as well as nuance and GitHub; and enterprise services including enterprise support services, industry solutions, and nuance professional services. The More Personal Computing segment offers Windows, including windows OEM licensing and other non-volume licensing of the Windows operating system; Windows commercial comprising volume licensing of the Windows operating system, windows cloud services, and other Windows commercial offerings; patent licensing; and windows Internet of Things; and devices, such as surface, HoloLens, and PC accessories. Additionally, this segment provides gaming, which includes Xbox hardware and content, and first- and third-party content; Xbox game pass and other subscriptions, cloud gaming, advertising, third-party disc royalties, and other cloud services; and search and news advertising, which includes Bing, Microsoft News and Edge, and third-party affiliates. The company sells its products through OEMs, distributors, and resellers; and directly through digital marketplaces, online, and retail stores. The company was founded in 1975 and is headquartered in Redmond, Washington.",35.0876,28.282543,3156.6 B,468.35,10.3%,508.4636,19.8%,0.78%,True
LMT,468.8500061035156,16.18,470.0,2025-02-21,0.03696276777408891,"Lockheed Martin Corporation, a security and aerospace company, engages in the research, design, development, manufacture, integration, and sustainment of technology systems, products, and services worldwide. The company operates through Aeronautics, Missiles and Fire Control, Rotary and Mission Systems, and Space segments. The Aeronautics segment offers combat and air mobility aircraft, unmanned air vehicles, and related technologies. The Missiles and Fire Control segment provides air and missile defense systems; tactical missiles and air-to-ground precision strike weapon systems; logistics; fire control systems; mission operations support, readiness, engineering support, and integration services; manned and unmanned ground vehicles; and energy management solutions. The Rotary and Mission Systems segment offers military and commercial helicopters, surface ships, sea and land-based missile defense systems, radar systems, sea and air-based mission and combat systems, command and control mission solutions, cyber solutions, and simulation and training solutions. The Space segment offers satellites; space transportation systems; strategic, advanced strike, and defensive systems; and classified systems and services in support of national security systems. This segment also provides network-enabled situational awareness and integrates space and ground global systems to help its customers gather, analyze, and securely distribute critical intelligence data. It serves primarily serves the U.S. government, as well as foreign military sales contracted through the U.S. government. The company was formerly known as The Lockheed Corporation and changed its name to Lockheed Martin Corporation in March 1995. Lockheed Martin Corporation was founded in 1912 and is based in Bethesda, Maryland.",16.975018,16.85748,111.1 B,618.95,32.0%,576.1191,22.9%,2.82%,True
BAC,46.209999084472656,1.93,46.0,2025-02-21,0.03722140120330142,"Bank of America Corporation, through its subsidiaries, provides banking and financial products and services for individual consumers, small and middle-market businesses, institutional investors, large corporations, and governments worldwide. It operates in four segments: Consumer Banking, Global Wealth & Investment Management (GWIM), Global Banking, and Global Markets. The Consumer Banking segment offers traditional and money market savings accounts, certificates of deposit and IRAs, non-interest and interest-bearing checking accounts, and investment accounts and products; credit and debit cards; residential mortgages, and home equity loans; and direct and indirect loans, such as automotive, recreational vehicle, and consumer personal loans. The GWIM segment provides investment management, brokerage, banking, and trust and retirement products and services; wealth management solutions; and customized solutions, including specialty asset management services. The Global Banking segment offers lending products and services, including commercial loans, leases, commitment facilities, trade finance, and commercial real estate and asset-based lending; treasury solutions, such as treasury management, foreign exchange, short-term investing options, and merchant services; working capital management solutions; debt and equity underwriting and distribution, and merger-related and other advisory services; and fixed-income and equity research, and certain market-based services. The Global Markets segment provides market-making, financing, securities clearing, settlement, and custody services; securities and derivative products; and risk management products using interest rate, equity, credit, currency and commodity derivatives, foreign exchange, fixed-income, and mortgage-related products. Bank of America Corporation was founded in 1784 and is based in Charlotte, North Carolina.",16.742754,12.461504,354.6 B,48.08,4.0%,50.84682,10.0%,2.25%,True
HON,220.1699981689453,8.5,220.0,2025-02-21,0.03783440932157678,"Honeywell International Inc. engages in the aerospace technologies, building automation, energy and sustainable solutions, and industrial automation businesses in the United States, Europe, and internationally. The company's Aerospace segment offers auxiliary power units, propulsion engines, integrated avionics, environmental control and electric power systems, engine controls, flight safety, communications, navigation hardware, data and software applications, radar and surveillance systems, aircraft lighting, advanced systems and instruments, satellite and space components, and aircraft wheels and brakes; spare parts; repair, overhaul, and maintenance services; and thermal systems, as well as wireless connectivity services. Its Honeywell Building Technologies segment provides software applications for building control and optimization; sensors, switches, control systems, and instruments for energy management; access control; video surveillance; fire products; and installation, maintenance, and upgrades of systems. The company's Performance Materials and Technologies segment offers automation control, instrumentation, and software and related services; catalysts and adsorbents, equipment, and consulting; and materials to manufacture end products, such as bullet-resistant armor, nylon, computer chips, and pharmaceutical packaging, as well as provides materials based on hydrofluoro-olefin technology. Its Safety and Productivity Solutions segment provides personal protective equipment, apparel, gear, and footwear; gas detection technology; custom-engineered sensors, switches, and controls for sensing and productivity solution; cloud-based notification and emergency messaging; mobile devices and software; custom-engineered sensors, switches, and controls; and data and asset management productivity solutions. Honeywell International Inc. was founded in 1885 and is headquartered in Charlotte, North Carolina.",25.45318,20.041965,143.2 B,242.77,10.3%,245.02458,11.3%,2.05%,True
BKNG,4872.419921875,197.2,4860.0,2025-02-21,0.03792367675360242,"Booking Holdings Inc., together with its subsidiaries, provides online and traditional travel and restaurant reservations and related services in the United States, the Netherlands, and internationally. The company operates Booking.com, which offers online accommodation reservations; and Priceline, which provides online travel reservation services, as well as consumers hotel, flight, activity, rental car reservation, vacation packages, cruises, and hotel distribution services. It also operates Agoda that offers online accommodation reservation, flight, ground transportation, and activities reservation services. In addition, the company operates KAYAK, an online meta-search service that allows consumers to search and compare travel itineraries and prices; OpenTable for booking online restaurant reservations, as well as reservation management services to restaurants; and Rentalcars.com. Further, it offers travel-related insurance products and restaurant management services to consumers, travel service providers, and restaurants; and advertising services. The company was formerly known as The Priceline Group Inc. and changed its name to Booking Holdings Inc. in February 2018. Booking Holdings Inc. was founded in 1997 and is headquartered in Norwalk, Connecticut.",33.004265,23.226458,161.3 B,5337.24,9.5%,5282.2314,8.4%,0.72%,True
AMGN,264.2099914550781,9.25,265.0,2025-02-21,0.03800010926774089,"Amgen Inc. discovers, develops, manufactures, and delivers human therapeutics worldwide. The company's principal products include Enbrel to treat plaque psoriasis, rheumatoid arthritis, and psoriatic arthritis; Otezla for the treatment of adult patients with plaque psoriasis, psoriatic arthritis, and oral ulcers associated with Behçet's disease; Prolia to treat postmenopausal women with osteoporosis; XGEVA for skeletal-related events prevention; Repatha, which reduces the risks of myocardial infarction, stroke, and coronary revascularization; Nplate for the treatment of patients with immune thrombocytopenia; KYPROLIS to treat patients with relapsed or refractory multiple myeloma; Aranesp to treat a lower-than-normal number of red blood cells and anemia; EVENITY for the treatment of osteoporosis in postmenopausal for men and women; Vectibix to treat patients with wild-type RAS metastatic colorectal cancer; BLINCYTO for the treatment of patients with acute lymphoblastic leukemia; TEPEZZA to treat thyroid eye disease; and KRYSTEXXA for the treatment of chronic refractory gout. It also markets other products, including Neulasta, MVASI, AMJEVITA/AMGEVITA, TEZSPIRE, Parsabiv, Aimovig, LUMAKRAS/LUMYKRAS, EPOGEN, KANJINTI, TAVNEOS, RAVICTI, UPLIZNA and PROCYSBI. The company serves healthcare providers, including physicians or their clinics, dialysis centers, hospitals, and pharmacies. It distributes its products through pharmaceutical wholesale distributors, as well as direct-to-consumer channels. The company has collaboration agreements with AstraZeneca plc for the development and commercialization of TEZSPIRE; Novartis Pharma AG to develop and commercialize Aimovig; UCB for the development and commercialization of EVENITY; Kyowa Kirin Co., Ltd. for rocatinlimab development and commercialization; and BeiGene, Ltd. for oncology products expansion and development. Amgen Inc. was incorporated in 1980 and is headquartered in Thousand Oaks, California.",33.78644,12.728625,142.0 B,346.85,31.3%,319.3523,20.9%,3.60%,True
SHW,337.5400085449219,10.5,340.0,2025-02-21,0.03839542314093802,"The Sherwin-Williams Company engages in the development, manufacture, distribution, and sale of paints, coating, and related products to professional, industrial, commercial, and retail customers. It operates through three segments: Paint Stores Group, Consumer Brands Group, and Performance Coatings Group. The Paint Stores Group segment offers architectural paints and coatings, and protective and marine products, as well as OEM product finishes and related products for architectural and industrial paint contractors, and do-it-yourself homeowners. The Consumer Brands Group segment supplies a portfolio of branded and private-label architectural paints, stains, varnishes, industrial products, wood finishes products, wood preservatives, applicators, corrosion inhibitors, aerosols, caulks, and adhesives to retailers, including home centers and hardware stores, and dedicated dealers and distributors. The Performance Coatings Group segment develops and sells industrial coatings for wood finishing and general industrial applications, automotive refinish products, protective and marine coatings, coil coatings, packaging coatings, and performance-based resins and colorants. It serves retailers, dealers, jobbers, licensees, and other third-party distributors through its branches and direct sales staff, as well as through outside sales representatives. The company has operations primarily in the North and South America, the Caribbean, Europe, Asia, and Australia. The Sherwin-Williams Company was founded in 1866 and is headquartered in Cleveland, Ohio.",33.552685,26.521173,85.0 B,400.42,18.6%,384.61783,13.9%,0.85%,True
JPM,243.1300048828125,7.48,245.0,2025-02-21,0.03845677180689466,"JPMorgan Chase & Co. operates as a financial services company worldwide. It operates through three segments: Consumer & Community Banking, Commercial & Investment Bank, and Asset & Wealth Management. It offers deposit, investment and lending products, cash management, and payments and services; mortgage origination and servicing activities; residential mortgages and home equity loans; and credit cards, auto loans, leases, and travel services to consumers and small businesses through bank branches, ATMs, and digital and telephone banking. The company also provides investment banking products and services, including corporate strategy and structure advisory, and equity and debt market capital-raising services, as well as loan origination and syndication; payments; and cash and derivative instruments, risk management solutions, prime brokerage, and research, as well as offers securities services, including custody, fund accounting and administration, and securities lending products for asset managers, insurance companies, and public and private investment funds. In addition, it provides financial solutions, including lending, payments, investment banking, and asset management to small and midsized companies, local governments, nonprofit clients, and large corporations, as well as investors, developers, and owners of multifamily, office, retail, industrial, and affordable housing properties. Further, the company offers multi-asset investment management solutions in equities, fixed income, alternatives, and money market funds to institutional clients and retail investors; and retirement products and services, brokerage, custody, estate planning, lending, deposits, and investment management products to high net worth clients. JPMorgan Chase & Co. was founded in 1799 and is headquartered in New York, New York.",13.51473,14.014719,684.5 B,254.31,4.6%,254.38667,4.6%,2.06%,True
