Ticker,Stock Price,Call Contract Price,Strike Price,Expiration Date,Breakeven increase,Company Description,P/E Ratio,Forward P/E,Market Cap,52 Week High,52-week-upside,1y Target Est,1y-target-upside,Dividend Yield,Attractiveness
AAPL,227.10000610351562,40.35,230.0,2027-01-15,0.19044470600661456,"Apple Inc. designs, manufactures, and markets smartphones, personal computers, tablets, wearables, and accessories worldwide. The company offers iPhone, a line of smartphones; Mac, a line of personal computers; iPad, a line of multi-purpose tablets; and wearables, home, and accessories comprising AirPods, Apple TV, Apple Watch, Beats products, and HomePod. It also provides AppleCare support and cloud services; and operates various platforms, including the App Store that allow customers to discover and download applications and digital content, such as books, music, video, games, and podcasts. In addition, the company offers various services, such as Apple Arcade, a game subscription service; Apple Fitness+, a personalized fitness service; Apple Music, which offers users a curated listening experience with on-demand radio stations; Apple News+, a subscription news and magazine service; Apple TV+, which offers exclusive original content; Apple Card, a co-branded credit card; and Apple Pay, a cashless payment service, as well as licenses its intellectual property. The company serves consumers, and small and mid-sized businesses; and the education, enterprise, and government markets. It distributes third-party applications for its products through the App Store. The company also sells its products through its retail and online stores, and direct sales force; and third-party cellular network carriers, wholesalers, retailers, and resellers. Apple Inc. was founded in 1976 and is headquartered in Cupertino, California.",34.56621,30.360964,3452.9 B,237.23,4.5%,240.58,5.9%,0.44%,False
MSFT,429.1600036621094,81.33,430.0,2027-01-15,0.1914670417483395,"Microsoft Corporation develops and supports software, services, devices and solutions worldwide. The Productivity and Business Processes segment offers office, exchange, SharePoint, Microsoft Teams, office 365 Security and Compliance, Microsoft viva, and Microsoft 365 copilot; and office consumer services, such as Microsoft 365 consumer subscriptions, Office licensed on-premises, and other office services. This segment also provides LinkedIn; and dynamics business solutions, including Dynamics 365, a set of intelligent, cloud-based applications across ERP, CRM, power apps, and power automate; and on-premises ERP and CRM applications. The Intelligent Cloud segment offers server products and cloud services, such as azure and other cloud services; SQL and windows server, visual studio, system center, and related client access licenses, as well as nuance and GitHub; and enterprise services including enterprise support services, industry solutions, and nuance professional services. The More Personal Computing segment offers Windows, including windows OEM licensing and other non-volume licensing of the Windows operating system; Windows commercial comprising volume licensing of the Windows operating system, windows cloud services, and other Windows commercial offerings; patent licensing; and windows Internet of Things; and devices, such as surface, HoloLens, and PC accessories. Additionally, this segment provides gaming, which includes Xbox hardware and content, and first- and third-party content; Xbox game pass and other subscriptions, cloud gaming, advertising, third-party disc royalties, and other cloud services; and search and news advertising, which includes Bing, Microsoft News and Edge, and third-party affiliates. The company sells its products through OEMs, distributors, and resellers; and directly through digital marketplaces, online, and retail stores. The company was founded in 1975 and is headquartered in Redmond, Washington.",36.396107,28.19383,3189.6 B,468.35,9.1%,496.38,15.7%,0.77%,False
AXP,265.75,47.7,270.0,2027-01-15,0.19548447789275625,"American Express Company, together with its subsidiaries, operates as integrated payments company in the United States, Europe, the Middle East and Africa, the Asia Pacific, Australia, New Zealand, Latin America, Canada, the Caribbean, and Internationally. It operates through four segments: U.S. Consumer Services, Commercial Services, International Card Services, and Global Merchant and Network Services. The company's products and services include credit card, charge card, banking, and other payment and financing products; network services; expense management products and services; and travel and lifestyle services. It also provides merchant acquisition and processing, servicing and settlement, point-of-sale marketing, and information products and services for merchants; and fraud prevention services, as well as the design and operation of customer loyalty programs. In addition, the company operates lounges at airports under Centurion Lounge brand name. It sells its products and services to consumers, small businesses, mid-sized companies, and large corporations through mobile and online applications, affiliate marketing, customer referral programs, third-party service providers and business partners, direct mail, telephone, in-house sales teams, and direct response advertising. American Express Company was founded in 1850 and is headquartered in New York, New York.",19.8469,17.799732,188.9 B,272.41,2.5%,254.87,-4.1%,1.05%,False
KKR,132.14999389648438,33.5,125.0,2027-01-15,0.1993946827130093,"KKR & Co. Inc. is a private equity and real estate investment firm specializing in direct and fund of fund investments. It specializes in acquisitions, leveraged buyouts, management buyouts, credit special situations, growth equity, mature, mezzanine, distressed, turnaround, lower middle market and middle market investments. The firm considers investments in all industries with a focus on software, security, semiconductors, consumer electronics, internet of things (iot), internet, information services, information technology infrastructure, financial technology, network and cyber security architecture, engineering and operations, content, technology and hardware, energy and infrastructure, real estate, services industry with a focus on business services, intelligence, industry-leading franchises and companies in natural resource, containers and packaging, agriculture, airports, ports, forestry, electric utilities, textiles, apparel and luxury goods, household durables, digital media, insurance, brokerage houses, non-durable goods distribution, supermarket retailing, grocery stores, food, beverage, and tobacco, hospitals, entertainment venues and production companies, publishing, printing services, capital goods, financial services, specialized finance, pipelines, and renewable energy. In energy and infrastructure, it focuses on the upstream oil and gas and equipment, minerals and royalties and services verticals. In real estate, the firm seeks to invest in private and public real estate securities including property-level equity, debt and special situations transactions and businesses with significant real estate holdings, and oil and natural gas properties. The firm also invests in asset services sector that encompasses a broad array of B2B, B2C and B2G services verticals including asset-based, transport, logistics, leisure/hospitality, resource and utility support, infra-like, mission-critical, and environmental services. Within Americas, the firm prefers to invest in consumer products; chemicals, metals and mining; energy and natural resources; financial services; healthcare; industrials; media and communications; retail; and technology. Within Europe, the firm invests in consumer and retail; energy; financial services; health care; industrials and chemicals; media and digital; and telecom and technologies. Within Asia, it invests in consumer products; energy and resources; financial services; healthcare; industrials; logistics; media and telecom; retail; real estate; and technology. It also seeks to make impact investments focused on identifying and investing behind businesses with positive social or environmental impact. The firm seeks to invest in mid to high-end residential developments, but can invest in other projects throughout Mainland China through outright ownership, joint ventures, and merger. It invests globally with a focus on Australia, emerging and developed Asia, Middle East and Africa, Nordic, Southeast Asia, Asia Pacific, Ireland, Hong Kong, Japan, Taiwan, India, Vietnam, Malaysia, Singapore, Indonesia, France, Germany, Netherlands, United Kingdom, Caribbean, Mexico, South America, North America, Brazil, Latin America, Korea with a focus on South Korea, and United States of America. In the United States and Europe, the firm focuses on buyouts of large, publicly traded companies. For middle market it seeks to invest in companies with enterprise values between $200 million to $1000 million. The firm prefers to invest in a range of debt and public equity investing and may co-invest. It seeks a board seat in its portfolio companies and a controlling ownership of a company or a strategic minority positions. The firm may acquire majority and minority equity interests, particularly when making private equity investments in Asia or sponsoring investments as part of a large investor consortium. The firm typically holds its investment for a period of five to seven years and more and exits through initial public offerings, secondary offerings, and sales to strategic buyers. KKR & Co. Inc. was founded in 1976 and is based in New York, New York with additional offices across North America, Europe, Australia, Sweden and Asia.",31.315166,21.771004,121.8 B,134.85,2.0%,138.93,5.1%,0.53%,False
GOOGL,162.08009338378906,35.3,160.0,2027-01-15,0.20495981907876626,"Alphabet Inc. offers various products and platforms in the United States, Europe, the Middle East, Africa, the Asia-Pacific, Canada, and Latin America. It operates through Google Services, Google Cloud, and Other Bets segments. The Google Services segment provides products and services, including ads, Android, Chrome, devices, Gmail, Google Drive, Google Maps, Google Photos, Google Play, Search, and YouTube. It is also involved in the sale of apps and in-app purchases and digital content in the Google Play and YouTube; and devices, as well as in the provision of YouTube consumer subscription services. The Google Cloud segment offers infrastructure, cybersecurity, databases, analytics, AI, and other services; Google Workspace that include cloud-based communication and collaboration tools for enterprises, such as Gmail, Docs, Drive, Calendar, and Meet; and other services for enterprise customers. The Other Bets segment sells healthcare-related and internet services. The company was incorporated in 1998 and is headquartered in Mountain View, California.",23.220644,18.608507,2002.0 B,191.75,18.3%,201.46,24.3%,0.49%,False
NVO,125.41999816894531,26.8,125.0,2027-01-15,0.21033329784872,"Novo Nordisk A/S, together with its subsidiaries, engages in the research and development, manufacture, and distribution of pharmaceutical products in Europe, the Middle East, Africa, Mainland China, Hong Kong, Taiwan, North America, and internationally. It operates in two segments, Diabetes and Obesity Care, and Rare Disease. The Diabetes and Obesity care segment provides products for diabetes, obesity, cardiovascular, and other emerging therapy areas. The Rare Disease segment offers products in the areas of rare blood disorders, rare endocrine disorders, and hormone replacement therapy. The company also provides insulin pens, growth hormone pens, and injection needles. In addition, it offers smart solutions for diabetes treatment, such as smart insulin pens and Dose Check, an insulin dose guidance application. The company has a collaboration agreement with Aspen Pharmaceuticals to produce insulin products; and with Korro Bio, Inc. for the discovery and development of new genetic medicines to treat cardiometabolic diseases. Novo Nordisk A/S was founded in 1923 and is headquartered in Bagsvaerd, Denmark.",41.667774,28.832184,562.1 B,148.15,18.1%,149.47,19.2%,1.17%,False
APO,124.95999908447266,26.5,125.0,2027-01-15,0.21238797303116463,"Apollo Global Management, Inc. is a private equity firm specializing in investments in credit, private equity, infrastructure, secondaries and real estate markets. The firm prefers to invest in private and public markets. The firm's private equity investments include traditional buyouts, recapitalization, distressed buyouts and debt investments in real estate, corporate partner buyouts, distressed asset, corporate carve-outs, middle market, growth, venture capital, turnaround, bridge, corporate restructuring, special situation, acquisition, and industry consolidation transactions. For credit strategies, the firm focuses to invest in multi-sector credit, semi-liquid credit, direct lending, first lien, unitranche, whole loans and private credit. The firm provides its services to endowment and sovereign wealth funds, as well as other institutional and individual investors. It manages client focused portfolios. The firm launches and manages hedge funds for its clients. It also manages real estate funds and private equity funds for its clients. The firm invests in the fixed income and alternative investment markets across the globe. Its fixed income investments include income-oriented senior loans, bonds, collateralized loan obligations, structured credit, opportunistic credit, non-performing loans, distressed debt, mezzanine debt, and value oriented fixed income securities. The firm seeks to invest in chemicals, commodities, consumer and retail, oil and gas, metals, mining, agriculture, commodities, distribution and transportation, financial and business services, manufacturing and industrial, media distribution, cable, entertainment and leisure, telecom, technology, natural resources, energy, packaging and materials, and satellite and wireless industries. It also focuses on clean energy, sustainable industry, climate solutions, energy transition, industrial decarbonization, sustainable mobility, sustainable resource use, and sustainable real estate. It seeks to invest in companies based in across Africa, Asia, North America with a focus on United States, Western Europe and Europe. It employs a combination of contrarian, value, and distressed strategies to make its investments. The firm seeks to make investments in the range of $75 million and $1500 million. The firm seeks to invest in companies with Enterprise value between $750 million to $2500 million. The firm conducts in-house research to create its investment portfolio. It seeks to acquire minority and majority positions in its portfolio companies. Apollo Global Management, Inc. was founded in 1990 and is headquartered in New York, New York with additional offices in North America, Asia, Africa and Europe.",13.509189,14.530231,71.2 B,126.93,1.6%,127.5,2.0%,1.48%,False
ELV,528.4450073242188,91.35,550.0,2027-01-15,0.21365514123688234,"Elevance Health, Inc., together with its subsidiaries, operates as a health benefits company in the United States. The company operates through four segments: Health Benefits, CarelonRx, Carelon Services, and Corporate & Other. It offers a variety of health plans and services to program members; health products; an array of fee-based administrative managed care services; and specialty and other insurance products and services, such as stop loss, dental, vision, life, disability, and supplemental health insurance benefits. The company operates in the pharmacy services business; and markets and offers pharmacy services, including pharmacy benefit management, as well as home delivery and specialty pharmacies, claims adjudication, formulary management, pharmacy networks, rebate administration, a prescription drug database, and member services. In addition, it provides healthcare-related services and capabilities, including utilization management, behavioral health, integrated care delivery, palliative care, payment integrity services, subrogation services, and health and wellness programs, as well as services related to data management, information technology, and business operations. Further, the company is involved in the National Government Services business. The company provides its services under the Anthem Blue Cross and Blue Shield, Wellpoint, and Carelon brand names. The company was formerly known as Anthem, Inc. and changed its name to Elevance Health, Inc. in June 2022. Elevance Health, Inc. was incorporated in 2001 and is headquartered in Indianapolis, Indiana.",18.502977,12.681666,122.5 B,567.26,7.3%,602.6,14.0%,1.22%,False
AMZN,193.22999572753906,43.1,195.0,2027-01-15,0.23221034655369532,"Amazon.com, Inc. engages in the retail sale of consumer products, advertising, and subscriptions service through online and physical stores in North America and internationally. The company operates through three segments: North America, International, and Amazon Web Services (AWS). It also manufactures and sells electronic devices, including Kindle, Fire tablets, Fire TVs, Echo, Ring, Blink, and eero; and develops and produces media content. In addition, the company offers programs that enable sellers to sell their products in its stores; and programs that allow authors, independent publishers, musicians, filmmakers, Twitch streamers, skill and app developers, and others to publish and sell content. Further, it provides compute, storage, database, analytics, machine learning, and other services, as well as advertising services through programs, such as sponsored ads, display, and video advertising. Additionally, the company offers Amazon Prime, a membership program. The company's products offered through its stores include merchandise and content purchased for resale and products offered by third-party sellers. It serves consumers, sellers, developers, enterprises, content creators, advertisers, and employees. Amazon.com, Inc. was incorporated in 1994 and is headquartered in Seattle, Washington.",46.116943,33.20103,2028.1 B,201.2,4.1%,218.6,13.1%,N/A,False
AVGO,174.68499755859375,41.17,175.0,2027-01-15,0.23748463245958562,"Broadcom Inc. designs, develops, and supplies various semiconductor devices with a focus on complex digital and mixed signal complementary metal oxide semiconductor based devices and analog III-V based products worldwide. The company operates in two segments, Semiconductor Solutions and Infrastructure Software. It provides set-top box system-on-chips (SoCs); cable, digital subscriber line, and passive optical networking central office/consumer premise equipment SoCs; wireless local area network access point SoCs; Ethernet switching and routing custom silicon solutions; serializer/deserializer application specific integrated circuits; optical and copper, and physical layer devices; and fiber optic components and RF semiconductor devices. The company also offers RF front end modules and filter; Wi-Fi, Bluetooth, and global positioning system/global navigation satellite system SoCs; custom touch controllers; inductive charging; attached small computer system interface, and redundant array of independent disks controllers and adapters; peripheral component interconnect express; fiber channel host bus adapters; read channel based SoCs; custom flash controllers; preamplifiers; optocouplers, industrial fiber optics, and motion control encoders and subsystems; light emitting diode, ethernet PHYs, switch ICs, and camera microcontrollers. Its products are used in various applications, including enterprise and data center networking, home connectivity, set-top boxes, broadband access, telecommunication equipment, smartphones and base stations, data center servers and storage systems, factory automation, power generation and alternative energy systems, and electronic displays. Broadcom Inc. was founded in 1961 and is headquartered in Palo Alto, California.",139.736,28.309563,815.8 B,185.162,6.0%,192.71,10.3%,1.23%,False
NFLX,719.3499755859375,171.63,720.0,2027-01-15,0.23949402969498124,"Netflix, Inc. provides entertainment services. It offers TV series, documentaries, feature films, and games across various genres and languages. The company also provides members the ability to receive streaming content through a host of internet-connected devices, including TVs, digital video players, TV set-top boxes, and mobile devices. It has operations in approximately 190 countries. The company was incorporated in 1997 and is headquartered in Los Gatos, California.",44.93129,31.276087,308.7 B,722.4399,0.4%,698.1,-3.0%,N/A,False
META,562.552490234375,145.2,560.0,2027-01-15,0.2535719106073002,"Meta Platforms, Inc. engages in the development of products that enable people to connect and share with friends and family through mobile devices, personal computers, virtual reality headsets, and wearables worldwide. It operates in two segments, Family of Apps and Reality Labs. The Family of Apps segment offers Facebook, which enables people to share, discuss, discover, and connect with interests; Instagram, a community for sharing photos, videos, and private messages, as well as feed, stories, reels, video, live, and shops; Messenger, a messaging application for people to connect with friends, family, communities, and businesses across platforms and devices through text, audio, and video calls; and WhatsApp, a messaging application that is used by people and businesses to communicate and transact privately. The Reality Labs segment provides augmented and virtual reality related products comprising consumer hardware, software, and content that help people feel connected, anytime, and anywhere. The company was formerly known as Facebook, Inc. and changed its name to Meta Platforms, Inc. in October 2021. The company was incorporated in 2004 and is headquartered in Menlo Park, California",28.80453,23.24597,1423.2 B,573.98,2.0%,568.06,1.0%,0.35%,False
DHI,191.4550018310547,45.48,195.0,2027-01-15,0.25606538194393247,"D.R. Horton, Inc. operates as a homebuilding company in East, North, Southeast, South Central, Southwest, and Northwest regions in the United States. It engages in the acquisition and development of land; and construction and sale of residential homes in 118 markets across 33 states under the names of D.R. Horton, America's Builder, Express Homes, Emerald Homes, and Freedom Homes. The company constructs and sells single-family detached homes; and attached homes, such as townhomes, duplexes, and triplexes. It also provides mortgage financing services; and title insurance policies, and examination and closing services, as well as engages in the residential lot development business. In addition, the company develops, constructs, owns, leases, and sells multi-family and single-family rental properties; and owns non-residential real estate, including ranch land and improvements. It primarily serves homebuyers. D.R. Horton, Inc. was founded in 1978 and is headquartered in Arlington, Texas.",12.883917,12.018518,62.4 B,199.85,4.4%,189.21,-1.2%,0.62%,False
GEV,256.8410949707031,62.94,260.0,2027-01-15,0.25735330647471555,"GE Vernova Inc., an energy company, engages in the provision of various products and services that generate, transfer, orchestrate, convert, and store electricity in the United States, Europe, Asia, the Americas, the Middle East, and Africa. The company operates through three segments: Power, Wind, and Electrification. The Power segment designs, manufactures, and services gas, nuclear, hydro, and steam technologies. The Wind segment offers wind generation technologies, including onshore and offshore wind turbines and blades. The Electrification segment provides grid solutions, power conversion, solar, and storage solutions; and electrification software for the transmission, distribution, conversion, storage, and orchestration of electricity from point of generation to point of consumption. The company was incorporated in 2023 and is headquartered in Cambridge, Massachusetts.",64.69549,40.898262,70.6 B,257.5,0.3%,236.11,-8.1%,N/A,False
ULTA,400.4700012207031,104.8,400.0,2027-01-15,0.26051888646160926,"Ulta Beauty, Inc. operates as a specialty beauty retailer in the United States. The company offers branded and private label beauty products, including cosmetics, fragrance, haircare, skincare, bath and body products, professional hair products, and salon styling tools through its Ulta Beauty stores, shop-in-shops, Ulta.com website, and its mobile applications. It also offers beauty services, including hair, makeup, brow, and skin services at its stores. The company was formerly known as ULTA Salon, Cosmetics & Fragrance, Inc. and changed its name to Ulta Beauty, Inc. in January 2017. Ulta Beauty, Inc. was incorporated in 1990 and is based in Bolingbrook, Illinois.",16.08879,16.075874,18.9 B,574.76,43.5%,398.92,-0.4%,N/A,False
