Ticker,Stock Price,Call Contract Price,Strike Price,Expiration Date,Breakeven increase,Company Description,P/E Ratio,Forward P/E,Market Cap,52 Week High,52-week-upside,1y Target Est,1y-target-upside,Dividend Yield,Attractiveness
KO,71.08000183105469,6.51,70.0,2026-01-16,0.07639276912023041,"The Coca-Cola Company, a beverage company, manufactures, markets, and sells various nonalcoholic beverages worldwide. The company provides sparkling soft drinks, sparkling flavors; water, sports, coffee, and tea; juice, value-added dairy, and plant-based beverages; and other beverages. It also offers beverage concentrates and syrups, as well as fountain syrups to fountain retailers, such as restaurants and convenience stores. The company sells its products under the Coca-Cola, Diet Coke/Coca-Cola Light, Coca-Cola Zero Sugar, caffeine free Diet Coke, Cherry Coke, Fanta Orange, Fanta Zero Orange, Fanta Zero Sugar, Fanta Apple, Sprite, Sprite Zero Sugar, Simply Orange, Simply Apple, Simply Grapefruit, Fresca, Schweppes, Thums Up, Aquarius, Ayataka, BODYARMOR, Ciel, Costa, Dasani, dogadan, FUZE TEA, Georgia, glacéau smartwater, glacéau vitaminwater, Gold Peak, Ice Dew, I LOHAS, Powerade, Topo Chico, AdeS, Del Valle, fairlife, innocent, Minute Maid, and Minute Maid Pulpy brands. It operates through a network of independent bottling partners, distributors, wholesalers, and retailers, as well as through bottling and distribution operators. The company was founded in 1886 and is headquartered in Atlanta, Georgia.",28.89431,25.847273,306.3 B,73.53,3.4%,64.36,-9.5%,2.73%,False
T,21.450000762939453,1.88,22.0,2026-01-16,0.113286673689029,"AT&T Inc. provides telecommunications and technology services worldwide. The company operates through two segments, Communications and Latin America. The Communications segment offers wireless voice and data communications services; and sells handsets, wireless data cards, wireless computing devices, carrying cases/protective covers, and wireless chargers through its own company-owned stores, agents, and third-party retail stores. It also provides Virtual Private Networks, AT&T Dedicated Internet, Ethernet, data services, cloud solutions, outsourcing, and managed professional services, as well as customer premises equipment for multinational corporations, small and mid-sized businesses, governmental, and wholesale customers. In addition, this segment offers broadband services, including fiber connections, legacy telephony voice communication services, and other VoIP services and equipment to residential customers. This segment markets its communications services and products under the AT&T, AT&T Business, Cricket, AT&T PREPAID, and AT&T Fiber brand names. The Latin America segment provides postpaid and prepaid wireless services in Mexico under the AT&T and Unefon brand names, as well as sells smartphones through its owned stores, agents and third-party retail stores. The company was formerly known as SBC Communications Inc. and changed its name to AT&T Inc. in 2005. AT&T Inc. was incorporated in 1983 and is based in Dallas, Texas.",12.327586,10.412622,153.8 B,21.86,1.9%,19.29,-10.1%,5.17%,False
MA,488.17999267578125,54.55,490.0,2026-01-16,0.11546972053329552,"Mastercard Incorporated, a technology company, provides transaction processing and other payment-related products and services in the United States and internationally. The company offers integrated products and value-added services for account holders, merchants, financial institutions, digital partners, businesses, governments, and other organizations, such as programs that enable issuers to provide consumers with credits to defer payments; payment products and solutions that allow its customers to access funds in deposit and other accounts; prepaid programs services; and commercial credit, debit, and prepaid payment products and solutions. It also provides solutions that enable businesses or governments to make payments to businesses, including Virtual Card Number, which is generated dynamically from a physical card and leverages the credit limit of the funding account; a platform to optimize supplier payment enablement campaigns for financial institutions; and treasury intelligence platform that offers corporations with recommendations to enhance working capital performance and accelerate spend on cards. In addition, the company offers Mastercard Send, which partners with digital messaging and payment platforms to enable consumers to send money directly within applications to other consumers; and Mastercard Cross-Border Services enables a range of payment flows through a distribution network with a single point of access to send and receive money globally through various channels, including bank accounts, mobile wallets, cards, and cash payouts. Further, it provides cyber and intelligence solutions; insights and analytics, consulting, marketing, loyalty, processing, and payment gateway solutions for e-commerce merchants; and open banking and digital identity services. The company offers payment solutions and services under the MasterCard, Maestro, and Cirrus name. Mastercard Incorporated was founded in 1966 and is headquartered in Purchase, New York.",37.322628,29.390726,451.0 B,490.0,0.4%,517.31,6.0%,0.54%,False
TMUS,198.5399932861328,21.5,200.0,2026-01-16,0.11564424040640309,"T-Mobile US, Inc., together with its subsidiaries, provides mobile communications services in the United States, Puerto Rico, and the United States Virgin Islands. The company offers voice, messaging, and data services to customers in the postpaid, prepaid, and wholesale and other services. It also provides wireless devices, including smartphones, wearables, tablets, home broadband routers, and other mobile communication devices, as well as wireless devices and accessories; financing through equipment installment plans; reinsurance for device insurance policies and extended warranty contracts; leasing through JUMP! On Demand; and High Speed Internet services. In addition, the company offers services, devices, and accessories under the T-Mobile and Metro by T-Mobile brands through its owned and operated retail stores, T-Mobile app and customer care channels, and its websites. It also sells its devices to dealers and other third-party distributors for resale through independent third-party retail outlets and various third-party websites. The company was founded in 1994 and is headquartered in Bellevue, Washington.",24.879698,17.710972,231.7 B,205.28,3.4%,207.13,4.3%,1.31%,False
JPM,207.22999572753906,22.55,210.0,2026-01-16,0.12218310473620364,"JPMorgan Chase & Co. operates as a financial services company worldwide. It operates through four segments: Consumer & Community Banking (CCB), Corporate & Investment Bank (CIB), Commercial Banking (CB), and Asset & Wealth Management (AWM). The CCB segment offers deposit, investment and lending products, cash management, and payments and services; mortgage origination and servicing activities; residential mortgages and home equity loans; and credit cards, auto loans, leases, and travel services to consumers and small businesses through bank branches, ATMs, and digital and telephone banking. The CIB segment provides investment banking products and services, including corporate strategy and structure advisory, and equity and debt market capital-raising services, as well as loan origination and syndication; payments; and cash and derivative instruments, risk management solutions, prime brokerage, and research. This segment also offers securities services, including custody, fund accounting and administration, and securities lending products for asset managers, insurance companies, and public and private investment funds. The CB segment provides financial solutions, including lending, payments, investment banking, and asset management to small and midsized companies, local governments, nonprofit clients, and large corporations, as well as investors, developers, and owners of multifamily, office, retail, industrial, and affordable housing properties. The AWM segment offers multi-asset investment management solutions in equities, fixed income, alternatives, and money market funds to institutional clients and retail investors; and retirement products and services, brokerage, custody, estate planning, lending, deposits, and investment management products to high net worth clients. JPMorgan Chase & Co. was founded in 1799 and is headquartered in New York, New York.",11.544847,13.465237,589.6 B,225.48,8.8%,197.13,-4.9%,2.22%,False
WMT,78.83999633789062,8.59,80.0,2026-01-16,0.12366824093094886,"Walmart Inc. engages in the operation of retail, wholesale, other units, and eCommerce worldwide. The company operates through three segments: Walmart U.S., Walmart International, and Sam's Club. It operates supercenters, supermarkets, hypermarkets, warehouse clubs, cash and carry stores, and discount stores under Walmart and Walmart Neighborhood Market brands; membership-only warehouse clubs; ecommerce websites, such as walmart.com.mx, walmart.ca, flipkart.com, PhonePe and other sites; and mobile commerce applications. The company offers grocery and consumables, including dairy, meat, bakery, deli, produce, dry, chilled or frozen packaged foods, alcoholic and nonalcoholic beverages, floral, snack foods, candy, other grocery items, health and beauty aids, paper goods, laundry and home care, baby care, pet supplies, and other consumable items; fuel, tobacco and other categories. It is also involved in the provision of health and wellness products covering pharmacy, optical and hearing services, and over-the-counter drugs and other medical products; and home and apparel including home improvement, outdoor living, gardening, furniture, apparel, jewelry, tools and power equipment, housewares, toys, seasonal items, mattresses and tire and battery centers. In addition, the company offers consumer electronics and accessories, software, video games, office supplies, appliances, and third-party gift cards. Further, it operates digital payment platforms; and offers financial services and related products, including money transfers, bill payments, money orders, check cashing, prepaid access, co-branded credit cards, installment lending, and earned wage access. Additionally, the company markets lines of merchandise under private brands, including Allswell, Athletic Works, Equate, and Free Assembly. The company was formerly known as Wal-Mart Stores, Inc. and changed its name to Walmart Inc. in February 2018. Walmart Inc. was founded in 1945 and is based in Bentonville, Arkansas.",41.0625,31.919027,633.7 B,78.92,0.1%,73.28,-7.1%,1.05%,False
V,283.9599914550781,35.6,285.0,2026-01-16,0.1290322920393463,"Visa Inc. operates as a payment technology company in the United States and internationally. The company operates VisaNet, a transaction processing network that enables authorization, clearing, and settlement of payment transactions. It also offers credit, debit, and prepaid card products; tap to pay, tokenization, and click to pay services; Visa Direct, a solution that facilitates the delivery of funds to eligible cards, deposit accounts, and digital wallets; Visa B2B Connect, a multilateral business-to-business cross-border payments network; Visa Cross-Border Solution, a cross-border consumer payments solution; and Visa DPS that provides a range of value-added services, including fraud mitigation, dispute management, data analytics, campaign management, a suite of digital solutions, and contact center services. The company also provides acceptance solutions, which include Cybersource that provides modular and value-added services for connecting merchants to payment processing; risk and identity solutions, such as Visa Advanced Authorization, Visa Secure, Visa Risk and Decision Manager, Visa Consumer Authentication Service, and payment-decisioning solutions for fraud prevention; and Visa Consulting and Analytics, a payment consulting advisory services. It provides its services under the Visa, Visa Electron, Interlink, V PAY, and PLUS brand names. The company serves merchants, financial institutions, and government entities. Visa Inc. was founded in 1958 and is headquartered in San Francisco, California.",30.402569,28.254725,552.6 B,290.96,2.5%,278.23,-2.0%,0.73%,False
TGT,147.2899932861328,22.5,145.0,2026-01-16,0.13721235409798838,"Target Corporation operates as a general merchandise retailer in the United States. The company offers apparel for women, men, boys, girls, toddlers, and infants and newborns, as well as jewelry, accessories, and shoes; and beauty and personal care, baby gear, cleaning, paper products, and pet supplies. It also provides dry grocery, dairy, frozen food, beverages, candy, snacks, deli, bakery, meat, and food service; electronics, which includes video game hardware and software, toys, entertainment, sporting goods, and luggage; and furniture, lighting, storage, kitchenware, small appliances, home decor, bed and bath, home improvement, school/office supplies, greeting cards and party supplies, and other seasonal merchandise. In addition, the company sells merchandise through periodic design and creative partnerships, and shop-in-shop experience; and in-store amenities. Further, it sells its products through its stores; and digital channels, including Target.com. Target Corporation was incorporated in 1902 and is headquartered in Minneapolis, Minnesota.",15.215908,13.974382,67.9 B,181.86,23.5%,177.99,20.8%,3.04%,True
MSFT,423.0400085449219,56.85,425.0,2026-01-16,0.13901756398256415,"Microsoft Corporation develops and supports software, services, devices and solutions worldwide. The Productivity and Business Processes segment offers office, exchange, SharePoint, Microsoft Teams, office 365 Security and Compliance, Microsoft viva, and Microsoft 365 copilot; and office consumer services, such as Microsoft 365 consumer subscriptions, Office licensed on-premises, and other office services. This segment also provides LinkedIn; and dynamics business solutions, including Dynamics 365, a set of intelligent, cloud-based applications across ERP, CRM, power apps, and power automate; and on-premises ERP and CRM applications. The Intelligent Cloud segment offers server products and cloud services, such as azure and other cloud services; SQL and windows server, visual studio, system center, and related client access licenses, as well as nuance and GitHub; and enterprise services including enterprise support services, industry solutions, and nuance professional services. The More Personal Computing segment offers Windows, including windows OEM licensing and other non-volume licensing of the Windows operating system; Windows commercial comprising volume licensing of the Windows operating system, windows cloud services, and other Windows commercial offerings; patent licensing; and windows Internet of Things; and devices, such as surface, HoloLens, and PC accessories. Additionally, this segment provides gaming, which includes Xbox hardware and content, and first- and third-party content; Xbox game pass and other subscriptions, cloud gaming, advertising, third-party disc royalties, and other cloud services; and search and news advertising, which includes Bing, Microsoft News and Edge, and third-party affiliates. The company sells its products through OEMs, distributors, and resellers; and directly through digital marketplaces, online, and retail stores. The company was founded in 1975 and is headquartered in Redmond, Washington.",35.85085,30.632874,3144.5 B,468.35,10.7%,450.66,6.5%,0.71%,False
AAPL,222.66000366210938,30.0,225.0,2026-01-16,0.1452438507410032,"Apple Inc. designs, manufactures, and markets smartphones, personal computers, tablets, wearables, and accessories worldwide. The company offers iPhone, a line of smartphones; Mac, a line of personal computers; iPad, a line of multi-purpose tablets; and wearables, home, and accessories comprising AirPods, Apple TV, Apple Watch, Beats products, and HomePod. It also provides AppleCare support and cloud services; and operates various platforms, including the App Store that allow customers to discover and download applications and digital content, such as books, music, video, games, and podcasts. In addition, the company offers various services, such as Apple Arcade, a game subscription service; Apple Fitness+, a personalized fitness service; Apple Music, which offers users a curated listening experience with on-demand radio stations; Apple News+, a subscription news and magazine service; Apple TV+, which offers exclusive original content; Apple Card, a co-branded credit card; and Apple Pay, a cashless payment service, as well as licenses its intellectual property. The company serves consumers, and small and mid-sized businesses; and the education, enterprise, and government markets. It distributes third-party applications for its products through the App Store. The company also sells its products through its retail and online stores, and direct sales force; and third-party cellular network carriers, wholesalers, retailers, and resellers. Apple Inc. was founded in 1976 and is headquartered in Cupertino, California.",33.89041,32.792343,3385.3 B,237.23,6.5%,218.29,-2.0%,0.45%,False
GOOGL,151.16000366210938,25.3,150.0,2026-01-16,0.15969830479662583,"Alphabet Inc. offers various products and platforms in the United States, Europe, the Middle East, Africa, the Asia-Pacific, Canada, and Latin America. It operates through Google Services, Google Cloud, and Other Bets segments. The Google Services segment provides products and services, including ads, Android, Chrome, devices, Gmail, Google Drive, Google Maps, Google Photos, Google Play, Search, and YouTube. It is also involved in the sale of apps and in-app purchases and digital content in the Google Play and YouTube; and devices, as well as in the provision of YouTube consumer subscription services. The Google Cloud segment offers infrastructure, cybersecurity, databases, analytics, AI, and other services; Google Workspace that include cloud-based communication and collaboration tools for enterprises, such as Gmail, Docs, Drive, Calendar, and Meet; and other services for enterprise customers. The Other Bets segment sells healthcare-related and internet services. The company was incorporated in 1998 and is headquartered in Mountain View, California.",21.687233,17.334862,1866.3 B,191.75,26.9%,201.98,33.6%,0.53%,True
ZM,67.30000305175781,13.05,65.0,2026-01-16,0.15973248827306552,"Zoom Video Communications, Inc. provides unified communications platform in the Americas, the Asia Pacific, Europe, the Middle East, and Africa. The company offers Zoom Meetings that offers HD video, voice, chat, and content sharing through mobile devices, desktops, laptops, telephones, and conference room systems; Zoom Phone, an enterprise cloud phone system; and Zoom Chat enables users to share messages, images, audio files, and content in desktop, laptop, tablet, and mobile devices. It also provides Zoom Rooms, a software-based conference room system; Zoom Conference Room Connector, a gateway for SIP/H.323 endpoints to join Zoom meetings; Zoom Events, which enables users to manage and host internal and external virtual events; OnZoom, a prosumer-focused virtual event platform and marketplace for Zoom users to create, host, and monetize online events; and Zoom Webinars to provide video presentations to large audiences from many devices. In addition, the company offers Zoom Developer Platform that enables developers, platform integrators, service providers, and customers to build apps and integrations using Zoom's video-based communications solutions, as well as integrate Zoom's technology into their products and services; Zoom App Marketplace, which helps developers to publish their apps, as well as third-party integrations of Zoom; and Zoom Contact Center, an omnichannel contact center solution. It serves individuals; and education, entertainment/media, enterprise infrastructure, finance, government, healthcare, manufacturing, non-profit/not for profit and social impact, retail/consumer products, and software/Internet industries. The company was formerly known as Zoom Communications, Inc. and changed its name to Zoom Video Communications, Inc. in May 2012. The company was incorporated in 2011 and is headquartered in San Jose, California.",24.035715,12.746212,20.7 B,74.77,11.1%,75.3,11.9%,N/A,False
AMZN,184.52000427246094,32.12,185.0,2026-01-16,0.17667458797259794,"Amazon.com, Inc. engages in the retail sale of consumer products, advertising, and subscriptions service through online and physical stores in North America and internationally. The company operates through three segments: North America, International, and Amazon Web Services (AWS). It also manufactures and sells electronic devices, including Kindle, Fire tablets, Fire TVs, Echo, Ring, Blink, and eero; and develops and produces media content. In addition, the company offers programs that enable sellers to sell their products in its stores; and programs that allow authors, independent publishers, musicians, filmmakers, Twitch streamers, skill and app developers, and others to publish and sell content. Further, it provides compute, storage, database, analytics, machine learning, and other services, as well as advertising services through programs, such as sponsored ads, display, and video advertising. Additionally, the company offers Amazon Prime, a membership program. The company's products offered through its stores include merchandise and content purchased for resale and products offered by third-party sellers. It serves consumers, sellers, developers, enterprises, content creators, advertisers, and employees. Amazon.com, Inc. was incorporated in 1994 and is headquartered in Seattle, Washington.",44.038185,34.88091,1936.6 B,201.2,9.0%,198.12,7.4%,N/A,False
CMG,55.790000915527344,10.2,56.0,2026-01-16,0.1865925598430196,"Chipotle Mexican Grill, Inc., together with its subsidiaries, owns and operates Chipotle Mexican Grill restaurants. It sells food and beverages through offering burritos, burrito bowls, quesadillas, tacos, and salads. The company also provides delivery and related services its app and website. It has operations in the United States, Canada, France, Germany, and the United Kingdom. Chipotle Mexican Grill, Inc. was founded in 1993 and is headquartered in Newport Beach, California.",54.69608,43.248062,76.4 B,69.2614,24.1%,62.65,12.3%,N/A,False
UBER,70.11000061035156,13.35,70.0,2026-01-16,0.18884608863765417,"Uber Technologies, Inc. develops and operates proprietary technology applications in the United States, Canada, Latin America, Europe, the Middle East, Africa, and Asia excluding China and Southeast Asia. It operates through three segments: Mobility, Delivery, and Freight. The Mobility segment connects consumers with a range of transportation modalities, such as ridesharing, carsharing, micromobility, rentals, public transit, taxis, and other modalities; and offers riders in a variety of vehicle types, as well as financial partnerships products and advertising services. The Delivery segment allows to search for and discover restaurants to grocery, alcohol, convenience, and other retails; order a meal or other items; and Uber direct, a white-label Delivery-as-a-Service for retailers and restaurants, as well as advertising. The Freight segment manages transportation and logistics network, which connects shippers and carriers in digital marketplace including carriers upfronts, pricing, and shipment booking; and provides on-demand platform to automate logistics end-to-end transactions for small-and medium-sized business to global enterprises. The company was formerly known as Ubercab, Inc. and changed its name to Uber Technologies, Inc. in February 2011. Uber Technologies, Inc. was founded in 2009 and is headquartered in San Francisco, California.",76.20652,31.439463,147.3 B,82.14,17.2%,87.02,24.1%,N/A,False
NFLX,681.469970703125,130.63,680.0,2026-01-16,0.189531505201338,"Netflix, Inc. provides entertainment services. It offers TV series, documentaries, feature films, and games across various genres and languages. The company also provides members the ability to receive streaming content through a host of internet-connected devices, including TVs, digital video players, TV set-top boxes, and mobile devices. It has operations in approximately 190 countries. The company was incorporated in 1997 and is headquartered in Los Gatos, California.",42.5387,32.63745,292.5 B,711.33,4.4%,630.54,-7.5%,N/A,False
