Ticker,Stock Price,Call Contract Price,Strike Price,Expiration Date,Breakeven increase,Company Description,P/E Ratio,Forward P/E,Market Cap,52 Week High,52-week-upside,1y Target Est,1y-target-upside,Dividend Yield,Attractiveness
PH,671.8200073242188,18.9,680.0,2025-01-17,0.04030840460324736,"Parker-Hannifin Corporation manufactures and sells motion and control technologies and systems for various mobile, industrial, and aerospace markets worldwide. The company operates through two segments: Diversified Industrial and Aerospace Systems. The Diversified Industrial segment offers various motion-control systems and components, such as active and passive vibration control, high purity sealing, coatings, high temperature sealing, cryogenic valves and fittings, HVAC/R controls and monitoring, elastomeric, fabric reinforced, metal, precision cut seals, hydrogen and natural gas filters, electric and hydraulic pumps and motors, industrial air, gas filtration, electric and hydraulic valves, miniature pumps and valves, electromagnetic interface shielding, pneumatic actuators, regulators and valves, electromechanical and hydraulic actuators, power take offs, electronics, drives and controllers, process filtration solutions, engine filtration solutions, rubber to substrate adhesives, fluid condition monitoring, sensors and diagnostics, fluid conveyance hose and tubing, structural adhesives, high pressure connectors, fittings, valves and regulators, thermal management, high purity fittings. The Aerospace Systems segment offers products for use in commercial and defense airframe and engine programs, such as avionics, electric & hydraulic braking systems, electric power, electromechanical actuators, engine exhaust systems and components, fire detection and suppression, flight control systems, fluid conveyance, fuel systems & components, fuel tank inerting systems, hydraulic pumps & motors, hydraulic valves & actuators, pneumatics, seals, sensors, and thermal management products. The company sells its products to original equipment manufacturers, distributors, direct-sales employees, and sales representatives. Parker-Hannifin Corporation was founded in 1917 and is headquartered in Cleveland, Ohio.",30.303112,22.772032,86.5 B,712.42,6.0%,736.205,9.6%,0.97%,True
DHI,149.8699951171875,5.92,150.0,2025-01-17,0.04036835310551545,"D.R. Horton, Inc. operates as a homebuilding company in East, North, Southeast, South Central, Southwest, and Northwest regions in the United States. It engages in the acquisition and development of land; and construction and sale of residential homes in 125 markets across 36 states under the names of D.R. Horton. The company constructs and sells single-family detached homes; and attached homes, such as townhomes, duplexes, and triplexes. It provides mortgage financing services; and title insurance policies, and examination and closing services, as well as engages in the residential lot development business. In addition, the company develops, constructs, owns, leases, and sells multi-family and single-family rental properties; and owns non-residential real estate, including ranch land and improvements. It primarily serves homebuyers. D.R. Horton, Inc. was founded in 1978 and is headquartered in Arlington, Texas.",10.451185,9.451823,48.1 B,199.85,33.3%,185.53125,23.8%,1.07%,True
MELI,1823.8599853515625,77.7,1820.0,2025-01-17,0.040485571941644594,"MercadoLibre, Inc. operates online commerce platforms in the United States. It operates Mercado Libre Marketplace, an automated online commerce platform that enables businesses, merchants, and individuals to list merchandise and conduct sales and purchases digitally; and Mercado Pago FinTech platform, a financial technology solution platform, which facilitates transactions on and off its marketplaces by providing a mechanism that allows its users to send and receive payments online, as well as allows users to transfer money through their websites or on the apps. The company also offers Mercado Fondo that allows users to invest funds deposited in their Mercado Pago accounts; Mercado Credito, which extends loans to certain merchants and consumers; and Mercado Envios logistics solution that enables sellers on its platform to utilize third-party carriers and other logistics service providers, as well as fulfillment and warehousing services for sellers. In addition, it provides Mercado Libre Classifieds, an online classified listing service, where users can list and purchase motor vehicles, real estate, and services; Mercado Ads, an advertising platform, which enables large retailers and brands to promote their products and services on the web; and Mercado Shops, an online storefronts solution that enables users to set-up, manage, and promote their own digital stores. The company was incorporated in 1999 and is headquartered in Montevideo, Uruguay.",64.51574,40.10465,92.5 B,2161.73,18.5%,2290.844,25.6%,N/A,True
PDD,102.2699966430664,6.44,100.0,2025-01-17,0.04077445481383335,"PDD Holdings Inc., a multinational commerce group, owns and operates a portfolio of businesses. It operates Pinduoduo, an e-commerce platform that offers products in various categories, including agricultural produce, apparel, shoes, bags, mother and childcare products, food and beverage, electronic appliances, furniture and household goods, cosmetics and other personal care, sports and fitness items and auto accessories; and Temu, an online marketplace. It focuses on bringing businesses and people into the digital economy. The company was formerly known as Pinduoduo Inc. and changed its name to PDD Holdings Inc. in February 2023. The company was incorporated in 2015 and is based in Dublin, Ireland.",10.115727,1.103435,142.0 B,164.69,61.0%,149.87898,46.6%,N/A,True
BHP,51.66999816894531,1.33,52.5,2025-01-17,0.041803791515380606,"BHP Group Limited operates as a resources company in Australia, Europe, China, Japan, India, South Korea, the rest of Asia, North America, South America, and internationally. The company operates through Copper, Iron Ore, and Coal segments. It engages in the mining of copper, uranium, gold, zinc, lead, molybdenum, silver, iron ore, cobalt, and metallurgical and energy coal. The company is also involved in the mining, smelting, and refining of nickel, as well as potash development activities. In addition, it provides towing, freight, marketing and trading, marketing support, finance, administrative, and other services. The company was founded in 1851 and is headquartered in Melbourne, Australia.",16.614147,11.164312,133.0 B,69.11,33.8%,55.8,8.0%,5.65%,True
UNH,520.47998046875,22.4,520.0,2025-01-17,0.04211500990203043,"UnitedHealth Group Incorporated operates as a diversified health care company in the United States. The company operates through four segments: UnitedHealthcare, Optum Health, Optum Insight, and Optum Rx. The UnitedHealthcare segment offers consumer-oriented health benefit plans and services for national employers, public sector employers, mid-sized employers, small businesses, and individuals; health care coverage, and health and well-being services to individuals age 50 and older addressing their needs; Medicaid plans, children's health insurance and health care programs; and health and dental benefits, and hospital and clinical services, as well as health care benefits products and services to state programs caring for the economically disadvantaged, medically underserved, and those without the benefit of employer-funded health care coverage. The Optum Health segment provides care delivery, care management, wellness and consumer engagement, and health financial services patients, consumers, care delivery systems, providers, employers, payers, and public-sector entities. The Optum Insight segment offers software and information products, advisory consulting arrangements, and managed services outsourcing contracts to hospital systems, physicians, health plans, governments, life sciences companies, and other organizations. The Optum Rx segment provides pharmacy care services and programs, including retail network contracting, home delivery, specialty and community health pharmacy services, infusion, and purchasing and clinical capabilities, as well as develops programs in the areas of step therapy, formulary management, drug adherence, and disease/drug therapy management. UnitedHealth Group Incorporated was founded in 1974 and is based in Minnetonka, Minnesota.",33.90749,17.400648,479.0 B,630.73,21.2%,636.20074,22.2%,1.61%,True
SOLV,69.55999755859375,2.5,70.0,2025-01-17,0.042265706506526834,"Solventum Corporation, a healthcare company, engages in the developing, manufacturing, and commercializing a portfolio of solutions to address critical customer and patient needs. It operates through four segments: Medsurg, Dental Solutions, Health Information Systems, and Purification and Filtration. The Medsurg segment is a provider of solutions including advanced wound care, I.V. site management, sterilization assurance, temperature management, surgical supplies, stethoscopes, and medical electrodes. The Dental Solutions segment provides a comprehensive suite of dental and orthodontic products including brackets, aligners, restorative cements, and bonding agents. The Health Information Systems provides software solutions including computer-assisted, physician documentation, direct-to-bill and coding automation, classification methodologies, speech, recognition, and data visualization platforms. The Purification and Filtration segment provides purification and filtration technologies including filters, purifiers, cartridges, and membranes. The company was incorporated in 2023 and is based in Saint Paul, Minnesota.",183.05263,12.677237,12.0 B,77.17,10.9%,73.765,6.0%,N/A,True
BABA,87.81999969482422,4.05,87.5,2025-01-17,0.042473244342263516,"Alibaba Group Holding Limited, through its subsidiaries, provides technology infrastructure and marketing reach to help merchants, brands, retailers, and other businesses to engage with their users and customers in the People's Republic of China and internationally. The company operates through seven segments: China Commerce, International Commerce, Local Consumer Services, Cainiao, Cloud, Digital Media and Entertainment, and Innovation Initiatives and Others. It operates Taobao and Tmall, which are digital retail platforms; Alimama, a proprietary monetization platform; 1688.com and Alibaba.com, which are online wholesale marketplaces; AliExpress, a retail marketplace; Lazada, Trendyol, and Daraz that are e-commerce platforms; Freshippo, a retail platform for groceries and fresh goods; and Tmall Global, an import e-commerce platform. The company also operates Cainiao Network logistic services platform; Ele.me, an on-demand delivery and local services platform; Koubei, a restaurant and local services guide platform; and Fliggy, an online travel platform. In addition, it offers pay-for-performance, in-feed, and display marketing services; and Taobao Ad Network and Exchange, a real-time online bidding marketing exchange. Further, the company provides elastic computing, storage, network, security, database, big data, and IoT services; and hardware, software license, software installation, and application development and maintenance services. Additionally, it operates Youku, an online video platform; Quark, a platform for information search, storage, and consumption; Alibaba Pictures and other content platforms that provide online videos, films, live events, news feeds, literature, music, and others; Amap, a mobile digital map, navigation, and real-time traffic information app; DingTalk, a business efficiency mobile app; and Tmall Genie smart speaker. The company was incorporated in 1999 and is based in Hangzhou, the People's Republic of China.",18.144627,1.2451289,210.3 B,117.82,34.2%,119.83762,36.5%,2.21%,True
ASML,718.5800170898438,29.27,720.0,2025-01-17,0.04270920729809147,"ASML Holding N.V. develops, produces, markets, sells, and services advanced semiconductor equipment systems for chipmakers. It offers advanced semiconductor equipment systems, including lithography, metrology, and inspection systems. The company also provides extreme ultraviolet lithography systems; and deep ultraviolet lithography systems comprising immersion and dry lithography solutions to manufacture various range of semiconductor nodes and technologies. In addition, it offers metrology and inspection systems, including YieldStar optical metrology systems to assess the quality of patterns on the wafers; and HMI electron beam solutions to locate and analyze individual chip defects. Further, the company provides computational lithography solutions, and lithography systems and control software solutions; and refurbishes and upgrades lithography systems, as well as offers customer support and related services. It operates in Japan, South Korea, Singapore, Taiwan, China, rest of Asia, the Netherlands, rest of Europe, the Middle East, Africa, and the United States. The company was formerly known as ASM Lithography Holding N.V. and changed its name to ASML Holding N.V. in 2001. ASML Holding N.V. was founded in 1984 and is headquartered in Veldhoven, the Netherlands.",38.905254,30.843044,282.5 B,1110.09,54.5%,916.1185,27.5%,0.94%,True
KLAC,653.760009765625,31.7,650.0,2025-01-17,0.04273738041026953,"KLA Corporation, together with its subsidiaries, engages in the design, manufacture, and marketing of process control, process-enabling, and yield management solutions for the semiconductor and related electronics industries worldwide. It operates through three segments: Semiconductor Process Control; Specialty Semiconductor Process; and PCB and Component Inspection. The company offers inspection and review tools to identify, locate, characterize, review, and analyze defects on various surfaces of patterned and unpatterned wafers; metrology systems that are used to measure pattern dimensions, film thickness, film stress, layer-to-layer alignment, pattern placement, surface topography, and electro-optical properties for wafers; chemical process control equipment; wired and wireless sensor wafers and reticles; wafer defect inspection, review, and metrology systems; reticle inspection and metrology systems; and semiconductor software solutions that provide run-time process control, defect excursion identification, process corrections, and defect classification to accelerate yield learning rates and reduce production risk. It also provides etch, plasma dicing, deposition, and other wafer processing technologies and solutions for the semiconductor and microelectronics industry. In addition, the company offers direct imaging, inspection, optical shaping, inkjet and additive printing, UV laser drilling, and computer-aided manufacturing and engineering solutions for the PCB market; inspection and electrical testing systems to identify and classify defects, as well as systems to repair defects for the display market; and inspection and metrology systems for quality control and yield improvement in advanced and traditional semiconductor packaging markets. The company was formerly known as KLA-Tencor Corporation and changed its name to KLA Corporation in July 2019. KLA Corporation was incorporated in 1975 and is headquartered in Milpitas, California.",29.852057,19.99446,87.4 B,896.32,37.1%,797.3204,22.0%,1.04%,True
HWM,113.43000030517578,3.3,115.0,2025-01-17,0.04293396528010063,"Howmet Aerospace Inc. provides advanced engineered solutions for the aerospace and transportation industries in the United States, Japan, France, Germany, the United Kingdom, Mexico, Italy, Canada, Poland, China, and internationally. It operates through four segments: Engine Products, Fastening Systems, Engineered Structures, and Forged Wheels. The Engine Products segment offers airfoils and seamless rolled rings primarily for aircraft engines and industrial gas turbines; and rotating and structural parts. The Fastening Systems segment produces aerospace fastening systems, as well as commercial transportation, industrial, and other fasteners; and latches, bearings, fluid fittings, and installation tools. The Engineered Structures segment provides titanium ingots and mill products, aluminum and nickel forgings, and machined components and assemblies for aerospace and defense applications; and titanium forgings, extrusions, and forming and machining services for airframe, wing, aero-engine, and landing gear components. The Forged Wheels segment offers forged aluminum wheels and related products for heavy-duty trucks and commercial transportation markets. The company was formerly known as Arconic Inc. Howmet Aerospace Inc. was founded in 1888 and is based in Pittsburgh, Pennsylvania.",43.626926,35.61415,46.1 B,120.71,6.4%,123.86909,9.2%,0.28%,True
PFE,25.579999923706055,0.69,26.0,2025-01-17,0.04339327910885804,"Pfizer Inc. discovers, develops, manufactures, markets, distributes, and sells biopharmaceutical products in the United States, Europe, and internationally. The company offers medicines and vaccines in various therapeutic areas, including cardiovascular metabolic, migraine, and women's health under the Eliquis, Nurtec ODT/Vydura, Zavzpret, and the Premarin family brands; infectious diseases with unmet medical needs under the Prevnar family, Abrysvo, Nimenrix, FSME/IMMUN-TicoVac, and Trumenba brands; and COVID-19 prevention and treatment, and potential future mRNA and antiviral products under the Comirnaty and Paxlovid brands. It also provides medicines and vaccines in various therapeutic areas, such as biosimilars for chronic immune and inflammatory diseases under the Xeljanz, Enbrel, Inflectra, Litfulo, Velsipity, and Cibinqo brands; amyloidosis, hemophilia, endocrine diseases, and sickle cell disease under the Vyndaqel family, Oxbryta, BeneFIX, Somavert, Ngenla, and Genotropin brands; sterile injectable and anti-infective medicines under the Sulperazon, Medrol, Zavicefta, Zithromax, and Panzyga brands; and biologics, small molecules, immunotherapies, and biosimilars under the Ibrance, Xtandi, Inlyta, Bosulif, Mektovi, Padcev, Adcetris, Talzenna, Tukysa, Elrexfio, Tivdak, Lorbrena, and Braftovi brands. In addition, the company involved in the contract manufacturing business. It serves wholesalers, retailers, hospitals, clinics, government agencies, pharmacies, individual provider offices, retail pharmacies, and integrated delivery systems. The company has collaboration agreements with Bristol-Myers Squibb Company; Astellas Pharma US, Inc.; Merck KGaA; and BioNTech SE, as well as has strategic clinical collaboration with Acepodia Inc. for the development of antibody-cell conjugation-based cell therapies in autoimmune diseases. Pfizer Inc. was founded in 1849 and is headquartered in New York, New York.",34.106667,8.837114,145.0 B,31.54,23.3%,32.12391,25.6%,6.72%,True
PBR,13.609999656677246,0.21,14.0,2025-01-17,0.044085257785321685,"Petróleo Brasileiro S.A. - Petrobras explores, produces, and sells oil and gas in Brazil and internationally. The company operates through three segments: Exploration and Production; Refining, Transportation and Marketing; and Gas and Power. The Exploration and Production segment explores, develops, and produces crude oil, natural gas liquids, and natural gas primarily for supplies to the domestic refineries. The Refining, Transportation and Marketing segment engages in the refining, logistics, transport, acquisition, and exports of crude oil; and production of fertilizers, as well as holding interests in petrochemical companies. The Gas and Power segment is involved in the logistic and trading of natural gas and electricity; transportation and trading of LNG; generation of electricity through thermoelectric power plants; renewable energy businesses; low carbon services; and natural gas processing business, as well as production of biodiesel and its co-products. The company also engages in prospecting, drilling, refining, processing, trading, and transporting crude oil from producing onshore and offshore oil fields, and shale or other rocks, as well as oil products, natural gas, and other liquid hydrocarbons. In addition, it engages in research, development, production, transport, distribution, and trading of energy. Petróleo Brasileiro S.A. - Petrobras was incorporated in 1953 and is headquartered in Rio de Janeiro, Brazil.",5.3164062,4.5565634,86.6 B,17.91,31.6%,16.77293,23.2%,12.87%,True
ADI,216.61000061035156,6.24,220.0,2025-01-17,0.0444577783228548,"Analog Devices, Inc. designs, manufactures, tests, and markets integrated circuits (ICs), software, and subsystems products in the United States, rest of North and South America, Europe, Japan, China, and rest of Asia. The company provides data converter products, which translate real-world analog signals into digital data, as well as translates digital data into analog signals; power management and reference products for power conversion, driver monitoring, sequencing, and energy management applications in the automotive, communications, industrial, and consumer markets; and power ICs that include performance, integration, and software design simulation tools for accurate power supply designs. It also offers amplifiers to condition analog signals; and radio frequency and microwave ICs to support cellular infrastructure; and micro-electro-mechanical systems technology solutions, including accelerometers used to sense acceleration, gyroscopes for sense rotation, inertial measurement units to sense multiple degrees of freedom, and broadband switches for radio and instrument systems, as well as isolators. In addition, the company provides digital signal processing and system products for numeric calculations. It serves clients in the industrial, automotive, consumer, instrumentation, aerospace, defense and healthcare, and communications markets through a direct sales force, third-party distributors, and independent sales representatives, as well as online. Analog Devices, Inc. was incorporated in 1965 and is headquartered in Wilmington, Massachusetts.",66.24159,24.0897,107.5 B,244.14,12.7%,251.7618,16.2%,1.65%,True
EME,479.2799987792969,20.61,480.0,2025-01-17,0.04450425904487898,"EMCOR Group, Inc. provides construction and facilities, building, and industrial services in the United States and the United Kingdom. It offers design, integration, installation, start-up, operation, and maintenance services related to power transmission, distribution, and generation systems; energy solutions; premises electrical and lighting systems; process instrumentation; low-voltage systems; voice and data communications systems; roadway and transit lighting, signaling, and fiber optic lines; computerized traffic control systems, and signal and communication equipment; heating, ventilation, air conditioning, refrigeration, and geothermal solutions; clean-room process ventilation systems; fire protection and suppression systems; plumbing, process, and high-purity piping systems; controls and filtration systems; water and wastewater treatment systems; central plant heating and cooling systems; crane and rigging services; millwright services; and steel fabrication, erection, and welding services. The company also provides building services that covers commercial and government site-based operations and maintenance; facility management, maintenance, and services; energy efficiency retrofit services; military base operations support services; services for indoor air quality; floor care and janitorial services; landscaping, lot sweeping, and snow removal services; vendor management and call center services; installation and support for building systems; program development, management, and maintenance for energy systems; technical consulting and diagnostic services; infrastructure and building projects; modification and retrofit projects; and other building services, including reception, security, and catering services. In addition, it offers refinery turnaround planning and engineering; welding; overhaul and maintenance; instrumentation and electrical; and renewable energy services. The company was incorporated in 1987 and is headquartered in Norwalk, Connecticut.",24.39084,21.054296,22.0 B,532.38,11.1%,540.0,12.7%,0.21%,True
SCCO,100.0,4.51,100.0,2025-01-17,0.04510000000000014,"Southern Copper Corporation engages in mining, exploring, smelting, and refining copper and other minerals in Peru, Mexico, Argentina, Ecuador, and Chile. The company is involved in the mining, milling, and flotation of copper ore to produce copper and molybdenum concentrates; smelting of copper concentrates to produce blister and anode copper; refining of anode copper to produce copper cathodes; production of molybdenum concentrate and sulfuric acid; production of refined silver, gold, and other materials; and mining and processing of zinc, copper, molybdenum, silver, gold, and lead. It operates the Toquepala and Cuajone open-pit mines, and a smelter and refinery in Peru; and La Caridad, an open-pit copper mine, as well as a copper ore concentrator, a SX-EW plant, a smelter, refinery, and a rod plant in Mexico. The company also operates Buenavista, an open-pit copper mine, as well as two copper concentrators and two operating SX-EW plants in Mexico. In addition, it operates underground mines that produce zinc, lead, copper, silver, and gold; a coal mine; and a zinc refinery. The company has interests in 156,818 hectares and 502,688 hectares of concessions in Peru and Mexico; and 168,200 hectares and 28,453 hectares of exploration concessions in Argentina and Chile. Southern Copper Corporation was incorporated in 1952 and is based in Phoenix, Arizona. Southern Copper Corporation is a subsidiary of Americas Mining Corporation.",26.109661,20.735445,79.0 B,128.37404,28.4%,101.71159,1.7%,2.80%,False
