Ticker,Stock Price,Call Contract Price,Strike Price,Expiration Date,Breakeven increase,Company Description,P/E Ratio,Forward P/E,Market Cap,52 Week High,52-week-upside,1y Target Est,1y-target-upside,Dividend Yield,Attractiveness
SBUX,89.91000366210938,2.2,90.0,2025-01-17,0.025469872590559106,"Starbucks Corporation, together with its subsidiaries, operates as a roaster, marketer, and retailer of coffee worldwide. The company operates through three segments: North America, International, and Channel Development. Its stores offer coffee, tea, and other beverages, roasted whole beans and ground coffees, single serve products, and ready-to-drink beverages; and various food products, such as pastries, breakfast sandwiches, and lunch items. The company also licenses its trademarks through licensed stores, and grocery and foodservice accounts. The company offers its products under the Starbucks Coffee, Teavana, Seattle's Best Coffee, Ethos, and Starbucks Reserve brands. Starbucks Corporation was founded in 1971 and is based in Seattle, Washington.",27.163143,24.068876,101.9 B,103.32,14.9%,103.304,14.9%,2.77%,True
PLD,104.69999694824219,2.37,105.0,2025-01-17,0.02550146255570307,"Prologis, Inc. is the global leader in logistics real estate with a focus on high-barrier, high-growth markets. At September 30, 2024, the company owned or had investments in, on a wholly owned basis or through co-investment ventures, properties and development projects expected to total approximately 1.2 billion square feet (116 million square meters) in 20 countries. Prologis leases modern logistics facilities to a diverse base of approximately 6,700 customers principally across two major categories: business-to-business and retail/online fulfilment.",31.63142,39.193665,97.0 B,135.76,29.7%,130.33333,24.5%,3.72%,True
SHW,346.5199890136719,5.41,350.0,2025-01-17,0.025655117361721436,"The Sherwin-Williams Company engages in the development, manufacture, distribution, and sale of paints, coating, and related products to professional, industrial, commercial, and retail customers. It operates through three segments: Paint Stores Group, Consumer Brands Group, and Performance Coatings Group. The Paint Stores Group segment offers architectural paints and coatings, and protective and marine products, as well as OEM product finishes and related products for architectural and industrial paint contractors, and do-it-yourself homeowners. The Consumer Brands Group segment supplies a portfolio of branded and private-label architectural paints, stains, varnishes, industrial products, wood finishes products, wood preservatives, applicators, corrosion inhibitors, aerosols, caulks, and adhesives to retailers, including home centers and hardware stores, and dedicated dealers and distributors. The Performance Coatings Group segment develops and sells industrial coatings for wood finishing and general industrial applications, automotive refinish products, protective and marine coatings, coil coatings, packaging coatings, and performance-based resins and colorants. It serves retailers, dealers, jobbers, licensees, and other third-party distributors through its branches and direct sales staff, as well as through outside sales representatives. The company has operations primarily in the North and South America, the Caribbean, Europe, Asia, and Australia. The Sherwin-Williams Company was founded in 1866 and is headquartered in Cleveland, Ohio.",34.4796,27.152843,87.3 B,400.42,15.6%,386.4874,11.5%,0.83%,True
APO,174.85000610351562,4.4,175.0,2025-01-17,0.02602226901719784,"Apollo Global Management, Inc. is a private equity firm specializing in investments in credit, private equity, infrastructure, secondaries and real estate markets. The firm prefers to invest in private and public markets. The firm's private equity investments include traditional buyouts, recapitalization, distressed buyouts and debt investments in real estate, corporate partner buyouts, distressed asset, corporate carve-outs, middle market, growth, venture capital, turnaround, bridge, corporate restructuring, special situation, acquisition, and industry consolidation transactions. For credit strategies, the firm focuses to invest in multi-sector credit, semi-liquid credit, direct lending, first lien, unitranche, whole loans and private credit. The firm provides its services to endowment and sovereign wealth funds, as well as other institutional and individual investors. It manages client focused portfolios. The firm launches and manages hedge funds for its clients. It also manages real estate funds and private equity funds for its clients. The firm invests in the fixed income and alternative investment markets across the globe. Its fixed income investments include income-oriented senior loans, bonds, collateralized loan obligations, structured credit, opportunistic credit, non-performing loans, distressed debt, mezzanine debt, and value oriented fixed income securities. The firm seeks to invest in chemicals, commodities, consumer and retail, oil and gas, metals, mining, agriculture, commodities, distribution and transportation, financial and business services, manufacturing and industrial, media distribution, cable, entertainment and leisure, telecom, technology, natural resources, energy, packaging and materials, and satellite and wireless industries. It also focuses on clean energy, sustainable industry, climate solutions, energy transition, industrial decarbonization, sustainable mobility, sustainable resource use, and sustainable real estate. It seeks to invest in companies based in across Africa, Asia, North America with a focus on United States, Western Europe and Europe. It employs a combination of contrarian, value, and distressed strategies to make its investments. The firm seeks to make investments in the range of $75 million and $1500 million. The firm seeks to invest in companies with Enterprise value between $750 million to $2500 million. The firm conducts in-house research to create its investment portfolio. It seeks to acquire minority and majority positions in its portfolio companies. Apollo Global Management, Inc. was founded in 1990 and is headquartered in New York, New York with additional offices in North America, Asia, Africa and Europe.",18.444094,20.461014,98.9 B,189.49,8.4%,182.82353,4.6%,1.08%,True
CAT,367.57000732421875,7.25,370.0,2025-01-17,0.026335099390312644,"Caterpillar Inc. manufactures and sells construction and mining equipment, off-highway diesel and natural gas engines, industrial gas turbines, and diesel-electric locomotives in worldwide. Its Construction Industries segment offers asphalt pavers, compactors, road reclaimers, forestry machines, cold planers, material handlers, track-type tractors, excavators, telehandlers, motor graders, and pipelayers; compact track, wheel, track-type, backhoe, and skid steer loaders; and related parts and tools. The company's Resource Industries segment provides electric rope and hydraulic shovels, draglines, rotary drills, hard rock vehicles, tractors, mining trucks, wheel loaders, off-highway and articulated trucks, wheel tractor scrapers and dozers, fleet management products, landfill and soil compactors, machinery components, autonomous ready vehicles and solutions, work tools, and safety services and mining performance solutions, as well as related parts and services. Its Energy & Transportation segment offers reciprocating engine powered generator sets; reciprocating engines, drivetrain, and integrated systems and solutions; turbines, centrifugal gas compressors, and related services; and diesel-electric locomotives and components, and other rail-related products. The company's Financial Products segment provides operating and finance leases, installment sale contracts, revolving charge accounts, repair/rebuild financing services, working capital loans, and wholesale financing; and insurance and risk management products and services. Its All Other Operating segment offers filters and fluids, undercarriage, ground engaging tools, fluid transfer products, precision seals, and rubber sealing and connecting components; parts distribution; logistics solutions and distribution services; brand management and marketing strategy services; and digital investments services. Caterpillar Inc. was founded in 1925 and is headquartered in Irving, Texas.",17.064531,16.58607,177.5 B,418.5,13.9%,394.13525,7.2%,1.54%,True
ZTS,164.6999969482422,4.1,165.0,2025-01-17,0.026715258854197454,"Zoetis Inc. engages in the discovery, development, manufacture, and commercialization of animal health medicines, vaccines, and diagnostic products and services in the United States and internationally. The company commercializes products primarily across species, including livestock, such as cattle, swine, poultry, fish, and sheep and others; and companion animals comprising dogs, cats, and horses. It also offers parasiticides, vaccines, dermatology, other pharmaceutical, anti-infectives, animal health diagnostics, and medicated feed additives. In addition, the company provides animal health diagnostics, including point-of-care diagnostic products, instruments and reagents, rapid immunoassay tests, reference laboratory kits and services, and blood glucose monitors; and other non-pharmaceutical products, which include nutritionals, as well as products and services in biodevices, genetic tests, and precision animal health. It markets its products to veterinarians, livestock producers, and pet owners. The company has collaboration Blacksmith Medicines, Inc. to discover and develop novel antibiotics for animal health. Zoetis Inc. was founded in 1952 and is headquartered in Parsippany, New Jersey.",30.958645,25.687136,74.3 B,200.53,21.8%,214.21765,30.1%,1.21%,True
NFLX,932.1199951171875,27.4,930.0,2025-01-17,0.027120976929192686,"Netflix, Inc. provides entertainment services. It offers TV series, documentaries, feature films, and games across various genres and languages. The company also provides members the ability to receive streaming content through a host of internet-connected devices, including TVs, digital video players, TV set-top boxes, and mobile devices. It has operations in approximately 190 countries. The company was incorporated in 1997 and is headquartered in Los Gatos, California.",52.632412,38.9714,398.4 B,941.75,1.0%,837.88275,-10.1%,N/A,False
FTNT,97.80999755859375,3.0,97.5,2025-01-17,0.027502326025463653,"Fortinet, Inc. provides cybersecurity and convergence of networking and security solutions worldwide. It offers secure networking solutions focus on the convergence of networking and security; network firewall solutions that consist of FortiGate data centers, hyperscale, and distributed firewalls, as well as encrypted applications; wireless LAN solutions; and secure connectivity solutions, including FortiSwitch secure ethernet switches, FortiAP wireless local area network access points, FortiExtender 5G connectivity gateways, and other products. The company also provides the Fortinet Unified SASE solutions that include firewall, SD-WAN, Secure web gateway, cloud access services broker, data loss prevention, zero trust network access, and cloud security, including web application firewalls, virtualized firewalls, and cloud-native firewalls. In addition, it offers security operations solutions comprising FortiAI generative AI assistant, FortiSIEM security information and event management, FortiSOAR security orchestration, automation and response, FortiEDR endpoint detection and response, FortiXDR extended detection and response, FortiMDR managed detection and response service, FortiNDR network detection and response, FortiRecon digital risk protection, FortiDeceptor deception technology, FortiGuard SoCaaS, FortiSandbox sandboxing, FortiGuard incident response, and other products. Further, the company offers FortiGuard security services consisting of FortiGuard application security, content security, device security, NOC/SOC security, and web security services; FortiCare technical support services; and training services to customers and channel partners, as well as operates a FortiGuard Lab, a cybersecurity threat intelligence and research organization. It serves enterprise, communication and security service providers, government organizations, and small and medium-sized businesses. The company was incorporated in 2000 and is headquartered in Sunnyvale, California.",49.150753,40.383648,75.0 B,100.59,2.8%,96.63703,-1.2%,N/A,False
PANW,189.50999450683594,4.88,190.0,2025-01-17,0.02833626536235445,"Palo Alto Networks, Inc. provides cybersecurity solutions worldwide. The company's network security platforms include Prisma Access, a security services edge (SSE) solution, as well as Strata Cloud Manager, a network security management solution. It also provides cloud security solutions, including Prisma Cloud, a cloud native application protection platform; and Code to Cloud platform, as well as offers VM-Series and CN-Series virtual firewalls for inline network security on multi- and hybrid-cloud environments. In addition, the company provides security operation solutions through Cortex platform that includes Cortex XSIAM, an AI-driven security operations platform; Cortex XDR for the prevention, detection, and response to complex cybersecurity attacks; and Cortex XSOAR for security orchestration, automation, and response; and Cortex Xpanse for attack surface management, as well as offers threat intelligence and advisory services under the Unit 42 name. Further, it provides subscription services covering the areas of threat prevention, malware and persistent threat, URL filtering, laptop and mobile device protection, DNS security, Internet of Things security, SaaS security API, and SaaS security inline, as well as threat intelligence, and data loss prevention. Additionally, the company offers professional services, including architecture design and planning, implementation, configuration, and firewall migration; education services, such as certifications, as well as online and in-classroom training; and support services. It sells its products and services through its channel partners, as well as directly to medium to large enterprises, service providers, and government entities operating in various industries, including education, energy, financial services, government entities, healthcare, Internet and media, manufacturing, public sector, and telecommunications. The company was incorporated in 2005 and is headquartered in Santa Clara, California.",49.223377,52.229485,124.4 B,207.24,9.4%,204.24408,7.8%,N/A,True
APH,71.66000366210938,1.2,72.5,2025-01-17,0.028467711884436975,"Amphenol Corporation, together with its subsidiaries, primarily designs, manufactures, and markets electrical, electronic, and fiber optic connectors in the United States, China, and internationally. It operates through three segments: Harsh Environment Solutions, Communications Solutions, and Interconnect and Sensor Systems. The company offers connectors and connector systems, including harsh environment data, power, high-speed, fiber optic, and radio frequency interconnect products; busbars and power distribution systems; and other connectors. It also provides value-add products, such as backplane interconnect systems, cable assemblies and harnesses, and cable management products; other products comprising flexible and rigid printed circuit boards, hinges, other mechanical, and production related products. In addition, the company offers consumer device, network infrastructure, and other antennas; coaxial, power, and specialty cables; and sensors and sensor-based products. It sells its products through its sales force, independent representatives, and a network of electronics distributors to original equipment manufacturers, electronic manufacturing services companies, original design manufacturers, and service providers in the automotive, broadband communication, commercial aerospace, industrial, information technology and data communication, military, mobile device, and mobile network markets. Amphenol Corporation was founded in 1932 and is headquartered in Wallingford, Connecticut.",40.948574,33.26448,86.4 B,75.78,5.7%,77.08667,7.6%,0.94%,True
NKE,76.79000091552734,1.55,77.5,2025-01-17,0.02943090321041608,"NIKE, Inc., together with its subsidiaries, engages in the design, development, marketing, and sale of athletic footwear, apparel, equipment, accessories, and services worldwide. The company provides athletic and casual footwear, apparel, and accessories under the NIKE, Jumpman, Converse, Chuck Taylor, All Star, One Star, Star Chevron, and Jack Purcell trademarks. It also sells a line of performance equipment and accessories comprising bags, sport balls, socks, eyewear, timepieces, digital devices, bats, gloves, protective equipment, and other equipment for sports activities under the NIKE brand; and various plastic products to other manufacturers. In addition, the company markets apparel with licensed college and professional team, and league logos, as well as sells sports apparel; licenses unaffiliated parties to manufacture and sell apparel, digital devices, and applications and other equipment for sports activities under NIKE-owned trademarks; and operates digital platforms, including fitness and activity apps; sport, fitness, and wellness content; and digital services and features in retail stores. It sells its products to footwear stores; sporting goods stores; athletic specialty stores; department stores; skate, tennis, and golf shops; and other retail accounts through NIKE-owned retail stores, digital platforms, independent distributors, licensees, and sales representatives. The company was founded in 1964 and is headquartered in Beaverton, Oregon.",23.700617,29.207048,114.3 B,109.96,43.2%,86.47971,12.6%,2.08%,True
ABNB,134.99000549316406,4.0,135.0,2025-01-17,0.029705862239104874,"Airbnb, Inc., together with its subsidiaries, operates a platform that enables hosts to offer stays and experiences to guests worldwide. The company's marketplace connects hosts and guests online or through mobile devices to book spaces and experiences. It primarily offers private rooms, primary homes, and vacation homes. The company was formerly known as AirBed & Breakfast, Inc. and changed its name to Airbnb, Inc. in November 2010. Airbnb, Inc. was founded in 2007 and is headquartered in San Francisco, California.",46.87153,30.731932,84.3 B,170.1,26.0%,137.55861,1.9%,N/A,False
GILD,93.94999694824219,1.75,95.0,2025-01-17,0.02980312019914555,"Gilead Sciences, Inc., a biopharmaceutical company, discovers, develops, and commercializes medicines in the areas of unmet medical need in the United States, Europe, and internationally. The company provides Biktarvy, Genvoya, Descovy, Odefsey, Truvada, Complera/ Eviplera, Stribild, Sunlencs, and Atripla products for the treatment of HIV/AIDS; Veklury, an injection for intravenous use, for the treatment of COVID-19; and Epclusa, Harvoni, Vemlidy, and Viread for the treatment of viral hepatitis. It also offers Yescarta, Tecartus, and Trodelvy products for the treatment of oncology; Letairis, an oral formulation for the treatment of pulmonary arterial hypertension; and AmBisome, a liposomal formulation for the treatment of serious invasive fungal infections. The company has collaboration agreements with Arcus Biosciences, Inc.; Merck Sharp & Dohme Corp.; Pionyr Immunotherapeutics Inc.; Tizona Therapeutics, Inc.; Galapagos NV; Janssen Sciences Ireland Unlimited Company; Japan Tobacco, Inc.; Dragonfly Therapeutics, Inc.; Arcellx, Inc.; Everest Medicines; Merck & Co, Inc.; Tentarix Biotherapeutics Inc.; Marengo Therapeutics; and Assembly Biosciences, Inc. It also has research collaboration, option, and license agreement with Merus N.V. for the discovery of novel dual tumor-associated antigens (TAA) targeting trispecific antibodies. The company has a collaboration with Terray Therapeutics, Inc. to discover and develop small molecule therapies. The company was incorporated in 1987 and is headquartered in Foster City, California.",1043.8888,12.410619,117.1 B,98.9,5.3%,98.92,5.3%,3.33%,True
ADI,218.08999633789062,4.6,220.0,2025-01-17,0.029850079194019052,"Analog Devices, Inc. designs, manufactures, tests, and markets integrated circuits (ICs), software, and subsystems products in the United States, rest of North and South America, Europe, Japan, China, and rest of Asia. The company provides data converter products, which translate real-world analog signals into digital data, as well as translates digital data into analog signals; power management and reference products for power conversion, driver monitoring, sequencing, and energy management applications in the automotive, communications, industrial, and consumer markets; and power ICs that include performance, integration, and software design simulation tools for accurate power supply designs. It also offers amplifiers to condition analog signals; and radio frequency and microwave ICs to support cellular infrastructure; and micro-electro-mechanical systems technology solutions, including accelerometers used to sense acceleration, gyroscopes for sense rotation, inertial measurement units to sense multiple degrees of freedom, and broadband switches for radio and instrument systems, as well as isolators. In addition, the company provides digital signal processing and system products for numeric calculations. It serves clients in the industrial, automotive, consumer, instrumentation, aerospace, defense and healthcare, and communications markets through a direct sales force, third-party distributors, and independent sales representatives, as well as online. Analog Devices, Inc. was incorporated in 1965 and is headquartered in Wilmington, Massachusetts.",66.69419,24.275864,108.2 B,244.14,11.9%,251.90463,15.5%,1.65%,True
GS,582.7899780273438,15.25,585.0,2025-01-17,0.029959372382750704,"The Goldman Sachs Group, Inc., a financial institution, provides a range of financial services for corporations, financial institutions, governments, and individuals worldwide. It operates through Global Banking & Markets, Asset & Wealth Management, and Platform Solutions segments. The Global Banking & Markets segment provides financial advisory services, including strategic advisory assignments related to mergers and acquisitions, divestitures, corporate defense activities, restructurings, and spin-offs; and relationship lending, and acquisition financing, as well as secured lending, through structured credit and asset-backed lending and involved in financing under securities to resale agreements. This segment also offers client execution activities for cash and derivative instruments; credit and interest rate products; and provision of mortgages, currencies, commodities, and equities related products, as well as underwriting services. The Asset & Wealth Management segment manages assets across various classes, including equity, fixed income, hedge funds, credit funds, private equity, real estate, currencies, and commodities; and provides customized investment advisory solutions, wealth advisory services, personalized financial planning, and private banking services, as well as invests in corporate equity, credit, real estate, and infrastructure assets. The Platform Solutions segment offers credit cards and point-of-sale financing for purchase of goods or services. This segment also provides cash management services, such as deposit-taking and payment solutions for corporate and institutional clients. The Goldman Sachs Group, Inc. was founded in 1869 and is headquartered in New York, New York.",17.095629,13.64126,182.9 B,612.73,5.1%,605.5,3.9%,2.12%,True
SNPS,500.1600036621094,15.4,500.0,2025-01-17,0.030470241975178336,"Synopsys, Inc. provides electronic design automation software products used to design and test integrated circuits. It operates in three segments: Design Automation, Design IP, and Software Integrity. The company offers Digital and Custom IC Design solution that provides digital design implementation solutions; Verification solution that offers virtual prototyping, static and formal verification, simulation, emulation, field programmable gate array (FPGA)-based prototyping, and debug solutions; and FPGA design products that are programmed to perform specific functions. It also provides intellectual property (IP) solutions for USB, PCI Express, DDR, Ethernet, MIPI, HDMI, and Bluetooth low energy applications; logic libraries and embedded memories; processor cores, software, and application-specific instruction-set processor tools for embedded applications; security IP solutions; IP solutions for automotive market; and system-on-chip (SoC) infrastructure IP, datapath and building block IP, and verification IP products, as well as mathematical and floating-point components, and Arm AMBA interconnect fabric and peripherals. In addition, the company offers HAPS FPGA-based prototyping systems; virtual prototyping solutions; and Platform Architect solutions for SoC architecture analysis and optimization, as well as optical products, and mechatronic simulations. Further, it provides security and quality testing products, managed services, programs and professional services, and training that enable its customers to detect and remediate security vulnerabilities, and defects in the software development lifecycle, as well as manufacturing solutions. Additionally, the company provides intelligent orchestration solution, software risk manager, and black duck software composition analysis tools. It serves electronics, financial services, automotive, medicine, energy, and industrial areas. The company was incorporated in 1986 and is headquartered in Sunnyvale, California.",54.07135,28.932156,77.3 B,629.38,25.8%,637.7786,27.5%,N/A,True
