Ticker,Stock Price,Call Contract Price,Strike Price,Expiration Date,Breakeven increase,Company Description,P/E Ratio,Forward P/E,Market Cap,52 Week High,52-week-upside,1y Target Est,1y-target-upside,Dividend Yield,Attractiveness
XOM,110.83999633789062,3.7,110.0,2025-01-17,0.025802993112619577,"Exxon Mobil Corporation engages in the exploration and production of crude oil and natural gas in the United States and internationally. It operates through Upstream, Energy Products, Chemical Products, and Specialty Products segments. The Upstream segment explores for and produces crude oil and natural gas. The Energy Products segment offers fuels, aromatics, and catalysts, as well as licensing services. It sells its products under the Exxon, Esso, and Mobil brands. The Chemical Products segment manufactures and markets petrochemicals including olefins, polyolefins, and intermediates. The Specialty Products segment offers performance products, including lubricants, basestocks, waxes, synthetics, elastomers, and resins. The company also involves in the manufacturing, trade, transport, and sale of crude oil, natural gas, petroleum products, petrochemicals, and other specialty products; and pursuit lower-emission business opportunities, including carbon capture and storage, hydrogen, lower-emission fuels, and lithium. Exxon Mobil Corporation was founded in 1870 and is based in Spring, Texas.",13.820448,13.764003,487.2 B,126.34,14.0%,131.0176,18.2%,3.57%,True
PLD,111.12999725341797,4.03,110.0,2025-01-17,0.026095589114151885,"Prologis, Inc. is the global leader in logistics real estate with a focus on high-barrier, high-growth markets. At September 30, 2024, the company owned or had investments in, on a wholly owned basis or through co-investment ventures, properties and development projects expected to total approximately 1.2 billion square feet (116 million square meters) in 20 countries. Prologis leases modern logistics facilities to a diverse base of approximately 6,700 customers principally across two major categories: business-to-business and retail/online fulfilment.",33.574017,41.603336,102.9 B,135.76,22.2%,130.33333,17.3%,3.46%,True
HSBC,48.599998474121094,0.9,49.0,2025-01-17,0.026749003429930918,"HSBC Holdings plc provides banking and financial services worldwide. The company operates through Wealth and Personal Banking, Commercial Banking, and Global Banking and Markets segments. The Wealth and Personal Banking segment offers retail banking and wealth products, including current and savings accounts, mortgages and personal loans, credit and debit cards, and local and international payment services; and wealth management services comprising insurance and investment products, global asset management services, investment management, and private wealth solutions. This segment serves personal banking and high net worth individuals. The Commercial Banking segment provides credit and lending, treasury management, payment, cash management, commercial insurance, and investment services; commercial cards; international trade and receivables finance services; foreign exchange products; capital raising services on debt and equity markets; and advisory services. It serves small and medium sized enterprises, mid-market enterprises, and corporates. The Global Banking and Markets segment offers financing, advisory, and transaction services; and credit, rates, foreign exchange, equities, money markets, and securities services; and engages in principal investment activities. It serves government, corporate and institutional clients, and private investors. HSBC Holdings plc was founded in 1865 and is headquartered in London, the United Kingdom.",7.967213,34.964027,174.7 B,48.76,0.3%,57.0,17.3%,4.12%,False
CMCSA,39.91999816894531,0.99,40.0,2025-01-17,0.026803654311965186,"Comcast Corporation operates as a media and technology company worldwide. It operates through Residential Connectivity & Platforms, Business Services Connectivity, Media, Studios, and Theme Parks segments. The Residential Connectivity & Platforms segment provides residential broadband and wireless connectivity services, residential and business video services, sky-branded entertainment television networks, and advertising. The Business Services Connectivity segment offers connectivity services for small business locations, which include broadband, wireline voice, and wireless services, as well as solutions for medium-sized customers and larger enterprises; and small business connectivity services in the United Kingdom. The Media segment operates NBCUniversal's television and streaming business, including national and regional cable networks; the NBC and Telemundo broadcast networks and owned local broadcast television stations; and Peacock, a direct-to-consumer streaming services. It also operates international television networks comprising the Sky Sports networks, as well as other digital properties. The Studios segment operates NBCUniversal and Sky film and television studio production and distribution operations. The Theme Parks segment operates Universal theme parks in Orlando, Florida; Hollywood, California; Osaka, Japan; and Beijing, China. The company also offers a consolidated streaming platforms under the Philadelphia Flyers and the Wells Fargo Center arena in Philadelphia, Pennsylvania; and Xumo. Comcast Corporation was founded in 1963 and is headquartered in Philadelphia, Pennsylvania.",10.760107,9.14225,152.8 B,47.11,18.0%,48.05964,20.4%,3.11%,True
TM,175.86000061035156,5.6,175.0,2025-01-17,0.026953254709413565,"Toyota Motor Corporation designs, manufactures, assembles, and sells passenger vehicles, minivans and commercial vehicles, and related parts and accessories in Japan, North America, Europe, Asia, Central and South America, Oceania, Africa, and the Middle East. It operates through Automotive, Financial Services, and All Other segments. The company offers subcompact and compact cars; mini-vehicles; mid-size, luxury, sports, and specialty cars; recreational and sport-utility vehicles; pickup trucks; minivans; trucks; and buses. It offers vehicles under the Toyota and Lexus brand names. Further, the company provides financial services, such as retail financing and leasing, wholesale financing, insurance, and credit cards. Additionally, it operates GAZOO.com, a web portal for automobile information, as well as engages in telecommunications and other businesses. The company was founded in 1933 and is headquartered in Toyota, Japan.",8.46702,11.144487,231.8 B,255.23,45.1%,231.94379,31.9%,2.96%,True
UNP,234.97999572753906,6.4,235.0,2025-01-17,0.02732149284701224,"Union Pacific Corporation, through its subsidiary, Union Pacific Railroad Company, operates in the railroad business in the United States. The company offers transportation services for grain and grain products, fertilizers, food and refrigerated products, and coal and renewables to grain processors, animal feeders, ethanol producers, renewable biofuel producers, and other agricultural users; and construction products, industrial chemicals, plastics, forest products, specialized products, metals and ores, petroleum, liquid petroleum gases, soda ash, and sand, as well as finished automobiles, automotive parts, and merchandise in intermodal containers. Union Pacific Corporation was founded in 1862 and is headquartered in Omaha, Nebraska.",21.597425,19.328638,142.5 B,258.66,10.1%,257.11465,9.4%,2.28%,True
LMT,494.6499938964844,13.2,495.0,2025-01-17,0.027393118913797476,"Lockheed Martin Corporation, a security and aerospace company, engages in the research, design, development, manufacture, integration, and sustainment of technology systems, products, and services worldwide. The company operates through Aeronautics, Missiles and Fire Control, Rotary and Mission Systems, and Space segments. The Aeronautics segment offers combat and air mobility aircraft, unmanned air vehicles, and related technologies. The Missiles and Fire Control segment provides air and missile defense systems; tactical missiles and air-to-ground precision strike weapon systems; logistics; fire control systems; mission operations support, readiness, engineering support, and integration services; manned and unmanned ground vehicles; and energy management solutions. The Rotary and Mission Systems segment offers military and commercial helicopters, surface ships, sea and land-based missile defense systems, radar systems, sea and air-based mission and combat systems, command and control mission solutions, cyber solutions, and simulation and training solutions. The Space segment offers satellites; space transportation systems; strategic, advanced strike, and defensive systems; and classified systems and services in support of national security systems. This segment also provides network-enabled situational awareness and integrates space and ground global systems to help its customers gather, analyze, and securely distribute critical intelligence data. It serves primarily serves the U.S. government, as well as foreign military sales contracted through the U.S. government. The company was formerly known as The Lockheed Corporation and changed its name to Lockheed Martin Corporation in March 1995. Lockheed Martin Corporation was founded in 1912 and is based in Bethesda, Maryland.",17.889692,17.773888,117.2 B,618.95,25.1%,597.6429,20.8%,2.67%,True
IBM,230.82000732421875,7.15,230.0,2025-01-17,0.02742393412582267,"International Business Machines Corporation, together with its subsidiaries, provides integrated solutions and services worldwide. The company operates through Software, Consulting, Infrastructure, and Financing segments. The Software segment offers a hybrid cloud and AI platforms that allows clients to realize their digital and AI transformations across the applications, data, and environments in which they operate. The Consulting segment focuses on skills integration for strategy, experience, technology, and operations by domain and industry. The Infrastructure segment provides on-premises and cloud based server, and storage solutions, as well as life-cycle services for hybrid cloud infrastructure deployment. The Financing segment offers client and commercial financing, facilitates IBM clients' acquisition of hardware, software, and services. The company has a strategic partnership to various companies including hyperscalers, service providers, global system integrators, and software and hardware vendors that includes Adobe, Amazon Web services, Microsoft, Oracle, Salesforce, Samsung Electronics and SAP, and others. The company was formerly known as Computing-Tabulating-Recording Co. International Business Machines Corporation was incorporated in 1911 and is headquartered in Armonk, New York.",33.647232,21.46045,213.4 B,239.35,3.7%,216.3,-6.3%,2.89%,False
AXP,302.1400146484375,10.43,300.0,2025-01-17,0.027437561890663487,"American Express Company, together with its subsidiaries, operates as integrated payments company in the United States, Europe, the Middle East and Africa, the Asia Pacific, Australia, New Zealand, Latin America, Canada, the Caribbean, and Internationally. It operates through four segments: U.S. Consumer Services, Commercial Services, International Card Services, and Global Merchant and Network Services. The company's products and services include credit card, charge card, banking, and other payment and financing products; network services; expense management products and services; and travel and lifestyle services. It also provides merchant acquisition and processing, servicing and settlement, point-of-sale marketing, and information products and services for merchants; and fraud prevention services, as well as the design and operation of customer loyalty programs. In addition, the company operates lounges at airports under Centurion Lounge brand name. It sells its products and services to consumers, small businesses, mid-sized companies, and large corporations through mobile and online applications, affiliate marketing, customer referral programs, third-party service providers and business partners, direct mail, telephone, in-house sales teams, and direct response advertising. American Express Company was founded in 1850 and is headquartered in New York, New York.",22.216177,19.9741,212.8 B,307.82,1.9%,285.6974,-5.4%,0.93%,False
AAPL,248.1300048828125,4.95,250.0,2025-01-17,0.027485572010561343,"Apple Inc. designs, manufactures, and markets smartphones, personal computers, tablets, wearables, and accessories worldwide. The company offers iPhone, a line of smartphones; Mac, a line of personal computers; iPad, a line of multi-purpose tablets; and wearables, home, and accessories comprising AirPods, Apple TV, Apple Watch, Beats products, and HomePod. It also provides AppleCare support and cloud services; and operates various platforms, including the App Store that allow customers to discover and download applications and digital content, such as books, music, video, games, and podcasts, as well as advertising services include third-party licensing arrangements and its own advertising platforms. In addition, the company offers various subscription-based services, such as Apple Arcade, a game subscription service; Apple Fitness+, a personalized fitness service; Apple Music, which offers users a curated listening experience with on-demand radio stations; Apple News+, a subscription news and magazine service; Apple TV+, which offers exclusive original content; Apple Card, a co-branded credit card; and Apple Pay, a cashless payment service, as well as licenses its intellectual property. The company serves consumers, and small and mid-sized businesses; and the education, enterprise, and government markets. It distributes third-party applications for its products through the App Store. The company also sells its products through its retail and online stores, and direct sales force; and third-party cellular network carriers, wholesalers, retailers, and resellers. Apple Inc. was founded in 1976 and is headquartered in Cupertino, California.",40.810856,29.851196,3750.7 B,250.8,1.1%,245.78214,-0.9%,0.40%,False
COST,989.3499755859375,26.79,990.0,2025-01-17,0.027735407177638338,"Costco Wholesale Corporation, together with its subsidiaries, engages in the operation of membership warehouses in the United States, Puerto Rico, Canada, Mexico, Japan, the United Kingdom, Korea, Australia, Taiwan, China, Spain, France, Iceland, New Zealand, and Sweden. The company offers branded and private-label products in a range of merchandise categories. It offers merchandise, such as sundries, dry groceries, candies, coolers, freezers, deli, liquor, and tobacco; appliances, electronics, health and beauty aids, hardware, lawn and garden, sporting goods, tires, toys and seasonal products, office supplies, automotive care products, postages, tickets, apparel, small appliances, furniture, domestics, housewares, special order kiosks, and jewelry; and meat, produce, service deli, and bakery products. The company also operates gasoline, pharmacies, optical, food courts, hearing-aid centers, and tire installation centers; and offers business delivery, travel, grocery, and various other services online. It also operates e-commerce websites. The company was formerly known as Costco Companies, Inc. and changed its name to Costco Wholesale Corporation in August 1999. Costco Wholesale Corporation was founded in 1976 and is based in Issaquah, Washington.",58.12867,49.61762,439.2 B,1007.8,1.9%,1006.2771,1.7%,0.47%,False
ADP,296.760009765625,5.0,300.0,2025-01-17,0.02776651153530696,"Automatic Data Processing, Inc. engages in the provision of cloud-based human capital management (HCM) solutions worldwide. It operates in two segments, Employer Services and Professional Employer Organization (PEO). The Employer Services segment offers strategic, cloud-based platforms, and human resources (HR) outsourcing solutions. This segment's offerings include RUN Powered by ADP, a software platform for small business payroll, HR management, and tax compliance administration; ADP Workforce Now, a HCM solution used across mid-sized and large businesses to manage employees; and ADP Vantage HCM, a solution for HR management, benefits administration, payroll services, time and attendance management, and talent management. The PEO Services segment provides HR and employment administration outsourcing solutions under ADP TotalSource name to businesses through a co-employment model. The segment also provides employee benefits, protection and compliance, talent engagement, expertise, comprehensive outsourcing, and recruitment process outsourcing services. The company was founded in 1949 and is headquartered in Roseland, New Jersey.",31.739037,27.289932,120.9 B,309.63,4.3%,296.88187,0.0%,2.08%,False
MS,127.4000015258789,5.95,125.0,2025-01-17,0.027864979839894,"Morgan Stanley, a financial holding company, provides various financial products and services to corporations, governments, financial institutions, and individuals in the Americas, Europe, the Middle East, Africa, and Asia. It operates through Institutional Securities, Wealth Management, and Investment Management segments. The Institutional Securities segment offers capital raising and financial advisory services, including services related to the underwriting of debt, equity, and other securities, as well as advice on mergers and acquisitions, restructurings, real estate, and project finance. This segment also provides equity and fixed income products comprising sales, financing, prime brokerage, and market-making services; foreign exchange and commodities; corporate and commercial real estate loans, commercial mortgage and secured lending facilities, and financing for sales and trading customers, and asset-backed and mortgage lending; and wealth management services, investment, and research services. The Wealth Management segment offers financial advisor-led brokerage, custody, administrative, and investment advisory services; self-directed brokerage services; financial and wealth planning services; workplace services, including stock plan administration; annuity and insurance products; securities-based lending, residential real estate loans, and other lending products; banking; and retirement plan services to individual investors and small to medium-sized businesses and institutions. The Investment Management segment provides equity, fixed income, alternatives and solutions, and liquidity and overlay services to benefit/defined contribution plans, foundations, endowments, government entities, sovereign wealth funds, insurance companies, third-party fund sponsors, corporations, and individuals through institutional and intermediary channels. The company was founded in 1924 and is headquartered in New York, New York.",19.391172,15.866571,205.2 B,136.24,6.9%,126.67059,-0.6%,2.90%,False
ABEV,2.140000104904175,0.2,2.0,2025-01-17,0.02803733278251963,"Ambev S.A., through its subsidiaries, engages in the production, distribution, and sale of beer, draft beer, carbonated soft drinks, malt and food, other alcoholic beverages, and non-alcoholic and non-carbonated products in Brazil, Central America and Caribbean, Latin America South, and Canada. It offers beer primarily under the Skol, Brahma, Antarctica, Brahva, Budweiser, Bud Light, Beck, Leffe, Hoegaarden, Balboa ICE, Balboa, Atlas Golden Light, Atlas, Bucanero, Cristal, Mayabe, Presidente, Presidente Light, Brahma Light, Bohemia, The One, Corona, Modelo Especial, Stella Artois, Quilmes Clásica, Paceña, Taquiña, Huari, Becker, Cusqueña, Michelob Ultra, Busch, Pilsen, Ouro Fino, Bud 66, Banks, Deputy, Patricia, Labatt Blue, Alexander Keith's, and Kokanee brands. The company also provides carbonated soft drinks, bottled water, isotonic beverages, energy drinks, coconut water, powdered and natural juices, and ready-to-drink teas under the Guaraná Antarctica, Gatorade, H2OH!, Pepsi Black, Lipton Iced Tea, Fusion, Pepsi-Cola, Canada Dry, Squirt, Red Rock, Red Bull, Seven Up, Nutrl, Bud Light Seltzer, Palm Bay, and Mike's brands. It offers its products through a network of third-party distributors and a direct distribution system. The company was founded in 1885 and is headquartered in São Paulo, Brazil. Ambev S.A. is a subsidiary of Interbrew International B.V.",14.266666,11.939965,34.6 B,3.0,40.2%,3.059,42.9%,5.28%,True
C,71.01000213623047,3.01,70.0,2025-01-17,0.0281650162456355,"Citigroup Inc., a diversified financial service holding company, provides various financial product and services to consumers, corporations, governments, and institutions worldwide. It operates through five segments: Services, Markets, Banking, U.S. Personal Banking, and Wealth. The Services segment includes Treasury and Trade Solutions, which provides cash management, trade, and working capital solutions to multinational corporations, financial institutions, and public sector organizations; and Securities Services, such as cross-border support for clients, local market expertise, post-trade technologies, data solutions, and various securities services solutions. The Markets segment offers sales and trading services for equities, foreign exchange, rates, spread products, and commodities to corporate, institutional, and public sector clients; and market-making services, including asset classes, risk management solutions, financing, prime brokerage, research, securities clearing, and settlement. The banking segment includes investment banking; advisory services related to mergers and acquisitions, divestitures, restructurings, and corporate defense activities; and corporate lending, which includes corporate and commercial banking. The U.S. Personal Banking segment provides co-branded cards and retail banking services. The Wealth segment provides financial services to high-net-worth clients through banking, lending, mortgages, investment, custody, and trust product offerings; and to professional industries, including law firms, consulting groups, accounting, and asset management. The company was founded in 1812 and is headquartered in New York, New York.",20.23077,9.740741,134.3 B,73.38,3.3%,80.24789,13.0%,3.07%,True
SPGI,505.75,10.1,510.0,2025-01-17,0.02837370242214532,"S&P Global Inc., together with its subsidiaries, provides credit ratings, benchmarks, analytics, and workflow solutions in the global capital, commodity, and automotive markets. It operates through S&P Global Market Intelligence, S&P Global Ratings, S&P Global Commodity Insights, S&P Global Mobility, and S&P Dow Jones Indices segments. The S&P Global Market Intelligence segment offers multi-asset-class data and analytics integrated with purpose-built workflow solutions. This segment offers Desktop, a product suite that provides data, analytics, and third-party research; Data and Advisory Solutions for research, reference data, market data, derived analytics, and valuation services; Enterprise Solutions, software and workflow solutions; and Credit & Risk Solutions for selling Ratings' credit ratings and related data and research. The S&P Global Ratings segment operates as an independent provider of credit ratings, research, and analytics, offering investors and other market participants information, ratings, and benchmarks. The S&P Global Commodity Insights segment provides information and benchmark prices for the commodity and energy markets. The S&P Global Mobility segment provides solutions serving the full automotive value chain, including vehicle manufacturers (OEMs), automotive suppliers, mobility service providers, retailers, consumers, and finance and insurance companies. The S&P Dow Jones Indices segment is an index provider that maintains various valuation and index benchmarks for investment advisors, wealth managers, and institutional investors. S&P Global Inc. was founded in 1860 and is headquartered in New York, New York.",44.63813,30.033445,156.9 B,533.29,5.4%,579.9605,14.7%,0.72%,True
