Ticker,Stock Price,Call Contract Price,Strike Price,Expiration Date,Breakeven increase,Company Description,P/E Ratio,Forward P/E,Market Cap,52 Week High,52-week-upside,1y Target Est,1y-target-upside,Dividend Yield,Attractiveness
META,511.8299865722656,100.89,510.0,2026-01-16,0.1935408554140039,"Meta Platforms, Inc. engages in the development of products that enable people to connect and share with friends and family through mobile devices, personal computers, virtual reality headsets, and wearables worldwide. It operates in two segments, Family of Apps and Reality Labs. The Family of Apps segment offers Facebook, which enables people to share, discuss, discover, and connect with interests; Instagram, a community for sharing photos, videos, and private messages, as well as feed, stories, reels, video, live, and shops; Messenger, a messaging application for people to connect with friends, family, communities, and businesses across platforms and devices through text, audio, and video calls; and WhatsApp, a messaging application that is used by people and businesses to communicate and transact privately. The Reality Labs segment provides augmented and virtual reality related products comprising consumer hardware, software, and content that help people feel connected, anytime, and anywhere. The company was formerly known as Facebook, Inc. and changed its name to Meta Platforms, Inc. in October 2021. The company was incorporated in 2004 and is headquartered in Menlo Park, California",26.180563,23.33926,1294.8 B,544.23,6.3%,514.42,0.5%,0.39%,False
TSM,170.22999572753906,33.2,170.0,2026-01-16,0.19367916994623524,"Taiwan Semiconductor Manufacturing Company Limited, together with its subsidiaries, manufactures, packages, tests, and sells integrated circuits and other semiconductor devices in Taiwan, China, Europe, the Middle East, Africa, Japan, the United States, and internationally. It provides a range of wafer fabrication processes, including processes to manufacture complementary metal- oxide-semiconductor (CMOS) logic, mixed-signal, radio frequency, embedded memory, bipolar CMOS mixed-signal, and others. The company also offers customer and engineering support services; manufactures masks; and invests in technology start-up companies; researches, designs, develops, manufactures, packages, tests, and sells color filters; and provides investment services. Its products are used in high performance computing, smartphones, Internet of things, automotive, and digital consumer electronics. The company was incorporated in 1987 and is headquartered in Hsinchu City, Taiwan.",30.290035,20.584038,882.8 B,193.47,13.7%,199.75,17.3%,1.45%,False
AVGO,158.27000427246094,31.0,158.0,2026-01-16,0.19416184304031203,"Broadcom Inc. designs, develops, and supplies various semiconductor devices with a focus on complex digital and mixed signal complementary metal oxide semiconductor based devices and analog III-V based products worldwide. The company operates in two segments, Semiconductor Solutions and Infrastructure Software. It provides set-top box system-on-chips (SoCs); cable, digital subscriber line, and passive optical networking central office/consumer premise equipment SoCs; wireless local area network access point SoCs; Ethernet switching and routing custom silicon solutions; serializer/deserializer application specific integrated circuits; optical and copper, and physical layer devices; and fiber optic components and RF semiconductor devices. The company also offers RF front end modules and filter; Wi-Fi, Bluetooth, and global positioning system/global navigation satellite system SoCs; custom touch controllers; inductive charging; attached small computer system interface, and redundant array of independent disks controllers and adapters; peripheral component interconnect express; fiber channel host bus adapters; read channel based SoCs; custom flash controllers; preamplifiers; optocouplers, industrial fiber optics, and motion control encoders and subsystems; light emitting diode, ethernet PHYs, switch ICs, and camera microcontrollers. Its products are used in various applications, including enterprise and data center networking, home connectivity, set-top boxes, broadband access, telecommunication equipment, smartphones and base stations, data center servers and storage systems, factory automation, power generation and alternative energy systems, and electronic displays. Broadcom Inc. was founded in 1961 and is headquartered in Palo Alto, California.",128.6748,28.776365,739.2 B,185.162,17.0%,175.44,10.8%,1.34%,False
ON,70.58000183105469,14.6,70.0,2026-01-16,0.1986398102185456,"ON Semiconductor Corporation provides intelligent sensing and power solutions in the United States and internationally. The company operates through Power Solutions Group, Advanced Solutions Group, and Intelligent Sensing Group. Its intelligent power technologies enable the electrification of the automotive industry that allows for lighter and longer-range electric vehicles, empowers fast-charging systems, and propels sustainable energy for the solar strings, industrial power, and storage systems. In addition, the company offers analog, discrete, module, and integrated semiconductor products that perform multiple application functions, includes power switching and conversion, signal conditioning, circuit protection, signal amplification, and voltage regulation functions. Further, it designs and develops analog, mixed-signal, power management ICs and sensor interface devices for automotive, industrial, compute and mobile markets. Additionally, the company offers single photon detectors, including silicon photomultipliers and single photon avalanche diode arrays, as well as actuator drivers for autofocus and image stabilization for a broad base of end-users in the different end-markets. ON Semiconductor Corporation was incorporated in 1992 and is headquartered in Scottsdale, Arizona.",16.07745,14.890297,30.2 B,98.07,38.9%,86.49,22.5%,N/A,True
CRWD,253.52999877929688,59.15,250.0,2026-01-16,0.2193823274898583,"CrowdStrike Holdings, Inc. provides cybersecurity solutions in the United States and internationally. Its unified platform offers cloud-delivered protection of endpoints, cloud workloads, identity, and data. The company offers corporate endpoint and cloud workload security, managed security, security and vulnerability management, IT operations management, identity protection, SIEM and log management, threat intelligence, data protection, security orchestration, automation and response and AI powered workflow automation, and securing generative AI workload services. It primarily sells subscriptions to its Falcon platform and cloud modules. The company was incorporated in 2011 and is headquartered in Austin, Texas.",372.83823,59.097904,62.1 B,398.327,57.1%,322.37,27.2%,N/A,True
DKNG,38.439998626708984,10.06,37.0,2026-01-16,0.22424562126028924,"DraftKings Inc. operates as a digital sports entertainment and gaming company in the United States and internationally. It provides online sports betting and casino, daily fantasy sports, media, and other consumer products, as well as retails sportsbooks. The company also engages in the design and development of sports betting and casino gaming software for online and retail sportsbooks, and iGaming operators. In addition, it offers DraftKings marketplace, a digital collectibles ecosystem designed for mainstream accessibility that offers curated NFT drops and supports secondary-market transactions. The company was founded in 2012 and is headquartered in Boston, Massachusetts.",N/A,54.140846,18.7 B,49.57,29.0%,48.89,27.2%,N/A,True
SHOP,71.5199966430664,18.15,70.0,2026-01-16,0.23252242921554744,"Shopify Inc., a commerce company, provides a commerce platform and services in Canada, the United States, Europe, the Middle East, Africa, the Asia Pacific, Australia, China, and Latin America. The company's platform enables merchants to displays, manages, markets, and sells its products through various sales channels, including web and mobile storefronts, physical retail locations, pop-up shops, social media storefronts, native mobile apps, buy buttons, and marketplaces; and enables to manage products and inventory, process orders and payments, fulfill and ship orders, new buyers and build customer relationships, source products, leverage analytics and reporting, manage cash, payments and transactions, and access financing. It also sells custom themes and apps, and registration of domain names; and merchant solutions, which include accepting payments, shipping, and securing working capital. The company was formerly known as Jaded Pixel Technologies Inc. and changed its name to Shopify Inc. in November 2011. Shopify Inc. was incorporated in 2004 and is headquartered in Ottawa, Canada.",72.24242,39.733334,92.0 B,91.57,28.0%,108.71,52.0%,N/A,True
CCJ,39.97999954223633,9.28,40.0,2026-01-16,0.2326163222673081,"Cameco Corporation provides uranium for the generation of electricity. It operates through Uranium, Fuel Services, Westinghouse segments. The Uranium segment is involved in the exploration for, mining, and milling, purchase, and sale of uranium concentrate. The Fuel Services segment engages in the refining, conversion, and fabrication of uranium concentrate, as well as the purchase and sale of conversion services. This segment also produces CANDU reactor fuel bundles and other reactor components. The company offers nuclear fuel processing services. The Westinghouse segment engages in the manufacture of nuclear reactor technology original equipment. This segment provides products and services to commercial utilities and government agencies; and outage and maintenance services, engineering support, instrumentation and controls equipment, plant modification, and components and parts to nuclear reactors. It sells its uranium and fuel services to nuclear utilities in the Americas, Europe, and Asia. Cameco Corporation was incorporated in 1987 and is headquartered in Saskatoon, Canada.",90.86363,34.765217,17.4 B,56.24,40.7%,53.77,34.5%,0.22%,True
NU,14.279999732971191,2.65,15.0,2026-01-16,0.23599442087157674,"Nu Holdings Ltd. provides digital banking platform in Brazil, Mexico, Colombia, Cayman Islands, Germany, Argentina, the United States, and Uruguay. It offers spending solutions comprising Nu credit and prepaid card, a digitally enabled card that acts as a credit and a prepaid card; Ultraviolet credit and prepaid card, a premium metal credit card for affluent customers; mobile payment solutions for NuAccount customers to make and receive transfers, pay bills, and make everyday purchases through their mobile phones; and Nu Shopping, an integrated mall that enables customers to purchase goods and services from various ecommerce retailers. The company also provides savings solutions, such as Nu Personal Accounts, a digital account solution for personal financial activities; Nu business prepaid and credit card; and Nu business accounts for entrepreneur customers and their businesses. In addition, it offers investing solutions, including Money Boxes for goal-based investing; Nucoin, a proprietary utility token for its loyalty program; NuInvest, which provides equity, fixed-income, stock options, ETF products, and multimarket funds; and NuCrypto, a solution for buying and selling cryptocurrencies through the Nu app. Further, the company provides borrowing solutions comprising Personal unsecured and secured loans; Pix financing that enables credit card and digital account customers to make free and instant peer-to-peer transfers; Boleto financing, which enables credit card and digital account customers to make payments using their credit line; purchase financing; and NuPay to make online purchases and pay for services through Nubank app. Additionally, it offers protection solutions, such as NuInsurance protection solutions, including life, mobile, auto, home, and financial protection insurance policies. The company was founded in 2013 and is headquartered in São Paulo, Brazil.",46.064514,22.666666,68.4 B,15.105,5.8%,14.28,0.0%,N/A,False
CCL,16.540000915527344,3.53,17.0,2026-01-16,0.24123330493452055,"Carnival Corporation & plc engages in the provision of leisure travel services in North America, Australia, Europe, Asia, and internationally. The company operates through four segments: NAA Cruise Operations, Europe Cruise Operations, Cruise Support, and Tour and Other. It operates port destinations, private islands, and a solar park, as well as owns and operates hotels, lodges, glass-domed railcars, and motor coaches. The company offers its services under the Carnival Cruise Line, Princess Cruises, Holland America Line, Seabourn, Costa Cruises, AIDA Cruises, P&O Cruises, and Cunard brand. Additionally, it sells its cruises primarily through travel agents, tour operators, vacation planners, and websites. Carnival Corporation & plc was founded in 1972 and is headquartered in Miami, Florida.",23.295776,10.670969,21.7 B,19.74,19.3%,22.01,33.1%,N/A,False
NVDA,116.91000366210938,31.05,117.0,2026-01-16,0.266358697822735,"NVIDIA Corporation provides graphics and compute and networking solutions in the United States, Taiwan, China, Hong Kong, and internationally. The Graphics segment offers GeForce GPUs for gaming and PCs, the GeForce NOW game streaming service and related infrastructure, and solutions for gaming platforms; Quadro/NVIDIA RTX GPUs for enterprise workstation graphics; virtual GPU or vGPU software for cloud-based visual and virtual computing; automotive platforms for infotainment systems; and Omniverse software for building and operating metaverse and 3D internet applications. The Compute & Networking segment comprises Data Center computing platforms and end-to-end networking platforms, including Quantum for InfiniBand and Spectrum for Ethernet; NVIDIA DRIVE automated-driving platform and automotive development agreements; Jetson robotics and other embedded platforms; NVIDIA AI Enterprise and other software; and DGX Cloud software and services. The company's products are used in gaming, professional visualization, data center, and automotive markets. It sells its products to original equipment manufacturers, original device manufacturers, system integrators and distributors, independent software vendors, cloud service providers, consumer internet companies, add-in board manufacturers, distributors, automotive manufacturers and tier-1 automotive suppliers, and other ecosystem participants. NVIDIA Corporation was incorporated in 1993 and is headquartered in Santa Clara, California.",54.88732,32.118134,2867.8 B,140.76,20.4%,131.77,12.7%,0.03%,False
PLTR,34.849998474121094,9.25,35.0,2026-01-16,0.26972745875036863,"Palantir Technologies Inc. builds and deploys software platforms for the intelligence community to assist in counterterrorism investigations and operations in the United States, the United Kingdom, and internationally. The company provides Palantir Gotham, a software platform which enables users to identify patterns hidden deep within datasets, ranging from signals intelligence sources to reports from confidential informants, as well as facilitates the handoff between analysts and operational users, helping operators plan and execute real-world responses to threats that have been identified within the platform. It also offers Palantir Foundry, a platform that transforms the ways organizations operate by creating a central operating system for their data; and allows individual users to integrate and analyze the data they need in one place. In addition, it provides Palantir Apollo, a software that delivers software and updates across the business, as well as enables customers to deploy their software virtually in any environment; and Palantir Artificial Intelligence Platform (AIP) that provides unified access to open-source, self-hosted, and commercial large language models (LLM) that can transform structured and unstructured data into LLM-understandable objects and can turn organizations' actions and processes into tools for humans and LLM-driven agents. The company was incorporated in 2003 and is headquartered in Denver, Colorado.",204.99998,81.04651,78.0 B,35.2,1.0%,26.94,-22.7%,N/A,False
HOOD,20.639999389648438,6.29,20.0,2026-01-16,0.27374034774367306,"Robinhood Markets, Inc. operates financial services platform in the United States. Its platform allows users to invest in stocks, exchange-traded funds (ETFs), American depository receipts, options, gold, and cryptocurrencies. The company offers fractional trading, recurring investments, fully-paid securities lending, access to investing on margin, cash sweep, instant withdrawals, retirement program, around-the-clock trading, and initial public offerings participation services. It also provides various learning and education solutions comprise Snacks, an accessible digest of business news stories for a new generation of investors.; Learn, which is an online collection of beginners' guides, feature tutorials, and financial dictionary; Newsfeeds that offer access to free, premium news from sites from various sites, such as Barron's, Reuters, and Dow Jones. In addition, the company offers In-App Education, a resource that covers investing fundamentals, including why people invest, a stock market overview, and tips on how to define investing goals, as well as allows customers to understand the basics of investing before their first trade; and Crypto Learn and Earn, an educational module available to various crypto customers through Robinhood Learn to teach customers the basics related to cryptocurrency. Further, it provides Robinhood credit cards, cash card and spending accounts, and wallets. Robinhood Markets, Inc. was incorporated in 2013 and is headquartered in Menlo Park, California.",66.58064,28.666664,18.3 B,24.88,20.5%,24.1,16.8%,N/A,False
CHWY,30.239999771118164,8.54,30.0,2026-01-16,0.27447090911717065,"Chewy, Inc., together with its subsidiaries, engages in the pure play e-commerce business in the United States. It provides pet food and treats, pet supplies and pet medications, and other pet-health products, as well as pet services for dogs, cats, fish, birds, small pets, horses, and reptiles through its retail websites and mobile applications. The company was founded in 2010 and is based in Plantation, Florida.",36.433735,46.52308,12.7 B,39.1,29.3%,30.4,0.5%,N/A,False
ENPH,110.58999633789062,32.98,110.0,2026-01-16,0.29288366701041135,"Enphase Energy, Inc., together with its subsidiaries, designs, develops, manufactures, and sells home energy solutions for the solar photovoltaic industry in the United States and internationally. The company offers semiconductor-based microinverter, which converts energy at the individual solar module level and combines with its proprietary networking and software technologies to provide energy monitoring and control. It also provides microinverter units and related accessories, an IQ gateway; IQ batteries; the cloud-based Enlighten monitoring service; storage solutions; and electric vehicle charging solutions, as well as design, proposal, permitting, and lead generation services. The company sells its solutions to solar distributors; and directly to large installers, original equipment manufacturers, strategic partners, and homeowners, as well as through its legacy product upgrade program or online store. Enphase Energy, Inc. was incorporated in 2006 and is headquartered in Fremont, California.",118.91397,23.331224,15.0 B,141.63,28.1%,127.14,15.0%,N/A,False
UEC,5.179999828338623,1.72,5.0,2026-01-16,0.29729734028877375,"Uranium Energy Corp., together with its subsidiaries, engages in exploration, pre-extraction, extraction, and processing uranium and titanium concentrates in the United States, Canada, and Paraguay. It owns interests in the Palangana mine, Goliad, Burke Hollow, Longhorn, and Salvo projects located in Texas; Anderson, Workman Creek, and Los Cuatros projects situated in Arizona; Dalton Pass and C de Baca project located in New Mexico; Roughrider, Shea Creek, Christie Lake, Horseshoe-Raven, Hidden Bay, Diabase, West Bear, JCU, and other project located in Canada; and Yuty, Oviedo, and Alto Paraná titanium projects in Paraguay. The company was formerly known as Carlin Gold Inc. and changed its name to Uranium Energy Corp. in January 2005. Uranium Energy Corp. was incorporated in 2003 and is headquartered in Corpus Christi, Texas.",N/A,129.5,2.1 B,8.34,61.0%,9.8,89.2%,N/A,True
SMCI,445.3999938964844,128.15,450.0,2026-01-16,0.2980467173835841,"Super Micro Computer, Inc., together with its subsidiaries, develops and manufactures high performance server and storage solutions based on modular and open architecture in the United States, Europe, Asia, and internationally. Its solutions range from complete server, storage systems, modular blade servers, blades, workstations, full racks, networking devices, server sub-systems, server management software, and security software. The company provides application-optimized server solutions, rackmount and blade servers, storage, and subsystems and accessories; and server software management solutions, such as Server Management Suite, including Supermicro Server Manager, Supermicro Power Management software, Supermicro Update Manager, SuperCloud Composer, and SuperDoctor 5. In addition, it offers server subsystems and accessories comprising server boards, chassis, power supplies, and other accessories. Further, the company provides server and storage system integration, configuration, and software upgrade and update services; and technical documentation services, as well as identifies service requirements, creates and executes project plans, and conducts verification testing and technical documentation, and training services. Additionally, it offers help desk and on-site product support services for its server and storage systems; and customer support services, including ongoing maintenance and technical support for its products. The company provides its products to enterprise data centers, cloud computing, artificial intelligence, and 5G and edge computing markets. It sells its products through direct and indirect sales force, distributors, value-added resellers, system integrators, and original equipment manufacturers. The company was incorporated in 1993 and is headquartered in San Jose, California.",22.170233,10.051907,26.1 B,1229.0,175.9%,850.42,90.9%,N/A,True
AFRM,40.2400016784668,12.8,40.0,2026-01-16,0.3121271818498532,"Affirm Holdings, Inc. operates payment network in the United States, Canada, and internationally. The company's platform includes point-of-sale payment solution for consumers, merchant commerce solutions, and a consumer-focused app. Its commerce platform, agreements with originating banks, and capital markets partners enables consumers to pay for a purchase over time. The company has active merchants covering small businesses, large enterprises, direct-to-consumer brands, brick-and-mortar stores, and companies with an omni-channel presence. Its merchants represent a range of industries, including sporting goods and outdoors, home and lifestyle, travel and ticketing, electronics, fashion and beauty, equipment and auto, and general merchandise. Affirm Holdings, Inc. was founded in 2012 and is headquartered in San Francisco, California.",N/A,167.66667,12.5 B,52.48,30.4%,38.2,-5.1%,N/A,False
FUBO,1.7300000190734863,0.79,1.5,2026-01-16,0.32369940737135106,"fuboTV Inc. operates a live TV streaming platform for live sports, news, and entertainment content in the United States and internationally. The company's platform allows customers to access content through streaming devices, as well as on SmartTVs, mobile phones, tablets, and computers. fuboTV Inc. was incorporated in 2009 and is headquartered in New York, New York.",N/A,-5.9655175,569.8 M,3.815,120.5%,2.82,63.0%,N/A,True
CVNA,133.5399932861328,44.5,135.0,2026-01-16,0.3441666094395395,"Carvana Co., together with its subsidiaries, operates an e-commerce platform for buying and selling used cars in the United States. Its platform allows customers to research and identify a vehicle; inspect it using company's 360-degree vehicle imaging technology; obtain financing and warranty coverage; purchase the vehicle; and schedule delivery or pick-up from their desktop or mobile devices. The company also operates auction sites. The company was founded in 2012 and is based in Tempe, Arizona.",53.63052,113.169495,15.6 B,159.85,19.7%,152.06,13.9%,N/A,False
RUN,19.149999618530273,6.2,20.0,2026-01-16,0.36814624135281315,"Sunrun Inc. designs, develops, installs, sells, owns, and maintains residential solar energy systems in the United States. It also sells solar energy systems and products, such as panels and racking; and solar leads generated to customers. In addition, the company offers battery storage along with solar energy systems; and sells services to commercial developers through multi-family and new homes. Its primary customers are residential homeowners. The company markets and sells its products through direct-to-consumer approach across online, retail, mass media, digital media, canvassing, field marketing, and referral channels, as well as its partner network. Sunrun Inc. was founded in 2007 and is headquartered in San Francisco, California.",N/A,-23.9375,4.3 B,22.26,16.2%,22.07,15.2%,N/A,False
